[
  {
    "sender_full_name": "Phillip K Allen",
    "reciever_full_name": "Tim Belden <Tim Belden/Enron@EnronXGate>",
    "sender_first_name": "Phillip",
    "sender_last_name": "Allen",
    "reciever_first_name": "Tim",
    "reciever_last_name": "enron",
    "sender_email": "phillip.allen@enron.com",
    "reciever_email": "tim.belden@enron.com",
    "sender_org": "enron",
    "reciever_org": "enron",
    "subject": "Mime-Version: 1.0",
    "body": "\nHere is our forecast\nhere is my phone number +91 8050328175\njason and jessica\n\n ",
    "date": "Mon, 14 May 2001 16:39:00 -0700 (PDT)",
    "message_id": "18782981.1075855378110.JavaMail.evans@thyme",
    "word_count": 13,
    "summarised_body": "",
    "named_entities": {
      "PERSON": [
        "jessica"
      ]
    },
    "phone_numbers": [
      "+91 8050328175"
    ]
  },
  {
    "sender_full_name": "Phillip K Allen",
    "reciever_full_name": "John J Lavorato <John J Lavorato/ENRON@enronXgate@ENRON>",
    "sender_first_name": "Phillip",
    "sender_last_name": "Allen",
    "reciever_first_name": "John",
    "reciever_last_name": "enron",
    "sender_email": "phillip.allen@enron.com",
    "reciever_email": "john.lavorato@enron.com",
    "sender_org": "enron",
    "reciever_org": "enron",
    "subject": "Re:",
    "body": "\nTraveling to have a business meeting takes the fun out of the trip.  Especially if you have to prepare a presentation.  I would suggest holding the business plan meetings here then take a trip without any formal business meetings.  I would even try and get some honest opinions on whether a trip is even desired or necessary.\n\nAs far as the business meetings, I think it would be more productive to try and stimulate discussions across the different groups about what is working and what is not.  Too often the presenter speaks and the others are quiet just waiting for their turn.   The meetings might be better if held in a round table discussion format.  \n\nMy suggestion for where to go is Austin.  Play golf and rent a ski boat and jet ski's.  Flying somewhere takes too much time.\n",
    "date": "Fri, 4 May 2001 13:51:00 -0700 (PDT)",
    "message_id": "15464986.1075855378456.JavaMail.evans@thyme",
    "word_count": 139,
    "summarised_body": "",
    "named_entities": {
      "PERSON": [
        "Austin"
      ]
    },
    "phone_numbers": []
  },
  {
    "sender_full_name": "Phillip K Allen",
    "reciever_full_name": "Leah Van Arsdall",
    "sender_first_name": "Phillip",
    "sender_last_name": "Allen",
    "reciever_first_name": "Leah",
    "reciever_last_name": "Arsdall",
    "sender_email": "phillip.allen@enron.com",
    "reciever_email": "leah.arsdall@enron.com",
    "sender_org": "enron",
    "reciever_org": "enron",
    "subject": "Re: test",
    "body": "\ntest successful.  way to go!!!",
    "date": "Wed, 18 Oct 2000 03:00:00 -0700 (PDT)",
    "message_id": "24216240.1075855687451.JavaMail.evans@thyme",
    "word_count": 5,
    "summarised_body": "",
    "named_entities": {},
    "phone_numbers": []
  },
  {
    "sender_full_name": "Phillip K Allen",
    "reciever_full_name": "Randall L Gay",
    "sender_first_name": "Phillip",
    "sender_last_name": "Allen",
    "reciever_first_name": "Randall",
    "reciever_last_name": "Gay",
    "sender_email": "phillip.allen@enron.com",
    "reciever_email": "randall.gay@enron.com",
    "sender_org": "enron",
    "reciever_org": "enron",
    "subject": "Mime-Version: 1.0",
    "body": "\nRandy,\n\n Can you send me a schedule of the salary and level of everyone in the \nscheduling group.  Plus your thoughts on any changes that need to be made.  \n(Patti S for example)\n\nPhillip",
    "date": "Mon, 23 Oct 2000 06:13:00 -0700 (PDT)",
    "message_id": "13505866.1075863688222.JavaMail.evans@thyme",
    "word_count": 34,
    "summarised_body": "",
    "named_entities": {
      "PERSON": [
        "Randy",
        "Phillip"
      ]
    },
    "phone_numbers": []
  },
  {
    "sender_full_name": "Phillip K Allen",
    "reciever_full_name": "Greg Piper",
    "sender_first_name": "Phillip",
    "sender_last_name": "Allen",
    "reciever_first_name": "Greg",
    "reciever_last_name": "Piper",
    "sender_email": "phillip.allen@enron.com",
    "reciever_email": "greg.piper@enron.com",
    "sender_org": "enron",
    "reciever_org": "enron",
    "subject": "Re: Hello",
    "body": "\nLet's shoot for Tuesday at 11:45.  ",
    "date": "Thu, 31 Aug 2000 05:07:00 -0700 (PDT)",
    "message_id": "30922949.1075863688243.JavaMail.evans@thyme",
    "word_count": 5,
    "summarised_body": "",
    "named_entities": {
      "DATE": [
        "Tuesday"
      ],
      "CARDINAL": [
        "11:45"
      ]
    },
    "phone_numbers": []
  },
  {
    "sender_full_name": "Phillip K Allen",
    "reciever_full_name": "Greg Piper",
    "sender_first_name": "Phillip",
    "sender_last_name": "Allen",
    "reciever_first_name": "Greg",
    "reciever_last_name": "Piper",
    "sender_email": "phillip.allen@enron.com",
    "reciever_email": "greg.piper@enron.com",
    "sender_org": "enron",
    "reciever_org": "enron",
    "subject": "Re: Hello",
    "body": "\nGreg,\n\n How about either next Tuesday or Thursday?\n\nPhillip",
    "date": "Thu, 31 Aug 2000 04:17:00 -0700 (PDT)",
    "message_id": "30965995.1075863688265.JavaMail.evans@thyme",
    "word_count": 9,
    "summarised_body": "",
    "named_entities": {
      "DATE": [
        "next Tuesday",
        "Thursday"
      ],
      "PERSON": [
        "Phillip"
      ]
    },
    "phone_numbers": []
  },
  {
    "sender_full_name": "Phillip K Allen",
    "reciever_full_name": "david.l.johnson@enron.com, John Shafer",
    "sender_first_name": "Phillip",
    "sender_last_name": "Allen",
    "reciever_first_name": "enron.com, john.shafer@enron",
    "reciever_last_name": "Shafer",
    "sender_email": "phillip.allen@enron.com",
    "reciever_email": "david.l.johnson@enron.com, john.shafer@enron.com",
    "sender_org": "enron",
    "reciever_org": "enron.com, john.shafer@enron",
    "subject": "Mime-Version: 1.0",
    "body": "\nPlease cc the following distribution list with updates:\n\nPhillip Allen (pallen@enron.com)\nMike Grigsby (mike.grigsby@enron.com)\nKeith Holst (kholst@enron.com)\nMonique Sanchez\nFrank Ermis\nJohn Lavorato\n\n\nThank you for your help\n\nPhillip Allen\n",
    "date": "Tue, 22 Aug 2000 07:44:00 -0700 (PDT)",
    "message_id": "16254169.1075863688286.JavaMail.evans@thyme",
    "word_count": 27,
    "summarised_body": "",
    "named_entities": {
      "PERSON": [
        "Phillip Allen",
        "Mike Grigsby",
        "Keith Holst",
        "Monique Sanchez",
        "Frank Ermis",
        "John Lavorato",
        "Phillip Allen\n"
      ]
    },
    "phone_numbers": []
  },
  {
    "sender_full_name": "Phillip K Allen",
    "reciever_full_name": "Joyce Teixeira",
    "sender_first_name": "Phillip",
    "sender_last_name": "Allen",
    "reciever_first_name": "Joyce",
    "reciever_last_name": "Teixeira",
    "sender_email": "phillip.allen@enron.com",
    "reciever_email": "joyce.teixeira@enron.com",
    "sender_org": "enron",
    "reciever_org": "enron",
    "subject": "Re: PRC review - phone calls",
    "body": "\nany morning between 10 and 11:30",
    "date": "Fri, 14 Jul 2000 06:59:00 -0700 (PDT)",
    "message_id": "17189699.1075863688308.JavaMail.evans@thyme",
    "word_count": 5,
    "summarised_body": "",
    "named_entities": {},
    "phone_numbers": []
  },
  {
    "sender_full_name": "Phillip K Allen",
    "reciever_full_name": "Mark Scott",
    "sender_first_name": "Phillip",
    "sender_last_name": "Allen",
    "reciever_first_name": "Mark",
    "reciever_last_name": "Scott",
    "sender_email": "phillip.allen@enron.com",
    "reciever_email": "mark.scott@enron.com",
    "sender_org": "enron",
    "reciever_org": "enron",
    "subject": "Re: High Speed Internet Access",
    "body": "\n1. login:  pallen pw: ke9davis\n\n I don't think these are required by the ISP \n\n  2.  static IP address\n\n IP: 64.216.90.105\n Sub: 255.255.255.248\n gate: 64.216.90.110\n DNS: 151.164.1.8\n\n  3.  Company: 0413\n        RC:  105891",
    "date": "Tue, 17 Oct 2000 02:26:00 -0700 (PDT)",
    "message_id": "20641191.1075855687472.JavaMail.evans@thyme",
    "word_count": 27,
    "summarised_body": "",
    "named_entities": {
      "CARDINAL": [
        "1",
        "2",
        "255.255.255.248",
        "151.164.1.8",
        "3"
      ],
      "ORG": [
        "ISP",
        "IP",
        "IP",
        "DNS"
      ],
      "MONEY": [
        "64.216.90.110\n "
      ],
      "DATE": [
        "0413",
        "105891"
      ]
    },
    "phone_numbers": []
  },
  {
    "sender_full_name": "Phillip K Allen",
    "reciever_full_name": "zimam@enron.com",
    "sender_first_name": "Phillip",
    "sender_last_name": "Allen",
    "reciever_first_name": "enron",
    "reciever_last_name": "",
    "sender_email": "phillip.allen@enron.com",
    "reciever_email": "zimam@enron.com",
    "sender_org": "enron",
    "reciever_org": "enron",
    "subject": "FW: fixed forward or other Collar floor gas price terms",
    "body": "\n---------------------- Forwarded by Phillip K Allen/HOU/ECT on 10/16/2000 \n01:42 PM ---------------------------\n\n\n\"Buckner, Buck\" <buck.buckner@honeywell.com",
    "date": "Mon, 16 Oct 2000 06:44:00 -0700 (PDT)",
    "message_id": "30795301.1075855687494.JavaMail.evans@thyme",
    "word_count": 11,
    "summarised_body": "",
    "named_entities": {
      "PERSON": [
        "Phillip K Allen/HOU",
        "Buck"
      ],
      "ORG": [
        "ECT"
      ],
      "TIME": [
        "10/16/2000 \n01:42 PM"
      ]
    },
    "phone_numbers": []
  },
  {
    "sender_full_name": "Phillip K Allen",
    "reciever_full_name": "\"Buckner, Buck\" <buck.buckner@honeywell.com> @ ENRON",
    "sender_first_name": "Phillip",
    "sender_last_name": "Allen",
    "reciever_first_name": "\"Buckner,",
    "reciever_last_name": "ENRON",
    "sender_email": "phillip.allen@enron.com",
    "reciever_email": "buck.buckner@honeywell.com",
    "sender_org": "enron",
    "reciever_org": "honeywell",
    "subject": "Re: FW: fixed forward or other Collar floor gas price terms",
    "body": "\nMr. Buckner,\n\n For delivered gas behind San Diego, Enron Energy Services is the appropriate \nEnron entity.  I have forwarded your request to Zarin Imam at EES.  Her phone \nnumber is 713-853-7107.  \n\nPhillip Allen",
    "date": "Mon, 16 Oct 2000 06:42:00 -0700 (PDT)",
    "message_id": "33076797.1075855687515.JavaMail.evans@thyme",
    "word_count": 34,
    "summarised_body": "",
    "named_entities": {
      "PERSON": [
        "Buckner",
        "Phillip Allen"
      ],
      "GPE": [
        "San Diego",
        "Zarin Imam"
      ],
      "ORG": [
        "Enron Energy Services",
        "Enron",
        "EES"
      ],
      "QUANTITY": [
        "713-853-7107"
      ]
    },
    "phone_numbers": [
      " 713-853-7107"
    ]
  },
  {
    "sender_full_name": "Phillip K Allen",
    "reciever_full_name": "stagecoachmama@hotmail.com",
    "sender_first_name": "Phillip",
    "sender_last_name": "Allen",
    "reciever_first_name": "hotmail",
    "reciever_last_name": "",
    "sender_email": "phillip.allen@enron.com",
    "reciever_email": "stagecoachmama@hotmail.com",
    "sender_org": "enron",
    "reciever_org": "hotmail",
    "subject": "Mime-Version: 1.0",
    "body": "\nLucy,\n\n Here are the rentrolls:\n\n\n\n Open them and save in the rentroll folder.  Follow these steps so you don't \nmisplace these files.\n\n 1.  Click on Save As\n 2.  Click on the drop down triangle under Save in:\n 3.  Click on the  (C): drive\n 4.  Click on the appropriate folder\n 5.  Click on Save:\n\nPhillip",
    "date": "Fri, 13 Oct 2000 06:45:00 -0700 (PDT)",
    "message_id": "25459584.1075855687536.JavaMail.evans@thyme",
    "word_count": 54,
    "summarised_body": "",
    "named_entities": {
      "PERSON": [
        "Lucy",
        "Save",
        "Phillip"
      ],
      "CARDINAL": [
        "1",
        "3",
        "4",
        "5"
      ]
    },
    "phone_numbers": []
  },
  {
    "sender_full_name": "Phillip K Allen",
    "reciever_full_name": "Keith Holst",
    "sender_first_name": "Phillip",
    "sender_last_name": "Allen",
    "reciever_first_name": "Keith",
    "reciever_last_name": "Holst",
    "sender_email": "phillip.allen@enron.com",
    "reciever_email": "keith.holst@enron.com",
    "sender_org": "enron",
    "reciever_org": "enron",
    "subject": "Consolidated positions: Issues & To Do list",
    "body": "\n---------------------- Forwarded by Phillip K Allen/HOU/ECT on 10/09/2000 \n02:16 PM ---------------------------\n\n\nRichard Burchfield\n10/06/2000 06:59 AM\nTo: Phillip K Allen/HOU/ECT@ECT\ncc: Beth Perlman/HOU/ECT@ECT \nSubject: Consolidated positions: Issues & To Do list\n\nPhillip,\n Below is the issues & to do list as we go forward with documenting the \nrequirements for consolidated physical/financial positions and transport \ntrade capture. What we need to focus on is the first bullet in Allan's list; \nthe need for a single set of requirements. Although the meeting with Keith, \non Wednesday,  was informative the solution of creating a infinitely dynamic \nconsolidated position screen, will be extremely difficult and time \nconsuming.  Throughout the meeting on Wednesday, Keith alluded to the \ninability to get consensus amongst the traders on the presentation of the \nconsolidated position, so the solution was to make it so that a trader can \narrange the position screen to their liking (much like Excel). What needs to \nhappen on Monday from 3 - 5 is a effort to design a desired layout for the \nconsolidated position screen, this is critical. This does not exclude \nbuilding a capability to create a more flexible position presentation for the \nfuture, but in order to create a plan that can be measured we need firm \nrequirements. Also, to reiterate that the goals of this project is a project \nplan on consolidate physical/financial positions and transport trade capture. \nThe other issues that have been raised will be capture as projects on to \nthemselves, and will need to be prioritised as efforts outside of this \nproject.\n\nI have been involved in most of the meetings and the discussions have been \ngood. I believe there has been good communication between the teams, but now \nwe need to have focus on the objectives we set out to solve.\n\nRichard  \n---------------------- Forwarded by Richard Burchfield/HOU/ECT on 10/06/2000 \n08:34 AM ---------------------------\n\n\nAllan Severude\n10/05/2000 06:03 PM\nTo: Richard Burchfield/HOU/ECT@ECT\ncc: Peggy Alix/HOU/ECT@ECT, Russ Severson/HOU/ECT@ECT, Scott \nMills/HOU/ECT@ECT, Kenny Ha/HOU/ECT@ECT \nSubject: Consolidated positions: Issues & To Do list\n\n\nFrom our initial set of meetings with the traders regarding consolidated \npositions, I think we still have the following issues:\nWe don't have a single point of contact from the trading group.  We've had \nthree meetings which brought out very different issues from different \ntraders.  We really need a single point of contact to help drive the trader \nrequirements and help come to a consensus regarding the requirements.\nWe're getting hit with a lot of different requests, many of which appear to \nbe outside the scope of position consolidation.\n\nThings left to do:\nI think it may be useful to try to formulate a high level project goal to \nmake it as clear as possible what we're trying to accomplish with this \nproject.  It'll help determine which requests fall under the project scope.\nGo through the list of requests to determine which are in scope for this \nproject and which fall out of scope.\nFor those in scope, work to define relative importance (priority) of each and \nwork with traders to define the exact requirements of each.\nDefine the desired lay out of the position manager screen: main view and all \ndrill downs.\nUse the above to formulate a project plan.\n\nThings requested thus far (no particular order):\nInclusion of Sitara physical deals into the TDS position manager and deal \nticker.\nCustomized rows and columns in the position manager (ad hoc rows/columns that \nadd up existing position manager rows/columns).\nNew drill down in the position manager to break out positions by: physical, \ntransport, swaps, options, ...\nAddition of a curve tab to the position manager to show the real-time values \nof all curves on which the desk has a position.\nAbility to split the current position grid to allow daily positions to be \nshown directly above monthly positions.  Each grouped column in the top grid \nwould be tied to a grouped column in the bottom grid.\nAbility to properly show curve shift for float-for-float deals; determine the \nappropriate positions to show for each:\nGas Daily for monthly index,\nPhysical gas for Nymex,\nPhysical gas for Inside Ferc,\nPhysical gas for Mid market.\nAbility for TDS to pull valuation results based on a TDS flag instead of \nusing official valuations.\nPosition and P&L aggregation across all gas desks.\nAbility to include the Gas Price book into TDS:\nInclusion of spread options in our systems.  Ability to handle volatility \nskew and correlations.\nAbility to revalue all options incrementally throughout the trading day.  \nApproximate delta changes between valuations using instantaneous gamma or a \ngamma grid.\nValuation of Gas Daily options.\nA new position screen for options (months x strike x delta).  TBD.\nInclusion of positions for exotic options currently managed in spreadsheets.\nAbility to isolate the position change due to changed deals in the position \nmanager.\nAbility to view change deal P&L in the TDS deal ticker.  Show new deal terms, \nprior deal terms, and net P&L affect of the change.\nEliminate change deals with no economic impact from the TDS deal ticker.\nPosition drill down in the position manager to isolate the impact of \nindividual deals on the position total in a grid cell.\nBenchmark positions in TDS.\nDeployment of TDS in Canada. Currency and volume uom conversions. Implicit \nand explicit position break out issues.\n\n-- Allan.\n\nPS: Colleen is setting up a meeting tomorrow to discuss the direction for \ntransport.  Hopefully we'll know much better where that part stands at that \npoint.\n\n\n\n\n",
    "date": "Mon, 9 Oct 2000 07:16:00 -0700 (PDT)",
    "message_id": "13116875.1075855687561.JavaMail.evans@thyme",
    "word_count": 898,
    "summarised_body": "",
    "named_entities": {
      "PERSON": [
        "Phillip K Allen/HOU",
        "Richard Burchfield",
        "Phillip K Allen/HOU",
        "Beth Perlman/HOU",
        "Phillip",
        "Allan",
        "Keith",
        "Keith",
        "Richard",
        "Richard Burchfield",
        "Allan Severude",
        "Richard Burchfield",
        "Peggy Alix/HOU/ECT@ECT",
        "Russ Severson",
        "Kenny Ha/HOU",
        "Benchmark",
        "Allan"
      ],
      "ORG": [
        "ECT",
        "ECT",
        "Scott \nMills/HOU/ECT@ECT",
        "Inclusion of Sitara",
        "TDS",
        "Nymex",
        "Inside Ferc",
        "TDS",
        "TDS",
        "P&L",
        "TDS",
        "TBD",
        "TDS",
        "P&L",
        "TDS",
        "TDS",
        "Deployment of TDS"
      ],
      "TIME": [
        "10/09/2000 \n02:16 PM",
        "06:59 AM",
        "06:03 PM"
      ],
      "ORDINAL": [
        "first"
      ],
      "DATE": [
        "Wednesday",
        "Wednesday",
        "Monday",
        "daily",
        "monthly",
        "monthly",
        "the trading day",
        "months",
        "tomorrow"
      ],
      "PRODUCT": [
        "Excel"
      ],
      "CARDINAL": [
        "3",
        "10/06/2000",
        "three"
      ],
      "GPE": [
        "Canada"
      ]
    },
    "phone_numbers": []
  },
  {
    "sender_full_name": "Phillip K Allen",
    "reciever_full_name": "Keith Holst",
    "sender_first_name": "Phillip",
    "sender_last_name": "Allen",
    "reciever_first_name": "Keith",
    "reciever_last_name": "Holst",
    "sender_email": "phillip.allen@enron.com",
    "reciever_email": "keith.holst@enron.com",
    "sender_org": "enron",
    "reciever_org": "enron",
    "subject": "Consolidated positions: Issues & To Do list",
    "body": "\n---------------------- Forwarded by Phillip K Allen/HOU/ECT on 10/09/2000 \n02:00 PM ---------------------------\n\n\nRichard Burchfield\n10/06/2000 06:59 AM\nTo: Phillip K Allen/HOU/ECT@ECT\ncc: Beth Perlman/HOU/ECT@ECT \nSubject: Consolidated positions: Issues & To Do list\n\nPhillip,\n Below is the issues & to do list as we go forward with documenting the \nrequirements for consolidated physical/financial positions and transport \ntrade capture. What we need to focus on is the first bullet in Allan's list; \nthe need for a single set of requirements. Although the meeting with Keith, \non Wednesday,  was informative the solution of creating a infinitely dynamic \nconsolidated position screen, will be extremely difficult and time \nconsuming.  Throughout the meeting on Wednesday, Keith alluded to the \ninability to get consensus amongst the traders on the presentation of the \nconsolidated position, so the solution was to make it so that a trader can \narrange the position screen to their liking (much like Excel). What needs to \nhappen on Monday from 3 - 5 is a effort to design a desired layout for the \nconsolidated position screen, this is critical. This does not exclude \nbuilding a capability to create a more flexible position presentation for the \nfuture, but in order to create a plan that can be measured we need firm \nrequirements. Also, to reiterate that the goals of this project is a project \nplan on consolidate physical/financial positions and transport trade capture. \nThe other issues that have been raised will be capture as projects on to \nthemselves, and will need to be prioritised as efforts outside of this \nproject.\n\nI have been involved in most of the meetings and the discussions have been \ngood. I believe there has been good communication between the teams, but now \nwe need to have focus on the objectives we set out to solve.\n\nRichard  \n---------------------- Forwarded by Richard Burchfield/HOU/ECT on 10/06/2000 \n08:34 AM ---------------------------\n\n\nAllan Severude\n10/05/2000 06:03 PM\nTo: Richard Burchfield/HOU/ECT@ECT\ncc: Peggy Alix/HOU/ECT@ECT, Russ Severson/HOU/ECT@ECT, Scott \nMills/HOU/ECT@ECT, Kenny Ha/HOU/ECT@ECT \nSubject: Consolidated positions: Issues & To Do list\n\n\nFrom our initial set of meetings with the traders regarding consolidated \npositions, I think we still have the following issues:\nWe don't have a single point of contact from the trading group.  We've had \nthree meetings which brought out very different issues from different \ntraders.  We really need a single point of contact to help drive the trader \nrequirements and help come to a consensus regarding the requirements.\nWe're getting hit with a lot of different requests, many of which appear to \nbe outside the scope of position consolidation.\n\nThings left to do:\nI think it may be useful to try to formulate a high level project goal to \nmake it as clear as possible what we're trying to accomplish with this \nproject.  It'll help determine which requests fall under the project scope.\nGo through the list of requests to determine which are in scope for this \nproject and which fall out of scope.\nFor those in scope, work to define relative importance (priority) of each and \nwork with traders to define the exact requirements of each.\nDefine the desired lay out of the position manager screen: main view and all \ndrill downs.\nUse the above to formulate a project plan.\n\nThings requested thus far (no particular order):\nInclusion of Sitara physical deals into the TDS position manager and deal \nticker.\nCustomized rows and columns in the position manager (ad hoc rows/columns that \nadd up existing position manager rows/columns).\nNew drill down in the position manager to break out positions by: physical, \ntransport, swaps, options, ...\nAddition of a curve tab to the position manager to show the real-time values \nof all curves on which the desk has a position.\nAbility to split the current position grid to allow daily positions to be \nshown directly above monthly positions.  Each grouped column in the top grid \nwould be tied to a grouped column in the bottom grid.\nAbility to properly show curve shift for float-for-float deals; determine the \nappropriate positions to show for each:\nGas Daily for monthly index,\nPhysical gas for Nymex,\nPhysical gas for Inside Ferc,\nPhysical gas for Mid market.\nAbility for TDS to pull valuation results based on a TDS flag instead of \nusing official valuations.\nPosition and P&L aggregation across all gas desks.\nAbility to include the Gas Price book into TDS:\nInclusion of spread options in our systems.  Ability to handle volatility \nskew and correlations.\nAbility to revalue all options incrementally throughout the trading day.  \nApproximate delta changes between valuations using instantaneous gamma or a \ngamma grid.\nValuation of Gas Daily options.\nA new position screen for options (months x strike x delta).  TBD.\nInclusion of positions for exotic options currently managed in spreadsheets.\nAbility to isolate the position change due to changed deals in the position \nmanager.\nAbility to view change deal P&L in the TDS deal ticker.  Show new deal terms, \nprior deal terms, and net P&L affect of the change.\nEliminate change deals with no economic impact from the TDS deal ticker.\nPosition drill down in the position manager to isolate the impact of \nindividual deals on the position total in a grid cell.\nBenchmark positions in TDS.\nDeployment of TDS in Canada. Currency and volume uom conversions. Implicit \nand explicit position break out issues.\n\n-- Allan.\n\nPS: Colleen is setting up a meeting tomorrow to discuss the direction for \ntransport.  Hopefully we'll know much better where that part stands at that \npoint.\n\n\n\n\n",
    "date": "Mon, 9 Oct 2000 07:00:00 -0700 (PDT)",
    "message_id": "2707340.1075855687584.JavaMail.evans@thyme",
    "word_count": 898,
    "summarised_body": "",
    "named_entities": {
      "PERSON": [
        "Phillip K Allen/HOU",
        "Richard Burchfield",
        "Phillip K Allen/HOU",
        "Beth Perlman/HOU",
        "Phillip",
        "Allan",
        "Keith",
        "Keith",
        "Richard",
        "Richard Burchfield",
        "Allan Severude",
        "Richard Burchfield",
        "Peggy Alix/HOU/ECT@ECT",
        "Russ Severson",
        "Kenny Ha/HOU",
        "Benchmark",
        "Allan"
      ],
      "ORG": [
        "ECT",
        "ECT",
        "Scott \nMills/HOU/ECT@ECT",
        "Inclusion of Sitara",
        "TDS",
        "Nymex",
        "Inside Ferc",
        "TDS",
        "TDS",
        "P&L",
        "TDS",
        "TBD",
        "TDS",
        "P&L",
        "TDS",
        "TDS",
        "Deployment of TDS"
      ],
      "TIME": [
        "10/09/2000 \n02:00 PM",
        "06:59 AM",
        "06:03 PM"
      ],
      "ORDINAL": [
        "first"
      ],
      "DATE": [
        "Wednesday",
        "Wednesday",
        "Monday",
        "daily",
        "monthly",
        "monthly",
        "the trading day",
        "months",
        "tomorrow"
      ],
      "PRODUCT": [
        "Excel"
      ],
      "CARDINAL": [
        "3",
        "10/06/2000",
        "three"
      ],
      "GPE": [
        "Canada"
      ]
    },
    "phone_numbers": []
  },
  {
    "sender_full_name": "Phillip K Allen",
    "reciever_full_name": "David W Delainey",
    "sender_first_name": "Phillip",
    "sender_last_name": "Allen",
    "reciever_first_name": "David",
    "reciever_last_name": "Delainey",
    "sender_email": "phillip.allen@enron.com",
    "reciever_email": "david.delainey@enron.com",
    "sender_org": "enron",
    "reciever_org": "enron",
    "subject": "Mime-Version: 1.0",
    "body": "\nDave, \n\n Here are the names of the west desk members by category.  The origination \nside is very sparse.  \n\n\n\n\n\nPhillip\n",
    "date": "Thu, 5 Oct 2000 06:26:00 -0700 (PDT)",
    "message_id": "2465689.1075855687605.JavaMail.evans@thyme",
    "word_count": 19,
    "summarised_body": "",
    "named_entities": {
      "PERSON": [
        "Dave",
        "Phillip"
      ]
    },
    "phone_numbers": []
  },
  {
    "sender_full_name": "Phillip K Allen",
    "reciever_full_name": "Paula Harris",
    "sender_first_name": "Phillip",
    "sender_last_name": "Allen",
    "reciever_first_name": "Paula",
    "reciever_last_name": "Harris",
    "sender_email": "phillip.allen@enron.com",
    "reciever_email": "paula.harris@enron.com",
    "sender_org": "enron",
    "reciever_org": "enron",
    "subject": "Re: 2001 Margin Plan",
    "body": "\nPaula,\n\n 35 million is fine\n\nPhillip",
    "date": "Thu, 5 Oct 2000 05:55:00 -0700 (PDT)",
    "message_id": "1115198.1075855687626.JavaMail.evans@thyme",
    "word_count": 6,
    "summarised_body": "",
    "named_entities": {
      "PERSON": [
        "Paula",
        "Phillip"
      ],
      "CARDINAL": [
        "35 million"
      ]
    },
    "phone_numbers": []
  },
  {
    "sender_full_name": "Phillip K Allen",
    "reciever_full_name": "Ina Rangel",
    "sender_first_name": "Phillip",
    "sender_last_name": "Allen",
    "reciever_first_name": "Ina",
    "reciever_last_name": "Rangel",
    "sender_email": "phillip.allen@enron.com",
    "reciever_email": "ina.rangel@enron.com",
    "sender_org": "enron",
    "reciever_org": "enron",
    "subject": "Var, Reporting and Resources Meeting",
    "body": "\n---------------------- Forwarded by Phillip K Allen/HOU/ECT on 10/04/2000 \n04:23 PM ---------------------------\n   \n\tEnron North America Corp.\n\t\n\tFrom:  Airam Arteaga                           10/04/2000 12:23 PM\n\t\n\nTo: Phillip K Allen/HOU/ECT@ECT, Thomas A Martin/HOU/ECT@ECT, Scott \nNeal/HOU/ECT@ECT, John Arnold/HOU/ECT@ECT, Grant Masson/HOU/ECT@ECT, Ted \nMurphy/HOU/ECT@ECT, Vladimir Gorny/HOU/ECT@ECT, Frank Hayden/Corp/Enron@Enron\ncc: Rita Hennessy/NA/Enron@Enron, Ina Rangel/HOU/ECT@ECT, Laura \nHarder/Corp/Enron@Enron, Kimberly Brown/HOU/ECT@ECT, Araceli \nRomero/NA/Enron@Enron, Kimberly Hillis/HOU/ECT@ect \nSubject: Var, Reporting and Resources Meeting\n\nPlease plan to attend the below  Meeting:\n\n\n                                Topic:  Var, Reporting and Resources Meeting\n        \n  Date:  Wednesday, October 11th\n\n  Time:  2:30 - 3:30 \n\n  Location: EB30C1\n\n  \n\n If you have any questions/conflicts, please feel free to call me.\n\nThanks,\nRain\nx.31560\n\n\n\n\n\n\n",
    "date": "Wed, 4 Oct 2000 09:23:00 -0700 (PDT)",
    "message_id": "19773657.1075855687649.JavaMail.evans@thyme",
    "word_count": 102,
    "summarised_body": "",
    "named_entities": {
      "PERSON": [
        "Phillip K Allen/HOU",
        "Airam Arteaga                           ",
        "Phillip K Allen/HOU",
        "Thomas A",
        "Scott \nNeal/HOU/ECT@ECT",
        "John Arnold/HOU/ECT@ECT",
        "Grant Masson/HOU",
        "Ted \nMurphy/HOU/ECT@ECT",
        "Vladimir Gorny/HOU",
        "Frank Hayden/Corp/Enron@Enron\ncc",
        "Rita Hennessy/",
        "Kimberly Hillis/HOU",
        "Var"
      ],
      "ORG": [
        "ECT",
        "Enron North America Corp.",
        "Martin/HOU/ECT@ECT",
        "Ina Rangel/HOU/ECT@ECT",
        "Laura \nHarder/Corp/Enron@Enron",
        "Kimberly Brown/HOU/ECT@ECT",
        "Araceli \nRomero/NA/Enron@Enron"
      ],
      "TIME": [
        "10/04/2000 \n04:23 PM",
        "12:23 PM"
      ],
      "DATE": [
        "Wednesday, October 11th",
        "2:30 - 3:30"
      ]
    },
    "phone_numbers": []
  },
  {
    "sender_full_name": "Phillip K Allen",
    "reciever_full_name": "Tim Heizenrader <Tim Heizenrader/Enron@EnronXGate>",
    "sender_first_name": "Phillip",
    "sender_last_name": "Allen",
    "reciever_first_name": "Tim",
    "reciever_last_name": "enron",
    "sender_email": "phillip.allen@enron.com",
    "reciever_email": "tim.heizenrader@enron.com",
    "sender_org": "enron",
    "reciever_org": "enron",
    "subject": "Mime-Version: 1.0",
    "body": "\nTim,\n\nmike grigsby is having problems with accessing the west power site.  Can you please make sure he has an active password.  \n\nThank you,\n\nPhillip",
    "date": "Fri, 4 May 2001 11:26:00 -0700 (PDT)",
    "message_id": "7391389.1075855378477.JavaMail.evans@thyme",
    "word_count": 25,
    "summarised_body": "",
    "named_entities": {
      "PERSON": [
        "Tim",
        "mike grigsby",
        "Phillip"
      ]
    },
    "phone_numbers": []
  },
  {
    "sender_full_name": "Phillip K Allen",
    "reciever_full_name": "pallen70@hotmail.com",
    "sender_first_name": "Phillip",
    "sender_last_name": "Allen",
    "reciever_first_name": "hotmail",
    "reciever_last_name": "",
    "sender_email": "phillip.allen@enron.com",
    "reciever_email": "pallen70@hotmail.com",
    "sender_org": "enron",
    "reciever_org": "hotmail",
    "subject": "Westgate",
    "body": "\n---------------------- Forwarded by Phillip K Allen/HOU/ECT on 10/03/2000 \n04:30 PM ---------------------------\n\n\n\"George Richards\" <cbpres@austin.rr.com",
    "date": "Tue, 3 Oct 2000 09:30:00 -0700 (PDT)",
    "message_id": "12759088.1075855687671.JavaMail.evans@thyme",
    "word_count": 11,
    "summarised_body": "",
    "named_entities": {
      "PERSON": [
        "Phillip K Allen/HOU",
        "George Richards"
      ],
      "ORG": [
        "ECT"
      ],
      "TIME": [
        "10/03/2000 \n04:30 PM"
      ]
    },
    "phone_numbers": []
  },
  {
    "sender_full_name": "Phillip K Allen",
    "reciever_full_name": "Ina Rangel",
    "sender_first_name": "Phillip",
    "sender_last_name": "Allen",
    "reciever_first_name": "Ina",
    "reciever_last_name": "Rangel",
    "sender_email": "phillip.allen@enron.com",
    "reciever_email": "ina.rangel@enron.com",
    "sender_org": "enron",
    "reciever_org": "enron",
    "subject": "Meeting re: Storage Strategies in the West",
    "body": "\n---------------------- Forwarded by Phillip K Allen/HOU/ECT on 10/03/2000 \n04:13 PM ---------------------------\n\n\nNancy Hall@ENRON\n10/02/2000 06:42 AM\nTo: Mark Whitt/NA/Enron@Enron, Phillip K Allen/HOU/ECT@ECT, Paul T \nLucci/NA/Enron@Enron, Paul Bieniawski/Corp/Enron@ENRON, Tyrell \nHarrison/NA/Enron@Enron\ncc: Jean Mrha/NA/Enron@Enron, Ina Rangel/HOU/ECT@ECT, Monica \nJackson/Corp/Enron@ENRON \nSubject: Meeting re: Storage Strategies in the West\n\nThere will be a meeting on Tuesday, Oct. 10th at 4:00pm in EB3270 regarding \nStorage Strategies in the West.  Please mark your calendars.\n\nThank you!\n\nRegards,\nNancy Hall\nENA Denver office\n303-575-6490\n",
    "date": "Tue, 3 Oct 2000 09:15:00 -0700 (PDT)",
    "message_id": "29177675.1075855687692.JavaMail.evans@thyme",
    "word_count": 79,
    "summarised_body": "",
    "named_entities": {
      "PERSON": [
        "Phillip K Allen/HOU",
        "Nancy Hall@ENRON\n",
        "Mark Whitt/",
        "Phillip K Allen/HOU",
        "Paul",
        "Paul Bieniawski/Corp/Enron@ENRON",
        "Tyrell",
        "Jean Mrha/NA/Enron@Enron",
        "Monica \nJackson/Corp/Enron@ENRON \nSubject",
        "Nancy Hall\nENA Denver"
      ],
      "ORG": [
        "ECT",
        "Lucci/NA/Enron@Enron",
        "Harrison/NA/Enron@Enron\ncc",
        "Ina Rangel/HOU/ECT@ECT",
        "Storage Strategies",
        "Storage Strategies"
      ],
      "TIME": [
        "04:13 PM",
        "06:42 AM"
      ],
      "DATE": [
        "Tuesday, Oct. 10th"
      ],
      "CARDINAL": [
        "4:00pm",
        "EB3270",
        "303"
      ]
    },
    "phone_numbers": [
      "\n303-575-6490"
    ]
  },
  {
    "sender_full_name": "Phillip K Allen",
    "reciever_full_name": "bs_stone@yahoo.com",
    "sender_first_name": "Phillip",
    "sender_last_name": "Allen",
    "reciever_first_name": "yahoo",
    "reciever_last_name": "",
    "sender_email": "phillip.allen@enron.com",
    "reciever_email": "bs_stone@yahoo.com",
    "sender_org": "enron",
    "reciever_org": "yahoo",
    "subject": "Mime-Version: 1.0",
    "body": "\nBrenda,\n\nPlease use the second check as the October payment.  If you have already \ntossed it, let me know so I can mail you another.\n\nPhillip",
    "date": "Tue, 3 Oct 2000 09:13:00 -0700 (PDT)",
    "message_id": "24729148.1075855687713.JavaMail.evans@thyme",
    "word_count": 26,
    "summarised_body": "",
    "named_entities": {
      "PERSON": [
        "Brenda",
        "Phillip"
      ],
      "ORDINAL": [
        "second"
      ],
      "DATE": [
        "October"
      ]
    },
    "phone_numbers": []
  },
  {
    "sender_full_name": "Phillip K Allen",
    "reciever_full_name": "Steve Touchstone <STouchstone@natsource.com>",
    "sender_first_name": "Phillip",
    "sender_last_name": "Allen",
    "reciever_first_name": "Steve",
    "reciever_last_name": "natsource",
    "sender_email": "phillip.allen@enron.com",
    "reciever_email": "stouchstone@natsource.com",
    "sender_org": "enron",
    "reciever_org": "natsource",
    "subject": "Re: Not business related..",
    "body": "\nI think Fletch has a good CPA.  I am still doing my own.  ",
    "date": "Tue, 3 Oct 2000 03:17:00 -0700 (PDT)",
    "message_id": "17610321.1075855687735.JavaMail.evans@thyme",
    "word_count": 13,
    "summarised_body": "",
    "named_entities": {
      "PERSON": [
        "Fletch"
      ]
    },
    "phone_numbers": []
  },
  {
    "sender_full_name": "Phillip K Allen",
    "reciever_full_name": "\"BS Stone\" <bs_stone@yahoo.com> @ ENRON",
    "sender_first_name": "Phillip",
    "sender_last_name": "Allen",
    "reciever_first_name": "\"BS",
    "reciever_last_name": "ENRON",
    "sender_email": "phillip.allen@enron.com",
    "reciever_email": "bs_stone@yahoo.com",
    "sender_org": "enron",
    "reciever_org": "yahoo",
    "subject": "Re: Original Sept check/closing",
    "body": "\nBrenda,\n\n Please use the second check as my October payment.  I have my copy of the \noriginal deal.  Do you want me to fax this to you?\n\nPhillip",
    "date": "Mon, 2 Oct 2000 02:19:00 -0700 (PDT)",
    "message_id": "26575732.1075855687756.JavaMail.evans@thyme",
    "word_count": 28,
    "summarised_body": "",
    "named_entities": {
      "PERSON": [
        "Brenda",
        "Phillip"
      ],
      "ORDINAL": [
        "second"
      ],
      "DATE": [
        "October"
      ]
    },
    "phone_numbers": []
  },
  {
    "sender_full_name": "Phillip K Allen",
    "reciever_full_name": "Lkuch@mh.com",
    "sender_first_name": "Phillip",
    "sender_last_name": "Allen",
    "reciever_first_name": "mh",
    "reciever_last_name": "",
    "sender_email": "phillip.allen@enron.com",
    "reciever_email": "lkuch@mh.com",
    "sender_org": "enron",
    "reciever_org": "mh",
    "subject": "San Juan Index",
    "body": "\n---------------------- Forwarded by Phillip K Allen/HOU/ECT on 09/28/2000 \n01:09 PM ---------------------------\n   \n\t\n\t\n\tFrom:  Phillip K Allen                           09/28/2000 10:56 AM\n\t\n\n\nLiane,\n\n As we discussed yesterday, I am concerned there may have been an attempt to \nmanipulate the  El Paso San Juan monthly index.  It appears that a single \nbuyer entered the marketplace on both September 26 and 27 and paid above \nmarket prices ($4.70-$4.80) for San Juan gas.  At the time of these trades, \noffers for physical gas at significantly (10 to 15 cents) lower prices were \nbypassed in order to establish higher trades to report into the index \ncalculation.  Additionally, these trades are out of line with the associated \nfinancial swaps for San Juan.\n\n We have compiled a list of financial and physical trades executed from \nSeptember 25 to September 27.  These are the complete list of trades from \nEnron Online (EOL), Enron's direct phone conversations, and three brokerage \nfirms (Amerex, APB, and Prebon).  Please see the attached spreadsheet for a \ntrade by trade list and a summary.  We have also included a summary of gas \ndaily prices to illustrate the value of San Juan based on several spread \nrelationships.  The two key points from this data are as follows:\n\n 1.  The high physical prices on the 26th & 27th (4.75,4,80) are much greater \nthan the high financial trades (4.6375,4.665) on those days. \n\n 2.  The spread relationship between San Juan and other points (Socal & \nNorthwest)  is  consistent between the end of September and \n       October gas daily.  It doesn't make sense to have monthly indices that \nare dramatically different.\n\n\n I understand you review the trades submitted for outliers.  Hopefully, the \ntrades submitted will reveal counterparty names and you will be able to \ndetermine that there was only one buyer in the 4.70's and these trades are \noutliers.  I wanted to give you some additional points of reference to aid in \nestablishing a reasonable index.  It is Enron's belief that the trades at \n$4.70 and higher  were above market trades that should be excluded from the \ncalculation of index.\n\n It is our desire to have reliable and accurate indices against which to \nconduct our physical and financial business.  Please contact me \nanytime I can assist you towards this goal.\n\nSincerely,\n\nPhillip Allen\n\n\n",
    "date": "Thu, 28 Sep 2000 06:17:00 -0700 (PDT)",
    "message_id": "15294346.1075855687778.JavaMail.evans@thyme",
    "word_count": 359,
    "summarised_body": "",
    "named_entities": {
      "PERSON": [
        "Phillip K Allen/HOU",
        "Phillip K Allen                           ",
        "Phillip Allen"
      ],
      "ORG": [
        "ECT",
        "Enron",
        "Enron",
        "APB",
        "the 26th & 27th",
        "Socal & \nNorthwest",
        "Enron"
      ],
      "TIME": [
        "09/28/2000 \n01:09 PM",
        "10:56 AM\n\t\n\n\nLiane"
      ],
      "DATE": [
        "yesterday",
        "monthly",
        "September 26",
        "27",
        "September 25 to September 27",
        "daily",
        "those days",
        "between the end of September",
        "October",
        "daily",
        "monthly",
        "4.70"
      ],
      "GPE": [
        "El Paso",
        "San Juan",
        "San Juan",
        "San Juan",
        "San Juan",
        "San Juan"
      ],
      "MONEY": [
        "4.70-$4.80",
        "10 to 15 cents",
        "4.70"
      ],
      "CARDINAL": [
        "three",
        "two",
        "1",
        "2"
      ],
      "NORP": [
        "Amerex"
      ]
    },
    "phone_numbers": []
  },
  {
    "sender_full_name": "Phillip K Allen",
    "reciever_full_name": "Jeffrey T Hodge",
    "sender_first_name": "Phillip",
    "sender_last_name": "Allen",
    "reciever_first_name": "Jeffrey",
    "reciever_last_name": "Hodge",
    "sender_email": "phillip.allen@enron.com",
    "reciever_email": "jeffrey.hodge@enron.com",
    "sender_org": "enron",
    "reciever_org": "enron",
    "subject": "San Juan Index",
    "body": "\nLiane,\n\n As we discussed yesterday, I am concerned there has been an attempt to \nmanipulate the  El Paso San Juan monthly index.  A single buyer entered the \nmarketplace on both September 26 and 27 and paid above market prices \n($4.70-$4.80) for San Juan gas with the intent to distort the index.  At the \ntime of these trades, offers for physical gas at significantly (10 to 15 \ncents) lower prices were bypassed in order to establish higher trades to \nreport into the index calculation.  Additionally, these trades are out of \nline with the associated financial swaps for San Juan.\n\n We have compiled a list of financial and physical trades executed from \nSeptember 25 to September 27.  These are the complete list of trades from \nEnron Online (EOL), Enron's direct phone conversations, and three brokerage \nfirms (Amerex, APB, and Prebon).  Please see the attached spreadsheet for a \ntrade by trade list and a summary.  We have also included a summary of gas \ndaily prices to illustrate the value of San Juan based on several spread \nrelationships.  The two key points from this data are as follows:\n\n 1.  The high physical prices on the 26th & 27th (4.75,4,80) are much greater \nthan the high financial trades (4.6375,4.665) on those days. \n\n 2.  The spread relationship between San Juan and other points (Socal & \nNorthwest)  is  consistent between the end of September and \n       October gas daily.  It doesn't make sense to have monthly indeces that \nare dramatically different.\n\n\n I understand you review the trades submitted for outliers.  Hopefully, the \ntrades submitted will reveal counterparty names and you will be able to \ndetermine that there was only one buyer in the 4.70's and these trades are \noutliers.  I wanted to give you some additional points of reference to aid in \nestablishing a reasonable index.  It is Enron's belief that the trades at \n$4.70 and higher  were above market trades that should be excluded from the \ncalculation of index.\n\n It is our desire to have reliable and accurate indeces against which to \nconduct our physical and financial business.  Please contact me \nanytime I can assist you towards this goal.\n\nSincerely,\n\nPhillip Allen\n",
    "date": "Thu, 28 Sep 2000 05:56:00 -0700 (PDT)",
    "message_id": "25140503.1075855687800.JavaMail.evans@thyme",
    "word_count": 348,
    "summarised_body": "",
    "named_entities": {
      "DATE": [
        "yesterday",
        "monthly",
        "September 26",
        "27",
        "September 25 to September 27",
        "daily",
        "those days",
        "between the end of September",
        "October",
        "daily",
        "monthly",
        "4.70"
      ],
      "GPE": [
        "El Paso",
        "San Juan",
        "San Juan",
        "San Juan",
        "San Juan",
        "San Juan"
      ],
      "MONEY": [
        "4.70-$4.80",
        "4.70"
      ],
      "CARDINAL": [
        "10 to 15 \ncents",
        "three",
        "two",
        "1",
        "2"
      ],
      "ORG": [
        "Enron",
        "Enron",
        "APB",
        "the 26th & 27th",
        "Socal & \nNorthwest",
        "Enron"
      ],
      "NORP": [
        "Amerex"
      ],
      "PERSON": [
        "Phillip Allen\n"
      ]
    },
    "phone_numbers": []
  },
  {
    "sender_full_name": "Phillip K Allen",
    "reciever_full_name": "kholst@enron.com",
    "sender_first_name": "Phillip",
    "sender_last_name": "Allen",
    "reciever_first_name": "enron",
    "reciever_last_name": "",
    "sender_email": "phillip.allen@enron.com",
    "reciever_email": "kholst@enron.com",
    "sender_org": "enron",
    "reciever_org": "enron",
    "subject": "Investment Structure",
    "body": "\n---------------------- Forwarded by Phillip K Allen/HOU/ECT on 09/26/2000 \n04:28 PM ---------------------------\n\n\n\"George Richards\" <cbpres@austin.rr.com",
    "date": "Tue, 26 Sep 2000 09:28:00 -0700 (PDT)",
    "message_id": "19034252.1075855687825.JavaMail.evans@thyme",
    "word_count": 11,
    "summarised_body": "",
    "named_entities": {
      "PERSON": [
        "Phillip K Allen/HOU",
        "George Richards"
      ],
      "ORG": [
        "ECT"
      ],
      "TIME": [
        "04:28 PM"
      ]
    },
    "phone_numbers": []
  },
  {
    "sender_full_name": "Phillip K Allen",
    "reciever_full_name": "pallen70@hotmail.com",
    "sender_first_name": "Phillip",
    "sender_last_name": "Allen",
    "reciever_first_name": "hotmail",
    "reciever_last_name": "",
    "sender_email": "phillip.allen@enron.com",
    "reciever_email": "pallen70@hotmail.com",
    "sender_org": "enron",
    "reciever_org": "hotmail",
    "subject": "Investment Structure",
    "body": "\n---------------------- Forwarded by Phillip K Allen/HOU/ECT on 09/26/2000 \n04:26 PM ---------------------------\n\n\n\"George Richards\" <cbpres@austin.rr.com",
    "date": "Tue, 26 Sep 2000 09:26:00 -0700 (PDT)",
    "message_id": "719350.1075855687850.JavaMail.evans@thyme",
    "word_count": 11,
    "summarised_body": "",
    "named_entities": {
      "PERSON": [
        "Phillip K Allen/HOU",
        "George Richards"
      ],
      "ORG": [
        "ECT"
      ],
      "TIME": [
        "04:26 PM"
      ]
    },
    "phone_numbers": []
  },
  {
    "sender_full_name": "Phillip K Allen",
    "reciever_full_name": "Ina Rangel",
    "sender_first_name": "Phillip",
    "sender_last_name": "Allen",
    "reciever_first_name": "Ina",
    "reciever_last_name": "Rangel",
    "sender_email": "phillip.allen@enron.com",
    "reciever_email": "ina.rangel@enron.com",
    "sender_org": "enron",
    "reciever_org": "enron",
    "subject": "Mime-Version: 1.0",
    "body": "\n---------------------- Forwarded by Phillip K Allen/HOU/ECT on 09/26/2000 \n02:00 PM ---------------------------\n\n\n\tReschedule\nChairperson: Richard Burchfield\nSent by: Cindy Cicchetti\n\nStart: 10/03/2000 02:30 PM\nEnd: 10/03/2000 03:30 PM\n\nDescription: Gas Physical/Financail Positions - Room 2537\n\n\n\nThis meeting repeats   starting on    (if the date occurs on a weekend the \nmeeting ).\nMeeting Dates: \n\n\n\nFletcher J Sturm/HOU/ECT\nScott Neal/HOU/ECT\nHunter S Shively/HOU/ECT\nPhillip K Allen/HOU/ECT\nAllan Severude/HOU/ECT\nScott Mills/HOU/ECT\nRuss Severson/HOU/ECT\n\nDetailed description:\n\n\n\n---------------------- Forwarded by Phillip K Allen/HOU/ECT on 09/26/2000 \n02:00 PM ---------------------------\n\n\n\tConfirmation\nChairperson: Richard Burchfield\nSent by: Cindy Cicchetti\n\nStart: 10/03/2000 02:30 PM\nEnd: 10/03/2000 03:30 PM\n\nDescription: Gas Physical/Financail Positions - Room 2537\n\n\n\nThis meeting repeats   starting on    (if the date occurs on a weekend the \nmeeting ).\nMeeting Dates: \n\n\n\nFletcher J Sturm/HOU/ECT\nScott Neal/HOU/ECT\nHunter S Shively/HOU/ECT\nPhillip K Allen/HOU/ECT\nAllan Severude/HOU/ECT\nScott Mills/HOU/ECT\nRuss Severson/HOU/ECT\n\nDetailed description:\n\n\nStatus update:\nFletcher J Sturm -",
    "date": "Tue, 26 Sep 2000 07:01:00 -0700 (PDT)",
    "message_id": "10523086.1075855687873.JavaMail.evans@thyme",
    "word_count": 159,
    "summarised_body": "",
    "named_entities": {
      "PERSON": [
        "Phillip K Allen/HOU",
        "Richard Burchfield",
        "Cindy Cicchetti",
        "Fletcher J Sturm/HOU",
        "Scott Neal/HOU",
        "Hunter S Shively/",
        "Phillip K Allen/HOU",
        "Scott Mills/HOU",
        "Russ Severson",
        "Phillip K Allen/HOU",
        "Richard Burchfield",
        "Cindy Cicchetti",
        "Fletcher J Sturm/HOU",
        "Scott Neal/HOU",
        "Hunter S Shively/",
        "Phillip K Allen/HOU",
        "Scott Mills/HOU",
        "Russ Severson",
        "Fletcher J Sturm -"
      ],
      "ORG": [
        "ECT",
        "ECT",
        "ECT",
        "Allan Severude/HOU",
        "ECT",
        "ECT",
        "ECT",
        "ECT",
        "ECT",
        "Allan Severude/HOU",
        "ECT",
        "ECT",
        "Status"
      ],
      "TIME": [
        "02:00 PM",
        "10/03/2000 02:30 PM",
        "10/03/2000 03:30 PM",
        "02:00 PM",
        "10/03/2000 02:30 PM",
        "10/03/2000 03:30 PM"
      ],
      "DATE": [
        "a weekend",
        "a weekend"
      ]
    },
    "phone_numbers": []
  },
  {
    "sender_full_name": "Phillip K Allen",
    "reciever_full_name": "rlehmann <rlehmann@yahoo.com>",
    "sender_first_name": "Phillip",
    "sender_last_name": "Allen",
    "reciever_first_name": "rlehmann",
    "reciever_last_name": "yahoo",
    "sender_email": "phillip.allen@enron.com",
    "reciever_email": "rlehmann@yahoo.com",
    "sender_org": "enron",
    "reciever_org": "yahoo",
    "subject": "Mime-Version: 1.0",
    "body": "\nReagan,\n\nJust wanted to give you an update.  I have changed the unit mix to include some 1 bedrooms and reduced the number of buildings to 12.  Kipp Flores is working on the construction drawings.  At the same time I am pursuing FHA financing.  Once the construction drawings are complete I will send them to you for a revised bid.  Your original bid was competitive and I am still attracted to your firm because of your strong local presence and contacts.\n\nPhillip",
    "date": "Thu, 3 May 2001 15:57:00 -0700 (PDT)",
    "message_id": "8572706.1075855378498.JavaMail.evans@thyme",
    "word_count": 82,
    "summarised_body": "",
    "named_entities": {
      "PERSON": [
        "Reagan",
        "Kipp Flores",
        "Phillip"
      ],
      "CARDINAL": [
        "12"
      ],
      "ORG": [
        "FHA"
      ]
    },
    "phone_numbers": []
  },
  {
    "sender_full_name": "Phillip K Allen",
    "reciever_full_name": "Cindy Cicchetti",
    "sender_first_name": "Phillip",
    "sender_last_name": "Allen",
    "reciever_first_name": "Cindy",
    "reciever_last_name": "Cicchetti",
    "sender_email": "phillip.allen@enron.com",
    "reciever_email": "cindy.cicchetti@enron.com",
    "sender_org": "enron",
    "reciever_org": "enron",
    "subject": "Re: Gas Trading Vision meeting",
    "body": "\nNymex expiration is during this time frame.  Please reschedule.",
    "date": "Tue, 26 Sep 2000 05:11:00 -0700 (PDT)",
    "message_id": "29665600.1075855687895.JavaMail.evans@thyme",
    "word_count": 9,
    "summarised_body": "",
    "named_entities": {
      "ORG": [
        "Nymex"
      ]
    },
    "phone_numbers": []
  },
  {
    "sender_full_name": "Phillip K Allen",
    "reciever_full_name": "Ina Rangel",
    "sender_first_name": "Phillip",
    "sender_last_name": "Allen",
    "reciever_first_name": "Ina",
    "reciever_last_name": "Rangel",
    "sender_email": "phillip.allen@enron.com",
    "reciever_email": "ina.rangel@enron.com",
    "sender_org": "enron",
    "reciever_org": "enron",
    "subject": "Mime-Version: 1.0",
    "body": "\n---------------------- Forwarded by Phillip K Allen/HOU/ECT on 09/26/2000 \n12:08 PM ---------------------------\n\n\n\tInvitation\nChairperson: Richard Burchfield\nSent by: Cindy Cicchetti\n\nStart: 09/27/2000 11:30 AM\nEnd: 09/27/2000 12:30 PM\n\nDescription: Gas Trading Vision Meeting - Room EB2556\n\n\n\nThis meeting repeats   starting on    (if the date occurs on a weekend the \nmeeting ).\nMeeting Dates: \n\n\n\nPhillip K Allen/HOU/ECT\nHunter S Shively/HOU/ECT\nScott Mills/HOU/ECT\nAllan Severude/HOU/ECT\nJeffrey C Gossett/HOU/ECT\nColleen Sullivan/HOU/ECT\nRuss Severson/HOU/ECT\nJayant Krishnaswamy/HOU/ECT\nRussell Long/HOU/ECT\n\nDetailed description:\n\n\n",
    "date": "Tue, 26 Sep 2000 05:08:00 -0700 (PDT)",
    "message_id": "4449575.1075855687916.JavaMail.evans@thyme",
    "word_count": 85,
    "summarised_body": "",
    "named_entities": {
      "PERSON": [
        "Phillip K Allen/HOU",
        "Richard Burchfield",
        "Cindy Cicchetti",
        "Phillip K Allen/HOU",
        "Hunter S Shively/",
        "Scott Mills/HOU",
        "Jeffrey C Gossett/HOU",
        "Colleen Sullivan/HOU",
        "Russ Severson",
        "Jayant Krishnaswamy/HOU",
        "Russell Long/HOU"
      ],
      "ORG": [
        "ECT",
        "ECT",
        "Allan Severude/HOU",
        "ECT",
        "ECT",
        "ECT",
        "ECT"
      ],
      "TIME": [
        "12:08 PM",
        "11:30 AM",
        "12:30 PM"
      ],
      "DATE": [
        "a weekend"
      ]
    },
    "phone_numbers": []
  },
  {
    "sender_full_name": "Phillip K Allen",
    "reciever_full_name": "Ina Rangel",
    "sender_first_name": "Phillip",
    "sender_last_name": "Allen",
    "reciever_first_name": "Ina",
    "reciever_last_name": "Rangel",
    "sender_email": "phillip.allen@enron.com",
    "reciever_email": "ina.rangel@enron.com",
    "sender_org": "enron",
    "reciever_org": "enron",
    "subject": "Gas Physical/Financial Position",
    "body": "\n---------------------- Forwarded by Phillip K Allen/HOU/ECT on 09/26/2000 \n12:07 PM ---------------------------\n   \n\t\n\t\n\tFrom:  Cindy Cicchetti                           09/26/2000 09:23 AM\n\t\n\nTo: Phillip K Allen/HOU/ECT@ECT, Hunter S Shively/HOU/ECT@ECT, Scott \nMills/HOU/ECT@ECT, Allan Severude/HOU/ECT@ECT, Russ Severson/HOU/ECT@ECT, \nFletcher J Sturm/HOU/ECT@ECT, Scott Neal/HOU/ECT@ECT\ncc:  \nSubject: Gas Physical/Financial Position\n\nI have scheduled and entered on each of your calendars a meeting for the \nabove referenced topic.  It will take place on Thursday, 9/28 from 3:00 - \n4:00 in Room EB2537.  \n",
    "date": "Tue, 26 Sep 2000 05:07:00 -0700 (PDT)",
    "message_id": "24741229.1075855687937.JavaMail.evans@thyme",
    "word_count": 71,
    "summarised_body": "",
    "named_entities": {
      "PERSON": [
        "Phillip K Allen/HOU",
        "Cindy Cicchetti                           ",
        "Phillip K Allen/HOU",
        "Hunter S Shively/HOU",
        "Allan Severude/HOU/ECT@ECT",
        "Russ Severson",
        "Scott Neal/HOU"
      ],
      "ORG": [
        "ECT",
        "Scott \nMills/HOU/ECT@ECT",
        "Fletcher J Sturm/HOU/ECT@ECT"
      ],
      "TIME": [
        "12:07 PM",
        "09:23 AM",
        "3:00 - \n4:00"
      ],
      "DATE": [
        "Thursday"
      ],
      "CARDINAL": [
        "9/28"
      ]
    },
    "phone_numbers": []
  },
  {
    "sender_full_name": "Phillip K Allen",
    "reciever_full_name": "jsmith@austintx.com",
    "sender_first_name": "Phillip",
    "sender_last_name": "Allen",
    "reciever_first_name": "austintx",
    "reciever_last_name": "",
    "sender_email": "phillip.allen@enron.com",
    "reciever_email": "jsmith@austintx.com",
    "sender_org": "enron",
    "reciever_org": "austintx",
    "subject": "closing",
    "body": "\n---------------------- Forwarded by Phillip K Allen/HOU/ECT on 09/26/2000 \n11:57 AM ---------------------------\n\n\n\"BS Stone\" <bs_stone@yahoo.com",
    "date": "Tue, 26 Sep 2000 04:57:00 -0700 (PDT)",
    "message_id": "19330146.1075855687961.JavaMail.evans@thyme",
    "word_count": 11,
    "summarised_body": "",
    "named_entities": {
      "PERSON": [
        "Phillip K Allen/HOU"
      ],
      "ORG": [
        "ECT"
      ],
      "TIME": [
        "11:57 AM"
      ],
      "WORK_OF_ART": [
        "BS Stone"
      ]
    },
    "phone_numbers": []
  },
  {
    "sender_full_name": "Phillip K Allen",
    "reciever_full_name": "Christopher F Calger",
    "sender_first_name": "Phillip",
    "sender_last_name": "Allen",
    "reciever_first_name": "Christopher",
    "reciever_last_name": "Calger",
    "sender_email": "phillip.allen@enron.com",
    "reciever_email": "christopher.calger@enron.com",
    "sender_org": "enron",
    "reciever_org": "enron",
    "subject": "Mime-Version: 1.0",
    "body": "\nChris,\n\n What is the latest with PG&E?  We have been having good discussions \nregarding EOL.\n Call me when you can. X37041\n\nPhillip",
    "date": "Mon, 25 Sep 2000 07:04:00 -0700 (PDT)",
    "message_id": "7763065.1075855687985.JavaMail.evans@thyme",
    "word_count": 21,
    "summarised_body": "",
    "named_entities": {
      "PERSON": [
        "Chris",
        "Phillip"
      ],
      "ORG": [
        "PG&E"
      ]
    },
    "phone_numbers": []
  },
  {
    "sender_full_name": "Phillip K Allen",
    "reciever_full_name": "Ina Rangel",
    "sender_first_name": "Phillip",
    "sender_last_name": "Allen",
    "reciever_first_name": "Ina",
    "reciever_last_name": "Rangel",
    "sender_email": "phillip.allen@enron.com",
    "reciever_email": "ina.rangel@enron.com",
    "sender_org": "enron",
    "reciever_org": "enron",
    "subject": "Mime-Version: 1.0",
    "body": "\n---------------------- Forwarded by Phillip K Allen/HOU/ECT on 09/25/2000 \n02:01 PM ---------------------------\n\n\n\tReschedule\nChairperson: Richard Burchfield\nSent by: Cindy Cicchetti\n\nStart: 09/28/2000 01:00 PM\nEnd: 09/28/2000 02:00 PM\n\nDescription: Gas Physical/Financail Positions - Room 2537\n\n\n\nThis meeting repeats   starting on    (if the date occurs on a weekend the \nmeeting ).\nMeeting Dates: \n\n\n\nFletcher J Sturm/HOU/ECT\nScott Neal/HOU/ECT\nHunter S Shively/HOU/ECT\nPhillip K Allen/HOU/ECT\nAllan Severude/HOU/ECT\nScott Mills/HOU/ECT\nRuss Severson/HOU/ECT\n\nDetailed description:\n   The meeting with Richard Burchfield/HOU/ECT was rescheduled.  \n\nOn   09/28/2000 03:00:00 PM CDT \nFor   1 hour  \nWith:   Richard Burchfield/HOU/ECT (Chairperson)  \n  Fletcher J Sturm/HOU/ECT (Invited)  \n  Scott Neal/HOU/ECT (Invited)  \n  Hunter S Shively/HOU/ECT (Invited)  \n  Phillip K Allen/HOU/ECT (Invited)  \n  Allan Severude/HOU/ECT (Invited)  \n  Scott Mills/HOU/ECT (Invited)  \n  Russ Severson/HOU/ECT (Invited)  \n\nGas Physical/Financail Positions - Room 2537  \n\n",
    "date": "Mon, 25 Sep 2000 07:01:00 -0700 (PDT)",
    "message_id": "14215818.1075855688008.JavaMail.evans@thyme",
    "word_count": 142,
    "summarised_body": "",
    "named_entities": {
      "PERSON": [
        "Phillip K Allen/HOU",
        "Richard Burchfield",
        "Cindy Cicchetti",
        "Fletcher J Sturm/HOU",
        "Scott Neal/HOU",
        "Hunter S Shively/",
        "Phillip K Allen/HOU",
        "Scott Mills/HOU",
        "Russ Severson",
        "Richard Burchfield",
        "Richard Burchfield",
        "Scott Neal/HOU",
        "Phillip K Allen/HOU",
        "Scott Mills/HOU",
        "Russ Severson/"
      ],
      "ORG": [
        "ECT",
        "ECT",
        "ECT",
        "Allan Severude/HOU",
        "ECT",
        "ECT",
        "ECT",
        "Fletcher J Sturm/HOU/",
        "ECT",
        "ECT",
        "ECT",
        "ECT",
        "ECT",
        "ECT",
        "ECT"
      ],
      "PRODUCT": [
        "09/25/2000"
      ],
      "TIME": [
        "02:01 PM",
        "01:00 PM",
        "02:00 PM",
        "03:00:00 PM CDT",
        "1 hour"
      ],
      "DATE": [
        "a weekend"
      ]
    },
    "phone_numbers": []
  },
  {
    "sender_full_name": "Phillip K Allen",
    "reciever_full_name": "Ina Rangel",
    "sender_first_name": "Phillip",
    "sender_last_name": "Allen",
    "reciever_first_name": "Ina",
    "reciever_last_name": "Rangel",
    "sender_email": "phillip.allen@enron.com",
    "reciever_email": "ina.rangel@enron.com",
    "sender_org": "enron",
    "reciever_org": "enron",
    "subject": "Mime-Version: 1.0",
    "body": "\n---------------------- Forwarded by Phillip K Allen/HOU/ECT on 09/25/2000 \n02:00 PM ---------------------------\n\n\n\tInvitation\nChairperson: Richard Burchfield\nSent by: Cindy Cicchetti\n\nStart: 09/27/2000 01:00 PM\nEnd: 09/27/2000 02:00 PM\n\nDescription: Gas Physical/Financail Positions - Room 2537\n\n\n\nThis meeting repeats   starting on    (if the date occurs on a weekend the \nmeeting ).\nMeeting Dates: \n\n\n\nFletcher J Sturm/HOU/ECT\nScott Neal/HOU/ECT\nHunter S Shively/HOU/ECT\nPhillip K Allen/HOU/ECT\nAllan Severude/HOU/ECT\nScott Mills/HOU/ECT\nRuss Severson/HOU/ECT\n\nDetailed description:\n\n\n",
    "date": "Mon, 25 Sep 2000 07:01:00 -0700 (PDT)",
    "message_id": "17698185.1075855688030.JavaMail.evans@thyme",
    "word_count": 77,
    "summarised_body": "",
    "named_entities": {
      "PERSON": [
        "Phillip K Allen/HOU",
        "Richard Burchfield",
        "Cindy Cicchetti",
        "Fletcher J Sturm/HOU",
        "Scott Neal/HOU",
        "Hunter S Shively/",
        "Phillip K Allen/HOU",
        "Scott Mills/HOU",
        "Russ Severson"
      ],
      "ORG": [
        "ECT",
        "ECT",
        "ECT",
        "Allan Severude/HOU",
        "ECT",
        "ECT"
      ],
      "PRODUCT": [
        "09/25/2000"
      ],
      "TIME": [
        "02:00 PM",
        "01:00 PM",
        "02:00 PM"
      ],
      "DATE": [
        "a weekend"
      ]
    },
    "phone_numbers": []
  },
  {
    "sender_full_name": "Phillip K Allen",
    "reciever_full_name": "muller@thedoghousemail.com",
    "sender_first_name": "Phillip",
    "sender_last_name": "Allen",
    "reciever_first_name": "thedoghousemail",
    "reciever_last_name": "",
    "sender_email": "phillip.allen@enron.com",
    "reciever_email": "muller@thedoghousemail.com",
    "sender_org": "enron",
    "reciever_org": "thedoghousemail",
    "subject": "Mime-Version: 1.0",
    "body": "\nGreg,\n\nHappy B-day. Email me your phone # and I will call you.\n\nKeith",
    "date": "Mon, 25 Sep 2000 05:47:00 -0700 (PDT)",
    "message_id": "26911498.1075855688052.JavaMail.evans@thyme",
    "word_count": 14,
    "summarised_body": "",
    "named_entities": {
      "DATE": [
        "B-day"
      ],
      "PERSON": [
        "Keith"
      ]
    },
    "phone_numbers": []
  },
  {
    "sender_full_name": "Phillip K Allen",
    "reciever_full_name": "Kathy M Moore",
    "sender_first_name": "Phillip",
    "sender_last_name": "Allen",
    "reciever_first_name": "Kathy",
    "reciever_last_name": "Moore",
    "sender_email": "phillip.allen@enron.com",
    "reciever_email": "kathy.moore@enron.com",
    "sender_org": "enron",
    "reciever_org": "enron",
    "subject": "Mime-Version: 1.0",
    "body": "\nKathy,\n\nRegarding the guest password for gas daily, can you please relay the \ninformation to Mike Grigsby at 37031 so he can pass it along to the user at \ngas daily today.  I will be out of the office on Friday.\n\nthank you\n\nPhillip",
    "date": "Fri, 22 Sep 2000 00:06:00 -0700 (PDT)",
    "message_id": "21367359.1075855688073.JavaMail.evans@thyme",
    "word_count": 44,
    "summarised_body": "",
    "named_entities": {
      "DATE": [
        "daily",
        "37031",
        "today",
        "Friday"
      ],
      "PERSON": [
        "Mike Grigsby",
        "Phillip"
      ]
    },
    "phone_numbers": []
  },
  {
    "sender_full_name": "Phillip K Allen",
    "reciever_full_name": "John J Lavorato",
    "sender_first_name": "Phillip",
    "sender_last_name": "Allen",
    "reciever_first_name": "John",
    "reciever_last_name": "Lavorato",
    "sender_email": "phillip.allen@enron.com",
    "reciever_email": "john.lavorato@enron.com",
    "sender_org": "enron",
    "reciever_org": "enron",
    "subject": "Mime-Version: 1.0",
    "body": "\nJohn,\n\n Denver's short rockies position  beyond 2002 is created by their Trailblazer \ntransport.  They are unhedged 15,000/d in 2003 and 25,000/d in 2004 and \n2005.  \n\n They are scrubbing all their books and booking the Hubert deal on Wednesday \nand Thursday.\n\nPhillip",
    "date": "Wed, 20 Sep 2000 08:06:00 -0700 (PDT)",
    "message_id": "21687372.1075855688094.JavaMail.evans@thyme",
    "word_count": 41,
    "summarised_body": "",
    "named_entities": {
      "PERSON": [
        "John",
        "Hubert",
        "Phillip"
      ],
      "GPE": [
        "Denver"
      ],
      "DATE": [
        "2002",
        "2003",
        "2004",
        "2005",
        "Wednesday",
        "Thursday"
      ],
      "PRODUCT": [
        "Trailblazer"
      ],
      "CARDINAL": [
        "15,000",
        "25,000"
      ]
    },
    "phone_numbers": []
  },
  {
    "sender_full_name": "Phillip K Allen",
    "reciever_full_name": "James D Steffes <James D Steffes/NA/Enron@Enron>",
    "sender_first_name": "Phillip",
    "sender_last_name": "Allen",
    "reciever_first_name": "James",
    "reciever_last_name": "enron",
    "sender_email": "phillip.allen@enron.com",
    "reciever_email": "james.steffes@enron.com",
    "sender_org": "enron",
    "reciever_org": "enron",
    "subject": "Mime-Version: 1.0",
    "body": "\nJim,\n\nIs there going to be a conference call or some type of weekly meeting about all the regulatory issues facing California this week?  Can you make sure the gas desk is included.\n\nPhillip",
    "date": "Wed, 2 May 2001 12:36:00 -0700 (PDT)",
    "message_id": "32300323.1075855378519.JavaMail.evans@thyme",
    "word_count": 34,
    "summarised_body": "",
    "named_entities": {
      "PERSON": [
        "Jim",
        "Phillip"
      ],
      "DATE": [
        "weekly",
        "this week"
      ],
      "GPE": [
        "California"
      ]
    },
    "phone_numbers": []
  },
  {
    "sender_full_name": "Phillip K Allen",
    "reciever_full_name": "cbpres@austin.rr.com",
    "sender_first_name": "Phillip",
    "sender_last_name": "Allen",
    "reciever_first_name": "austin.rr",
    "reciever_last_name": "",
    "sender_email": "phillip.allen@enron.com",
    "reciever_email": "cbpres@austin.rr.com",
    "sender_org": "enron",
    "reciever_org": "austin.rr",
    "subject": "Mime-Version: 1.0",
    "body": "\nGeorge,\n\n Below is a list of questions that Keith and I had regarding the Westgate \nproject:\n\n Ownership Structure\n\n What will be the ownership structure? Limited partnership? General partner?\n\n What are all the legal entities that will be involved and in what \ncapacity(regarding ownership and \n liabilities)?\n\n Who owns the land? improvements?\n\n Who holds the various loans?\n\n Is the land collateral?\n\n Investment\n \n What happens to initial investment?\n\n Is it used to purchase land for cash?Secure future loans?\n \n Why is the land cost spread out on the cash flow statement?\n\n When is the 700,000 actually needed? Now or for the land closing? Investment \nschedule?\n\n Investment Return\n\n Is Equity Repayment the return of the original investment?\n\n Is the plan to wait until the last unit is sold and closed before profits \nare distributed?\n\n Debt\n\n Which entity is the borrower for each loan and what recourse or collateral \nis associated with each \n loan?\n\n Improvement\n\n Construction\n\n Are these the only two loans?  Looks like it from the cash flow statement.\n\n Terms of each loan?\n\n Uses of Funds\n\n How will disbursements be made?  By whom?\n\n What type of bank account?  Controls on max disbursement? Internet viewing \nfor investors?\n\n Reports to track expenses vs plan?\n\n Bookkeeping procedures to record actual expenses?\n\n What is the relationship of Creekside Builders to the project?  Do you get \npaid a markup on subcontractors as a \n general contractor and paid gain out of profits?\n\n Do you or Larry receive any money in the form of salary or personal expenses \nbefore the ultimate payout of profits?\n\n Design and Construction\n \n When will design be complete?\n\n What input will investors have in selecting design and materials for units?\n\n What level of investor involvement will be possible during construction \nplanning and permitting?\n\n Does Creekside have specific procedures for dealing with subcontractors, \nvendors, and other professionals? \n Such as always getting 3 bids, payment schedules, or reference checking?\n\n Are there any specific companies or individuals that you already plan to \nuse? Names?\n\nThese questions are probably very basic to you, but as a first time investor \nin a project like this it is new to me.  Also, I want to learn as\nmuch as possible from the process.\n\nPhillip\n\n\n\n\n\n\n\n\n\n\n \n \n\n \n\n  \n\n ",
    "date": "Wed, 20 Sep 2000 06:34:00 -0700 (PDT)",
    "message_id": "31434120.1075855688116.JavaMail.evans@thyme",
    "word_count": 357,
    "summarised_body": "",
    "named_entities": {
      "PERSON": [
        "Keith",
        "Westgate",
        "Controls",
        "max",
        "Larry"
      ],
      "CARDINAL": [
        "700,000",
        "only two",
        "3"
      ],
      "PRODUCT": [
        "Debt"
      ],
      "ORG": [
        "Improvement\n\n Construction\n\n Are",
        "Uses of Funds\n\n ",
        "Creekside Builders"
      ],
      "ORDINAL": [
        "first"
      ]
    },
    "phone_numbers": []
  },
  {
    "sender_full_name": "Phillip K Allen",
    "reciever_full_name": "pallen70@hotmail.com",
    "sender_first_name": "Phillip",
    "sender_last_name": "Allen",
    "reciever_first_name": "hotmail",
    "reciever_last_name": "",
    "sender_email": "phillip.allen@enron.com",
    "reciever_email": "pallen70@hotmail.com",
    "sender_org": "enron",
    "reciever_org": "hotmail",
    "subject": "Westgate Proforma-Phillip Allen.xls",
    "body": "\n---------------------- Forwarded by Phillip K Allen/HOU/ECT on 09/19/2000 \n04:35 PM ---------------------------\n\n\n\"George Richards\" <cbpres@austin.rr.com",
    "date": "Tue, 19 Sep 2000 09:35:00 -0700 (PDT)",
    "message_id": "32280829.1075855688139.JavaMail.evans@thyme",
    "word_count": 11,
    "summarised_body": "",
    "named_entities": {
      "PERSON": [
        "Phillip K Allen/HOU",
        "George Richards"
      ],
      "ORG": [
        "ECT"
      ],
      "TIME": [
        "04:35 PM"
      ]
    },
    "phone_numbers": []
  },
  {
    "sender_full_name": "Phillip K Allen",
    "reciever_full_name": "cbpres@austin.rr.com>",
    "sender_first_name": "Phillip",
    "sender_last_name": "Allen",
    "reciever_first_name": "austin.rr",
    "reciever_last_name": "",
    "sender_email": "phillip.allen@enron.com",
    "reciever_email": "cbpres@austin.rr.com",
    "sender_org": "enron",
    "reciever_org": "austin.rr",
    "subject": "Mime-Version: 1.0",
    "body": "\nGeorge,\n\n Here sales numbers from Reagan:\n\n \n \n\n As you can see his units sold at a variety of prices per square foot.  The \n1308/1308 model seems to have the most data and looks most similiar to the \nunits you are selling.  At  2.7 MM, my bid is .70/sf higher than his units \nunder construction.  I am having a hard time justifying paying much more with \ncompetition on the way.  The price I am bidding is higher than any deals \nactually done to date.   \n\n Let me know what you think.  I will follow up with an email and phone call \nabout Cherry Creek.  I am sure Deborah Yates let you know that the bid was \nrejected on the De Ville property.\n\nPhillip Allen\n \n \n\n\n\n\n  ",
    "date": "Tue, 19 Sep 2000 07:26:00 -0700 (PDT)",
    "message_id": "2287499.1075855688163.JavaMail.evans@thyme",
    "word_count": 119,
    "summarised_body": "",
    "named_entities": {
      "PERSON": [
        "Reagan",
        "Deborah",
        "Phillip Allen"
      ],
      "DATE": [
        "1308/1308"
      ],
      "CARDINAL": [
        "At  2.7"
      ],
      "GPE": [
        "MM",
        "Cherry Creek"
      ]
    },
    "phone_numbers": []
  },
  {
    "sender_full_name": "Phillip K Allen",
    "reciever_full_name": "jsmith@austintx.com",
    "sender_first_name": "Phillip",
    "sender_last_name": "Allen",
    "reciever_first_name": "austintx",
    "reciever_last_name": "",
    "sender_email": "phillip.allen@enron.com",
    "reciever_email": "jsmith@austintx.com",
    "sender_org": "enron",
    "reciever_org": "austintx",
    "subject": "Mime-Version: 1.0",
    "body": "\nJeff,\n\n What is up with Burnet?\n\nPhillip",
    "date": "Tue, 19 Sep 2000 03:15:00 -0700 (PDT)",
    "message_id": "26184989.1075855688184.JavaMail.evans@thyme",
    "word_count": 7,
    "summarised_body": "",
    "named_entities": {
      "PERSON": [
        "Jeff",
        "Phillip"
      ]
    },
    "phone_numbers": []
  },
  {
    "sender_full_name": "Phillip K Allen",
    "reciever_full_name": "\"Jeff Smith\" <jsmith@austintx.com> @ ENRON",
    "sender_first_name": "Phillip",
    "sender_last_name": "Allen",
    "reciever_first_name": "\"Jeff",
    "reciever_last_name": "ENRON",
    "sender_email": "phillip.allen@enron.com",
    "reciever_email": "jsmith@austintx.com",
    "sender_org": "enron",
    "reciever_org": "austintx",
    "subject": "Re: burnet",
    "body": "\nJeff,\n\n I need to see the site plan for Burnet.  Remember I must get written \napproval from Brenda Key Stone before I can sell this property and she has \nconcerns about the way the property will be subdivided.    I would also like \nto review the closing statements as soon as possible.\n\nPhillip",
    "date": "Mon, 18 Sep 2000 02:34:00 -0700 (PDT)",
    "message_id": "24737799.1075855688205.JavaMail.evans@thyme",
    "word_count": 52,
    "summarised_body": "",
    "named_entities": {
      "PERSON": [
        "Jeff",
        "Brenda Key Stone",
        "Phillip"
      ]
    },
    "phone_numbers": []
  },
  {
    "sender_full_name": "Phillip K Allen",
    "reciever_full_name": "stagecoachmama@hotmail.com",
    "sender_first_name": "Phillip",
    "sender_last_name": "Allen",
    "reciever_first_name": "hotmail",
    "reciever_last_name": "",
    "sender_email": "phillip.allen@enron.com",
    "reciever_email": "stagecoachmama@hotmail.com",
    "sender_org": "enron",
    "reciever_org": "hotmail",
    "subject": "Mime-Version: 1.0",
    "body": "\nLucy,\n\nI want to have an accurate rent roll as soon as possible. I faxed you a copy \nof this file.  You can fill in on the computer or just write in the correct \namounts and I will input.\n",
    "date": "Wed, 13 Sep 2000 06:02:00 -0700 (PDT)",
    "message_id": "28779445.1075855688226.JavaMail.evans@thyme",
    "word_count": 39,
    "summarised_body": "",
    "named_entities": {
      "PERSON": [
        "Lucy"
      ]
    },
    "phone_numbers": []
  },
  {
    "sender_full_name": "Phillip K Allen",
    "reciever_full_name": "Brenda Stone <bs_stone@yahoo.com> @ ENRON",
    "sender_first_name": "Phillip",
    "sender_last_name": "Allen",
    "reciever_first_name": "Brenda",
    "reciever_last_name": "ENRON",
    "sender_email": "phillip.allen@enron.com",
    "reciever_email": "bs_stone@yahoo.com",
    "sender_org": "enron",
    "reciever_org": "yahoo",
    "subject": "Re: Sept 1 Payment",
    "body": "\nBrenda,\n\n I checked my records and I mailed check #1178 for the normal amount on \nAugust 28th.  I mailed it to 4303 Pate Rd. #29, College Station, TX 77845.  I \nwill go ahead and mail you another check.  If the first one shows up you can \ntreat the 2nd as payment for October.\n\n I know your concerns about the site plan.  I will not proceed without \ngetting the details and getting your approval.\n\n I will find that amortization schedule and send it soon.\n\nPhillip",
    "date": "Tue, 12 Sep 2000 06:42:00 -0700 (PDT)",
    "message_id": "9007402.1075855688248.JavaMail.evans@thyme",
    "word_count": 84,
    "summarised_body": "",
    "named_entities": {
      "PERSON": [
        "Brenda",
        "Phillip"
      ],
      "MONEY": [
        "1178",
        "29"
      ],
      "DATE": [
        "August 28th",
        "4303",
        "the 2nd",
        "October"
      ],
      "ORG": [
        "College Station",
        "TX 77845"
      ],
      "ORDINAL": [
        "first"
      ]
    },
    "phone_numbers": []
  },
  {
    "sender_full_name": "Phillip K Allen",
    "reciever_full_name": "stagecoachmama@hotmail.com",
    "sender_first_name": "Phillip",
    "sender_last_name": "Allen",
    "reciever_first_name": "hotmail",
    "reciever_last_name": "",
    "sender_email": "phillip.allen@enron.com",
    "reciever_email": "stagecoachmama@hotmail.com",
    "sender_org": "enron",
    "reciever_org": "hotmail",
    "subject": "Mime-Version: 1.0",
    "body": "\nLucy,\n\n\nYou wrote fewer checks this month.  Spent more money on Materials and less on \nLabor.\n\n\n   June  July  August\n\nTotal Materials  2929  4085  4801\n\nServices  53  581  464\n\nLabor   3187  3428  2770\n\n\n\n\n\n\nHere are my questions on the August bank statement (attached):\n\n1.  Check 1406  Walmart    Description and unit?\n\n2.  Check 1410  Crumps     Detail description and unit?\n\n3.  Check 1411  Lucy      What is this?\n\n4.  Check 1415  Papes      Detail description and units?\n\n5.  Checks 1416, 1417, and 1425  Why overtime?\n\n6.  Check 1428    Ralph's   What unit?\n\n7.  Check 1438    Walmart?    Description and unit?  \n\n\nTry and pull together the support for these items and get back to me.\n\nPhillip",
    "date": "Tue, 12 Sep 2000 06:06:00 -0700 (PDT)",
    "message_id": "23377438.1075855688269.JavaMail.evans@thyme",
    "word_count": 108,
    "summarised_body": "",
    "named_entities": {
      "PERSON": [
        "Lucy",
        "Lucy      ",
        "Ralph",
        "Phillip"
      ],
      "DATE": [
        "this month",
        "June  July  August",
        "2929  4085  4801",
        "3187  3428  2770",
        "August",
        "1410",
        "1415",
        "1416, 1417",
        "1425",
        "1428",
        "1438"
      ],
      "CARDINAL": [
        "53",
        "581",
        "1",
        "2",
        "3",
        "4",
        "5",
        "6",
        "7"
      ],
      "ORG": [
        "Crumps     Detail"
      ]
    },
    "phone_numbers": []
  },
  {
    "sender_full_name": "Phillip K Allen",
    "reciever_full_name": "Paul T Lucci, Kenneth Shulklapper",
    "sender_first_name": "Phillip",
    "sender_last_name": "Allen",
    "reciever_first_name": "Paul",
    "reciever_last_name": "Shulklapper",
    "sender_email": "phillip.allen@enron.com",
    "reciever_email": "paul.lucci@enron.com, kenneth.shulklapper@enron.com",
    "sender_org": "enron",
    "reciever_org": "enron.com, kenneth.shulklapper@enron",
    "subject": "Contact list for mid market",
    "body": "\n---------------------- Forwarded by Phillip K Allen/HOU/ECT on 09/12/2000 \n11:22 AM ---------------------------\n\nMichael Etringer\n\n09/11/2000 02:32 PM\n\nTo: Phillip K Allen/HOU/ECT@ECT\ncc:  \nSubject: Contact list for mid market\n\nPhillip,\nAttached is the list.  Have your people fill in the columns highlighted in \nyellow.  As best can we will try not to overlap on accounts. \n\nThanks, Mike\n\n\n",
    "date": "Tue, 12 Sep 2000 04:23:00 -0700 (PDT)",
    "message_id": "15766602.1075855688290.JavaMail.evans@thyme",
    "word_count": 52,
    "summarised_body": "",
    "named_entities": {
      "PERSON": [
        "Phillip K Allen/HOU",
        "Michael Etringer",
        "Phillip K Allen/HOU",
        "Phillip",
        "Mike"
      ],
      "ORG": [
        "ECT"
      ],
      "TIME": [
        "11:22 AM",
        "02:32 PM"
      ]
    },
    "phone_numbers": []
  },
  {
    "sender_full_name": "Phillip K Allen",
    "reciever_full_name": "moshuffle@hotmail.com",
    "sender_first_name": "Phillip",
    "sender_last_name": "Allen",
    "reciever_first_name": "hotmail",
    "reciever_last_name": "",
    "sender_email": "phillip.allen@enron.com",
    "reciever_email": "moshuffle@hotmail.com",
    "sender_org": "enron",
    "reciever_org": "hotmail",
    "subject": "Mime-Version: 1.0",
    "body": "\nhttp://www.hearme.com/vc2/?chnlOwnr=pallen@enron.com",
    "date": "Tue, 12 Sep 2000 00:27:00 -0700 (PDT)",
    "message_id": "9942513.1075855688311.JavaMail.evans@thyme",
    "word_count": 0,
    "summarised_body": "",
    "named_entities": {},
    "phone_numbers": []
  },
  {
    "sender_full_name": "Phillip K Allen",
    "reciever_full_name": "Tori Kuykendall <Tori Kuykendall/HOU/ECT@ECT>",
    "sender_first_name": "Phillip",
    "sender_last_name": "Allen",
    "reciever_first_name": "Tori",
    "reciever_last_name": "enron",
    "sender_email": "phillip.allen@enron.com",
    "reciever_email": "tori.kuykendall@enron.com",
    "sender_org": "enron",
    "reciever_org": "enron",
    "subject": "Re: 2- SURVEY - PHILLIP ALLEN",
    "body": "\n\n---------------------- Forwarded by Phillip K Allen/HOU/ECT on 05/02/2001 05:26 AM ---------------------------\n\n\nIna Rangel\n05/01/2001 12:24 PM\nTo:\tPhillip K Allen/HOU/ECT@ECT\ncc:\t \nSubject:\tRe: 2- SURVEY - PHILLIP ALLEN   \n\n\n\n\n   \n-\nFull Name:        Phillip Allen\n\nLogin ID:  \tpallen\n\nExtension:  3-7041\n\nOffice Location:  EB3210C\n\nWhat type of computer do you have?  (Desktop,  Laptop,  Both)  Both\n\nDo you have a PDA?  If yes, what type do you have:   (None, IPAQ, Palm Pilot, Jornada)  IPAQ\n\nDo you have permission to access anyone's Email/Calendar?  NO\n    If yes, who?  \n\nDoes anyone have permission to access your Email/Calendar?  YES\n    If yes, who?  INA RANGEL\n\nAre you responsible for updating anyone else's address book?  \n    If yes, who?  NO\n\nIs anyone else responsible for updating your address book?  \n    If yes, who?  NO\n\nDo you have access to a shared calendar?  \n    If yes, which shared calendar?  YES, West Calendar\n\nDo you have any Distribution Groups that Messaging maintains for you (for mass mailings)?  \n    If yes, please list here:  NO\n\nPlease list all Notes databases applications that you currently use:  NONE\n\nIn our efforts to plan the exact date/time of your migration, we also will need to know:\n\nWhat are your normal work hours?  From:     7:00 AM To:      5:00 PM\n\nWill you be out of the office in the near future for vacation, leave, etc? NO\n       If so, when?        From (MM/DD/YY):      To (MM/DD/YY):      \n\n\n\n\n\n\n\n\n\n\n<Embedded StdOleLink",
    "date": "Wed, 2 May 2001 10:27:00 -0700 (PDT)",
    "message_id": "27936946.1075855378542.JavaMail.evans@thyme",
    "word_count": 223,
    "summarised_body": "",
    "named_entities": {
      "PERSON": [
        "Phillip K Allen/HOU",
        "Ina Rangel\n",
        "Phillip K Allen/HOU",
        "Subject",
        "Phillip Allen"
      ],
      "ORG": [
        "ECT",
        "Laptop",
        "IPAQ",
        "IPAQ"
      ],
      "TIME": [
        "05:26 AM",
        "12:24 PM",
        "normal work hours",
        "7:00 AM",
        "5:00 PM"
      ],
      "CARDINAL": [
        "3-7041"
      ],
      "GPE": [
        "Jornada",
        "MM",
        "DD",
        "MM",
        "DD"
      ],
      "WORK_OF_ART": [
        "Email/Calendar"
      ],
      "PRODUCT": [
        "Notes"
      ]
    },
    "phone_numbers": []
  },
  {
    "sender_full_name": "Phillip K Allen",
    "reciever_full_name": "Keith Holst",
    "sender_first_name": "Phillip",
    "sender_last_name": "Allen",
    "reciever_first_name": "Keith",
    "reciever_last_name": "Holst",
    "sender_email": "phillip.allen@enron.com",
    "reciever_email": "keith.holst@enron.com",
    "sender_org": "enron",
    "reciever_org": "enron",
    "subject": "Westgate Proforma-Phillip Allen.xls",
    "body": "\n---------------------- Forwarded by Phillip K Allen/HOU/ECT on 09/11/2000 \n04:57 PM ---------------------------\n\n\n\"George Richards\" <cbpres@austin.rr.com",
    "date": "Mon, 11 Sep 2000 09:57:00 -0700 (PDT)",
    "message_id": "2751799.1075855688335.JavaMail.evans@thyme",
    "word_count": 11,
    "summarised_body": "",
    "named_entities": {
      "PERSON": [
        "Phillip K Allen/HOU",
        "George Richards"
      ],
      "ORG": [
        "ECT"
      ],
      "TIME": [
        "04:57 PM"
      ]
    },
    "phone_numbers": []
  },
  {
    "sender_full_name": "Phillip K Allen",
    "reciever_full_name": "\"Jeff Smith\" <jsmith@austintx.com> @ ENRON",
    "sender_first_name": "Phillip",
    "sender_last_name": "Allen",
    "reciever_first_name": "\"Jeff",
    "reciever_last_name": "ENRON",
    "sender_email": "phillip.allen@enron.com",
    "reciever_email": "jsmith@austintx.com",
    "sender_org": "enron",
    "reciever_org": "austintx",
    "subject": "Re: Chelsea Villas",
    "body": "\nJeff,\n\n I received the rent roll.  I am going to be in San Marcos this weekend but I \nam booked with stage coach.  I will drive by Friday evening.\n I will let you know next week if I need to see the inside.  Can you find out \nwhen Chelsea Villa last changed hands and for what price?\n\n What about getting a look at the site plans for the Burnet deal.  Remember \nwe have to get Brenda happy.\n\nPhillip",
    "date": "Mon, 11 Sep 2000 09:30:00 -0700 (PDT)",
    "message_id": "11482982.1075855688356.JavaMail.evans@thyme",
    "word_count": 78,
    "summarised_body": "",
    "named_entities": {
      "PERSON": [
        "Jeff",
        "Chelsea Villa",
        "Brenda",
        "Phillip"
      ],
      "GPE": [
        "San Marcos"
      ],
      "DATE": [
        "this weekend",
        "Friday",
        "next week"
      ],
      "TIME": [
        "evening"
      ]
    },
    "phone_numbers": []
  },
  {
    "sender_full_name": "Phillip K Allen",
    "reciever_full_name": "John J Lavorato",
    "sender_first_name": "Phillip",
    "sender_last_name": "Allen",
    "reciever_first_name": "John",
    "reciever_last_name": "Lavorato",
    "sender_email": "phillip.allen@enron.com",
    "reciever_email": "john.lavorato@enron.com",
    "sender_org": "enron",
    "reciever_org": "enron",
    "subject": "Mime-Version: 1.0",
    "body": "\n  9/8  9/7  diff\n\nSocal  36,600  37,200  -600\n\nNWPL  -51,000  -51,250  250\n\nSan Juan -32,500  -32,000  -500\n\n\nThe reason the benchmark report shows net selling San Juan is that the \ntransport positions were rolled in on 9/8.  This added 800 shorts to San Juan \nand 200 longs to Socal.  Before this adjustment we bought 300 San Juan and \nsold 800 Socal.\n ",
    "date": "Mon, 11 Sep 2000 08:07:00 -0700 (PDT)",
    "message_id": "22955100.1075855688377.JavaMail.evans@thyme",
    "word_count": 49,
    "summarised_body": "",
    "named_entities": {
      "CARDINAL": [
        "9/7",
        "36,600",
        "37,200",
        "250",
        "9/8",
        "800",
        "200",
        "300",
        "800"
      ],
      "ORG": [
        "Socal",
        "NWPL",
        "Socal",
        "Socal"
      ],
      "GPE": [
        "San Juan",
        "San Juan",
        "San Juan",
        "San Juan"
      ]
    },
    "phone_numbers": []
  },
  {
    "sender_full_name": "Phillip K Allen",
    "reciever_full_name": "Frank Hayden",
    "sender_first_name": "Phillip",
    "sender_last_name": "Allen",
    "reciever_first_name": "Frank",
    "reciever_last_name": "Hayden",
    "sender_email": "phillip.allen@enron.com",
    "reciever_email": "frank.hayden@enron.com",
    "sender_org": "enron",
    "reciever_org": "enron",
    "subject": "Re: VaR by Curve",
    "body": "\nwhy is aeco basis so low on the list?  Is NWPL mapped differently than AECO?  \nWhat about the correlation to Nymex on AECO?",
    "date": "Mon, 11 Sep 2000 07:16:00 -0700 (PDT)",
    "message_id": "31071154.1075855688399.JavaMail.evans@thyme",
    "word_count": 23,
    "summarised_body": "",
    "named_entities": {
      "ORG": [
        "NWPL",
        "Nymex"
      ]
    },
    "phone_numbers": []
  },
  {
    "sender_full_name": "Phillip K Allen",
    "reciever_full_name": "\"Jeff Smith\" <jsmith@austintx.com> @ ENRON",
    "sender_first_name": "Phillip",
    "sender_last_name": "Allen",
    "reciever_first_name": "\"Jeff",
    "reciever_last_name": "ENRON",
    "sender_email": "phillip.allen@enron.com",
    "reciever_email": "jsmith@austintx.com",
    "sender_org": "enron",
    "reciever_org": "austintx",
    "subject": "Re: Sagewood etc.",
    "body": "\nJeff,\n\n You would clearly receive a commission on a deal on the sagewood. \n\n  I am surprised by your request for payment on any type of project in which  \nI might become involved with Creekside.  Are you in the business of brokering \nproperties or contacts?  Is your position based on a legal or what you \nperceive to be an ethical issue?  Did you propose we look at developing a \nproject from scratch?\n\n I am not prepared to pay more than 2.7 for sagewood yet.  \n\nPhillip",
    "date": "Mon, 11 Sep 2000 02:19:00 -0700 (PDT)",
    "message_id": "5273698.1075855688420.JavaMail.evans@thyme",
    "word_count": 83,
    "summarised_body": "",
    "named_entities": {
      "PERSON": [
        "Jeff",
        "Phillip"
      ],
      "ORG": [
        "Creekside"
      ],
      "CARDINAL": [
        "more than 2.7"
      ]
    },
    "phone_numbers": []
  },
  {
    "sender_full_name": "Phillip K Allen",
    "reciever_full_name": "pallen70@hotmail.com",
    "sender_first_name": "Phillip",
    "sender_last_name": "Allen",
    "reciever_first_name": "hotmail",
    "reciever_last_name": "",
    "sender_email": "phillip.allen@enron.com",
    "reciever_email": "pallen70@hotmail.com",
    "sender_org": "enron",
    "reciever_org": "hotmail",
    "subject": "Sagewood Town Homes",
    "body": "\n---------------------- Forwarded by Phillip K Allen/HOU/ECT on 09/08/2000 \n12:29 PM ---------------------------\n\n\n\"George Richards\" <cbpres@austin.rr.com",
    "date": "Fri, 8 Sep 2000 05:30:00 -0700 (PDT)",
    "message_id": "17791617.1075855688442.JavaMail.evans@thyme",
    "word_count": 11,
    "summarised_body": "",
    "named_entities": {
      "PERSON": [
        "Phillip K Allen/HOU",
        "George Richards"
      ],
      "ORG": [
        "ECT"
      ],
      "TIME": [
        "12:29 PM"
      ]
    },
    "phone_numbers": []
  },
  {
    "sender_full_name": "Phillip K Allen",
    "reciever_full_name": "pallen70@hotmail.com",
    "sender_first_name": "Phillip",
    "sender_last_name": "Allen",
    "reciever_first_name": "hotmail",
    "reciever_last_name": "",
    "sender_email": "phillip.allen@enron.com",
    "reciever_email": "pallen70@hotmail.com",
    "sender_org": "enron",
    "reciever_org": "hotmail",
    "subject": "Westgate Proforma-Phillip Allen.xls",
    "body": "\n---------------------- Forwarded by Phillip K Allen/HOU/ECT on 09/08/2000 \n12:28 PM ---------------------------\n\n\n\"George Richards\" <cbpres@austin.rr.com",
    "date": "Fri, 8 Sep 2000 05:29:00 -0700 (PDT)",
    "message_id": "20163768.1075855688465.JavaMail.evans@thyme",
    "word_count": 11,
    "summarised_body": "",
    "named_entities": {
      "PERSON": [
        "Phillip K Allen/HOU",
        "George Richards"
      ],
      "ORG": [
        "ECT"
      ],
      "TIME": [
        "12:28 PM"
      ]
    },
    "phone_numbers": []
  },
  {
    "sender_full_name": "Phillip K Allen",
    "reciever_full_name": "pallen70@hotmail.com",
    "sender_first_name": "Phillip",
    "sender_last_name": "Allen",
    "reciever_first_name": "hotmail",
    "reciever_last_name": "",
    "sender_email": "phillip.allen@enron.com",
    "reciever_email": "pallen70@hotmail.com",
    "sender_org": "enron",
    "reciever_org": "hotmail",
    "subject": "utilities roll",
    "body": "\n---------------------- Forwarded by Phillip K Allen/HOU/ECT on 09/06/2000 \n03:53 PM ---------------------------\n\n\n\"Lucy Gonzalez\" <stagecoachmama@hotmail.com",
    "date": "Wed, 6 Sep 2000 08:54:00 -0700 (PDT)",
    "message_id": "26254346.1075855688486.JavaMail.evans@thyme",
    "word_count": 11,
    "summarised_body": "",
    "named_entities": {
      "PERSON": [
        "Phillip K Allen/HOU",
        "Lucy Gonzalez"
      ],
      "ORG": [
        "ECT"
      ],
      "TIME": [
        "03:53 PM"
      ]
    },
    "phone_numbers": []
  },
  {
    "sender_full_name": "Phillip K Allen",
    "reciever_full_name": "Ina Rangel",
    "sender_first_name": "Phillip",
    "sender_last_name": "Allen",
    "reciever_first_name": "Ina",
    "reciever_last_name": "Rangel",
    "sender_email": "phillip.allen@enron.com",
    "reciever_email": "ina.rangel@enron.com",
    "sender_org": "enron",
    "reciever_org": "enron",
    "subject": "TIME SENSITIVE: Executive Impact & Influence Program Survey",
    "body": "\n---------------------- Forwarded by Phillip K Allen/HOU/ECT on 09/06/2000 \n02:01 PM ---------------------------\n\n\nEnron-admin@FSDDataSvc.com on 09/06/2000 10:12:33 AM\nTo: pallen@enron.com\ncc:  \nSubject: TIME SENSITIVE: Executive Impact & Influence Program Survey\n\n\nExecutive Impact & Influence Program\n* IMMEDIATE ACTION REQUIRED - Do Not Delete *\n\nAs part of the Executive Impact and Influence Program, each participant\nis asked to gather input on the participant's own management styles and\npractices as experienced by their immediate manager, each direct report,\nand up to eight peers/colleagues.\n\nYou have been requested to provide feedback for a participant attending\nthe next program.  Your input (i.e., a Self assessment, Manager assessment,\nDirect Report assessment, or Peer/Colleague assessment) will be combined\nwith the input of others and used by the program participant to develop an\naction plan to improve his/her management styles and practices.\n\nIt is important that you complete this assessment\nNO LATER THAN CLOSE OF BUSINESS Thursday, September 14.\n\nSince the feedback is such an important part of the program, the participant\nwill be asked to cancel his/her attendance if not enough feedback is\nreceived.  Therefore, your feedback is critical.\n\nTo complete your assessment, please click on the following link or simply\nopen your internet browser and go to:\n\nhttp://www.fsddatasvc.com/enron\n\nYour unique ID for each participant you have been asked to rate is:\n\nUnique ID - Participant\nEVH3JY - John Arnold\nER93FX - John Lavorato\nEPEXWX - Hunter Shively\n\nIf you experience technical problems, please call Dennis Ward at\nFSD Data Services, 713-942-8436.  If you have any questions about this \nprocess,\nyou may contact Debbie Nowak at Enron, 713-853-3304, or Christi Smith at\nKeilty, Goldsmith & Company, 858-450-2554.\n\nThank you for your participation.\n",
    "date": "Wed, 6 Sep 2000 07:02:00 -0700 (PDT)",
    "message_id": "16024444.1075855688508.JavaMail.evans@thyme",
    "word_count": 267,
    "summarised_body": "",
    "named_entities": {
      "PERSON": [
        "Phillip K Allen/HOU",
        "John Arnold\nER93FX - John Lavorato",
        "Dennis Ward",
        "Debbie Nowak",
        "Christi Smith"
      ],
      "ORG": [
        "ECT",
        "Executive Impact & Influence Program Survey\n\n\n",
        "Executive Impact & Influence Program",
        "Influence Program",
        "Direct Report",
        "Peer/Colleague",
        "FSD Data Services",
        "Enron",
        "Keilty, Goldsmith & Company"
      ],
      "TIME": [
        "02:01 PM"
      ],
      "CARDINAL": [
        "up to eight",
        "713",
        "713",
        "858"
      ],
      "DATE": [
        "Thursday, September 14"
      ]
    },
    "phone_numbers": [
      " 713-942-8436",
      " 713-853-3304",
      " 858-450-2554"
    ]
  },
  {
    "sender_full_name": "Phillip K Allen",
    "reciever_full_name": "retwell@sanmarcos.net",
    "sender_first_name": "Phillip",
    "sender_last_name": "Allen",
    "reciever_first_name": null,
    "reciever_last_name": "",
    "sender_email": "phillip.allen@enron.com",
    "reciever_email": "retwell@sanmarcos.net",
    "sender_org": "enron",
    "reciever_org": null,
    "subject": "Mime-Version: 1.0",
    "body": "\nLarry,\n\n Just a note to touch base on the sagewood townhomes and other development \nopportunities.\n\n I stumbled across some other duplexes for sale on the same street. that were \nbuilt by Reagan Lehmann.  22 Units were sold for \n around $2 million. ($182,000/duplex).  I spoke to Reagan and he indicated \nthat he had more units under construction that would be \n available in the 180's.  Are the units he is selling significantly different \nfrom yours?  He mentioned some of the units are the 1308 floor\n plan.  My bid of 2.7 million is almost $193,000/duplex.  \n\n As far as being an investor in a new project, I am still very interested.  \n\n Call or email with your thoughts.\n\nPhillip",
    "date": "Wed, 6 Sep 2000 07:00:00 -0700 (PDT)",
    "message_id": "14974170.1075855688529.JavaMail.evans@thyme",
    "word_count": 113,
    "summarised_body": "",
    "named_entities": {
      "PERSON": [
        "Larry",
        "Reagan Lehmann",
        "Reagan",
        "Phillip"
      ],
      "CARDINAL": [
        "22",
        "180",
        "2.7 million"
      ],
      "ORG": [
        "Units"
      ],
      "MONEY": [
        "$2 million",
        "182,000",
        "almost $193,000"
      ],
      "DATE": [
        "1308"
      ]
    },
    "phone_numbers": []
  },
  {
    "sender_full_name": "Phillip K Allen",
    "reciever_full_name": "Ina Rangel <Ina Rangel/HOU/ECT@ECT>",
    "sender_first_name": "Phillip",
    "sender_last_name": "Allen",
    "reciever_first_name": "Ina",
    "reciever_last_name": "enron",
    "sender_email": "phillip.allen@enron.com",
    "reciever_email": "ina.rangel@enron.com",
    "sender_org": "enron",
    "reciever_org": "enron",
    "subject": "4-URGENT - OWA Please print this now.",
    "body": "\n\n---------------------- Forwarded by Phillip K Allen/HOU/ECT on 05/01/2001 0=\n2:14 PM ---------------------------\n\n\nOutlook Migration Team@ENRON\n04/27/2001 01:01 PM\nTo:=09Allison Horton/NA/Enron@ENRON, Amir Baig/NA/Enron@ENRON, Brandon Bang=\nerter/NA/Enron@Enron, Brian Ellis/Corp/Enron@Enron, Charles Philpott/HR/Cor=\np/Enron@ENRON, Chris P Wood/NA/Enron@Enron, Chris Tull/HOU/ECT@ECT, Dale Sm=\nith/Corp/Enron@ENRON, Dave June/NA/Enron@ENRON, Donald Sutton/NA/Enron@Enro=\nn, Felicia Buenrostro/HR/Corp/Enron@ENRON, Johnna Morrison/Corp/Enron@ENRON=\n, Joe Dorn/Corp/Enron@ENRON, Kathryn Schultea/HR/Corp/Enron@ENRON, Leon McD=\nowell/NA/Enron@ENRON, Leticia Barrios/Corp/Enron@ENRON, Milton Brown/HR/Cor=\np/Enron@ENRON, Raj Perubhatla/Corp/Enron@Enron, Shekar Komatireddy/NA/Enron=\n@Enron, Andrea Yowman/Corp/Enron@ENRON, Angie O'Brian/HR/Corp/Enron@ENRON, =\nBonne Castellano/HR/Corp/Enron@ENRON, Gwynn Gorsuch/NA/Enron@ENRON, Jo Ann =\nMatson/Corp/Enron@ENRON, LaQuitta Washington/HR/Corp/Enron@ENRON, Rick John=\nson/HR/Corp/Enron@ENRON, Sandra Lighthill/HR/Corp/Enron@ENRON, Valeria A Ho=\npe/HOU/ECT@ECT, Charlotte Brown/HR/Corp/Enron@ENRON, Ronald Fain/HR/Corp/En=\nron@ENRON, Gary Fitch/HR/Corp/Enron@Enron, Anna Harris/HR/Corp/Enron@ENRON,=\n Keith Jones/HR/Corp/Enron@ENRON, Kristi Monson/NA/Enron@Enron, Bobbie McNi=\nel/HR/Corp/Enron@ENRON, John Stabler/HR/Corp/Enron@ENRON, Michelle Prince/N=\nA/Enron@Enron, James Gramke/NA/Enron@ENRON, Blair Hicks/NA/Enron@ENRON, Jen=\nnifer Johnson/Contractor/Enron Communications@Enron Communications, Jim Lit=\ntle/Enron@EnronXGate, Dale Lukert/NA/Enron@ENRON, Donald Martin/NA/Enron@EN=\nRON, Andrew Mattei/NA/Enron@ENRON, Darvin Mitchell/NA/Enron@ENRON, Mark Old=\nham/NA/Enron@ENRON, Wesley Pearson/NA/Enron@ENRON, Ramon Pizarro/ENRON_DEVE=\nLOPMENT@ENRON_DEVELOPMENT, Natalie Rau/NA/Enron@ENRON, William Redick/NA/En=\nron@ENRON, Mark A Richardson/NA/Enron@ENRON, Joseph Schnieders/NA/Enron@ENR=\nON, Gary Simmons/NA/Enron@Enron, Delaney Trimble/NA/Enron@ENRON, David Upto=\nn/NA/Enron@ENRON, Mike Boegler/HR/Corp/Enron@ENRON, Lyndel Click/HR/Corp/En=\nron@ENRON, Gabriel Franco/NA/Enron@Enron, Randy Gross/HR/Corp/Enron@Enron, =\nArthur Johnson/HR/Corp/Enron@Enron, Danny Jones/HR/Corp/Enron@ENRON, John O=\ngden/Houston/Eott@Eott, Edgar Ponce/NA/Enron@Enron, Tracy Pursifull/HR/Corp=\n/Enron@ENRON, Lance Stanley/HR/Corp/Enron@ENRON, Frank Ermis/HOU/ECT@ECT, J=\nane M Tholt/HOU/ECT@ECT, Jay Reitmeyer/HOU/ECT@ECT, Keith Holst/HOU/ECT@ect=\n, Matthew Lenhart/HOU/ECT@ECT, Mike Grigsby/HOU/ECT@ECT, Monique Sanchez/HO=\nU/ECT@ECT, Phillip K Allen/HOU/ECT@ECT, Randall L Gay/HOU/ECT@ECT, Tori Kuy=\nkendall/HOU/ECT@ECT, Brenda H Fletcher/HOU/ECT@ECT, Jeanne Wukasch/Corp/Enr=\non@ENRON, Mary Theresa Franklin/HOU/ECT@ECT, Mike Potter/NA/Enron@Enron, Na=\ntalie Baker/HOU/ECT@ECT, Suzanne Calcagno/NA/Enron@Enron, Alvin Thompson/Co=\nrp/Enron@Enron, Cynthia Franklin/Corp/Enron@ENRON, Jesse Villarreal/HOU/ECT=\n@ECT, Joan Collins/HOU/EES@EES, Joe A Casas/HOU/ECT@ECT, Kelly Loocke/ENRON=\n@enronXgate, Lia Halstead/NA/Enron@ENRON, Meredith Homco/HOU/ECT@ECT, Rober=\nt Allwein/HOU/ECT@ECT, Scott Loving/NA/Enron@ENRON, Shanna Boudreaux/ENRON@=\nenronXgate, Steve Gillespie/Corp/Enron@ENRON, Tamara Carter/NA/Enron@ENRON,=\n Tracy Wood/NA/Enron@ENRON, Gabriel Fuzat/Enron Communications@Enron Commun=\nications, Jack Netek/Enron Communications@Enron Communications, Lam Nguyen/=\nNA/Enron@Enron, Camille Gerard/Corp/Enron@ENRON, Craig Taylor/HOU/ECT@ECT, =\nJessica Hangach/NYC/MGUSA@MGUSA, Kathy Gagel/NYC/MGUSA@MGUSA, Lisa Goulart/=\nNYC/MGUSA@MGUSA, Ruth Balladares/NYC/MGUSA@MGUSA, Sid Strutt/NYC/MGUSA@MGUS=\nA\ncc:=09=20\nSubject:=094-URGENT - OWA Please print this now.\n\n\nCurrent Notes User:\n\nREASONS FOR USING OUTLOOK WEB ACCESS (OWA)\n\n1. Once your mailbox has been migrated from Notes to Outlook, the Outlook c=\nlient will be configured on your computer.\nAfter migration of your mailbox, you will not be able to send or recieve ma=\nil via Notes, and you will not be able to start using Outlook until it is c=\nonfigured by the Outlook Migration team the morning after your mailbox is m=\nigrated.  During this period, you can use Outlook Web Access (OWA) via your=\n web browser (Internet Explorer 5.0) to read and send mail.\n\nPLEASE NOTE:  Your calendar entries, personal address book, journals, and T=\no-Do entries imported from Notes will not be available until the Outlook cl=\nient is configured on your desktop.\n\n2. Remote access to your mailbox.\nAfter your Outlook client is configured, you can use Outlook Web Access (OW=\nA) for remote access to your mailbox.\n\nPLEASE NOTE:  At this time, the OWA client is only accessible while connect=\ning to the Enron network (LAN).  There are future plans to make OWA availab=\nle from your home or when traveling abroad.\n\nHOW TO ACCESS OUTLOOK WEB ACCESS (OWA)\n\nLaunch Internet Explorer 5.0, and in the address window type:  http://nahou=\n-msowa01p/exchange/john.doe\n\nSubstitute \"john.doe\" with your first and last name, then click ENTER.  You=\n will be prompted with a sign in box as shown below.  Type in \"corp/your us=\ner id\" for the user name and your NT password to logon to OWA and click OK.=\n  You will now be able to view your mailbox.\n\n=09\n\nPLEASE NOTE:  There are some subtle differences in the functionality betwee=\nn the Outlook and OWA clients.  You will not be able to do many of the thin=\ngs in OWA that you can do in Outlook.  Below is a brief list of *some* of t=\nhe functions NOT available via OWA:\n\nFeatures NOT available using OWA:\n\n-  Tasks\n-  Journal\n-  Spell Checker\n-  Offline Use\n-  Printing Templates\n-  Reminders\n-  Timed Delivery\n-  Expiration\n-  Outlook Rules\n-  Voting, Message Flags and Message Recall\n-  Sharing Contacts with others\n-  Task Delegation\n-  Direct Resource Booking\n-  Personal Distribution Lists\n\nQUESTIONS OR CONCERNS?\n\nIf you have questions or concerns using the OWA client, please contact the =\nOutlook 2000 question and answer Mailbox at:\n\n=09Outlook.2000@enron.com\n\nOtherwise, you may contact the Resolution Center at:\n\n=09713-853-1411\n\nThank you,\n\nOutlook 2000 Migration Team\n",
    "date": "Tue, 1 May 2001 17:14:00 -0700 (PDT)",
    "message_id": "9093068.1075855378565.JavaMail.evans@thyme",
    "word_count": 741,
    "summarised_body": "",
    "named_entities": {
      "PERSON": [
        "Phillip K Allen/HOU",
        "Amir Baig/NA/Enron@ENRON",
        "Brandon",
        "Charles Philpott/HR",
        "Chris Tull/HOU/ECT@ECT",
        "Dale Sm=",
        "Dave June/",
        "Donald Sutton/",
        "Felicia Buenrostro",
        "Johnna Morrison/Corp",
        "Joe Dorn/Corp/Enron@ENRON",
        "Kathryn Schultea/HR/Corp/Enron@ENRON",
        "Leon",
        "Milton Brown",
        "Shekar Komatireddy/NA",
        "Andrea Yowman/Corp/Enron@ENRON",
        "Angie O'Brian/HR/Corp/Enron@ENRON",
        "Bonne Castellano",
        "Jo Ann",
        "LaQuitta Washington",
        "Rick",
        "Charlotte Brown",
        "Ronald Fain/HR/Corp",
        "Gary Fitch/HR/Corp/Enron@Enron",
        "Anna Harris",
        "Kristi Monson/NA/Enron@Enron",
        "Bobbie",
        "John Stabler/HR/Corp/Enron@ENRON",
        "Michelle Prince/N=",
        "James Gramke/NA/Enron@ENRON",
        "Blair Hicks/NA/Enron@ENRON",
        "Jim Lit=",
        "Dale Lukert/NA/Enron@ENRON",
        "Donald Martin/NA",
        "Andrew Mattei/",
        "Darvin Mitchell/",
        "Mark Old=",
        "Wesley Pearson/NA",
        "Ramon Pizarro/ENRON_DEVE=\nLOPMENT@ENRON_DEVELOPMENT",
        "Natalie Rau/",
        "William Redick/",
        "Mark A Richardson/NA/Enron@ENRON",
        "Joseph Schnieders/NA",
        "Gary Simmons/",
        "David",
        "Mike Boegler/HR/Corp/Enron@ENRON",
        "Lyndel Click/HR/Corp",
        "Gabriel Franco/NA/Enron@Enron",
        "Randy Gross",
        "Arthur Johnson/HR/Corp/Enron@Enron",
        "Danny Jones",
        "John",
        "Edgar Ponce/",
        "Tracy Pursifull",
        "Lance Stanley/HR/Corp/Enron@ENRON",
        "Frank Ermis/HOU",
        "J=\nane M Tholt/HOU/ECT@ECT",
        "Jay Reitmeyer/HOU",
        "Keith Holst/HOU",
        "Matthew Lenhart/HOU",
        "Mike Grigsby/",
        "Monique Sanchez",
        "Phillip K Allen/HOU",
        "Randall L Gay/HOU",
        "Tori Kuy=",
        "Brenda H Fletcher/HOU/ECT@ECT",
        "Jeanne Wukasch/Corp/Enr=",
        "Mary Theresa Franklin/HOU/ECT@ECT",
        "Mike Potter/NA/Enron@Enron",
        "Suzanne Calcagno/NA/Enron@Enron",
        "Alvin Thompson",
        "Cynthia Franklin/Corp/Enron@ENRON",
        "Joan Collins",
        "Joe A",
        "Kelly Loocke/ENRON=\n@enronXgate",
        "Lia Halstead/NA/Enron@ENRON",
        "Scott Loving/",
        "Shanna Boudreaux",
        "Steve Gillespie/Corp/Enron@ENRON",
        "Tamara Carter/NA",
        "Gabriel Fuzat/Enron Communications@Enron Commun=",
        "Jack Netek/Enron Communications@Enron Communications",
        "Camille Gerard/Corp/Enron@ENRON",
        "Craig Taylor/HOU/ECT@ECT",
        "Jessica Hangach/NYC",
        "Kathy Gagel/NYC",
        "Lisa Goulart/=\nNYC/MGUSA@MGUSA",
        "Ruth Balladares",
        "Sid Strutt/NYC",
        "Outlook",
        "Outlook",
        "Outlook",
        "You=\n ",
        "OK.=\n  You",
        "Printing Templates\n-  ",
        "Timed Delivery"
      ],
      "ORG": [
        "ECT",
        "Outlook Migration",
        "Horton/NA/Enron@ENRON",
        "NA/Enron@Enron",
        "Brian Ellis/Corp/Enron@Enron",
        "Chris P Wood/NA/Enron@Enron",
        "NA",
        "NA/Enron@ENRON",
        "Leticia Barrios/Corp/Enron@ENRON",
        "Raj Perubhatla/Corp/Enron@Enron",
        "Gwynn Gorsuch/",
        "Matson/Corp/Enron@ENRON",
        "Sandra Lighthill/HR/Corp/Enron@ENRON",
        "Valeria A",
        "el/HR/Corp/Enron@ENRON",
        "Johnson/Contractor/Enron Communications@Enron Communications",
        "NA/Enron@ENRON",
        "NA/Enron@Enron, Delaney Trimble/",
        "U/ECT@ECT",
        "Baker/HOU/ECT@ECT",
        "Meredith Homco/HOU/ECT@ECT",
        "Allwein/HOU/ECT@ECT",
        "Wood/NA/Enron@ENRON",
        "NA/Enron@Enron",
        "OWA",
        "the Outlook Migration",
        "Outlook Web Access",
        "OWA",
        "OWA",
        "Enron",
        "LAN",
        "OWA",
        "OWA",
        "OWA",
        "Outlook",
        "OWA",
        "OWA",
        "OWA",
        "Journal",
        "Direct Resource Booking\n-  Personal Distribution Lists\n\n",
        "OWA",
        "the Resolution Center",
        "Migration Team\n"
      ],
      "TIME": [
        "2:14 PM",
        "01:01 PM",
        "the morning"
      ],
      "GPE": [
        "Houston",
        "Casas",
        "Outlook"
      ],
      "CARDINAL": [
        "1",
        "2",
        "09",
        "09Outlook.2000@enron.com"
      ],
      "PRODUCT": [
        "Notes",
        "Notes",
        "Notes",
        "Reminders",
        "Task Delegation",
        "Mailbox"
      ],
      "WORK_OF_ART": [
        "Outlook Web Access",
        "Sharing Contacts"
      ],
      "ORDINAL": [
        "first"
      ],
      "DATE": [
        "2000",
        "09713",
        "1411",
        "2000"
      ]
    },
    "phone_numbers": [
      "09713-853-1411"
    ]
  },
  {
    "sender_full_name": "Phillip K Allen",
    "reciever_full_name": "Ina Rangel",
    "sender_first_name": "Phillip",
    "sender_last_name": "Allen",
    "reciever_first_name": "Ina",
    "reciever_last_name": "Rangel",
    "sender_email": "phillip.allen@enron.com",
    "reciever_email": "ina.rangel@enron.com",
    "sender_org": "enron",
    "reciever_org": "enron",
    "subject": "Mime-Version: 1.0",
    "body": "\nIna,\n\n I scheduled a meeting with Jean Mrha tomorrow at 3:30",
    "date": "Wed, 6 Sep 2000 06:04:00 -0700 (PDT)",
    "message_id": "12637670.1075855688550.JavaMail.evans@thyme",
    "word_count": 10,
    "summarised_body": "",
    "named_entities": {
      "PERSON": [
        "Ina",
        "Jean Mrha"
      ],
      "DATE": [
        "tomorrow"
      ],
      "TIME": [
        "3:30"
      ]
    },
    "phone_numbers": []
  },
  {
    "sender_full_name": "Phillip K Allen",
    "reciever_full_name": "Thomas A Martin, Mike Grigsby, Keith Holst, Jay Reitmeyer, Frank Ermis",
    "sender_first_name": "Phillip",
    "sender_last_name": "Allen",
    "reciever_first_name": "Thomas",
    "reciever_last_name": "Ermis",
    "sender_email": "phillip.allen@enron.com",
    "reciever_email": "thomas.martin@enron.com, mike.grigsby@enron.com, keith.holst@enron.com, ",
    "sender_org": "enron",
    "reciever_org": "enron.com, mike.grigsby@enron.com, keith.holst@enron",
    "subject": "Wow",
    "body": "\n---------------------- Forwarded by Phillip K Allen/HOU/ECT on 09/06/2000 \n10:49 AM ---------------------------\n\n\nJeff Richter\n09/06/2000 07:39 AM\nTo: Phillip K Allen/HOU/ECT@ECT\ncc:  \nSubject: Wow\n\n\n---------------------- Forwarded by Jeff Richter/HOU/ECT on 09/06/2000 09:45 \nAM ---------------------------\nTo: Mike Swerzbin/HOU/ECT@ECT, Robert Badeer/HOU/ECT@ECT, Sean \nCrandall/PDX/ECT@ECT, Tim Belden/HOU/ECT@ECT, Jeff Richter/HOU/ECT@ECT, John \nM Forney/HOU/ECT@ECT, Matt Motley/PDX/ECT@ECT, Tom Alonso/PDX/ECT@ECT, Mark \nFischer/PDX/ECT@ECT\ncc:  \nSubject: Wow\n\n\n---------------------- Forwarded by Tim Belden/HOU/ECT on 09/06/2000 07:27 AM \n---------------------------\n   \n\tEnron Capital & Trade Resources Corp.\n\t\n\tFrom:  Kevin M Presto                           09/05/2000 01:59 PM\n\t\n\nTo: Tim Belden/HOU/ECT@ECT\ncc: Rogers Herndon/HOU/ECT@ect, John Zufferli/HOU/ECT@ECT, Lloyd \nWill/HOU/ECT@ECT, Doug Gilbert-Smith/Corp/Enron@ENRON, Mike \nSwerzbin/HOU/ECT@ECT \nSubject: Wow\n\nDo not underestimate the effects of the Internet economy on load growth.  I \nhave been preaching the tremendous growth described below for the last year.  \nThe utility infrastructure simply cannot handle these loads at the \ndistribution level and ultimatley distributed generation will be required for \npower quality reasons.\n\nThe City of Austin, TX has experienced 300+ MW of load growth this year due \nto server farms and technology companies.  There is a 100 MW server farm \ntrying to hook up to HL&P as we speak and they cannot deliver for 12 months \ndue to distribution infrastructure issues.  Obviously, Seattle, Porltand, \nBoise, Denver, San Fran and San Jose in your markets are in for a rude \nawakening in the next 2-3 years.\n---------------------- Forwarded by Kevin M Presto/HOU/ECT on 09/05/2000 \n03:41 PM ---------------------------\n   \n\tEnron North America Corp.\n\t\n\tFrom:  John D Suarez                           09/05/2000 01:45 PM\n\t\n\nTo: Kevin M Presto/HOU/ECT@ECT, Mark Dana Davis/HOU/ECT@ECT, Paul J \nBroderick/HOU/ECT@ECT, Jeffrey Miller/NA/Enron@Enron\ncc:  \nSubject: \n\n\n---------------------- Forwarded by John D Suarez/HOU/ECT on 09/05/2000 01:46 \nPM ---------------------------\n\n\nGeorge Hopley\n09/05/2000 11:41 AM\nTo: John D Suarez/HOU/ECT@ECT, Suresh Vasan/Enron Communications@ENRON \nCOMMUNICATIONS@ENRON\ncc:  \nSubject: \n\nInternet Data Gain Is a Major Power Drain on\n                  Local Utilities \n\n                  ( September 05, 2000 ) \n\n\n                  In 1997, a little-known Silicon Valley company called Exodus\n                  Communications opened a 15,000-square-foot data center in \nTukwila. \n\n                       The mission was to handle the Internet traffic and \ncomputer servers for the\n                  region's growing number of dot-coms. \n\n                       Fast-forward to summer 2000. Exodus is now wrapping up \nconstruction\n                  on a new 13-acre, 576,000-square-foot data center less than \na mile from its\n                  original facility. Sitting at the confluence of several \nfiber optic backbones, the\n                  Exodus plant will consume enough power for a small town and \neventually\n                  house Internet servers for firms such as Avenue A, \nMicrosoft and Onvia.com. \n\n                       Exodus is not the only company building massive data \ncenters near Seattle.\n                  More than a dozen companies -- with names like AboveNet, \nGlobix and\n                  HostPro -- are looking for facilities here that will house \nthe networking\n                  equipment of the Internet economy. \n\n                       It is a big business that could have an effect on \neverything from your\n                  monthly electric bill to the ease with which you access \nyour favorite Web sites.\n\n                       Data centers, also known as co-location facilities and \nserver farms, are\n                  sprouting at such a furious pace in Tukwila and the Kent \nValley that some\n                  have expressed concern over whether Seattle City Light and \nPuget Sound\n                  Energy can handle the power necessary to run these 24-hour, \nhigh-security\n                  facilities. \n\n                       \"We are talking to about half a dozen customers that \nare requesting 445\n                  megawatts of power in a little area near Southcenter Mall,\" \nsaid Karl\n                  Karzmar, manager of revenue requirements for Puget Sound \nEnergy. \"That is\n                  the equivalent of six oil refineries.\" \n\n                       A relatively new phenomenon in the utility business, \nthe rise of the Internet\n                  data center has some utility veterans scratching their \nheads. \n\n                       Puget Sound Energy last week asked the Washington \nUtilities and\n                  Transportation Commission to accept a tariff on the new \ndata centers. The\n                  tariff is designed to protect the company's existing \nresidential and business\n                  customers from footing the bill for the new base stations \nnecessary to support\n                  the projects. Those base stations could cost as much as $20 \nmillion each,\n                  Karzmar said. \n\n                       Not to be left behind, Seattle City Light plans to \nbring up the data center\n                  issue on Thursday at the Seattle City Council meeting. \n\n                       For the utilities that provide power to homes, \nbusinesses and schools in the\n                  region, this is a new and complex issue. \n\n                       On one hand, the data centers -- with their amazing \nappetite for power --\n                  represent potentially lucrative business customers. The \nfacilities run 24 hours a\n                  day, seven days a week, and therefore could become a \nconstant revenue\n                  stream. On the other hand, they require so much energy that \nthey could\n                  potentially flood the utilities with exorbitant capital \nexpenditures. \n\n                       Who will pay for those expenditures and what it will \nmean for power rates\n                  in the area is still open to debate. \n\n                       \"These facilities are what we call extremely dense \nloads,\" said Bob Royer,\n                  director of communications and public affairs at Seattle \nCity Light. \n\n                       \"The entire University of Washington, from stadium \nlights at the football\n                  game to the Medical School, averages 31 megawatts per day. \nWe have data\n                  center projects in front of us that are asking for 30, 40 \nand 50 megawatts.\" \n\n                       With more than 1.5 million square feet, the Intergate \ncomplex in Tukwila is\n                  one of the biggest data centers. Sabey Corp. re-purchased \nthe 1.35 million\n                  square-foot Intergate East facility last September from \nBoeing Space &\n                  Defense. In less than 12 months, the developer has leased \n92 percent of the\n                  six-building complex to seven different co-location \ncompanies. \n\n                       \"It is probably the largest data center park in the \ncountry,\" boasts Laurent\n                  Poole, chief operating officer at Sabey. Exodus, ICG \nCommunications,\n                  NetStream Communications, Pac West Telecomm and Zama \nNetworks all\n                  lease space in the office park. \n\n                       After building Exodus' first Tukwila facility in 1997, \nSabey has become an\n                  expert in the arena and now has facilities either under \nmanagement or\n                  development in Los Angeles, Spokane and Denver. Poole \nclaims his firm is\n                  one of the top four builders of Internet data centers in \nthe country. \n\n                       As more people access the Internet and conduct \nbandwidth-heavy tasks\n                  such as listening to online music, Poole said the need for \nco-location space in\n                  Seattle continues to escalate. \n\n                       But it is not just Seattle. The need for data center \nspace is growing at a\n                  rapid clip at many technology hubs throughout the country, \ncausing similar\n                  concerns among utilities in places such as Texas and \nCalifornia. \n\n                       Exodus, one of the largest providers of co-location \nspace, plans to nearly\n                  double the amount of space it has by the end of the year. \nWhile companies\n                  such as Amazon.com run their own server farms, many \nhigh-tech companies\n                  have decided to outsource the operations to companies such \nas Exodus that\n                  may be better prepared for dealing with Internet traffic \nmanagement. \n\n                       \"We have 2 million square feet of space under \nconstruction and we plan to\n                  double our size in the next nine months , yet there is more \ndemand right now\n                  than data center space,\" said Steve Porter, an account \nexecutive at Exodus in\n                  Seattle. \n\n                       The booming market for co-location space has left some \nin the local utility\n                  industry perplexed. \n\n                       \"It accelerates in a quantum way what you have to do \nto serve the growth,\"\n                  said Seattle City Light's Royer. \"The utility industry is \nalmost stunned by this, in\n                  a way.\" \n\n\n\n\n\n\n\n\n",
    "date": "Wed, 6 Sep 2000 04:46:00 -0700 (PDT)",
    "message_id": "1776521.1075855688576.JavaMail.evans@thyme",
    "word_count": 1180,
    "summarised_body": "",
    "named_entities": {
      "PERSON": [
        "Phillip K Allen/HOU",
        "Jeff",
        "Phillip K Allen/HOU",
        "Jeff",
        "Mike Swerzbin/HOU/ECT@ECT",
        "Robert Badeer/HOU",
        "Sean \nCrandall/PDX/ECT@ECT",
        "Tim Belden/HOU/ECT@ECT",
        "Jeff",
        "John \nM Forney/HOU/ECT@ECT",
        "Matt Motley",
        "Tom Alonso",
        "Mark \nFischer",
        "Tim Belden/HOU",
        "Kevin M Presto                           ",
        "Tim Belden/HOU",
        "Rogers Herndon/HOU",
        "John Zufferli/HOU/ECT@ECT",
        "Lloyd \nWill/HOU/ECT@ECT",
        "Doug Gilbert-Smith",
        "Mike \nSwerzbin/HOU",
        "Porltand",
        "Kevin M Presto/HOU",
        "John D Suarez                           ",
        "Kevin M Presto/HOU/ECT@ECT",
        "Mark Dana Davis/HOU",
        "Paul J \nBroderick/HOU/ECT@ECT",
        "Jeffrey Miller/",
        "John D Suarez/HOU",
        "George Hopley\n",
        "John D Suarez/HOU/ECT@ECT",
        "Tukwila",
        "Exodus",
        "Karl",
        "Karzmar",
        "Karzmar",
        "Bob Royer",
        "Pac West Telecomm",
        "Tukwila",
        "Sabey",
        "Exodus",
        "Steve Porter"
      ],
      "ORG": [
        "ECT",
        "ECT",
        "ECT",
        "Enron Capital & Trade Resources Corp.",
        "TX",
        "MW",
        "HL&P",
        "Boise",
        "ECT",
        "Enron North America Corp.",
        "NA",
        "ECT",
        "Vasan/Enron Communications@ENRON \nCOMMUNICATIONS@ENRON\ncc:  \nSubject: \n\n",
        "Local Utilities",
        "Exodus\n                  Communications",
        "Avenue A",
        "Microsoft",
        "Onvia.com",
        "AboveNet",
        "Seattle City Light",
        "Transportation Commission",
        "Seattle City Light",
        "the Seattle City Council",
        "Seattle \nCity Light",
        "University of Washington",
        "the Medical School",
        "Sabey Corp.",
        "Boeing Space &\n                  ",
        "Defense",
        "Sabey",
        "ICG \nCommunications",
        "NetStream Communications",
        "Zama \nNetworks",
        "Exodus",
        "Poole",
        "Amazon.com",
        "Exodus",
        "Seattle City Light's"
      ],
      "TIME": [
        "10:49 AM",
        "07:39 AM",
        "07:27 AM",
        "01:59 PM",
        "03:41 PM",
        "01:45 PM",
        "01:46 \nPM",
        "11:41 AM",
        "24-hour",
        "24 hours"
      ],
      "DATE": [
        "the last year",
        "this year",
        "12 months",
        "September 05, 2000",
        "1997",
        "summer 2000",
        "monthly",
        "last week",
        "Thursday",
        "a\n                  day",
        "seven days",
        "last September",
        "less than 12 months",
        "1997",
        "the end of the year",
        "the next nine months"
      ],
      "GPE": [
        "The City of",
        "Austin",
        "Seattle",
        "Denver",
        "San Fran",
        "San Jose",
        "Seattle",
        "Globix",
        "Tukwila",
        "Washington",
        "Intergate",
        "Tukwila",
        "Los Angeles",
        "Spokane",
        "Denver",
        "Seattle",
        "Seattle",
        "Texas",
        "California",
        "Seattle"
      ],
      "CARDINAL": [
        "300+ MW",
        "100",
        "More than a dozen",
        "about half a dozen",
        "445",
        "six",
        "30",
        "40",
        "one",
        "1.35 million",
        "six",
        "seven",
        "one",
        "four",
        "one"
      ],
      "LOC": [
        "Silicon Valley",
        "Intergate East"
      ],
      "QUANTITY": [
        "15,000-square-foot",
        "13-acre",
        "576,000-square-foot",
        "31 megawatts",
        "50 megawatts",
        "more than 1.5 million square feet",
        "2 million square feet"
      ],
      "NORP": [
        "Exodus"
      ],
      "FAC": [
        "Southcenter Mall"
      ],
      "MONEY": [
        "as much as $20 \nmillion"
      ],
      "PERCENT": [
        "92 percent"
      ],
      "ORDINAL": [
        "first"
      ]
    },
    "phone_numbers": []
  },
  {
    "sender_full_name": "Phillip K Allen",
    "reciever_full_name": "Ina Rangel",
    "sender_first_name": "Phillip",
    "sender_last_name": "Allen",
    "reciever_first_name": "Ina",
    "reciever_last_name": "Rangel",
    "sender_email": "phillip.allen@enron.com",
    "reciever_email": "ina.rangel@enron.com",
    "sender_org": "enron",
    "reciever_org": "enron",
    "subject": "Re:",
    "body": "\nIna,\n\n Can you pull Tori K.'s and Martin Cuilla's resumes and past performance \nreviews from H.R.\n\n---------------------- Forwarded by Phillip K Allen/HOU/ECT on 09/06/2000 \n10:44 AM ---------------------------\n\n\nJohn J Lavorato@ENRON\n09/06/2000 05:39 AM\nTo: Phillip K Allen/HOU/ECT@ECT\ncc:  \nSubject: Re:  \n\nThe commercial support people that you and Hunter want to make commercial \nmanagers.  \n",
    "date": "Wed, 6 Sep 2000 03:46:00 -0700 (PDT)",
    "message_id": "28100251.1075855688597.JavaMail.evans@thyme",
    "word_count": 47,
    "summarised_body": "",
    "named_entities": {
      "PERSON": [
        "Ina",
        "Tori K.'s",
        "Martin Cuilla's",
        "Phillip K Allen/HOU",
        "John J Lavorato@ENRON",
        "Phillip K Allen/HOU",
        "Hunter"
      ],
      "GPE": [
        "H.R."
      ],
      "ORG": [
        "ECT"
      ],
      "TIME": [
        "10:44 AM",
        "05:39 AM"
      ]
    },
    "phone_numbers": []
  },
  {
    "sender_full_name": "Phillip K Allen",
    "reciever_full_name": "John J Lavorato",
    "sender_first_name": "Phillip",
    "sender_last_name": "Allen",
    "reciever_first_name": "John",
    "reciever_last_name": "Lavorato",
    "sender_email": "phillip.allen@enron.com",
    "reciever_email": "john.lavorato@enron.com",
    "sender_org": "enron",
    "reciever_org": "enron",
    "subject": "Re:",
    "body": "\nresumes of whom?",
    "date": "Tue, 5 Sep 2000 23:22:00 -0700 (PDT)",
    "message_id": "2291003.1075855688619.JavaMail.evans@thyme",
    "word_count": 3,
    "summarised_body": "",
    "named_entities": {},
    "phone_numbers": []
  },
  {
    "sender_full_name": "Phillip K Allen",
    "reciever_full_name": "Ina Rangel",
    "sender_first_name": "Phillip",
    "sender_last_name": "Allen",
    "reciever_first_name": "Ina",
    "reciever_last_name": "Rangel",
    "sender_email": "phillip.allen@enron.com",
    "reciever_email": "ina.rangel@enron.com",
    "sender_org": "enron",
    "reciever_org": "enron",
    "subject": "RE: Receipt of Team Selection Form - Executive Impact & Influence",
    "body": "\n---------------------- Forwarded by Phillip K Allen/HOU/ECT on 09/05/2000 \n01:50 PM ---------------------------\n\n\n\"Christi Smith\" <christi.smith@lrinet.com",
    "date": "Tue, 5 Sep 2000 06:51:00 -0700 (PDT)",
    "message_id": "17954197.1075855688641.JavaMail.evans@thyme",
    "word_count": 11,
    "summarised_body": "",
    "named_entities": {
      "PERSON": [
        "Phillip K Allen/HOU",
        "Christi Smith"
      ],
      "ORG": [
        "ECT"
      ],
      "TIME": [
        "01:50 PM"
      ]
    },
    "phone_numbers": []
  },
  {
    "sender_full_name": "Phillip K Allen",
    "reciever_full_name": "dexter@intelligencepress.com",
    "sender_first_name": "Phillip",
    "sender_last_name": "Allen",
    "reciever_first_name": "intelligencepress",
    "reciever_last_name": "",
    "sender_email": "phillip.allen@enron.com",
    "reciever_email": "dexter@intelligencepress.com",
    "sender_org": "enron",
    "reciever_org": "intelligencepress",
    "subject": "Mime-Version: 1.0",
    "body": "\n---------------------- Forwarded by Phillip K Allen/HOU/ECT on 09/05/2000 \n01:29 PM ---------------------------\n   \n\t\n\t\n\tFrom:  Phillip K Allen                           08/29/2000 02:20 PM\n\t\n\nTo: mark@intelligencepress.com\ncc:  \nSubject: \n\nMark,\n\n Here is a spreadsheet detailing our September Socal trades. (I did not \ndistinguish between buys vs. sells.)\n\n\n\nPhillip\n",
    "date": "Tue, 5 Sep 2000 06:30:00 -0700 (PDT)",
    "message_id": "1191072.1075855688663.JavaMail.evans@thyme",
    "word_count": 35,
    "summarised_body": "",
    "named_entities": {
      "PERSON": [
        "Phillip K Allen/HOU",
        "Phillip K Allen                           ",
        "Mark",
        "Phillip"
      ],
      "ORG": [
        "ECT"
      ],
      "TIME": [
        "01:29 PM",
        "02:20 PM"
      ],
      "DATE": [
        "September"
      ]
    },
    "phone_numbers": []
  },
  {
    "sender_full_name": "Phillip K Allen",
    "reciever_full_name": "Mike Grigsby, Frank Ermis",
    "sender_first_name": "Phillip",
    "sender_last_name": "Allen",
    "reciever_first_name": "Mike",
    "reciever_last_name": "Ermis",
    "sender_email": "phillip.allen@enron.com",
    "reciever_email": "mike.grigsby@enron.com, frank.ermis@enron.com",
    "sender_org": "enron",
    "reciever_org": "enron.com, frank.ermis@enron",
    "subject": "FYI",
    "body": "\n---------------------- Forwarded by Phillip K Allen/HOU/ECT on 09/01/2000 \n01:07 PM ---------------------------\n   \n\tEnron North America Corp.\n\t\n\tFrom:  Matt Motley                           09/01/2000 08:53 AM\n\t\n\nTo: Phillip K Allen/HOU/ECT@ECT\ncc:  \nSubject: FYI\n\n\n--\n\n\n\n - Ray Niles on Price Caps.pdf\n\n\n",
    "date": "Fri, 1 Sep 2000 06:08:00 -0700 (PDT)",
    "message_id": "19909580.1075855688684.JavaMail.evans@thyme",
    "word_count": 28,
    "summarised_body": "",
    "named_entities": {
      "PERSON": [
        "Phillip K Allen/HOU",
        "Matt Motley                           ",
        "Phillip K Allen/HOU"
      ],
      "ORG": [
        "ECT",
        "Enron North America Corp.",
        "FYI"
      ],
      "TIME": [
        "01:07 PM",
        "08:53 AM"
      ]
    },
    "phone_numbers": []
  },
  {
    "sender_full_name": "Phillip K Allen",
    "reciever_full_name": "\"Richard Redash\" <rich@pira.com> @ ENRON",
    "sender_first_name": "Phillip",
    "sender_last_name": "Allen",
    "reciever_first_name": "\"Richard",
    "reciever_last_name": "ENRON",
    "sender_email": "phillip.allen@enron.com",
    "reciever_email": "rich@pira.com",
    "sender_org": "enron",
    "reciever_org": "pira",
    "subject": "Re: Western Gas Market Report -- Draft",
    "body": "\nRichard,\n\n Compare your california production to the numbers in the 2000 California Gas \nReport.  It shows 410.  But again that might be just what the two utilities \nreceive.",
    "date": "Thu, 31 Aug 2000 07:36:00 -0700 (PDT)",
    "message_id": "15522927.1075855688706.JavaMail.evans@thyme",
    "word_count": 28,
    "summarised_body": "",
    "named_entities": {
      "PERSON": [
        "Richard"
      ],
      "GPE": [
        "Compare",
        "california"
      ],
      "DATE": [
        "2000"
      ],
      "EVENT": [
        "California Gas \nReport"
      ],
      "CARDINAL": [
        "410",
        "two"
      ]
    },
    "phone_numbers": []
  },
  {
    "sender_full_name": "Phillip K Allen",
    "reciever_full_name": "Cooper Richey",
    "sender_first_name": "Phillip",
    "sender_last_name": "Allen",
    "reciever_first_name": "Cooper",
    "reciever_last_name": "Richey",
    "sender_email": "phillip.allen@enron.com",
    "reciever_email": "cooper.richey@enron.com",
    "sender_org": "enron",
    "reciever_org": "enron",
    "subject": "Mime-Version: 1.0",
    "body": "\nCooper,\n \n Can you give access to the new west power site to Jay Reitmeyer.  He is an \nanalyst in our group.\n\nPhillip",
    "date": "Thu, 31 Aug 2000 06:54:00 -0700 (PDT)",
    "message_id": "8133551.1075855688727.JavaMail.evans@thyme",
    "word_count": 22,
    "summarised_body": "",
    "named_entities": {
      "PERSON": [
        "Jay Reitmeyer",
        "Phillip"
      ]
    },
    "phone_numbers": []
  },
  {
    "sender_full_name": "Phillip K Allen",
    "reciever_full_name": "Ina Rangel",
    "sender_first_name": "Phillip",
    "sender_last_name": "Allen",
    "reciever_first_name": "Ina",
    "reciever_last_name": "Rangel",
    "sender_email": "phillip.allen@enron.com",
    "reciever_email": "ina.rangel@enron.com",
    "sender_org": "enron",
    "reciever_org": "enron",
    "subject": "Receipt of Team Selection Form - Executive Impact & Influence",
    "body": "\n---------------------- Forwarded by Phillip K Allen/HOU/ECT on 08/31/2000 \n01:13 PM ---------------------------\n\n\n\"Christi Smith\" <christi.smith@lrinet.com",
    "date": "Thu, 31 Aug 2000 06:14:00 -0700 (PDT)",
    "message_id": "33396487.1075855688749.JavaMail.evans@thyme",
    "word_count": 11,
    "summarised_body": "",
    "named_entities": {
      "PERSON": [
        "Phillip K Allen/HOU",
        "Christi Smith"
      ],
      "ORG": [
        "ECT"
      ],
      "TIME": [
        "01:13 PM"
      ]
    },
    "phone_numbers": []
  },
  {
    "sender_full_name": "Phillip K Allen",
    "reciever_full_name": "Ina Rangel <Ina Rangel/HOU/ECT@ECT>",
    "sender_first_name": "Phillip",
    "sender_last_name": "Allen",
    "reciever_first_name": "Ina",
    "reciever_last_name": "enron",
    "sender_email": "phillip.allen@enron.com",
    "reciever_email": "ina.rangel@enron.com",
    "sender_org": "enron",
    "reciever_org": "enron",
    "subject": "2- SURVEY/INFORMATION EMAIL",
    "body": "\n\n---------------------- Forwarded by Phillip K Allen/HOU/ECT on 05/01/2001 0=\n2:14 PM ---------------------------\n\n\nOutlook Migration Team@ENRON\n04/27/2001 01:00 PM\nTo:=09Allison Horton/NA/Enron@ENRON, Amir Baig/NA/Enron@ENRON, Brandon Bang=\nerter/NA/Enron@Enron, Brian Ellis/Corp/Enron@Enron, Charles Philpott/HR/Cor=\np/Enron@ENRON, Chris P Wood/NA/Enron@Enron, Chris Tull/HOU/ECT@ECT, Dale Sm=\nith/Corp/Enron@ENRON, Dave June/NA/Enron@ENRON, Donald Sutton/NA/Enron@Enro=\nn, Felicia Buenrostro/HR/Corp/Enron@ENRON, Johnna Morrison/Corp/Enron@ENRON=\n, Joe Dorn/Corp/Enron@ENRON, Kathryn Schultea/HR/Corp/Enron@ENRON, Leon McD=\nowell/NA/Enron@ENRON, Leticia Barrios/Corp/Enron@ENRON, Milton Brown/HR/Cor=\np/Enron@ENRON, Raj Perubhatla/Corp/Enron@Enron, Shekar Komatireddy/NA/Enron=\n@Enron, Andrea Yowman/Corp/Enron@ENRON, Angie O'Brian/HR/Corp/Enron@ENRON, =\nBonne Castellano/HR/Corp/Enron@ENRON, Gwynn Gorsuch/NA/Enron@ENRON, Jo Ann =\nMatson/Corp/Enron@ENRON, LaQuitta Washington/HR/Corp/Enron@ENRON, Rick John=\nson/HR/Corp/Enron@ENRON, Sandra Lighthill/HR/Corp/Enron@ENRON, Valeria A Ho=\npe/HOU/ECT@ECT, Charlotte Brown/HR/Corp/Enron@ENRON, Ronald Fain/HR/Corp/En=\nron@ENRON, Gary Fitch/HR/Corp/Enron@Enron, Anna Harris/HR/Corp/Enron@ENRON,=\n Keith Jones/HR/Corp/Enron@ENRON, Kristi Monson/NA/Enron@Enron, Bobbie McNi=\nel/HR/Corp/Enron@ENRON, John Stabler/HR/Corp/Enron@ENRON, Michelle Prince/N=\nA/Enron@Enron, James Gramke/NA/Enron@ENRON, Blair Hicks/NA/Enron@ENRON, Jen=\nnifer Johnson/Contractor/Enron Communications@Enron Communications, Jim Lit=\ntle/Enron@EnronXGate, Dale Lukert/NA/Enron@ENRON, Donald Martin/NA/Enron@EN=\nRON, Andrew Mattei/NA/Enron@ENRON, Darvin Mitchell/NA/Enron@ENRON, Mark Old=\nham/NA/Enron@ENRON, Wesley Pearson/NA/Enron@ENRON, Ramon Pizarro/ENRON_DEVE=\nLOPMENT@ENRON_DEVELOPMENT, Natalie Rau/NA/Enron@ENRON, William Redick/NA/En=\nron@ENRON, Mark A Richardson/NA/Enron@ENRON, Joseph Schnieders/NA/Enron@ENR=\nON, Gary Simmons/NA/Enron@Enron, Delaney Trimble/NA/Enron@ENRON, David Upto=\nn/NA/Enron@ENRON, Mike Boegler/HR/Corp/Enron@ENRON, Lyndel Click/HR/Corp/En=\nron@ENRON, Gabriel Franco/NA/Enron@Enron, Randy Gross/HR/Corp/Enron@Enron, =\nArthur Johnson/HR/Corp/Enron@Enron, Danny Jones/HR/Corp/Enron@ENRON, John O=\ngden/Houston/Eott@Eott, Edgar Ponce/NA/Enron@Enron, Tracy Pursifull/HR/Corp=\n/Enron@ENRON, Lance Stanley/HR/Corp/Enron@ENRON, Frank Ermis/HOU/ECT@ECT, J=\nane M Tholt/HOU/ECT@ECT, Jay Reitmeyer/HOU/ECT@ECT, Keith Holst/HOU/ECT@ect=\n, Matthew Lenhart/HOU/ECT@ECT, Mike Grigsby/HOU/ECT@ECT, Monique Sanchez/HO=\nU/ECT@ECT, Phillip K Allen/HOU/ECT@ECT, Randall L Gay/HOU/ECT@ECT, Tori Kuy=\nkendall/HOU/ECT@ECT, Brenda H Fletcher/HOU/ECT@ECT, Jeanne Wukasch/Corp/Enr=\non@ENRON, Mary Theresa Franklin/HOU/ECT@ECT, Mike Potter/NA/Enron@Enron, Na=\ntalie Baker/HOU/ECT@ECT, Suzanne Calcagno/NA/Enron@Enron, Alvin Thompson/Co=\nrp/Enron@Enron, Cynthia Franklin/Corp/Enron@ENRON, Jesse Villarreal/HOU/ECT=\n@ECT, Joan Collins/HOU/EES@EES, Joe A Casas/HOU/ECT@ECT, Kelly Loocke/ENRON=\n@enronXgate, Lia Halstead/NA/Enron@ENRON, Meredith Homco/HOU/ECT@ECT, Rober=\nt Allwein/HOU/ECT@ECT, Scott Loving/NA/Enron@ENRON, Shanna Boudreaux/ENRON@=\nenronXgate, Steve Gillespie/Corp/Enron@ENRON, Tamara Carter/NA/Enron@ENRON,=\n Tracy Wood/NA/Enron@ENRON, Gabriel Fuzat/Enron Communications@Enron Commun=\nications, Jack Netek/Enron Communications@Enron Communications, Lam Nguyen/=\nNA/Enron@Enron, Camille Gerard/Corp/Enron@ENRON, Craig Taylor/HOU/ECT@ECT, =\nJessica Hangach/NYC/MGUSA@MGUSA, Kathy Gagel/NYC/MGUSA@MGUSA, Lisa Goulart/=\nNYC/MGUSA@MGUSA, Ruth Balladares/NYC/MGUSA@MGUSA, Sid Strutt/NYC/MGUSA@MGUS=\nA\ncc:=09=20\nSubject:=092- SURVEY/INFORMATION EMAIL\n\nCurrent Notes User:=20\n\nTo ensure that you experience a successful migration from Notes to Outlook,=\n it is necessary to gather individual user information prior to your date o=\nf migration.  Please take a few minutes to completely fill out the followin=\ng survey.  When you finish, simply click on the 'Reply' button then hit 'Se=\nnd'  Your survey will automatically be sent to the Outlook 2000 Migration M=\nailbox.\n\nThank you.\n\nOutlook 2000 Migration Team\n\n---------------------------------------------------------------------------=\n-----------------------------------------------------------------\n\nFull Name:       =20\n\nLogin ID: =20\n\nExtension: =20\n\nOffice Location: =20\n\nWhat type of computer do you have?  (Desktop,  Laptop,  Both) =20\n\nDo you have a PDA?  If yes, what type do you have:   (None, IPAQ, Palm Pilo=\nt, Jornada) =20\n\nDo you have permission to access anyone's Email/Calendar? =20\n    If yes, who? =20\n\nDoes anyone have permission to access your Email/Calendar? =20\n    If yes, who? =20\n\nAre you responsible for updating anyone else's address book? =20\n    If yes, who? =20\n\nIs anyone else responsible for updating your address book? =20\n    If yes, who? =20\n\nDo you have access to a shared calendar? =20\n    If yes, which shared calendar? =20\n\nDo you have any Distribution Groups that Messaging maintains for you (for m=\nass mailings)? =20\n    If yes, please list here: =20\n\nPlease list all Notes databases applications that you currently use: =20\n\nIn our efforts to plan the exact date/time of your migration, we also will =\nneed to know:\n\nWhat are your normal work hours?  From:      To:     =20\n\nWill you be out of the office in the near future for vacation, leave, etc?\n       If so, when?        From (MM/DD/YY):      To (MM/DD/YY):     =20\n\n\n",
    "date": "Tue, 1 May 2001 17:14:00 -0700 (PDT)",
    "message_id": "20312982.1075855378658.JavaMail.evans@thyme",
    "word_count": 629,
    "summarised_body": "",
    "named_entities": {
      "PERSON": [
        "Phillip K Allen/HOU",
        "Amir Baig/NA/Enron@ENRON",
        "Brandon",
        "Charles Philpott/HR",
        "Chris Tull/HOU/ECT@ECT",
        "Dale Sm=",
        "Dave June/",
        "Donald Sutton/",
        "Felicia Buenrostro",
        "Johnna Morrison/Corp",
        "Joe Dorn/Corp/Enron@ENRON",
        "Kathryn Schultea/HR/Corp/Enron@ENRON",
        "Leon",
        "Milton Brown",
        "Shekar Komatireddy/NA",
        "Andrea Yowman/Corp/Enron@ENRON",
        "Angie O'Brian/HR/Corp/Enron@ENRON",
        "Bonne Castellano",
        "Jo Ann",
        "LaQuitta Washington",
        "Rick",
        "Charlotte Brown",
        "Ronald Fain/HR/Corp",
        "Gary Fitch/HR/Corp/Enron@Enron",
        "Anna Harris",
        "Kristi Monson/NA/Enron@Enron",
        "Bobbie",
        "John Stabler/HR/Corp/Enron@ENRON",
        "Michelle Prince/N=",
        "James Gramke/NA/Enron@ENRON",
        "Blair Hicks/NA/Enron@ENRON",
        "Jim Lit=",
        "Dale Lukert/NA/Enron@ENRON",
        "Donald Martin/NA",
        "Andrew Mattei/",
        "Darvin Mitchell/",
        "Mark Old=",
        "Wesley Pearson/NA",
        "Ramon Pizarro/ENRON_DEVE=\nLOPMENT@ENRON_DEVELOPMENT",
        "Natalie Rau/",
        "William Redick/",
        "Mark A Richardson/NA/Enron@ENRON",
        "Joseph Schnieders/NA",
        "Gary Simmons/",
        "David",
        "Mike Boegler/HR/Corp/Enron@ENRON",
        "Lyndel Click/HR/Corp",
        "Gabriel Franco/NA/Enron@Enron",
        "Randy Gross",
        "Arthur Johnson/HR/Corp/Enron@Enron",
        "Danny Jones",
        "John",
        "Edgar Ponce/",
        "Tracy Pursifull",
        "Lance Stanley/HR/Corp/Enron@ENRON",
        "Frank Ermis/HOU",
        "J=\nane M Tholt/HOU/ECT@ECT",
        "Jay Reitmeyer/HOU",
        "Keith Holst/HOU",
        "Matthew Lenhart/HOU",
        "Mike Grigsby/",
        "Monique Sanchez",
        "Phillip K Allen/HOU",
        "Randall L Gay/HOU",
        "Tori Kuy=",
        "Brenda H Fletcher/HOU/ECT@ECT",
        "Jeanne Wukasch/Corp/Enr=",
        "Mary Theresa Franklin/HOU/ECT@ECT",
        "Mike Potter/NA/Enron@Enron",
        "Suzanne Calcagno/NA/Enron@Enron",
        "Alvin Thompson",
        "Cynthia Franklin/Corp/Enron@ENRON",
        "Joan Collins",
        "Joe A",
        "Kelly Loocke/ENRON=\n@enronXgate",
        "Lia Halstead/NA/Enron@ENRON",
        "Scott Loving/",
        "Shanna Boudreaux",
        "Steve Gillespie/Corp/Enron@ENRON",
        "Tamara Carter/NA",
        "Gabriel Fuzat/Enron Communications@Enron Commun=",
        "Jack Netek/Enron Communications@Enron Communications",
        "Camille Gerard/Corp/Enron@ENRON",
        "Craig Taylor/HOU/ECT@ECT",
        "Jessica Hangach/NYC",
        "Kathy Gagel/NYC",
        "Lisa Goulart/=\nNYC/MGUSA@MGUSA",
        "Ruth Balladares",
        "Sid Strutt/NYC"
      ],
      "ORG": [
        "ECT",
        "Outlook Migration",
        "Horton/NA/Enron@ENRON",
        "NA/Enron@Enron",
        "Brian Ellis/Corp/Enron@Enron",
        "Chris P Wood/NA/Enron@Enron",
        "NA",
        "NA/Enron@ENRON",
        "Leticia Barrios/Corp/Enron@ENRON",
        "Raj Perubhatla/Corp/Enron@Enron",
        "Gwynn Gorsuch/",
        "Matson/Corp/Enron@ENRON",
        "Sandra Lighthill/HR/Corp/Enron@ENRON",
        "Valeria A",
        "el/HR/Corp/Enron@ENRON",
        "Johnson/Contractor/Enron Communications@Enron Communications",
        "NA/Enron@ENRON",
        "NA/Enron@Enron, Delaney Trimble/",
        "U/ECT@ECT",
        "Baker/HOU/ECT@ECT",
        "Meredith Homco/HOU/ECT@ECT",
        "Allwein/HOU/ECT@ECT",
        "Wood/NA/Enron@ENRON",
        "NA/Enron@Enron",
        "the Outlook 2000 Migration",
        "Migration Team",
        "Laptop",
        "IPAQ"
      ],
      "TIME": [
        "2:14 PM",
        "01:00 PM",
        "a few minutes",
        "normal work hours"
      ],
      "GPE": [
        "Houston",
        "Casas",
        "Jornada",
        "MM",
        "DD",
        "MM",
        "DD"
      ],
      "PRODUCT": [
        "Notes",
        "Notes"
      ],
      "DATE": [
        "2000"
      ],
      "CARDINAL": [
        "20",
        "20",
        "20",
        "20",
        "20",
        "20",
        "20",
        "20",
        "20",
        "20",
        "20",
        "20",
        "20",
        "20",
        "20",
        "20",
        "20",
        "20",
        "20",
        "20",
        "20"
      ],
      "WORK_OF_ART": [
        "Email/Calendar"
      ]
    },
    "phone_numbers": []
  },
  {
    "sender_full_name": "Phillip K Allen",
    "reciever_full_name": "debe@fsddatasvc.com",
    "sender_first_name": "Phillip",
    "sender_last_name": "Allen",
    "reciever_first_name": "fsddatasvc",
    "reciever_last_name": "",
    "sender_email": "phillip.allen@enron.com",
    "reciever_email": "debe@fsddatasvc.com",
    "sender_org": "enron",
    "reciever_org": "fsddatasvc",
    "subject": "Mime-Version: 1.0",
    "body": "\nJohn Lavorato-M\n\nMike Grigsby-D\nKeith Holst-D\nFrank Ermis-D\nSteve South-D\nJanie Tholt-D\n\nScott Neal-P\nHunter Shively-P\nTom Martin-P\nJohn Arnold-P",
    "date": "Thu, 31 Aug 2000 05:02:00 -0700 (PDT)",
    "message_id": "29777670.1075855688771.JavaMail.evans@thyme",
    "word_count": 30,
    "summarised_body": "",
    "named_entities": {
      "PERSON": [
        "John Lavorato-M",
        "Mike Grigsby-D",
        "Keith Holst-D",
        "Frank Ermis-D\n",
        "Steve South-D\n",
        "Janie Tholt-D\n\n",
        "Scott Neal-P\n",
        "Hunter Shively-P",
        "Tom Martin-P",
        "John Arnold-P"
      ]
    },
    "phone_numbers": []
  },
  {
    "sender_full_name": "Phillip K Allen",
    "reciever_full_name": "kolinge@enron.com",
    "sender_first_name": "Phillip",
    "sender_last_name": "Allen",
    "reciever_first_name": "enron",
    "reciever_last_name": "",
    "sender_email": "phillip.allen@enron.com",
    "reciever_email": "kolinge@enron.com",
    "sender_org": "enron",
    "reciever_org": "enron",
    "subject": "Mime-Version: 1.0",
    "body": "\n---------------------- Forwarded by Phillip K Allen/HOU/ECT on 08/31/2000 \n10:17 AM ---------------------------\n   \n\t\n\t\n\tFrom:  Phillip K Allen                           08/29/2000 02:20 PM\n\t\n\nTo: mark@intelligencepress.com\ncc:  \nSubject: \n\nMark,\n\n Here is a spreadsheet detailing our September Socal trades. (I did not \ndistinguish between buys vs. sells.)\n\n\n\nPhillip\n",
    "date": "Thu, 31 Aug 2000 03:17:00 -0700 (PDT)",
    "message_id": "8958723.1075855688792.JavaMail.evans@thyme",
    "word_count": 35,
    "summarised_body": "",
    "named_entities": {
      "PERSON": [
        "Phillip K Allen/HOU",
        "Phillip K Allen                           ",
        "Mark",
        "Phillip"
      ],
      "ORG": [
        "ECT"
      ],
      "TIME": [
        "10:17 AM",
        "02:20 PM"
      ],
      "DATE": [
        "September"
      ]
    },
    "phone_numbers": []
  },
  {
    "sender_full_name": "Phillip K Allen",
    "reciever_full_name": "muller@thedoghousemail.com",
    "sender_first_name": "Phillip",
    "sender_last_name": "Allen",
    "reciever_first_name": "thedoghousemail",
    "reciever_last_name": "",
    "sender_email": "phillip.allen@enron.com",
    "reciever_email": "muller@thedoghousemail.com",
    "sender_org": "enron",
    "reciever_org": "thedoghousemail",
    "subject": "Re: (No Subject)",
    "body": "\nGreg,\n\n Got your message.  Good luck on the bike ride.\n\n What were you doing to your apartment?  Are you setting up a studio?\n\n The kids are back in school.  Otherwise just work is going on here.\n\nKeith",
    "date": "Wed, 30 Aug 2000 08:14:00 -0700 (PDT)",
    "message_id": "10522460.1075855688813.JavaMail.evans@thyme",
    "word_count": 37,
    "summarised_body": "",
    "named_entities": {
      "PERSON": [
        "Keith"
      ]
    },
    "phone_numbers": []
  },
  {
    "sender_full_name": "Phillip K Allen",
    "reciever_full_name": "Cindy Long",
    "sender_first_name": "Phillip",
    "sender_last_name": "Allen",
    "reciever_first_name": "Cindy",
    "reciever_last_name": "Long",
    "sender_email": "phillip.allen@enron.com",
    "reciever_email": "cindy.long@enron.com",
    "sender_org": "enron",
    "reciever_org": "enron",
    "subject": "Re: Security Request: CLOG-4NNJEZ has been Denied.",
    "body": "\nWhy are his requests coming to me?",
    "date": "Wed, 30 Aug 2000 06:20:00 -0700 (PDT)",
    "message_id": "19131288.1075855688834.JavaMail.evans@thyme",
    "word_count": 7,
    "summarised_body": "",
    "named_entities": {},
    "phone_numbers": []
  },
  {
    "sender_full_name": "Phillip K Allen",
    "reciever_full_name": "mark@intelligencepress.com",
    "sender_first_name": "Phillip",
    "sender_last_name": "Allen",
    "reciever_first_name": "intelligencepress",
    "reciever_last_name": "",
    "sender_email": "phillip.allen@enron.com",
    "reciever_email": "mark@intelligencepress.com",
    "sender_org": "enron",
    "reciever_org": "intelligencepress",
    "subject": "Mime-Version: 1.0",
    "body": "\nMark,\n\n Here is a spreadsheet detailing our September Socal trades. (I did not \ndistinguish between buys vs. sells.)\n\n\n\nPhillip",
    "date": "Tue, 29 Aug 2000 09:20:00 -0700 (PDT)",
    "message_id": "20997494.1075855688856.JavaMail.evans@thyme",
    "word_count": 18,
    "summarised_body": "",
    "named_entities": {
      "PERSON": [
        "Mark",
        "Phillip"
      ],
      "DATE": [
        "September"
      ]
    },
    "phone_numbers": []
  },
  {
    "sender_full_name": "Phillip K Allen",
    "reciever_full_name": "Mark@intelligencepress.com",
    "sender_first_name": "Phillip",
    "sender_last_name": "Allen",
    "reciever_first_name": "intelligencepress",
    "reciever_last_name": "",
    "sender_email": "phillip.allen@enron.com",
    "reciever_email": "mark@intelligencepress.com",
    "sender_org": "enron",
    "reciever_org": "intelligencepress",
    "subject": "Mime-Version: 1.0",
    "body": "\nMark,\n\n Were you able to log in to enron online and find socal today?\n\n I will follow up with a list of our physical deals done yesterday and today.\n\nPhillip",
    "date": "Tue, 29 Aug 2000 05:38:00 -0700 (PDT)",
    "message_id": "12933608.1075855688877.JavaMail.evans@thyme",
    "word_count": 30,
    "summarised_body": "",
    "named_entities": {
      "DATE": [
        "today",
        "yesterday",
        "today"
      ],
      "PERSON": [
        "Phillip"
      ]
    },
    "phone_numbers": []
  },
  {
    "sender_full_name": "Phillip K Allen",
    "reciever_full_name": "bs_stone@yahoo.com",
    "sender_first_name": "Phillip",
    "sender_last_name": "Allen",
    "reciever_first_name": "yahoo",
    "reciever_last_name": "",
    "sender_email": "phillip.allen@enron.com",
    "reciever_email": "bs_stone@yahoo.com",
    "sender_org": "enron",
    "reciever_org": "yahoo",
    "subject": "Mime-Version: 1.0",
    "body": "\nBrenda\n\n Can you send me your address in College Station.\n\nPhillip",
    "date": "Mon, 28 Aug 2000 09:30:00 -0700 (PDT)",
    "message_id": "9552654.1075855688898.JavaMail.evans@thyme",
    "word_count": 11,
    "summarised_body": "",
    "named_entities": {
      "PERSON": [
        "Brenda",
        "Phillip"
      ],
      "GPE": [
        "College Station"
      ]
    },
    "phone_numbers": []
  },
  {
    "sender_full_name": "Phillip K Allen",
    "reciever_full_name": "Matthew Lenhart, Mike Grigsby, Keith Holst, Frank Ermis, Jay Reitmeyer",
    "sender_first_name": "Phillip",
    "sender_last_name": "Allen",
    "reciever_first_name": "Matthew",
    "reciever_last_name": "Reitmeyer",
    "sender_email": "phillip.allen@enron.com",
    "reciever_email": "matthew.lenhart@enron.com, mike.grigsby@enron.com, keith.holst@enron.com, ",
    "sender_org": "enron",
    "reciever_org": "enron.com, mike.grigsby@enron.com, keith.holst@enron",
    "subject": "New Generation",
    "body": "\n---------------------- Forwarded by Phillip K Allen/HOU/ECT on 08/28/2000 \n01:39 PM ---------------------------\n\nKristian J Lande\n\n08/24/2000 03:56 PM\n\nTo: Christopher F Calger/PDX/ECT@ECT, Jake Thomas/HOU/ECT@ECT, Frank W \nVickers/HOU/ECT@ECT, Elliot Mainzer/PDX/ECT@ECT, Michael McDonald/SF/ECT@ECT, \nDavid Parquet/SF/ECT@ECT, Laird Dyer/SF/ECT@ECT, Jim Buerkle/PDX/ECT@ECT, Jim \nGilbert/PDX/ECT@ECT, Terry W Donovan/HOU/ECT@ECT, Jeff G \nSlaughter/ENRON_DEVELOPMENT@ENRON_DEVELOPMENT, Ed Clark/PDX/ECT@ECT\ncc: Tim Belden/HOU/ECT@ECT, Robert Badeer/HOU/ECT@ECT, Matt \nMotley/PDX/ECT@ECT, Phillip K Allen/HOU/ECT@ECT \nSubject: New Generation\n\n\n\nSorry, \nReport as of August 24, 2000\n",
    "date": "Mon, 28 Aug 2000 06:40:00 -0700 (PDT)",
    "message_id": "27058154.1075855688919.JavaMail.evans@thyme",
    "word_count": 77,
    "summarised_body": "",
    "named_entities": {
      "PERSON": [
        "Phillip K Allen/HOU",
        "Kristian J Lande\n\n",
        "Christopher F Calger/PDX/ECT@ECT",
        "Jake Thomas/HOU",
        "Frank W \n",
        "Elliot Mainzer",
        "Michael McDonald/SF/ECT@ECT",
        "David Parquet/SF/ECT@ECT",
        "Laird Dyer/SF/ECT@ECT",
        "Jim Buerkle/PDX/ECT@ECT",
        "Jim \nGilbert/PDX/ECT@ECT",
        "Terry W Donovan/HOU",
        "Jeff G \nSlaughter/ENRON_DEVELOPMENT@ENRON_DEVELOPMENT",
        "Ed Clark/",
        "Tim Belden/HOU/ECT@ECT",
        "Robert Badeer/HOU",
        "Matt \nMotley",
        "Phillip K Allen/HOU"
      ],
      "ORG": [
        "ECT"
      ],
      "TIME": [
        "01:39 PM",
        "03:56 PM"
      ],
      "DATE": [
        "August 24, 2000"
      ]
    },
    "phone_numbers": []
  },
  {
    "sender_full_name": "Phillip K Allen",
    "reciever_full_name": "Mark@intelligencepress.com",
    "sender_first_name": "Phillip",
    "sender_last_name": "Allen",
    "reciever_first_name": "intelligencepress",
    "reciever_last_name": "",
    "sender_email": "phillip.allen@enron.com",
    "reciever_email": "mark@intelligencepress.com",
    "sender_org": "enron",
    "reciever_org": "intelligencepress",
    "subject": "Mime-Version: 1.0",
    "body": "\nMark,\n\n The following is a guest password that will allow you temporary view only \naccess to EnronOnline.  Please note, the user ID and password are CASE \nSENSITIVE.\n\nGuest User ID:  GNA45925\nGuest Password: YJ53KU42\n\nLog in to www.enrononline.com and install shockwave using instructions \nbelow.  I have set up a composite page with western basis and cash prices to \nhelp you filter through the products.  The title of the composite page is \nMark's Page.  If you have any problems logging in you can call me at \n(713)853-7041 or Kathy Moore, EnronOnline HelpDesk, 713/853-HELP (4357).\n\n\nThe Shockwave installer can be found within \"About EnronOnline\" on the home \npage.  After opening \"About EnronOnline\", using right scroll bar, go to the \nbottom.  Click on \"download Shockwave\" and follow the directions.  After \nloading Shockwave, shut down and reopen browser (i.e. Microsoft Internet \nExplorer/Netscape).\n\nI hope you will find this site useful.\n\n\nSincerely,\n\nPhillip Allen\n\n",
    "date": "Mon, 28 Aug 2000 06:12:00 -0700 (PDT)",
    "message_id": "3183108.1075855688941.JavaMail.evans@thyme",
    "word_count": 148,
    "summarised_body": "",
    "named_entities": {
      "PERSON": [
        "Mark",
        "Kathy Moore",
        "Shockwave",
        "Phillip Allen"
      ],
      "ORG": [
        "EnronOnline",
        "EnronOnline HelpDesk",
        "EnronOnline",
        "EnronOnline",
        "Microsoft"
      ],
      "WORK_OF_ART": [
        "Mark's Page"
      ],
      "DATE": [
        "7041",
        "4357"
      ],
      "CARDINAL": [
        "713/853"
      ]
    },
    "phone_numbers": [
      "\n(713)853-7041"
    ]
  },
  {
    "sender_full_name": "Phillip K Allen",
    "reciever_full_name": "mark@intelligencepress.com",
    "sender_first_name": "Phillip",
    "sender_last_name": "Allen",
    "reciever_first_name": "intelligencepress",
    "reciever_last_name": "",
    "sender_email": "phillip.allen@enron.com",
    "reciever_email": "mark@intelligencepress.com",
    "sender_org": "enron",
    "reciever_org": "intelligencepress",
    "subject": "Mime-Version: 1.0",
    "body": "\nMark,\n\n Attached is a spreadsheet that lists the end of day midmarkets for socal \nbasis and socal/san juan spreads.  I listed the days during bidweek that \nreflected financial trading for Socal Index and the actual gas daily prints \nbefore and after bidweek.  \n\n\n\n \n\n\n\n\n The following observations can be made:\n\n  July 1.  The basis market  anticipated a Socal/San Juan spread of .81 vs \nactual of .79\n   2.  Perceived index was 4.95 vs actual of 4.91\n   3.  Socal Gas Daily Swaps are trading at a significant premium.\n\n  Aug. 1.  The basis market  anticipated a Socal/San Juan spread of 1.04 vs \nactual of .99\n   2.  Perceived index was 4.54 vs actual of 4.49\n   3.  Gas daily spreads were much wider before and after bidweek than the \nmonthly postings\n   4.  Socal Gas Daily Swaps are trading at a significant premium.\n\n   \n\n Enron Online will allow you to monitor the value of financial swaps against \nthe index, as well as, spreads to other locations.  Please call with any \nquestions.\n\nPhillip\n\n\n  ",
    "date": "Mon, 28 Aug 2000 06:07:00 -0700 (PDT)",
    "message_id": "12741026.1075855688962.JavaMail.evans@thyme",
    "word_count": 157,
    "summarised_body": "",
    "named_entities": {
      "PERSON": [
        "Mark",
        "Phillip"
      ],
      "DATE": [
        "the end of day",
        "daily",
        "July 1",
        "Aug. 1",
        "monthly"
      ],
      "GPE": [
        "san juan"
      ],
      "ORG": [
        "Socal Index",
        "Socal/San Juan",
        "Socal Gas Daily Swaps",
        "Socal/San Juan",
        "Socal Gas Daily Swaps"
      ],
      "CARDINAL": [
        "2",
        "4.95",
        "4.91",
        "3",
        "1.04",
        "2",
        "4.54",
        "4.49",
        "3",
        "4"
      ]
    },
    "phone_numbers": []
  },
  {
    "sender_full_name": "Phillip K Allen",
    "reciever_full_name": "Alan Comnes <Alan Comnes/PDX/ECT@ECT>",
    "sender_first_name": "Phillip",
    "sender_last_name": "Allen",
    "reciever_first_name": "Alan",
    "reciever_last_name": "enron",
    "sender_email": "phillip.allen@enron.com",
    "reciever_email": "alan.comnes@enron.com",
    "sender_org": "enron",
    "reciever_org": "enron",
    "subject": "Re: Request from Steve Kean",
    "body": "\nAlan, \n\nYou should have received updated numbers from Keith Holst.  Call me if you did not receive them.\n\nPhillip",
    "date": "Mon, 30 Apr 2001 19:04:00 -0700 (PDT)",
    "message_id": "17508231.1075855378741.JavaMail.evans@thyme",
    "word_count": 19,
    "summarised_body": "",
    "named_entities": {
      "PERSON": [
        "Alan",
        "Keith Holst",
        "Phillip"
      ]
    },
    "phone_numbers": []
  },
  {
    "sender_full_name": "Phillip K Allen",
    "reciever_full_name": "Suzanne Nicholie",
    "sender_first_name": "Phillip",
    "sender_last_name": "Allen",
    "reciever_first_name": "Suzanne",
    "reciever_last_name": "Nicholie",
    "sender_email": "phillip.allen@enron.com",
    "reciever_email": "suzanne.nicholie@enron.com",
    "sender_org": "enron",
    "reciever_org": "enron",
    "subject": "Re: Meeting to discuss 2001 direct expense plan?",
    "body": "\nSuzanne,\n\n Can you give me more details or email  the plan prior to meeting?  What do I \nneed to provide besides headcount?\n Otherwise any afternoon next week would be fine\n\nPhillip",
    "date": "Fri, 25 Aug 2000 06:32:00 -0700 (PDT)",
    "message_id": "27607670.1075855688984.JavaMail.evans@thyme",
    "word_count": 31,
    "summarised_body": "",
    "named_entities": {
      "PERSON": [
        "Suzanne",
        "Phillip"
      ],
      "TIME": [
        "afternoon"
      ],
      "DATE": [
        "next week"
      ]
    },
    "phone_numbers": []
  },
  {
    "sender_full_name": "Phillip K Allen",
    "reciever_full_name": "Colleen Sullivan",
    "sender_first_name": "Phillip",
    "sender_last_name": "Allen",
    "reciever_first_name": "Colleen",
    "reciever_last_name": "Sullivan",
    "sender_email": "phillip.allen@enron.com",
    "reciever_email": "colleen.sullivan@enron.com",
    "sender_org": "enron",
    "reciever_org": "enron",
    "subject": "Re: regulatory filing summary",
    "body": "\nColleen,\n\n Please add Mike Grigsby to the distribution.\n\n On another note, do you have any idea how Patti is holding up?\n\nPhillip",
    "date": "Fri, 25 Aug 2000 04:03:00 -0700 (PDT)",
    "message_id": "11434451.1075855689007.JavaMail.evans@thyme",
    "word_count": 22,
    "summarised_body": "",
    "named_entities": {
      "PERSON": [
        "Colleen",
        "Mike Grigsby",
        "Patti",
        "Phillip"
      ]
    },
    "phone_numbers": []
  },
  {
    "sender_full_name": "Phillip K Allen",
    "reciever_full_name": "Brad McSherry",
    "sender_first_name": "Phillip",
    "sender_last_name": "Allen",
    "reciever_first_name": "Brad",
    "reciever_last_name": "McSherry",
    "sender_email": "phillip.allen@enron.com",
    "reciever_email": "brad.mcsherry@enron.com",
    "sender_org": "enron",
    "reciever_org": "enron",
    "subject": "Cc: john.lavorato@enron.com, hunter.shively@enron.com",
    "body": "\nBrad,\n\n With regard to Tori Kuykendall, I would like to promote her to commercial \nmanager instead of converting her from a commercial support manager to an \nassociate.  Her duties since the beginning of the year have been those of a \ncommercial manager.  I have no doubt that she will compare favorably to \nothers in that category at year end.  \n\n Martin Cuilla on the central desk is in a similiar situation as Tori.  \nHunter would like Martin handled the same as Tori.\n\n Let me know if there are any issues.\n\nPhillip",
    "date": "Fri, 25 Aug 2000 03:30:00 -0700 (PDT)",
    "message_id": "12599900.1075855689029.JavaMail.evans@thyme",
    "word_count": 90,
    "summarised_body": "",
    "named_entities": {
      "PERSON": [
        "Brad",
        "Martin Cuilla",
        "Hunter",
        "Phillip"
      ],
      "FAC": [
        "Tori Kuykendall"
      ],
      "DATE": [
        "the beginning of the year",
        "year end"
      ],
      "PRODUCT": [
        "Tori",
        "Tori"
      ],
      "ORG": [
        "Martin"
      ]
    },
    "phone_numbers": []
  },
  {
    "sender_full_name": "Phillip K Allen",
    "reciever_full_name": "Bruce Ferrell",
    "sender_first_name": "Phillip",
    "sender_last_name": "Allen",
    "reciever_first_name": "Bruce",
    "reciever_last_name": "Ferrell",
    "sender_email": "phillip.allen@enron.com",
    "reciever_email": "bruce.ferrell@enron.com",
    "sender_org": "enron",
    "reciever_org": "enron",
    "subject": "Re: Evaluation for new trading application",
    "body": "\nBruce,\n\nCan you stop by and set up my reuters.\n\nPhillip",
    "date": "Fri, 25 Aug 2000 01:58:00 -0700 (PDT)",
    "message_id": "4512177.1075855689051.JavaMail.evans@thyme",
    "word_count": 11,
    "summarised_body": "",
    "named_entities": {
      "PERSON": [
        "Bruce",
        "Phillip"
      ]
    },
    "phone_numbers": []
  },
  {
    "sender_full_name": "Phillip K Allen",
    "reciever_full_name": "stagecoachmama@hotmail.com",
    "sender_first_name": "Phillip",
    "sender_last_name": "Allen",
    "reciever_first_name": "hotmail",
    "reciever_last_name": "",
    "sender_email": "phillip.allen@enron.com",
    "reciever_email": "stagecoachmama@hotmail.com",
    "sender_org": "enron",
    "reciever_org": "hotmail",
    "subject": "Mime-Version: 1.0",
    "body": "\nLucy,\n\n The rent roll spreadsheet is starting to look better.  See if you can add \nthese modifications:\n\n 1.  Use a formula in column E.  Add the value in column C to column D.  It \nshould read =c6+d6.  Then copy this formula to the rows below.\n\n 2.  Column H needs a formula.  Subtract amount paid from amount owed.  \n=e6-g6.\n\n 3.  Column F is filled with the #### sign.  this is because the column width \nis too narrow.  Use you mouse to click on the line beside the \n       letter F.  Hold the left mouse button down and drag the column wider.\n\n 4.  After we get the rent part fixed, lets bring the database columns up to \nthis sheet and place them to the right in columns J and beyond.\n\nPhillip",
    "date": "Fri, 25 Aug 2000 01:47:00 -0700 (PDT)",
    "message_id": "3143867.1075855689072.JavaMail.evans@thyme",
    "word_count": 124,
    "summarised_body": "",
    "named_entities": {
      "PERSON": [
        "Lucy",
        "Column F",
        "Phillip"
      ],
      "CARDINAL": [
        "1",
        "2",
        "3",
        "4"
      ],
      "NORP": [
        "D."
      ],
      "ORG": [
        "Column H"
      ],
      "MONEY": [
        "####"
      ]
    },
    "phone_numbers": []
  },
  {
    "sender_full_name": "Phillip K Allen",
    "reciever_full_name": "\"Lucy Gonzalez\" <stagecoachmama@hotmail.com> @ ENRON",
    "sender_first_name": "Phillip",
    "sender_last_name": "Allen",
    "reciever_first_name": "\"Lucy",
    "reciever_last_name": "ENRON",
    "sender_email": "phillip.allen@enron.com",
    "reciever_email": "stagecoachmama@hotmail.com",
    "sender_org": "enron",
    "reciever_org": "hotmail",
    "subject": "Re: receipts",
    "body": "\nLucy,\n I got your email with the attachment.  Let's work together today to get this \ndone\n\nPhillip",
    "date": "Thu, 24 Aug 2000 02:48:00 -0700 (PDT)",
    "message_id": "24302765.1075855689093.JavaMail.evans@thyme",
    "word_count": 17,
    "summarised_body": "",
    "named_entities": {
      "PERSON": [
        "Lucy",
        "Phillip"
      ],
      "DATE": [
        "today"
      ]
    },
    "phone_numbers": []
  },
  {
    "sender_full_name": "Phillip K Allen",
    "reciever_full_name": "Ina Rangel",
    "sender_first_name": "Phillip",
    "sender_last_name": "Allen",
    "reciever_first_name": "Ina",
    "reciever_last_name": "Rangel",
    "sender_email": "phillip.allen@enron.com",
    "reciever_email": "ina.rangel@enron.com",
    "sender_org": "enron",
    "reciever_org": "enron",
    "subject": "Re: ENA Fileplan Project - Needs your approval",
    "body": "\nyou have my approval",
    "date": "Wed, 23 Aug 2000 08:23:00 -0700 (PDT)",
    "message_id": "32035482.1075855689114.JavaMail.evans@thyme",
    "word_count": 4,
    "summarised_body": "",
    "named_entities": {},
    "phone_numbers": []
  },
  {
    "sender_full_name": "Phillip K Allen",
    "reciever_full_name": "\"Lucy Gonzalez\" <stagecoachmama@hotmail.com> @ ENRON",
    "sender_first_name": "Phillip",
    "sender_last_name": "Allen",
    "reciever_first_name": "\"Lucy",
    "reciever_last_name": "ENRON",
    "sender_email": "phillip.allen@enron.com",
    "reciever_email": "stagecoachmama@hotmail.com",
    "sender_org": "enron",
    "reciever_org": "hotmail",
    "subject": "Re: checkbook and budget",
    "body": "\nLucy,\n\n We can discuss your email later.  How is progress on creating the \nspreadsheets.  You will probably need to close the file before you attach to \nan email.  It is 2:00.  I really want to make some progress on these two \nfiles.\n\nPhillip",
    "date": "Wed, 23 Aug 2000 07:09:00 -0700 (PDT)",
    "message_id": "5946371.1075855689136.JavaMail.evans@thyme",
    "word_count": 42,
    "summarised_body": "",
    "named_entities": {
      "PERSON": [
        "Lucy",
        "Phillip"
      ],
      "CARDINAL": [
        "two"
      ]
    },
    "phone_numbers": []
  },
  {
    "sender_full_name": "Phillip K Allen",
    "reciever_full_name": "stagecoachmama@hotmail.com",
    "sender_first_name": "Phillip",
    "sender_last_name": "Allen",
    "reciever_first_name": "hotmail",
    "reciever_last_name": "",
    "sender_email": "phillip.allen@enron.com",
    "reciever_email": "stagecoachmama@hotmail.com",
    "sender_org": "enron",
    "reciever_org": "hotmail",
    "subject": "Mime-Version: 1.0",
    "body": "\nLucy,\n\nPlease open this excel file and input the rents and names due for this week.  \nThen email the file back.\n",
    "date": "Wed, 23 Aug 2000 04:25:00 -0700 (PDT)",
    "message_id": "15573916.1075855689159.JavaMail.evans@thyme",
    "word_count": 21,
    "summarised_body": "",
    "named_entities": {
      "PERSON": [
        "Lucy"
      ],
      "DATE": [
        "this week"
      ]
    },
    "phone_numbers": []
  },
  {
    "sender_full_name": "Phillip K Allen",
    "reciever_full_name": "stagecoachmama@hotmail.com",
    "sender_first_name": "Phillip",
    "sender_last_name": "Allen",
    "reciever_first_name": "hotmail",
    "reciever_last_name": "",
    "sender_email": "phillip.allen@enron.com",
    "reciever_email": "stagecoachmama@hotmail.com",
    "sender_org": "enron",
    "reciever_org": "hotmail",
    "subject": "Mime-Version: 1.0",
    "body": "\nOpen the \"utility\" spreadsheet and try to complete the analysis of whether it \nis better to be a small commercial or a medium commercial (LP-1).\nYou will need to get the usage for that meter for the last 12 months.  If we \nhave one year of data, we can tell which will be cheaper.  Use the rates \ndescribed in the spreadsheet.  This is a great chance for you to practice \nexcel.\n",
    "date": "Tue, 22 Aug 2000 08:22:00 -0700 (PDT)",
    "message_id": "26241198.1075855689180.JavaMail.evans@thyme",
    "word_count": 70,
    "summarised_body": "",
    "named_entities": {
      "ORG": [
        "LP-1"
      ],
      "DATE": [
        "the last 12 months",
        "one year"
      ]
    },
    "phone_numbers": []
  },
  {
    "sender_full_name": "Phillip K Allen",
    "reciever_full_name": "Keith Holst <Keith Holst/HOU/ECT@ect>",
    "sender_first_name": "Phillip",
    "sender_last_name": "Allen",
    "reciever_first_name": "Keith",
    "reciever_last_name": "enron",
    "sender_email": "phillip.allen@enron.com",
    "reciever_email": "keith.holst@enron.com",
    "sender_org": "enron",
    "reciever_org": "enron",
    "subject": "Request from Steve Kean",
    "body": "\n\n---------------------- Forwarded by Phillip K Allen/HOU/ECT on 04/30/2001 11:21 AM ---------------------------\n\n\nAlan Comnes\n04/27/2001 01:38 PM\nTo:\tPhillip K Allen/HOU/ECT@ECT\ncc:\tJoe Hartsoe/Corp/Enron@ENRON \nSubject:\tRequest from Steve Kean\n\nPhillip,\n\nI got this request.  On the gas side, I think Kean/Lay need an update to a table you prepared for me a few months ago, which I've attached..  Can you oblige?  Thanks,\n\nAlan Comnes\n\n \n\n---------------------- Forwarded by Alan Comnes/PDX/ECT on 04/27/2001 01:42 PM ---------------------------\n\n\nJanel Guerrero@ENRON\n04/27/2001 12:44 PM\nTo:\tAlan Comnes/PDX/ECT@ECT, Jeff Dasovich/NA/Enron@Enron\ncc:\tPaul Kaufman/PDX/ECT@ECT, Richard Shapiro/NA/Enron@Enron \n\nSubject:\tRequest from Steve Kean\n\nAlan,\n\nSteve has asked that you update the power point below so that it reflects all of the \"stupid regulatory/legislative decisions\" since the beginning of the year.  Ken wants to have this updated chart in his briefing book for next week's \"Ken Lay Tour\" to CA.  \n\nHe also wants a forward price curve for both gas and power in CA.  Can we get these three documents by Monday afternoon?  \n\n\n\n",
    "date": "Mon, 30 Apr 2001 14:22:00 -0700 (PDT)",
    "message_id": "22040365.1075855378763.JavaMail.evans@thyme",
    "word_count": 161,
    "summarised_body": "",
    "named_entities": {
      "PERSON": [
        "Phillip K Allen/HOU",
        "Alan Comnes",
        "Phillip K Allen/HOU",
        "Joe Hartsoe/Corp",
        "Steve Kean",
        "Phillip",
        "Kean",
        "Alan Comnes",
        "Jeff Dasovich/",
        "Paul Kaufman/",
        "Richard Shapiro/NA",
        "Steve Kean",
        "Alan",
        "Steve",
        "Ken",
        "Ken Lay Tour"
      ],
      "ORG": [
        "ECT",
        "Janel"
      ],
      "TIME": [
        "11:21 AM",
        "01:38 PM",
        "04/27/2001 01:42 PM",
        "12:44 PM",
        "afternoon"
      ],
      "DATE": [
        "a few months ago",
        "the beginning of the year",
        "next week's",
        "Monday"
      ],
      "PRODUCT": [
        "CA",
        "CA"
      ],
      "CARDINAL": [
        "three"
      ]
    },
    "phone_numbers": []
  },
  {
    "sender_full_name": "Phillip K Allen",
    "reciever_full_name": "mac.d.hargrove@rssmb.com",
    "sender_first_name": "Phillip",
    "sender_last_name": "Allen",
    "reciever_first_name": "rssmb",
    "reciever_last_name": "",
    "sender_email": "phillip.allen@enron.com",
    "reciever_email": "mac.d.hargrove@rssmb.com",
    "sender_org": "enron",
    "reciever_org": "rssmb",
    "subject": "Mime-Version: 1.0",
    "body": "\nMac,\n\n Thanks for the research report on EOG.  Here are my observations:\n\n  Gas Sales 916,000/day x 365 days = 334,340,000/year\n  \n  Estimated Gas Prices $985,721,000/334,340,000= $2.95/mcf\n\n  Actual gas prices are around $1.00/mcf higher and rising. \n\n   Recalc of EPS with more accurate gas prices:\n  (334,340,000 mct X $1/mcf)/116,897,000 shares outst = $2.86 additional EPS \nX 12 P/E multiple = $34 a share\n\n\n That is just a back of the envelope valuation based on gas prices.  I think \ncrude price are undervalued by the tune of $10/share.\n\n Current price 37\n Nat. Gas 34\n Crude  10\n\n Total  81\n\n \n Can you take a look at these numbers and play devil's advocate?  To me this \nlooks like the best stock to own Also can you send me a report on Calpine, \nTosco, and SLB?\n\n\nThank you,\n\n Phillip\n\n\n\n\n",
    "date": "Mon, 21 Aug 2000 09:40:00 -0700 (PDT)",
    "message_id": "29919154.1075855689201.JavaMail.evans@thyme",
    "word_count": 127,
    "summarised_body": "",
    "named_entities": {
      "ORG": [
        "EOG",
        "EPS",
        "EPS",
        "Calpine",
        "SLB"
      ],
      "DATE": [
        "/day",
        "365 days",
        "334,340,000/year"
      ],
      "MONEY": [
        "$985,721,000/334,340,000= $",
        "2.95",
        "around $1.00",
        "2.86",
        "34",
        "10"
      ],
      "CARDINAL": [
        "334,340,000",
        "37",
        "34",
        "10"
      ],
      "GPE": [
        "Tosco"
      ],
      "PERSON": [
        "Phillip"
      ]
    },
    "phone_numbers": []
  },
  {
    "sender_full_name": "Phillip K Allen",
    "reciever_full_name": "pallen70@hotmail.com",
    "sender_first_name": "Phillip",
    "sender_last_name": "Allen",
    "reciever_first_name": "hotmail",
    "reciever_last_name": "",
    "sender_email": "phillip.allen@enron.com",
    "reciever_email": "pallen70@hotmail.com",
    "sender_org": "enron",
    "reciever_org": "hotmail",
    "subject": "Daily Duties",
    "body": "\n---------------------- Forwarded by Phillip K Allen/HOU/ECT on 08/20/2000 \n05:39 PM ---------------------------\n\n\n\"Lucy Gonzalez\" <stagecoachmama@hotmail.com",
    "date": "Sun, 20 Aug 2000 10:39:00 -0700 (PDT)",
    "message_id": "4511963.1075855689223.JavaMail.evans@thyme",
    "word_count": 11,
    "summarised_body": "",
    "named_entities": {
      "PERSON": [
        "Phillip K Allen/HOU",
        "Lucy Gonzalez"
      ],
      "ORG": [
        "ECT"
      ],
      "TIME": [
        "05:39 PM"
      ]
    },
    "phone_numbers": []
  },
  {
    "sender_full_name": "Phillip K Allen",
    "reciever_full_name": "pallen70@hotmail.com",
    "sender_first_name": "Phillip",
    "sender_last_name": "Allen",
    "reciever_first_name": "hotmail",
    "reciever_last_name": "",
    "sender_email": "phillip.allen@enron.com",
    "reciever_email": "pallen70@hotmail.com",
    "sender_org": "enron",
    "reciever_org": "hotmail",
    "subject": "Daily Report",
    "body": "\n---------------------- Forwarded by Phillip K Allen/HOU/ECT on 08/20/2000 \n05:38 PM ---------------------------\n\n\n\"Lucy Gonzalez\" <stagecoachmama@hotmail.com",
    "date": "Sun, 20 Aug 2000 10:39:00 -0700 (PDT)",
    "message_id": "33111317.1075855689245.JavaMail.evans@thyme",
    "word_count": 11,
    "summarised_body": "",
    "named_entities": {
      "PERSON": [
        "Phillip K Allen/HOU",
        "Lucy Gonzalez"
      ],
      "ORG": [
        "ECT"
      ],
      "TIME": [
        "05:38 PM"
      ]
    },
    "phone_numbers": []
  },
  {
    "sender_full_name": "Phillip K Allen",
    "reciever_full_name": "pallen70@hotmail.com",
    "sender_first_name": "Phillip",
    "sender_last_name": "Allen",
    "reciever_first_name": "hotmail",
    "reciever_last_name": "",
    "sender_email": "phillip.allen@enron.com",
    "reciever_email": "pallen70@hotmail.com",
    "sender_org": "enron",
    "reciever_org": "hotmail",
    "subject": "Daily Report",
    "body": "\n---------------------- Forwarded by Phillip K Allen/HOU/ECT on 08/20/2000 \n05:38 PM ---------------------------\n\n\n\"Lucy Gonzalez\" <stagecoachmama@hotmail.com",
    "date": "Sun, 20 Aug 2000 10:38:00 -0700 (PDT)",
    "message_id": "1665326.1075855689266.JavaMail.evans@thyme",
    "word_count": 11,
    "summarised_body": "",
    "named_entities": {
      "PERSON": [
        "Phillip K Allen/HOU",
        "Lucy Gonzalez"
      ],
      "ORG": [
        "ECT"
      ],
      "TIME": [
        "05:38 PM"
      ]
    },
    "phone_numbers": []
  },
  {
    "sender_full_name": "Phillip K Allen",
    "reciever_full_name": "\"Hargrove, Mac D\" <mac.d.hargrove@rssmb.com> @ ENRON",
    "sender_first_name": "Phillip",
    "sender_last_name": "Allen",
    "reciever_first_name": "\"Hargrove,",
    "reciever_last_name": "ENRON",
    "sender_email": "phillip.allen@enron.com",
    "reciever_email": "mac.d.hargrove@rssmb.com",
    "sender_org": "enron",
    "reciever_org": "rssmb",
    "subject": "Re: enron close to 85",
    "body": "\nI checked into exercising options with Smith Barney, but Enron has some kind \nof exclusive with Paine Weber.  I am starting to exercise now, but I am going \nto use the proceeds to buy another apartment complex.   \n What do you think about selling JDSU and buying SDLI?\n Also can you look at EOG as a play on rising oil and gas prices.\n\nThanks,\n\nPhillip",
    "date": "Thu, 17 Aug 2000 08:53:00 -0700 (PDT)",
    "message_id": "4752513.1075855689288.JavaMail.evans@thyme",
    "word_count": 64,
    "summarised_body": "",
    "named_entities": {
      "ORG": [
        "Smith Barney",
        "Enron",
        "SDLI",
        "EOG"
      ],
      "PERSON": [
        "Paine Weber",
        "JDSU",
        "Phillip"
      ]
    },
    "phone_numbers": []
  },
  {
    "sender_full_name": "Phillip K Allen",
    "reciever_full_name": "Cooper Richey",
    "sender_first_name": "Phillip",
    "sender_last_name": "Allen",
    "reciever_first_name": "Cooper",
    "reciever_last_name": "Richey",
    "sender_email": "phillip.allen@enron.com",
    "reciever_email": "cooper.richey@enron.com",
    "sender_org": "enron",
    "reciever_org": "enron",
    "subject": "Re:",
    "body": "\nI tried the new address but I don't have access.  also, what do I need to \nenter under domain?",
    "date": "Wed, 16 Aug 2000 05:35:00 -0700 (PDT)",
    "message_id": "15940494.1075855689309.JavaMail.evans@thyme",
    "word_count": 19,
    "summarised_body": "",
    "named_entities": {},
    "phone_numbers": []
  },
  {
    "sender_full_name": "Phillip K Allen",
    "reciever_full_name": "Ina Rangel",
    "sender_first_name": "Phillip",
    "sender_last_name": "Allen",
    "reciever_first_name": "Ina",
    "reciever_last_name": "Rangel",
    "sender_email": "phillip.allen@enron.com",
    "reciever_email": "ina.rangel@enron.com",
    "sender_org": "enron",
    "reciever_org": "enron",
    "subject": "ENA Management Committee",
    "body": "\n---------------------- Forwarded by Phillip K Allen/HOU/ECT on 08/16/2000 \n10:58 AM ---------------------------\n   \n\t\n\t\n\tFrom:  David W Delainey                           08/15/2000 01:28 PM\n\t\n\nSent by: Kay Chapman\nTo: Tim Belden/HOU/ECT@ECT, Kevin M Presto/HOU/ECT@ECT, John \nArnold/HOU/ECT@ECT, Scott Neal/HOU/ECT@ECT, Hunter S Shively/HOU/ECT@ECT, \nPhillip K Allen/HOU/ECT@ECT, Janet R Dietrich/HOU/ECT@ECT, Christopher F \nCalger/PDX/ECT@ECT, W David Duran/HOU/ECT@ECT, Raymond Bowen/HOU/ECT@ECT, \nJeff Donahue/HOU/ECT@ECT, Brian Redmond/HOU/ECT@ECT, C John \nThompson/Corp/Enron@ENRON, Scott Josey/Corp/Enron@ENRON, Rob \nMilnthorp/CAL/ECT@ECT, Max Yzaguirre/NA/Enron@ENRON, Beth \nPerlman/HOU/ECT@ECT, Wes Colwell/HOU/ECT@ECT, Sally Beck/HOU/ECT@ECT, David \nOxley/HOU/ECT@ECT, Joseph Deffner/HOU/ECT@ECT, Jordan Mintz/HOU/ECT@ECT, Mark \nE Haedicke/HOU/ECT@ECT\ncc: Mollie Gustafson/PDX/ECT@ECT, Felicia Doan/HOU/ECT@ECT, Ina \nRangel/HOU/ECT@ECT, Kimberly Brown/HOU/ECT@ECT, Airam Arteaga/HOU/ECT@ECT, \nChristy Chapman/HOU/ECT@ECT, Tina Rode/HOU/ECT@ECT, Marsha \nSchiller/HOU/ECT@ECT, Lillian Carroll/HOU/ECT@ECT, Tonai \nLehr/Corp/Enron@ENRON, Nicole Mayer/HOU/ECT@ECT, Darlene C \nForsyth/HOU/ECT@ECT, Janette Elbertson/HOU/ECT@ECT, Angela \nMcCulloch/CAL/ECT@ECT, Pilar Cerezo/NA/Enron@ENRON, Cherylene R \nWestbrook/HOU/ECT@ECT, Shirley Tijerina/Corp/Enron@ENRON, Nicki \nDaw/NA/Enron@Enron, Kimberly Hillis/HOU/ECT@ect \nSubject: ENA Management Committee\n\n\nThis is a reminder !!!!!  There will be a Friday Meeting August 18, 2000.  \nThis meeting replaces the every Friday Meeting and will be held every other \nFriday.\n\n     \n    Date:  Friday August 18, 2000\n\n    Time:  2:30 pm - 4:30 pm\n\n    Location: 30C1  \n \n    Topic:   ENA Management Committee\n\n      \n\n\nIf you have any questions or conflicts, please feel free to call me (3-0643) \nor Bev (3-7857).\n\nThanks,\n\nKay 3-0643",
    "date": "Wed, 16 Aug 2000 03:59:00 -0700 (PDT)",
    "message_id": "13302421.1075855689330.JavaMail.evans@thyme",
    "word_count": 224,
    "summarised_body": "",
    "named_entities": {
      "PERSON": [
        "Phillip K Allen/HOU",
        "David W Delainey                           ",
        "Kay Chapman",
        "Tim Belden/HOU/ECT@ECT",
        "Kevin M Presto/HOU/ECT@ECT",
        "John \nArnold/HOU/ECT@ECT",
        "Scott Neal/HOU",
        "Hunter S Shively/HOU",
        "Phillip K Allen/HOU",
        "Janet R Dietrich/HOU/ECT@ECT",
        "Christopher F \nCalger/PDX/ECT@ECT",
        "Raymond Bowen/HOU/ECT@ECT",
        "Jeff Donahue/HOU",
        "Brian Redmond/HOU",
        "Scott Josey/Corp/Enron@ENRON",
        "Max Yzaguirre/",
        "Beth \nPerlman/HOU/ECT@ECT",
        "Wes Colwell/HOU",
        "Sally Beck/HOU",
        "David \nOxley/HOU/ECT@ECT",
        "Joseph Deffner/HOU",
        "Jordan Mintz/HOU",
        "Mark \nE Haedicke/HOU",
        "Mollie Gustafson",
        "Airam Arteaga/HOU/ECT@ECT",
        "Christy Chapman/HOU",
        "Tina Rode/HOU/ECT@ECT",
        "Marsha \nSchiller/HOU/ECT@ECT",
        "Lillian Carroll/HOU/ECT@ECT",
        "Nicole Mayer/HOU",
        "Darlene C",
        "Janette Elbertson/HOU",
        "Angela \nMcCulloch/CAL/ECT@ECT",
        "Nicki \nDaw/NA/Enron@Enron",
        "Kimberly Hillis/HOU",
        "Bev",
        "Kay 3-0643"
      ],
      "ORG": [
        "ECT",
        "Thompson/Corp/Enron@ENRON",
        "Rob \nMilnthorp/CAL/ECT@ECT",
        "NA/Enron@ENRON",
        "Felicia Doan/HOU/ECT@ECT",
        "Kimberly Brown/HOU/ECT@ECT",
        "Lehr/Corp/Enron@ENRON",
        "Forsyth/HOU/ECT@ECT",
        "Cerezo/NA/Enron@ENRON",
        "Westbrook/HOU/ECT@ECT",
        "Shirley Tijerina/Corp/Enron@ENRON",
        "ENA Management Committee",
        "ENA Management Committee"
      ],
      "TIME": [
        "08/16/2000 \n10:58 AM",
        "01:28 PM",
        "2:30 pm - 4:30 pm"
      ],
      "DATE": [
        "Friday",
        "August 18, 2000",
        "Friday",
        "Friday August 18, 2000",
        "3-7857"
      ],
      "CARDINAL": [
        "3-0643"
      ]
    },
    "phone_numbers": []
  },
  {
    "sender_full_name": "Phillip K Allen",
    "reciever_full_name": "Cooper Richey",
    "sender_first_name": "Phillip",
    "sender_last_name": "Allen",
    "reciever_first_name": "Cooper",
    "reciever_last_name": "Richey",
    "sender_email": "phillip.allen@enron.com",
    "reciever_email": "cooper.richey@enron.com",
    "sender_org": "enron",
    "reciever_org": "enron",
    "subject": "Re:",
    "body": "\nCooper,\n\nThis is the website I use:\n\nhttp://ectpdx-sunone/~ctatham/navsetup/index.htm\n\nShould I use a different address.\n",
    "date": "Wed, 16 Aug 2000 03:57:00 -0700 (PDT)",
    "message_id": "621515.1075855689352.JavaMail.evans@thyme",
    "word_count": 14,
    "summarised_body": "",
    "named_entities": {},
    "phone_numbers": []
  },
  {
    "sender_full_name": "Phillip K Allen",
    "reciever_full_name": "Cooper Richey",
    "sender_first_name": "Phillip",
    "sender_last_name": "Allen",
    "reciever_first_name": "Cooper",
    "reciever_last_name": "Richey",
    "sender_email": "phillip.allen@enron.com",
    "reciever_email": "cooper.richey@enron.com",
    "sender_org": "enron",
    "reciever_org": "enron",
    "subject": "Mime-Version: 1.0",
    "body": "\nCooper,\n\n Did you add some more security to the expost hourly summary?  It keeps \nasking me for additional passwords and domain.  What do I need to enter?\n\nPhillip",
    "date": "Tue, 15 Aug 2000 05:37:00 -0700 (PDT)",
    "message_id": "10376621.1075855689373.JavaMail.evans@thyme",
    "word_count": 28,
    "summarised_body": "",
    "named_entities": {
      "TIME": [
        "hourly"
      ],
      "PERSON": [
        "Phillip"
      ]
    },
    "phone_numbers": []
  },
  {
    "sender_full_name": "Phillip K Allen",
    "reciever_full_name": "Stephanie Sever",
    "sender_first_name": "Phillip",
    "sender_last_name": "Allen",
    "reciever_first_name": "Stephanie",
    "reciever_last_name": "Sever",
    "sender_email": "phillip.allen@enron.com",
    "reciever_email": "stephanie.sever@enron.com",
    "sender_org": "enron",
    "reciever_org": "enron",
    "subject": "Re: Your approval is requested",
    "body": "\nStephanie\n\nPlease grant Paul the requested eol rights\n\nThanks,\nPhillip",
    "date": "Thu, 10 Aug 2000 15:02:00 -0700 (PDT)",
    "message_id": "17491901.1075855689394.JavaMail.evans@thyme",
    "word_count": 10,
    "summarised_body": "",
    "named_entities": {
      "ORG": [
        "Stephanie"
      ],
      "PERSON": [
        "Paul",
        "Phillip"
      ]
    },
    "phone_numbers": []
  },
  {
    "sender_full_name": "Phillip K Allen",
    "reciever_full_name": "Keith Holst <Keith Holst/HOU/ECT@ect>",
    "sender_first_name": "Phillip",
    "sender_last_name": "Allen",
    "reciever_first_name": "Keith",
    "reciever_last_name": "enron",
    "sender_email": "phillip.allen@enron.com",
    "reciever_email": "keith.holst@enron.com",
    "sender_org": "enron",
    "reciever_org": "enron",
    "subject": "Request from Steve Kean",
    "body": "\n\n---------------------- Forwarded by Phillip K Allen/HOU/ECT on 04/30/2001 10:36 AM ---------------------------\n\n\nAlan Comnes\n04/27/2001 01:38 PM\nTo:\tPhillip K Allen/HOU/ECT@ECT\ncc:\tJoe Hartsoe/Corp/Enron@ENRON \nSubject:\tRequest from Steve Kean\n\nPhillip,\n\nI got this request.  On the gas side, I think Kean/Lay need an update to a table you prepared for me a few months ago, which I've attached..  Can you oblige?  Thanks,\n\nAlan Comnes\n\n \n\n---------------------- Forwarded by Alan Comnes/PDX/ECT on 04/27/2001 01:42 PM ---------------------------\n\n\nJanel Guerrero@ENRON\n04/27/2001 12:44 PM\nTo:\tAlan Comnes/PDX/ECT@ECT, Jeff Dasovich/NA/Enron@Enron\ncc:\tPaul Kaufman/PDX/ECT@ECT, Richard Shapiro/NA/Enron@Enron \n\nSubject:\tRequest from Steve Kean\n\nAlan,\n\nSteve has asked that you update the power point below so that it reflects all of the \"stupid regulatory/legislative decisions\" since the beginning of the year.  Ken wants to have this updated chart in his briefing book for next week's \"Ken Lay Tour\" to CA.  \n\nHe also wants a forward price curve for both gas and power in CA.  Can we get these three documents by Monday afternoon?  \n\n\n\n",
    "date": "Mon, 30 Apr 2001 13:37:00 -0700 (PDT)",
    "message_id": "25043030.1075855378785.JavaMail.evans@thyme",
    "word_count": 161,
    "summarised_body": "",
    "named_entities": {
      "PERSON": [
        "Phillip K Allen/HOU",
        "Alan Comnes",
        "Phillip K Allen/HOU",
        "Joe Hartsoe/Corp",
        "Steve Kean",
        "Phillip",
        "Kean",
        "Alan Comnes",
        "Jeff Dasovich/",
        "Paul Kaufman/",
        "Richard Shapiro/NA",
        "Steve Kean",
        "Alan",
        "Steve",
        "Ken",
        "Ken Lay Tour"
      ],
      "ORG": [
        "ECT",
        "Janel"
      ],
      "TIME": [
        "10:36 AM",
        "01:38 PM",
        "04/27/2001 01:42 PM",
        "12:44 PM",
        "afternoon"
      ],
      "DATE": [
        "a few months ago",
        "the beginning of the year",
        "next week's",
        "Monday"
      ],
      "PRODUCT": [
        "CA",
        "CA"
      ],
      "CARDINAL": [
        "three"
      ]
    },
    "phone_numbers": []
  },
  {
    "sender_full_name": "Phillip K Allen",
    "reciever_full_name": "Stephen Harrington",
    "sender_first_name": "Phillip",
    "sender_last_name": "Allen",
    "reciever_first_name": "Stephen",
    "reciever_last_name": "Harrington",
    "sender_email": "phillip.allen@enron.com",
    "reciever_email": "stephen.harrington@enron.com",
    "sender_org": "enron",
    "reciever_org": "enron",
    "subject": "tv on 33",
    "body": "\nCash\n Hehub\n Chicago\n PEPL\n Katy\n Socal\n Opal\n Permian\n\nGas Daily\n\n Hehub\n Chicago\n PEPL\n Katy\n Socal\n NWPL\n Permian\n\nPrompt\n\n Nymex\n Chicago\n PEPL\n HSC\n Socal\n NWPL",
    "date": "Thu, 10 Aug 2000 05:36:00 -0700 (PDT)",
    "message_id": "16011733.1075855689415.JavaMail.evans@thyme",
    "word_count": 24,
    "summarised_body": "",
    "named_entities": {
      "PERSON": [
        "Katy\n Socal",
        "Katy\n Socal\n NWPL\n Permian"
      ],
      "ORG": [
        "Hehub\n Chicago\n PEPL",
        "Nymex"
      ],
      "PRODUCT": [
        "NWPL"
      ]
    },
    "phone_numbers": []
  },
  {
    "sender_full_name": "Phillip K Allen",
    "reciever_full_name": "Sunil Dalal",
    "sender_first_name": "Phillip",
    "sender_last_name": "Allen",
    "reciever_first_name": "Sunil",
    "reciever_last_name": "Dalal",
    "sender_email": "phillip.allen@enron.com",
    "reciever_email": "sunil.dalal@enron.com",
    "sender_org": "enron",
    "reciever_org": "enron",
    "subject": "Re: Ad Hoc VaR model",
    "body": "\nI tried to run the model and it did not work",
    "date": "Thu, 10 Aug 2000 01:52:00 -0700 (PDT)",
    "message_id": "2663045.1075855689436.JavaMail.evans@thyme",
    "word_count": 11,
    "summarised_body": "",
    "named_entities": {},
    "phone_numbers": []
  },
  {
    "sender_full_name": "Phillip K Allen",
    "reciever_full_name": "Keith Holst",
    "sender_first_name": "Phillip",
    "sender_last_name": "Allen",
    "reciever_first_name": "Keith",
    "reciever_last_name": "Holst",
    "sender_email": "phillip.allen@enron.com",
    "reciever_email": "keith.holst@enron.com",
    "sender_org": "enron",
    "reciever_org": "enron",
    "subject": "TRANSPORTATION MODEL",
    "body": "\n---------------------- Forwarded by Phillip K Allen/HOU/ECT on 08/09/2000 \n02:11 PM ---------------------------\n   \n\tEnron North America Corp.\n\t\n\tFrom:  Colleen Sullivan                           08/09/2000 10:11 AM\n\t\n\nTo: Keith Holst/HOU/ECT@ect, Andrew H Lewis/HOU/ECT@ECT, Fletcher J \nSturm/HOU/ECT@ECT, Larry May/Corp/Enron@Enron, Kate Fraser/HOU/ECT@ECT, Zimin \nLu/HOU/ECT@ECT, Greg Couch/HOU/ECT@ECT, John Griffith/Corp/Enron@Enron, \nSandra F Brawner/HOU/ECT@ECT, John J Lavorato/Corp/Enron@Enron, Hunter S \nShively/HOU/ECT@ECT, Phillip K Allen/HOU/ECT@ECT, Scott Neal/HOU/ECT@ECT, \nThomas A Martin/HOU/ECT@ECT, Steve Jackson/HOU/ECT@ECT\ncc: Julie A Gomez/HOU/ECT@ECT, Stephanie Miller/Corp/Enron@ENRON \nSubject: TRANSPORTATION MODEL\n\nPlease plan to attend a meeting on Friday, August 11 at 11:15 a.m. in 30C1 to \ndiscuss the transportation model.  Now that we have had several traders \nmanaging transportation positions for several months, I would like to discuss \nany issues you have with the way the model works.   I have asked Zimin Lu \n(Research), Mark Breese and John Griffith (Structuring) to attend so they \nwill be available to answer any technical questions.   The point of this \nmeeting is to get all issues out in the open and make sure everyone is \ncomfortable with using the model and position manager, and to make sure those \nwho are managing the books believe in the model's results.   Since I have \nheard a few concerns, I hope you will take advantage of this opportunity to \ndiscuss them.\n\nPlease let me know if you are unable to attend.\n\n\n",
    "date": "Wed, 9 Aug 2000 07:12:00 -0700 (PDT)",
    "message_id": "29754711.1075855689458.JavaMail.evans@thyme",
    "word_count": 221,
    "summarised_body": "",
    "named_entities": {
      "PERSON": [
        "Phillip K Allen/HOU",
        "Colleen Sullivan                           ",
        "Keith Holst/HOU",
        "Andrew H Lewis/HOU/ECT@ECT",
        "Larry May/Corp/Enron@Enron",
        "Kate Fraser/HOU",
        "Zimin \nLu/HOU/ECT@ECT",
        "John Griffith/Corp/Enron@Enron",
        "Sandra F Brawner/HOU/ECT@ECT",
        "John J Lavorato/Corp/Enron@Enron",
        "Hunter S",
        "Phillip K Allen/HOU",
        "Scott Neal/HOU",
        "Thomas A",
        "Steve Jackson/HOU",
        "Julie A",
        "Stephanie Miller/Corp",
        "Zimin Lu",
        "Mark Breese",
        "John Griffith"
      ],
      "ORG": [
        "ECT",
        "Enron North America Corp.",
        "Fletcher J \nSturm/HOU/ECT@ECT",
        "Martin/HOU/ECT@ECT"
      ],
      "TIME": [
        "02:11 PM",
        "10:11 AM",
        "11:15 a.m."
      ],
      "DATE": [
        "Friday, August 11",
        "several months"
      ],
      "CARDINAL": [
        "30C1"
      ]
    },
    "phone_numbers": []
  },
  {
    "sender_full_name": "Phillip K Allen",
    "reciever_full_name": "Colleen Sullivan",
    "sender_first_name": "Phillip",
    "sender_last_name": "Allen",
    "reciever_first_name": "Colleen",
    "reciever_last_name": "Sullivan",
    "sender_email": "phillip.allen@enron.com",
    "reciever_email": "colleen.sullivan@enron.com",
    "sender_org": "enron",
    "reciever_org": "enron",
    "subject": "Re: TRANSPORTATION MODEL",
    "body": "\nColleen,\n\n I am out ot the office on Friday, but Keith Holst will attend.  He has been \nmanaging the Transport on the west desk.\n\nPhillip",
    "date": "Wed, 9 Aug 2000 07:11:00 -0700 (PDT)",
    "message_id": "25730802.1075855689480.JavaMail.evans@thyme",
    "word_count": 25,
    "summarised_body": "",
    "named_entities": {
      "PERSON": [
        "Colleen",
        "Keith Holst",
        "Phillip"
      ],
      "DATE": [
        "Friday"
      ],
      "ORG": [
        "the Transport on the west desk"
      ]
    },
    "phone_numbers": []
  },
  {
    "sender_full_name": "Phillip K Allen",
    "reciever_full_name": "stagecoachmama@hotmail.com",
    "sender_first_name": "Phillip",
    "sender_last_name": "Allen",
    "reciever_first_name": "hotmail",
    "reciever_last_name": "",
    "sender_email": "phillip.allen@enron.com",
    "reciever_email": "stagecoachmama@hotmail.com",
    "sender_org": "enron",
    "reciever_org": "hotmail",
    "subject": "Mime-Version: 1.0",
    "body": "\nLucy,\n\n Now that #44 is rented and you have settled in for a couple of months, we \nneed to focus on expenses and recordkeeping.\n\n First, I want to implement the following changes:\n\n  1.  No Overtime without my written (or email) instructions.\n  2.  Daily timesheets for you and Wade faxed to me daily\n  3.  Paychecks will be issued each Friday by me at the State Bank\n  4.  No more expenditures on office or landscape than is necessary for basic \noperations.\n\n\n Moving on to the checkbook, I have attached a spreadsheet that organizes all \nthe checks since Jan. 1.\n When you open the file, go to the \"Checkbook\" tab and look at the yellow \nhighlighted items.  I have questions about these items.\n Please gather receipts so we can discuss.\n\nPhillip\n\n\n\n",
    "date": "Wed, 9 Aug 2000 06:28:00 -0700 (PDT)",
    "message_id": "8079253.1075855689501.JavaMail.evans@thyme",
    "word_count": 127,
    "summarised_body": "",
    "named_entities": {
      "PERSON": [
        "Lucy",
        "Phillip\n\n\n\n"
      ],
      "MONEY": [
        "44"
      ],
      "DATE": [
        "a couple of months",
        "Friday",
        "Jan. 1"
      ],
      "ORDINAL": [
        "First"
      ],
      "CARDINAL": [
        "1",
        "2",
        "3"
      ],
      "ORG": [
        "Paychecks",
        "the State Bank\n  4"
      ],
      "PRODUCT": [
        "the \"Checkbook"
      ]
    },
    "phone_numbers": []
  },
  {
    "sender_full_name": "Phillip K Allen",
    "reciever_full_name": "Ina Rangel",
    "sender_first_name": "Phillip",
    "sender_last_name": "Allen",
    "reciever_first_name": "Ina",
    "reciever_last_name": "Rangel",
    "sender_email": "phillip.allen@enron.com",
    "reciever_email": "ina.rangel@enron.com",
    "sender_org": "enron",
    "reciever_org": "enron",
    "subject": "Your Approval is Overdue: Access Request for paul.t.lucci@enron.com",
    "body": "\nIna,\n\n How many times do you think Jeff wants to get this message.  Please help\n\nPhillip\n---------------------- Forwarded by Phillip K Allen/HOU/ECT on 08/08/2000 \n04:30 PM ---------------------------\n   \n\t\n\t\n\tFrom:  Jeffrey A Shankman                           08/08/2000 05:59 AM\n\t\n\nTo: Phillip K Allen/HOU/ECT@ECT\ncc: Paul T Lucci/DEN/ECT@Enron \nSubject: Your Approval is Overdue: Access Request for paul.t.lucci@enron.com\n\nPlease have Phillip or John L approve.  thanks.  Jeff\n---------------------- Forwarded by Jeffrey A Shankman/HOU/ECT on 08/08/2000 \n07:48 AM ---------------------------\n\n\nARSystem@ect.enron.com on 08/07/2000 07:03:23 PM\nTo: jeffrey.a.shankman@enron.com\ncc:  \nSubject: Your Approval is Overdue: Access Request for paul.t.lucci@enron.com\n\n\nThis request has been pending your approval for 8 days. Please click \nhttp://itcApps.corp.enron.com/srrs/Approve/Detail.asp?ID=000000000000935&Email\n=jeffrey.a.shankman@enron.com to approve the request or contact IRM at \n713-853-5536 if you have any issues.\n\n\n\n\nRequest ID          : 000000000000935\nRequest Create Date : 7/27/00 2:15:23 PM\nRequested For       : paul.t.lucci@enron.com\nResource Name       : EOL US NatGas US GAS PHY FWD FIRM Non-Texas < or = 1 \nMonth\nResource Type       : Applications\n\n\n\n\n\n\n\n",
    "date": "Tue, 8 Aug 2000 09:31:00 -0700 (PDT)",
    "message_id": "26778614.1075855689532.JavaMail.evans@thyme",
    "word_count": 133,
    "summarised_body": "",
    "named_entities": {
      "PERSON": [
        "Ina",
        "Jeff",
        "Phillip",
        "Phillip K Allen/HOU",
        "Jeffrey A Shankman                           ",
        "Phillip K Allen/HOU",
        "Phillip",
        "John L",
        "Jeff",
        "Jeffrey A Shankman/HOU"
      ],
      "ORG": [
        "ECT",
        "Paul T Lucci/DEN/ECT@Enron \nSubject: Your Approval",
        "ECT",
        "Non-Texas"
      ],
      "TIME": [
        "04:30 PM",
        "05:59 AM",
        "07:48 AM",
        "07:03:23 PM",
        "2:15:23 PM"
      ],
      "DATE": [
        "8 days",
        "1 \nMonth"
      ],
      "CARDINAL": [
        "7/27/00"
      ],
      "WORK_OF_ART": [
        "Requested For       : paul.t.lucci@enron.com\nResource Name"
      ],
      "GPE": [
        "US"
      ]
    },
    "phone_numbers": [
      "0000000000009",
      "\n713-853-5536",
      " 0000000000"
    ]
  },
  {
    "sender_full_name": "Phillip K Allen",
    "reciever_full_name": "Ina Rangel",
    "sender_first_name": "Phillip",
    "sender_last_name": "Allen",
    "reciever_first_name": "Ina",
    "reciever_last_name": "Rangel",
    "sender_email": "phillip.allen@enron.com",
    "reciever_email": "ina.rangel@enron.com",
    "sender_org": "enron",
    "reciever_org": "enron",
    "subject": "Request Submitted: Access Request for frank.ermis@enron.com",
    "body": "\nIna,\n I keep getting these security requests that I cannot approve.  Please take \ncare of this.\n\nPhillip\n\n\n\n\n---------------------- Forwarded by Phillip K Allen/HOU/ECT on 08/08/2000 \n04:28 PM ---------------------------\n\n\nARSystem@ect.enron.com on 08/08/2000 07:17:38 AM\nTo: phillip.k.allen@enron.com\ncc:  \nSubject: Request Submitted: Access Request for frank.ermis@enron.com\n\n\nPlease review and act upon this request. You have received this email because \nthe requester specified you as their Manager. Please click \nhttp://itcApps.corp.enron.com/srrs/Approve/Detail.asp?ID=000000000001282&Email\n=phillip.k.allen@enron.com to approve th\n\n\n\n\nRequest ID          : 000000000001282\nRequest Create Date : 8/8/00 9:15:59 AM\nRequested For       : frank.ermis@enron.com\nResource Name       : Market Data Telerate Basic Energy\nResource Type       : Applications\n\n\n\n\n\n",
    "date": "Tue, 8 Aug 2000 09:30:00 -0700 (PDT)",
    "message_id": "2576119.1075855689554.JavaMail.evans@thyme",
    "word_count": 81,
    "summarised_body": "",
    "named_entities": {
      "PERSON": [
        "Phillip",
        "Phillip K Allen/HOU"
      ],
      "ORG": [
        "ECT"
      ],
      "TIME": [
        "07:17:38 AM"
      ],
      "QUANTITY": [
        "8/8/00 9:15:59 AM"
      ]
    },
    "phone_numbers": [
      "0000000000012",
      " 0000000000"
    ]
  },
  {
    "sender_full_name": "Phillip K Allen",
    "reciever_full_name": "Barry Steinhart",
    "sender_first_name": "Phillip",
    "sender_last_name": "Allen",
    "reciever_first_name": "Barry",
    "reciever_last_name": "Steinhart",
    "sender_email": "phillip.allen@enron.com",
    "reciever_email": "barry.steinhart@enron.com",
    "sender_org": "enron",
    "reciever_org": "enron",
    "subject": "Re: trading opportunities",
    "body": "\nWhat are your skills?  Why do you want to be on a trading desk?",
    "date": "Tue, 8 Aug 2000 09:27:00 -0700 (PDT)",
    "message_id": "11621863.1075855689575.JavaMail.evans@thyme",
    "word_count": 14,
    "summarised_body": "",
    "named_entities": {},
    "phone_numbers": []
  },
  {
    "sender_full_name": "Phillip K Allen",
    "reciever_full_name": "matt.smith@enron.com",
    "sender_first_name": "Phillip",
    "sender_last_name": "Allen",
    "reciever_first_name": "enron",
    "reciever_last_name": "",
    "sender_email": "phillip.allen@enron.com",
    "reciever_email": "matt.smith@enron.com",
    "sender_org": "enron",
    "reciever_org": "enron",
    "subject": "New Socal Curves",
    "body": "\n---------------------- Forwarded by Phillip K Allen/HOU/ECT on 08/07/2000 \n12:42 PM ---------------------------\n   \n\t\n\t\n\tFrom:  Jay Reitmeyer                           08/07/2000 10:39 AM\n\t\n\nTo: Phillip K Allen/HOU/ECT@ECT, Keith Holst/HOU/ECT@ect\ncc:  \nSubject: New Socal Curves\n\n\n",
    "date": "Mon, 7 Aug 2000 05:43:00 -0700 (PDT)",
    "message_id": "8313101.1075855689596.JavaMail.evans@thyme",
    "word_count": 26,
    "summarised_body": "",
    "named_entities": {
      "PERSON": [
        "Phillip K Allen/HOU",
        "Jay Reitmeyer                           08/07/2000",
        "Phillip K Allen/HOU",
        "Keith Holst/HOU"
      ],
      "ORG": [
        "ECT"
      ],
      "NORP": [
        "08/07/2000"
      ],
      "TIME": [
        "12:42 PM",
        "10:39 AM"
      ]
    },
    "phone_numbers": []
  },
  {
    "sender_full_name": "Phillip K Allen",
    "reciever_full_name": "\"Lucy Gonzalez\" <stagecoachmama@hotmail.com> @ ENRON",
    "sender_first_name": "Phillip",
    "sender_last_name": "Allen",
    "reciever_first_name": "\"Lucy",
    "reciever_last_name": "ENRON",
    "sender_email": "phillip.allen@enron.com",
    "reciever_email": "stagecoachmama@hotmail.com",
    "sender_org": "enron",
    "reciever_org": "hotmail",
    "subject": "Re: Report on Property",
    "body": "\nLucy,\n\n I didn't get a fax with the July bank statement on Friday.  Can you refax it \nto 713 646 2391\n\nPhillip",
    "date": "Mon, 7 Aug 2000 02:14:00 -0700 (PDT)",
    "message_id": "31200236.1075855689617.JavaMail.evans@thyme",
    "word_count": 22,
    "summarised_body": "",
    "named_entities": {
      "PERSON": [
        "Lucy",
        "Phillip"
      ],
      "DATE": [
        "July",
        "Friday",
        "2391"
      ]
    },
    "phone_numbers": [
      " 713 646 2391"
    ]
  },
  {
    "sender_full_name": "Phillip K Allen",
    "reciever_full_name": "Outlook Migration Team <Outlook Migration Team/Corp/Enron@ENRON>",
    "sender_first_name": "Phillip",
    "sender_last_name": "Allen",
    "reciever_first_name": "Outlook",
    "reciever_last_name": "enron",
    "sender_email": "phillip.allen@enron.com",
    "reciever_email": "outlook.team@enron.com",
    "sender_org": "enron",
    "reciever_org": "enron",
    "subject": "Re: 2- SURVEY/INFORMATION EMAIL 5-14- 01",
    "body": "\n\n\n\n\n\nOutlook Migration Team@ENRON\n05/11/2001 01:49 PM\nTo:=09Cheryl Wilchynski/HR/Corp/Enron@ENRON, Cindy R Ward/NA/Enron@ENRON, J=\no Ann Hill/Corp/Enron@ENRON, Sonja Galloway/Corp/Enron@Enron, Bilal Bajwa/N=\nA/Enron@Enron, Binh Pham/HOU/ECT@ECT, Bradley Jones/ENRON@enronXgate, Bruce=\n Mills/Corp/Enron@ENRON, Chance Rabon/ENRON@enronXgate, Chuck Ames/NA/Enron=\n@Enron, David Baumbach/HOU/ECT@ECT, Jad Doan/ENRON@enronXgate, O'Neal D Win=\nfree/HOU/ECT@ECT, Phillip M Love/HOU/ECT@ECT, Sladana-Anna Kulic/ENRON@enro=\nnXgate, Victor Guggenheim/HOU/ECT@ECT, Alejandra Chavez/NA/Enron@ENRON, Ann=\ne Bike/Enron@EnronXGate, Carole Frank/NA/Enron@ENRON, Darron C Giron/HOU/EC=\nT@ECT, Elizabeth L Hernandez/HOU/ECT@ECT, Elizabeth Shim/Corp/Enron@ENRON, =\nJeff Royed/Corp/Enron@ENRON, Kam Keiser/HOU/ECT@ECT, Kimat Singla/HOU/ECT@E=\nCT, Kristen Clause/ENRON@enronXgate, Kulvinder Fowler/NA/Enron@ENRON, Kyle =\nR Lilly/HOU/ECT@ECT, Luchas Johnson/NA/Enron@Enron, Maria Garza/HOU/ECT@ECT=\n, Patrick Ryder/NA/Enron@Enron, Ryan O'Rourke/ENRON@enronXgate, Yuan Tian/N=\nA/Enron@ENRON, Frank Ermis/HOU/ECT@ECT, Jane M Tholt/HOU/ECT@ECT, Jay Reitm=\neyer/HOU/ECT@ECT, Keith Holst/HOU/ECT@ect, Matthew Lenhart/HOU/ECT@ECT, Mik=\ne Grigsby/HOU/ECT@ECT, Monique Sanchez/HOU/ECT@ECT, Phillip K Allen/HOU/ECT=\n@ECT, Randall L Gay/HOU/ECT@ECT, Tori Kuykendall/HOU/ECT@ECT, Ina Norman/HO=\nU/ECT@ECT, Jackie Travis/HOU/ECT@ECT, Michael J Gasper/HOU/ECT@ECT, Brenda =\nH Fletcher/HOU/ECT@ECT, Jeanne Wukasch/Corp/Enron@ENRON, Mary Theresa Frank=\nlin/HOU/ECT@ECT, Mike Potter/NA/Enron@Enron, Natalie Baker/HOU/ECT@ECT, Suz=\nanne Calcagno/NA/Enron@Enron, Albert Stromquist/Corp/Enron@ENRON, Rajesh Ch=\nettiar/ENRON_DEVELOPMENT@ENRON_DEVELOPMENT, Derek Anderson/HOU/ECT@ECT, Bra=\nd Horn/HOU/ECT@ECT, Camille Gerard/Corp/Enron@ENRON, Cathy Lira/NA/Enron@EN=\nRON, Daniel Castagnola/ENRON_DEVELOPMENT@ENRON_DEVELOPMENT, Eva Tow/Corp/En=\nron@ENRON, Lam Nguyen/NA/Enron@Enron, Andy Pace/NA/Enron@Enron, Anna Santuc=\nci/NA/Enron@Enron, Claudia Guerra/NA/Enron@ENRON, Clayton Vernon/Corp/Enron=\n@ENRON, David Ryan/Corp/Enron@ENRON, Eric Smith/Contractor/Enron Communicat=\nions@Enron Communications, Grace Kim/NA/Enron@Enron, Jason Kaniss/ENRON@enr=\nonXgate, Kevin Cline/Corp/Enron@Enron, Rika Imai/NA/Enron@Enron, Todd DeCoo=\nk/Corp/Enron@Enron, Beth Jensen/NPNG/Enron@ENRON, Billi Harrill/NPNG/Enron@=\nENRON, Martha Sumner-Kenney/NPNG/Enron@ENRON, Phyllis Miller/NPNG/Enron@ENR=\nON, Sandy Olofson/NPNG/Enron@ENRON, Theresa Byrne/NPNG/Enron@ENRON, Danny M=\ncCarty/ET&S/Enron@Enron, Denis Tu/FGT/Enron@ENRON, John A Ayres/FGT/Enron@E=\nNRON, John Millar/FGT/Enron@Enron, Julie Armstrong/Corp/Enron@ENRON, Maggie=\n Schroeder/FGT/Enron@ENRON, Max Brown/OTS/Enron@ENRON, Randy Cantrell/GCO/E=\nnron@ENRON, Tracy Scott/Corp/Enron@ENRON, Charles T Muzzy/HOU/ECT@ECT, Cora=\n Pendergrass/Corp/Enron@ENRON, Darren Espey/Corp/Enron@ENRON, Jessica White=\n/NA/Enron@Enron, Kevin Brady/NA/Enron@Enron, Kirk Lenart/HOU/ECT@ECT, Lisa =\nKinsey/HOU/ECT@ECT, Margie Straight/HOU/ECT@ECT, Mark L Schrab/HOU/ECT@ECT,=\n Souad Mahmassani/Corp/Enron@ENRON, Tammy Gilmore/NA/Enron@ENRON, Teresa Mc=\nOmber/NA/Enron@ENRON, Wes Dempsey/NA/Enron@Enron, Barry Feldman/NYC/MGUSA@M=\nGUSA, Catherine Huynh/NA/Enron@Enron\ncc:=09=20\nSubject:=092- SURVEY/INFORMATION EMAIL 5-14- 01\n\nCurrent Notes User:=20\n\nTo ensure that you experience a successful migration from Notes to Outlook,=\n it is necessary to gather individual user information prior to your date o=\nf migration.  Please take a few minutes to completely fill out the followin=\ng survey. Double Click on document to put it in \"Edit\" mode. When you finis=\nh, simply click on the 'Reply With History' button then hit 'Send'  Your su=\nrvey will automatically be sent to the Outlook 2000 Migration Mailbox.\n\nThank you.\n\nOutlook 2000 Migration Team\n\n---------------------------------------------------------------------------=\n-----------------------------------------------------------------\n\nFull Name:        Phillip Allen=09=09\n\nLogin ID:  =09pallen\n\nExtension:  =0937041\n\nOffice Location:  EB3210C\n\nWhat type of computer do you have?  (Desktop,  Laptop,  Both)  =09Both\n\nDo you have a PDA?  If yes, what type do you have:   (None, IPAQ, Palm Pilo=\nt, Jornada)  IPAQ\n\nDo you have permission to access anyone's Email/Calendar?  =09\n    If yes, who? =20\n\nDoes anyone have permission to access your Email/Calendar?  =09Yes, Ina Ran=\ngel\n    If yes, who? =20\n\nAre you responsible for updating anyone else's address book?  =09\n    If yes, who? =20\n\nIs anyone else responsible for updating your address book? =20\n    If yes, who? =20\n\nDo you have access to a shared calendar? =20\n    If yes, which shared calendar? =20\n\nDo you have any Distribution Groups that Messaging maintains for you (for m=\nass mailings)? =20\n    If yes, please list here: =20\n\nPlease list all Notes databases applications that you currently use: =20\n\nIn our efforts to plan the exact date/time of your migration, we also will =\nneed to know:\n\nWhat are your normal work hours?  From:   7   To:      5\n\nWill you be out of the office in the near future for vacation, leave, etc?\n       If so, when?        From (MM/DD/YY):      To (MM/DD/YY):     =20\n\n\n\n",
    "date": "Mon, 14 May 2001 13:39:00 -0700 (PDT)",
    "message_id": "5468446.1075855378133.JavaMail.evans@thyme",
    "word_count": 605,
    "summarised_body": "",
    "named_entities": {
      "ORG": [
        "Outlook Migration",
        "Cindy R Ward/NA/Enron@ENRON",
        "Ann Hill/Corp/Enron@ENRON",
        "Galloway/Corp/Enron@Enron",
        "Bradley Jones",
        "Bruce=\n Mills/Corp/Enron@ENRON",
        "Jad Doan",
        "O'Neal D Win=",
        "Bike/Enron@EnronXGate",
        "Darron C Giron/HOU",
        "CT",
        "NA/Enron@ENRON",
        "Lilly/HOU/ECT@ECT",
        "Grigsby/HOU/ECT@ECT",
        "U/ECT@ECT",
        "Fletcher/HOU/ECT@ECT",
        "lin/HOU/ECT@ECT",
        "Suz=",
        "Eva Tow/Corp",
        "Lam Nguyen/NA/Enron@Enron",
        "ci/NA/Enron@Enron",
        "Claudia Guerra/NA/Enron@ENRON",
        "Clayton Vernon/Corp/Enron=\n",
        "onXgate",
        "Kevin Cline/Corp/Enron@Enron",
        "ENRON",
        "cCarty/ET&S/Enron@Enron",
        "NRON",
        "Kinsey/HOU/ECT@ECT",
        "Margie Straight/HOU/ECT@ECT",
        "Omber/NA/Enron@ENRON",
        "NA",
        "the 'Reply With History'",
        "the Outlook 2000 Migration Mailbox",
        "Migration Team",
        "Laptop",
        "IPAQ",
        "IPAQ"
      ],
      "TIME": [
        "01:49 PM",
        "a few minutes",
        "normal work hours"
      ],
      "PERSON": [
        "Wilchynski",
        "J=\n",
        "Binh Pham/HOU/ECT@ECT",
        "Chance Rabon",
        "Chuck Ames/NA",
        "David Baumbach/HOU",
        "Anna Kulic/ENRON@enro=\nnXgate",
        "Victor Guggenheim/HOU",
        "Alejandra Chavez/",
        "Carole Frank/NA/Enron@ENRON",
        "Elizabeth L Hernandez/HOU",
        "Elizabeth Shim/Corp/Enron@ENRON",
        "Jeff Royed/Corp/Enron@ENRON",
        "Kam Keiser/HOU/ECT@ECT",
        "Kimat Singla/HOU",
        "Kristen Clause",
        "Kulvinder Fowler/",
        "Kyle",
        "Luchas Johnson/",
        "Maria Garza/HOU",
        "Patrick Ryder/NA/Enron@Enron",
        "Ryan O'Rourke",
        "Yuan Tian/N=",
        "Frank Ermis/HOU",
        "Jane M Tholt",
        "Jay Reitm=\neyer/HOU/ECT@ECT",
        "Keith Holst/HOU",
        "Matthew Lenhart/HOU",
        "Monique Sanchez/HOU",
        "Phillip K Allen/HOU",
        "Randall L Gay/HOU",
        "Ina Norman",
        "Jackie Travis/HOU",
        "Michael J Gasper/HOU/ECT@ECT",
        "Brenda",
        "Jeanne Wukasch/Corp/Enron@ENRON",
        "Mary Theresa",
        "Mike Potter/NA/Enron@Enron",
        "Natalie Baker/HOU/ECT@ECT",
        "anne Calcagno/NA/Enron@Enron",
        "Albert Stromquist",
        "Rajesh Ch=",
        "Derek Anderson/HOU",
        "Camille Gerard/Corp/Enron@ENRON",
        "Cathy Lira/NA",
        "Daniel Castagnola",
        "Andy Pace/",
        "David Ryan/Corp/Enron@ENRON",
        "Eric Smith/Contractor/Enron Communicat=\n",
        "Grace Kim/NA/Enron@Enron",
        "Jason Kaniss/ENRON@enr=",
        "Rika Imai/",
        "Beth Jensen",
        "Billi Harrill",
        "Martha Sumner-Kenney",
        "Phyllis Miller/NPNG",
        "Sandy Olofson",
        "Theresa Byrne/NPNG",
        "Danny M=\n",
        "Denis Tu/FGT/Enron@ENRON",
        "John A Ayres/FGT",
        "John Millar/FGT/Enron@Enron",
        "Julie Armstrong/Corp/Enron@ENRON",
        "Maggie=\n Schroeder/FGT/Enron@ENRON",
        "Max Brown/",
        "Randy Cantrell",
        "Tracy Scott/Corp/Enron@ENRON",
        "Charles T Muzzy/HOU/ECT@ECT",
        "Darren Espey/Corp/Enron@ENRON",
        "Jessica White=\n/NA/Enron@Enron",
        "Kevin Brady/",
        "Kirk Lenart/HOU",
        "Lisa =\n",
        "Mark L Schrab/HOU",
        "Tammy Gilmore/NA/Enron@ENRON",
        "Wes Dempsey/",
        "Barry Feldman/NYC",
        "Catherine Huynh/"
      ],
      "LOC": [
        "Horn/HOU/ECT@ECT"
      ],
      "GPE": [
        "Anna Santuc=",
        "Jornada",
        "MM",
        "DD",
        "MM",
        "DD"
      ],
      "PRODUCT": [
        "Notes",
        "Notes"
      ],
      "DATE": [
        "2000"
      ],
      "CARDINAL": [
        "0937041",
        "09Both",
        "09",
        "20",
        "20",
        "09",
        "20",
        "20",
        "20",
        "20",
        "20",
        "20",
        "20",
        "20",
        "20"
      ],
      "WORK_OF_ART": [
        "Email/Calendar"
      ]
    },
    "phone_numbers": []
  },
  {
    "sender_full_name": "Phillip K Allen",
    "reciever_full_name": "Lisa Jones <Lisa Jones/ENRON@enronXgate@ENRON>",
    "sender_first_name": "Phillip",
    "sender_last_name": "Allen",
    "reciever_first_name": "Lisa",
    "reciever_last_name": "enron",
    "sender_email": "phillip.allen@enron.com",
    "reciever_email": "lisa.jones@enron.com",
    "sender_org": "enron",
    "reciever_org": "enron",
    "subject": "Re: Analyst Resume - Rafael Avila",
    "body": "\nSend to Karen Buckley.  Trading track interview to be conducted in May. ",
    "date": "Fri, 27 Apr 2001 13:37:00 -0700 (PDT)",
    "message_id": "24978223.1075855378806.JavaMail.evans@thyme",
    "word_count": 12,
    "summarised_body": "",
    "named_entities": {
      "PERSON": [
        "Karen Buckley"
      ],
      "DATE": [
        "May"
      ]
    },
    "phone_numbers": []
  },
  {
    "sender_full_name": "Phillip K Allen",
    "reciever_full_name": "Mike Grigsby, Keith Holst, Frank Ermis, Jane M Tholt, Steven P South",
    "sender_first_name": "Phillip",
    "sender_last_name": "Allen",
    "reciever_first_name": "Mike",
    "reciever_last_name": "South",
    "sender_email": "phillip.allen@enron.com",
    "reciever_email": "mike.grigsby@enron.com, keith.holst@enron.com, frank.ermis@enron.com, ",
    "sender_org": "enron",
    "reciever_org": "enron.com, keith.holst@enron.com, frank.ermis@enron",
    "subject": "Gas fundamentals development website",
    "body": "\n---------------------- Forwarded by Phillip K Allen/HOU/ECT on 08/07/2000 \n07:05 AM ---------------------------\n\n\nChris Gaskill@ENRON\n08/04/2000 03:13 PM\nTo: John J Lavorato/Corp/Enron@Enron, Phillip K Allen/HOU/ECT@ECT, Scott \nNeal/HOU/ECT@ECT, Thomas A Martin/HOU/ECT@ECT\ncc: Hunter S Shively/HOU/ECT@ECT \nSubject: Gas fundamentals development website\n\nAttached is the link to the site that we reviewed in today's meeting.  The \nsite is a work in progress, so please forward your comments.  \n\nhttp://gasfundy.dev.corp.enron.com/\n\nChris\n",
    "date": "Mon, 7 Aug 2000 00:06:00 -0700 (PDT)",
    "message_id": "27259145.1075855689639.JavaMail.evans@thyme",
    "word_count": 63,
    "summarised_body": "",
    "named_entities": {
      "PERSON": [
        "Phillip K Allen/HOU",
        "Chris",
        "John J Lavorato/Corp/Enron@Enron",
        "Phillip K Allen/HOU",
        "Scott \nNeal/HOU/ECT@ECT",
        "Thomas A",
        "Hunter S Shively/HOU",
        "Chris"
      ],
      "ORG": [
        "ECT",
        "Martin/HOU/ECT@ECT"
      ],
      "TIME": [
        "07:05 AM",
        "03:13 PM"
      ],
      "DATE": [
        "today"
      ]
    },
    "phone_numbers": []
  },
  {
    "sender_full_name": "Phillip K Allen",
    "reciever_full_name": "Hunter S Shively",
    "sender_first_name": "Phillip",
    "sender_last_name": "Allen",
    "reciever_first_name": "Hunter",
    "reciever_last_name": "Shively",
    "sender_email": "phillip.allen@enron.com",
    "reciever_email": "hunter.shively@enron.com",
    "sender_org": "enron",
    "reciever_org": "enron",
    "subject": "Mime-Version: 1.0",
    "body": "\nHunter,\n\nAre you watching Alberto?  Do you have Yahoo Messenger or Hear Me turned on?\n\nPhillip",
    "date": "Sat, 5 Aug 2000 09:38:00 -0700 (PDT)",
    "message_id": "25793808.1075855689661.JavaMail.evans@thyme",
    "word_count": 16,
    "summarised_body": "",
    "named_entities": {
      "PERSON": [
        "Hunter",
        "Alberto",
        "Yahoo Messenger",
        "Phillip"
      ]
    },
    "phone_numbers": []
  },
  {
    "sender_full_name": "Phillip K Allen",
    "reciever_full_name": "Chris Gaskill",
    "sender_first_name": "Phillip",
    "sender_last_name": "Allen",
    "reciever_first_name": "Chris",
    "reciever_last_name": "Gaskill",
    "sender_email": "phillip.allen@enron.com",
    "reciever_email": "chris.gaskill@enron.com",
    "sender_org": "enron",
    "reciever_org": "enron",
    "subject": "Mime-Version: 1.0",
    "body": "\ncan you build something to look at historical prices from where we saved \ncurves each night.\n\nHere is an example that pulls socal only.\nImprovements could include a drop down menu to choose any curve and a choice \nof index,gd, or our curves.\n\n",
    "date": "Fri, 4 Aug 2000 07:00:00 -0700 (PDT)",
    "message_id": "26838693.1075855689682.JavaMail.evans@thyme",
    "word_count": 44,
    "summarised_body": "",
    "named_entities": {
      "TIME": [
        "each night"
      ]
    },
    "phone_numbers": []
  },
  {
    "sender_full_name": "Phillip K Allen",
    "reciever_full_name": "John J Lavorato",
    "sender_first_name": "Phillip",
    "sender_last_name": "Allen",
    "reciever_first_name": "John",
    "reciever_last_name": "Lavorato",
    "sender_email": "phillip.allen@enron.com",
    "reciever_email": "john.lavorato@enron.com",
    "sender_org": "enron",
    "reciever_org": "enron",
    "subject": "Mime-Version: 1.0",
    "body": "\nJohn,\n\n\nThe only long term deal in the west that you could put prudency against is \nthe PGT transport until 2023\n\nPhillip",
    "date": "Fri, 4 Aug 2000 05:43:00 -0700 (PDT)",
    "message_id": "5690387.1075855689704.JavaMail.evans@thyme",
    "word_count": 22,
    "summarised_body": "",
    "named_entities": {
      "PERSON": [
        "John"
      ],
      "ORG": [
        "PGT"
      ],
      "DATE": [
        "2023"
      ]
    },
    "phone_numbers": []
  },
  {
    "sender_full_name": "Phillip K Allen",
    "reciever_full_name": "\"Lucy Gonzalez\" <stagecoachmama@hotmail.com> @ ENRON",
    "sender_first_name": "Phillip",
    "sender_last_name": "Allen",
    "reciever_first_name": "\"Lucy",
    "reciever_last_name": "ENRON",
    "sender_email": "phillip.allen@enron.com",
    "reciever_email": "stagecoachmama@hotmail.com",
    "sender_org": "enron",
    "reciever_org": "hotmail",
    "subject": "Re: Electric Overage (1824.62)",
    "body": "\nLucy,\n\n I will call you this afternoon to discuss the things in your email.\n\nPhillip",
    "date": "Thu, 3 Aug 2000 00:12:00 -0700 (PDT)",
    "message_id": "8214445.1075855689725.JavaMail.evans@thyme",
    "word_count": 15,
    "summarised_body": "",
    "named_entities": {
      "PERSON": [
        "Lucy",
        "Phillip"
      ],
      "TIME": [
        "this afternoon"
      ]
    },
    "phone_numbers": []
  },
  {
    "sender_full_name": "Phillip K Allen",
    "reciever_full_name": "Mike Grigsby, Keith Holst, Matthew Lenhart, Frank Ermis, Jay Reitmeyer",
    "sender_first_name": "Phillip",
    "sender_last_name": "Allen",
    "reciever_first_name": "Mike",
    "reciever_last_name": "Reitmeyer",
    "sender_email": "phillip.allen@enron.com",
    "reciever_email": "mike.grigsby@enron.com, keith.holst@enron.com, matthew.lenhart@enron.com, ",
    "sender_org": "enron",
    "reciever_org": "enron.com, keith.holst@enron.com, matthew.lenhart@enron",
    "subject": "New Generation Update 7/24/00",
    "body": "\n---------------------- Forwarded by Phillip K Allen/HOU/ECT on 07/26/2000 \n10:49 AM ---------------------------\n   \n\tEnron North America Corp.\n\t\n\tFrom:  Kristian J Lande                           07/25/2000 02:24 PM\n\t\n\nTo: Christopher F Calger/PDX/ECT@ECT, Jake Thomas/HOU/ECT@ECT, Frank W \nVickers/HOU/ECT@ECT, Elliot Mainzer/PDX/ECT@ECT, Michael McDonald/SF/ECT@ECT, \nDavid Parquet/SF/ECT@ECT, Laird Dyer/SF/ECT@ECT, Jim Buerkle/PDX/ECT@ECT, Jim \nGilbert/PDX/ECT@ECT, Terry W Donovan/HOU/ECT@ECT, Jeff G \nSlaughter/ENRON_DEVELOPMENT@ENRON_DEVELOPMENT, Tim Belden/HOU/ECT@ECT, Mike \nSwerzbin/HOU/ECT@ECT, Matt Motley/PDX/ECT@ECT, Robert Badeer/HOU/ECT@ECT, \nSean Crandall/PDX/ECT@ECT, Diana Scholtes/HOU/ECT@ECT, Tom \nAlonso/PDX/ECT@ECT, Mark Fischer/PDX/ECT@ECT, Tim Heizenrader/PDX/ECT@ECT\ncc: Phillip K Allen/HOU/ECT@ECT \nSubject: New Generation Update 7/24/00\n\n\n",
    "date": "Wed, 26 Jul 2000 03:56:00 -0700 (PDT)",
    "message_id": "17256273.1075855689747.JavaMail.evans@thyme",
    "word_count": 90,
    "summarised_body": "",
    "named_entities": {
      "PERSON": [
        "Phillip K Allen/HOU",
        "Kristian J Lande                           07/25/2000",
        "Christopher F Calger/PDX/ECT@ECT",
        "Jake Thomas/HOU",
        "Frank W \n",
        "Elliot Mainzer",
        "Michael McDonald/SF/ECT@ECT",
        "David Parquet/SF/ECT@ECT",
        "Laird Dyer/SF/ECT@ECT",
        "Jim Buerkle/PDX/ECT@ECT",
        "Jim \nGilbert/PDX/ECT@ECT",
        "Terry W Donovan/HOU",
        "Jeff G \nSlaughter/ENRON_DEVELOPMENT@ENRON_DEVELOPMENT",
        "Tim Belden/HOU/ECT@ECT",
        "Mike \nSwerzbin/HOU/ECT@ECT",
        "Matt Motley",
        "Robert Badeer/HOU",
        "Diana Scholtes/HOU",
        "Tom \nAlonso",
        "Mark Fischer",
        "Tim Heizenrader/PDX/ECT@ECT",
        "Phillip K Allen/HOU"
      ],
      "ORG": [
        "ECT",
        "Enron North America Corp.",
        "Sean Crandall/PDX/ECT@ECT"
      ],
      "TIME": [
        "10:49 AM"
      ]
    },
    "phone_numbers": []
  },
  {
    "sender_full_name": "Phillip K Allen",
    "reciever_full_name": "ywang@enron.com @ ENRON",
    "sender_first_name": "Phillip",
    "sender_last_name": "Allen",
    "reciever_first_name": "enron",
    "reciever_last_name": "ENRON",
    "sender_email": "phillip.allen@enron.com",
    "reciever_email": "ywang@enron.com",
    "sender_org": "enron",
    "reciever_org": "enron",
    "subject": "Re: New Notice from Transwestern Pipeline Co.",
    "body": "\nplease add mike grigsby to distribution",
    "date": "Wed, 26 Jul 2000 03:46:00 -0700 (PDT)",
    "message_id": "15240164.1075855689768.JavaMail.evans@thyme",
    "word_count": 6,
    "summarised_body": "",
    "named_entities": {
      "PERSON": [
        "mike grigsby"
      ]
    },
    "phone_numbers": []
  },
  {
    "sender_full_name": "Phillip K Allen",
    "reciever_full_name": "Frank Ermis",
    "sender_first_name": "Phillip",
    "sender_last_name": "Allen",
    "reciever_first_name": "Frank",
    "reciever_last_name": "Ermis",
    "sender_email": "phillip.allen@enron.com",
    "reciever_email": "frank.ermis@enron.com",
    "sender_org": "enron",
    "reciever_org": "enron",
    "subject": "Price for Stanfield Term",
    "body": "\n---------------------- Forwarded by Phillip K Allen/HOU/ECT on 07/26/2000 \n10:44 AM ---------------------------\n\nMichael Etringer\n\n07/26/2000 08:32 AM\n\nTo: Keith Holst/HOU/ECT@ect, Phillip K Allen/HOU/ECT@ECT\ncc:  \nSubject: Price for Stanfield Term\n\nI am sending off a follow-up to a bid I submitted to Clark County PUD.  They \nhave requested term pricing for Stanfield on a volume of 17,000.  Could you \ngive me a basis for the period :\n\nSept -00 - May 31, 2006\nSept-00 - May 31, 2008\n\nSince I assume you do not keep a Stanfield basis, but rather a basis off \nMalin or Rockies, it would probably make sense to show the basis as an \nadjustment to one of these point.  Also, what should the Mid - Offer Spread \nbe on these terms.\n\nThanks, Mike\n\n",
    "date": "Wed, 26 Jul 2000 03:44:00 -0700 (PDT)",
    "message_id": "20457011.1075855689790.JavaMail.evans@thyme",
    "word_count": 117,
    "summarised_body": "",
    "named_entities": {
      "PERSON": [
        "Phillip K Allen/HOU",
        "Michael Etringer",
        "Keith Holst/HOU",
        "Phillip K Allen/HOU",
        "Mike"
      ],
      "ORG": [
        "ECT",
        "Stanfield",
        "Stanfield",
        "the Mid - Offer Spread"
      ],
      "TIME": [
        "10:44 AM",
        "08:32 AM"
      ],
      "GPE": [
        "Clark County",
        "Malin"
      ],
      "CARDINAL": [
        "17,000"
      ],
      "DATE": [
        "2006",
        "May 31, 2008"
      ],
      "LOC": [
        "Rockies"
      ]
    },
    "phone_numbers": []
  },
  {
    "sender_full_name": "Phillip K Allen",
    "reciever_full_name": "stagecoachmama@hotmail.com",
    "sender_first_name": "Phillip",
    "sender_last_name": "Allen",
    "reciever_first_name": "hotmail",
    "reciever_last_name": "",
    "sender_email": "phillip.allen@enron.com",
    "reciever_email": "stagecoachmama@hotmail.com",
    "sender_org": "enron",
    "reciever_org": "hotmail",
    "subject": "For Wade",
    "body": "\nWade,\n\n I understood your number one priority was to deal with your vehicle \nsituation.  You need to take care of it this week.  Lucy can't hold the \ntenants to a standard (vehicles must be in running order with valid stickers) \nif the staff doesn't live up to it.  If you decide to buy a small truck and \nyou want to list me as an employer for credit purposes, I will vouch for your \nincome.\n\nPhillip",
    "date": "Tue, 25 Jul 2000 10:08:00 -0700 (PDT)",
    "message_id": "22278229.1075855689811.JavaMail.evans@thyme",
    "word_count": 75,
    "summarised_body": "",
    "named_entities": {
      "CARDINAL": [
        "number one"
      ],
      "DATE": [
        "this week"
      ],
      "PERSON": [
        "Lucy",
        "Phillip"
      ]
    },
    "phone_numbers": []
  },
  {
    "sender_full_name": "Phillip K Allen",
    "reciever_full_name": "\"Hargrove, Mac D\" <mac.d.hargrove@rssmb.com> @ ENRON",
    "sender_first_name": "Phillip",
    "sender_last_name": "Allen",
    "reciever_first_name": "\"Hargrove,",
    "reciever_last_name": "ENRON",
    "sender_email": "phillip.allen@enron.com",
    "reciever_email": "mac.d.hargrove@rssmb.com",
    "sender_org": "enron",
    "reciever_org": "rssmb",
    "subject": "Re: your address",
    "body": "\nthe merlin ct. address is still good.  I don't know why the mailing would be \nreturned.  ",
    "date": "Mon, 24 Jul 2000 03:15:00 -0700 (PDT)",
    "message_id": "29850337.1075855689832.JavaMail.evans@thyme",
    "word_count": 16,
    "summarised_body": "",
    "named_entities": {},
    "phone_numbers": []
  },
  {
    "sender_full_name": "Phillip K Allen",
    "reciever_full_name": "Tim Heizenrader <Tim Heizenrader/PDX/ECT@ECT>",
    "sender_first_name": "Phillip",
    "sender_last_name": "Allen",
    "reciever_first_name": "Tim",
    "reciever_last_name": "enron",
    "sender_email": "phillip.allen@enron.com",
    "reciever_email": "tim.heizenrader@enron.com",
    "sender_org": "enron",
    "reciever_org": "enron",
    "subject": "Cc: tim.belden@enron.com",
    "body": "\nTim,\n\nCan you authorize access to the west power site for Keith Holtz.  He is our Southern California basis trader and is under a two year contract.\n\nOn another note, is it my imagination or did the SARR website lower its forecast for McNary discharge during May.  It seems like the flows have been lowered into the 130 range and there are fewer days near 170.  Also the second half of April doesn't seem to have panned out as I expected.  The outflows stayed at 100-110 at McNary.  Can you email or call with some additional insight?\n\nThank you,\n\nPhillip",
    "date": "Fri, 27 Apr 2001 13:02:00 -0700 (PDT)",
    "message_id": "9496454.1075855378828.JavaMail.evans@thyme",
    "word_count": 101,
    "summarised_body": "",
    "named_entities": {
      "PERSON": [
        "Tim",
        "Keith Holtz",
        "McNary",
        "McNary",
        "Phillip"
      ],
      "LOC": [
        "Southern California"
      ],
      "DATE": [
        "two year",
        "May",
        "the second half of April"
      ],
      "ORG": [
        "SARR"
      ],
      "CARDINAL": [
        "130",
        "170",
        "100-110"
      ]
    },
    "phone_numbers": []
  },
  {
    "sender_full_name": "Phillip K Allen",
    "reciever_full_name": "Fletcher J Sturm, Hunter S Shively",
    "sender_first_name": "Phillip",
    "sender_last_name": "Allen",
    "reciever_first_name": "Fletcher",
    "reciever_last_name": "Shively",
    "sender_email": "phillip.allen@enron.com",
    "reciever_email": "fletcher.sturm@enron.com, hunter.shively@enron.com",
    "sender_org": "enron",
    "reciever_org": "enron.com, hunter.shively@enron",
    "subject": "Mime-Version: 1.0",
    "body": "\nHere is the 1st draft of a wish list for systems.\n\n",
    "date": "Thu, 20 Jul 2000 09:59:00 -0700 (PDT)",
    "message_id": "22301623.1075855689854.JavaMail.evans@thyme",
    "word_count": 11,
    "summarised_body": "",
    "named_entities": {
      "ORDINAL": [
        "1st"
      ]
    },
    "phone_numbers": []
  },
  {
    "sender_full_name": "Phillip K Allen",
    "reciever_full_name": "Hunter S Shively",
    "sender_first_name": "Phillip",
    "sender_last_name": "Allen",
    "reciever_first_name": "Hunter",
    "reciever_last_name": "Shively",
    "sender_email": "phillip.allen@enron.com",
    "reciever_email": "hunter.shively@enron.com",
    "sender_org": "enron",
    "reciever_org": "enron",
    "subject": "Interactive Information Resource",
    "body": "\n---------------------- Forwarded by Phillip K Allen/HOU/ECT on 07/19/2000 \n10:39 AM ---------------------------\n\n\nSkipping Stone <ss4@skpstnhouston.com",
    "date": "Wed, 19 Jul 2000 03:39:00 -0700 (PDT)",
    "message_id": "20376172.1075855689875.JavaMail.evans@thyme",
    "word_count": 11,
    "summarised_body": "",
    "named_entities": {
      "PERSON": [
        "Phillip K Allen/HOU"
      ],
      "ORG": [
        "ECT",
        "Skipping Stone",
        "ss4@skpstnhouston.com"
      ],
      "TIME": [
        "10:39 AM"
      ]
    },
    "phone_numbers": []
  },
  {
    "sender_full_name": "Phillip K Allen",
    "reciever_full_name": "Al Pollard",
    "sender_first_name": "Phillip",
    "sender_last_name": "Allen",
    "reciever_first_name": "Al",
    "reciever_last_name": "Pollard",
    "sender_email": "phillip.allen@enron.com",
    "reciever_email": "al.pollard@enron.com",
    "sender_org": "enron",
    "reciever_org": "enron",
    "subject": "Re: lunch",
    "body": "\n11:15 today still works.",
    "date": "Tue, 18 Jul 2000 02:38:00 -0700 (PDT)",
    "message_id": "5791021.1075855689896.JavaMail.evans@thyme",
    "word_count": 3,
    "summarised_body": "",
    "named_entities": {
      "TIME": [
        "11:15 today"
      ]
    },
    "phone_numbers": []
  },
  {
    "sender_full_name": "Phillip K Allen",
    "reciever_full_name": "Paul T Lucci",
    "sender_first_name": "Phillip",
    "sender_last_name": "Allen",
    "reciever_first_name": "Paul",
    "reciever_last_name": "Lucci",
    "sender_email": "phillip.allen@enron.com",
    "reciever_email": "paul.lucci@enron.com",
    "sender_org": "enron",
    "reciever_org": "enron",
    "subject": "Comments on Order 637 Compliance Filings",
    "body": "\nfyi  CIG\n\n---------------------- Forwarded by Phillip K Allen/HOU/ECT on 07/17/2000 \n10:45 AM ---------------------------\n   \n\tEnron North America Corp.\n\t\n\tFrom:  Rebecca W Cantrell                           07/14/2000 02:31 PM\n\t\n\nTo: Julie A Gomez/HOU/ECT@ECT, Stephanie Miller/Corp/Enron@ENRON, Chris \nMeyer/HOU/ECT@ECT, Judy Townsend/HOU/ECT@ECT, Theresa Branney/HOU/ECT@ECT, \nPaul T Lucci/DEN/ECT@Enron, Jane M Tholt/HOU/ECT@ECT, Steven P \nSouth/HOU/ECT@ECT, Frank Ermis/HOU/ECT@ECT, Susan W Pereira/HOU/ECT@ECT, \nGeorge Smith/HOU/ECT@ECT, Randall L Gay/HOU/ECT@ECT, Jim Homco/HOU/ECT@ECT, \nColleen Sullivan/HOU/ECT@ECT, Hunter S Shively/HOU/ECT@ECT, Ray \nHamman/HOU/EES@EES, Robert Superty/HOU/ECT@ECT, Edward Terry/HOU/ECT@ECT, \nScott Neal/HOU/ECT@ECT, Tori Kuykendall/HOU/ECT@ECT, Brenda H \nFletcher/HOU/ECT@ECT, Jeff Coates/HOU/EES@EES, John Hodge/Corp/Enron@ENRON, \nJanet Edwards/Corp/Enron@ENRON, Ruth Concannon/HOU/ECT@ECT, Sylvia A \nCampos/HOU/ECT@ECT, Paul Tate/HOU/EES@EES, Phillip K Allen/HOU/ECT@ECT, \nVictor Lamadrid/HOU/ECT@ECT, Barbara G Dillard/HOU/ECT@ECT, Gary L \nPayne/HOU/ECT@ECT\ncc:  \nSubject: Comments on Order 637 Compliance Filings\n\n\n\t\n\nFYI\n\nAttached are initial comments of ENA which will be filed Monday in the Order \n637 Compliance Filings of the indicated pipelines.  (Columbia is Columbia \nGas.)  For all other pipelines on the priority list, we filed plain \ninterventions.\n\n\n",
    "date": "Mon, 17 Jul 2000 03:46:00 -0700 (PDT)",
    "message_id": "21852423.1075855689918.JavaMail.evans@thyme",
    "word_count": 171,
    "summarised_body": "",
    "named_entities": {
      "PERSON": [
        "Phillip K Allen/HOU",
        "Rebecca W Cantrell                           07/14/2000",
        "Julie A",
        "Stephanie Miller/Corp/Enron@ENRON",
        "Judy Townsend/HOU",
        "Jane M Tholt",
        "Steven P \nSouth/HOU/ECT@ECT",
        "Frank Ermis/HOU",
        "Susan W Pereira/HOU/ECT@ECT",
        "George Smith/HOU/ECT@ECT",
        "Randall L Gay/HOU",
        "Jim Homco/HOU",
        "Colleen Sullivan/HOU",
        "Hunter S Shively/HOU",
        "Ray \nHamman/HOU",
        "Robert Superty",
        "Edward Terry/HOU/ECT@ECT",
        "Scott Neal/HOU/ECT@ECT",
        "Brenda H \n",
        "Jeff Coates/HOU",
        "John Hodge/Corp/Enron@ENRON",
        "Janet Edwards/Corp/Enron@ENRON",
        "Ruth Concannon/HOU",
        "Sylvia A \n",
        "Paul Tate/HOU",
        "Phillip K Allen/HOU",
        "Victor Lamadrid/HOU/ECT@ECT",
        "Barbara G Dillard/HOU/ECT@ECT",
        "Gary L \nPayne/HOU"
      ],
      "ORG": [
        "ECT",
        "Enron North America Corp.",
        "Chris \nMeyer/HOU/ECT@ECT",
        "Theresa Branney/HOU/ECT@ECT",
        "Paul T Lucci/DEN/ECT@Enron",
        "Fletcher/HOU/ECT@ECT",
        "Campos/HOU/ECT@ECT",
        "Order 637 Compliance Filings\n\n\n\t\n\n",
        "ENA",
        "Columbia",
        "Columbia \nGas"
      ],
      "TIME": [
        "10:45 AM",
        "02:31 PM"
      ],
      "DATE": [
        "Monday"
      ]
    },
    "phone_numbers": []
  },
  {
    "sender_full_name": "Phillip K Allen",
    "reciever_full_name": "Frank L Davis, Niamh Clarke, Sonya Clarke",
    "sender_first_name": "Phillip",
    "sender_last_name": "Allen",
    "reciever_first_name": "Frank",
    "reciever_last_name": "Clarke",
    "sender_email": "phillip.allen@enron.com",
    "reciever_email": "frank.davis@enron.com, niamh.clarke@enron.com, sonya.clarke@enron.com",
    "sender_org": "enron",
    "reciever_org": "enron.com, niamh.clarke@enron.com, sonya.clarke@enron",
    "subject": "El Paso Blanco Avg product",
    "body": "\n---------------------- Forwarded by Phillip K Allen/HOU/ECT on 07/14/2000 \n02:00 PM ---------------------------\n   \n\tEnron North America Corp.\n\t\n\tFrom:  Kenneth Shulklapper                           07/14/2000 06:58 AM\n\t\n\nTo: Phillip K Allen/HOU/ECT@ECT\ncc:  \nSubject: El Paso Blanco Avg product,\n\n\n\nPlease extend all internal gas traders view access to the new El Paso Blanco \nAvg physical NG product.\n\nTori Kuykendahl and Jane Tholt should both have administrative access to \nmanage this on EOL.\n\nIf you have any questions, please call me on 3-7041\n\nThanks,\n\nPhillip Allen\n",
    "date": "Fri, 14 Jul 2000 07:01:00 -0700 (PDT)",
    "message_id": "20426321.1075855689940.JavaMail.evans@thyme",
    "word_count": 75,
    "summarised_body": "",
    "named_entities": {
      "PERSON": [
        "Phillip K Allen/HOU",
        "Kenneth Shulklapper                           07/14/2000",
        "Phillip K Allen/HOU",
        "Blanco Avg",
        "Kuykendahl",
        "Jane Tholt",
        "Phillip Allen\n"
      ],
      "ORG": [
        "ECT",
        "Enron North America Corp.",
        "El Paso Blanco \nAvg physical NG"
      ],
      "TIME": [
        "02:00 PM"
      ],
      "DATE": [
        "3-7041"
      ]
    },
    "phone_numbers": []
  },
  {
    "sender_full_name": "Phillip K Allen",
    "reciever_full_name": "hargr@webtv.net (Neal Hargrove) @ ENRON",
    "sender_first_name": "Phillip",
    "sender_last_name": "Allen",
    "reciever_first_name": null,
    "reciever_last_name": "ENRON",
    "sender_email": "phillip.allen@enron.com",
    "reciever_email": "hargr@webtv.net",
    "sender_org": "enron",
    "reciever_org": null,
    "subject": "Re: 65th BD for Nea",
    "body": "\nKay,\n\n I will be down that weekend, but I am not sure about the rest of the family.\nAll is well here.  I will try to bring some pictures if I can't bring the \nreal thing.\n\nKeith",
    "date": "Fri, 14 Jul 2000 06:51:00 -0700 (PDT)",
    "message_id": "9793656.1075855689961.JavaMail.evans@thyme",
    "word_count": 37,
    "summarised_body": "",
    "named_entities": {
      "PERSON": [
        "Kay",
        "Keith"
      ],
      "DATE": [
        "that weekend"
      ]
    },
    "phone_numbers": []
  },
  {
    "sender_full_name": "Phillip K Allen",
    "reciever_full_name": "Keith Holst",
    "sender_first_name": "Phillip",
    "sender_last_name": "Allen",
    "reciever_first_name": "Keith",
    "reciever_last_name": "Holst",
    "sender_email": "phillip.allen@enron.com",
    "reciever_email": "keith.holst@enron.com",
    "sender_org": "enron",
    "reciever_org": "enron",
    "subject": "Project Elvis and Cactus Open Gas Position",
    "body": "\n---------------------- Forwarded by Phillip K Allen/HOU/ECT on 07/13/2000 \n10:24 AM ---------------------------\nFrom: Andy Chen on 07/12/2000 02:14 PM\nTo: Michael Etringer/HOU/ECT@ECT\ncc: Frank W Vickers/HOU/ECT@ECT, Saji John/HOU/ECT@ECT, Phillip K \nAllen/HOU/ECT@ECT, John Arnold/HOU/ECT@ECT \nSubject: Project Elvis and Cactus Open Gas Position\n\nMike--\n\nHere are the net open Socal border positions we have for Elvis and Cactus.  \nLet's try and set up a conference call with Phillip and John to talk about \ntheir offers at the back-end of their curves.\n\nRoughly speaking, we are looking at a nominal 3750 MMBtu/d for 14 years from \nMay 2010 on Elvis, and 3000 MMBtu/d on Cactus fromJune 2004 to April 2022. \n\nAndy\n\n\n\n",
    "date": "Thu, 13 Jul 2000 03:24:00 -0700 (PDT)",
    "message_id": "17498013.1075855689982.JavaMail.evans@thyme",
    "word_count": 110,
    "summarised_body": "",
    "named_entities": {
      "PERSON": [
        "Phillip K Allen/HOU",
        "Andy Chen",
        "Michael Etringer/HOU",
        "Frank W Vickers/HOU/ECT@ECT",
        "Saji John/HOU/ECT@ECT",
        "Phillip K \nAllen/HOU/ECT@ECT",
        "John Arnold/HOU",
        "Elvis",
        "Phillip",
        "John",
        "Elvis",
        "Andy\n\n\n\n"
      ],
      "ORG": [
        "ECT",
        "07/13/2000",
        "Cactus Open Gas Position\n\nMike--\n\n",
        "Socal",
        "Cactus",
        "Cactus"
      ],
      "TIME": [
        "10:24 AM",
        "02:14 PM"
      ],
      "DATE": [
        "14 years",
        "May 2010",
        "fromJune 2004 to April 2022"
      ],
      "CARDINAL": [
        "3000"
      ]
    },
    "phone_numbers": []
  },
  {
    "sender_full_name": "Phillip K Allen",
    "reciever_full_name": "Randall L Gay",
    "sender_first_name": "Phillip",
    "sender_last_name": "Allen",
    "reciever_first_name": "Randall",
    "reciever_last_name": "Gay",
    "sender_email": "phillip.allen@enron.com",
    "reciever_email": "randall.gay@enron.com",
    "sender_org": "enron",
    "reciever_org": "enron",
    "subject": "assoc. for west desk",
    "body": "\n---------------------- Forwarded by Phillip K Allen/HOU/ECT on 07/12/2000 \n02:18 PM ---------------------------\n   \n\t\n\t\n\tFrom:  Jana Giovannini                           07/11/2000 02:58 PM\n\t\n\nTo: Phillip K Allen/HOU/ECT@ECT\ncc: Celeste Roberts/HOU/ECT@ECT \nSubject: assoc. for west desk\n\nSorry, I didn't attach the form.  There is one for Associates and one for \nAnalyst.\n\n\n---------------------- Forwarded by Jana Giovannini/HOU/ECT on 07/11/2000 \n04:57 PM ---------------------------\n   \n\t\n\t\n\tFrom:  Jana Giovannini                           07/11/2000 04:57 PM\n\t\n\nTo: Phillip K Allen/HOU/ECT@ECT\ncc: Celeste Roberts/HOU/ECT@ECT \nSubject: assoc. for west desk\n\nHey Phillip,\nI received your note from Celeste.  I am the ENA Staffing Coordinator and \nneed for you to fill out the attached Needs Assessment form before I can send \nyou any resumes.  Also, would you be interested in the new class?  Analysts \nstart with the business units on Aug. 3rd and Assoc. start on Aug. 28th.  We \nare starting to place the Associates and would like to see if you are \ninterested.  Please let me know.  \n\nOnce I receive the Needs Assessment back (and you let me know if you can wait \na month,) I will be happy to pull a couple of resumes for your review.  If \nyou have any questions, please let me know.  Thanks.\n---------------------- Forwarded by Jana Giovannini/HOU/ECT on 07/11/2000 \n04:50 PM ---------------------------\n   \n\t\n\t\n\tFrom:  Dolores Muzzy                           07/11/2000 04:17 PM\n\t\n\nTo: Jana Giovannini/HOU/ECT@ECT\ncc:  \nSubject: assoc. for west desk\n\nI believe Phillip Allen is from ENA.\n\nDolores\n---------------------- Forwarded by Dolores Muzzy/HOU/ECT on 07/11/2000 04:17 \nPM ---------------------------\n   \n\t\n\t\n\tFrom:  Phillip K Allen                           07/11/2000 12:54 PM\n\t\n\nTo: Celeste Roberts/HOU/ECT@ECT\ncc:  \nSubject: assoc. for west desk\n\nCeleste,\n\n I need two assoc./analyst for the west gas trading desk.  Can you help?\n I also left you a voice mail.\n\nPhillip\nx37041\n\n\n\n\n\n\n",
    "date": "Wed, 12 Jul 2000 07:19:00 -0700 (PDT)",
    "message_id": "18062842.1075855690006.JavaMail.evans@thyme",
    "word_count": 259,
    "summarised_body": "",
    "named_entities": {
      "PERSON": [
        "Phillip K Allen/HOU",
        "Jana Giovannini                           ",
        "Phillip K Allen/HOU",
        "Celeste Roberts/HOU",
        "Jana Giovannini/HOU",
        "Jana Giovannini                           ",
        "Phillip K Allen/HOU",
        "Celeste Roberts/HOU",
        "Phillip",
        "Assoc",
        "Jana Giovannini/HOU",
        "Jana Giovannini/HOU",
        "Phillip Allen",
        "Dolores Muzzy/HOU",
        "Phillip K Allen                           ",
        "Celeste Roberts/HOU",
        "Phillip"
      ],
      "ORG": [
        "ECT",
        "Associates",
        "ECT",
        "Celeste",
        "Needs Assessment",
        "Associates",
        "ECT",
        "ENA",
        "ECT"
      ],
      "TIME": [
        "02:18 PM",
        "02:58 PM",
        "04:57 PM",
        "04:57 PM",
        "04:50 PM",
        "04:17 PM",
        "04:17 \nPM",
        "12:54 PM"
      ],
      "GPE": [
        "west desk",
        "west desk",
        "west desk",
        "west desk"
      ],
      "CARDINAL": [
        "one",
        "one",
        "two"
      ],
      "DATE": [
        "Aug. 3rd",
        "Aug. 28th"
      ],
      "LAW": [
        "the Needs Assessment"
      ]
    },
    "phone_numbers": []
  },
  {
    "sender_full_name": "Phillip K Allen",
    "reciever_full_name": "Matthew Lenhart, Mike Grigsby",
    "sender_first_name": "Phillip",
    "sender_last_name": "Allen",
    "reciever_first_name": "Matthew",
    "reciever_last_name": "Grigsby",
    "sender_email": "phillip.allen@enron.com",
    "reciever_email": "matthew.lenhart@enron.com, mike.grigsby@enron.com",
    "sender_org": "enron",
    "reciever_org": "enron.com, mike.grigsby@enron",
    "subject": "Mime-Version: 1.0",
    "body": "\n---------------------- Forwarded by Phillip K Allen/HOU/ECT on 07/11/2000 \n04:59 PM ---------------------------\n   \n\t\n\t\n\tFrom:  Robert Badeer                           07/11/2000 02:44 PM\n\t\n\nTo: Phillip K Allen/HOU/ECT@ECT\ncc:  \nSubject: \n\n\n",
    "date": "Tue, 11 Jul 2000 09:59:00 -0700 (PDT)",
    "message_id": "15248522.1075855690027.JavaMail.evans@thyme",
    "word_count": 20,
    "summarised_body": "",
    "named_entities": {
      "PERSON": [
        "Phillip K Allen/HOU",
        "Robert Badeer",
        "Phillip K Allen/HOU"
      ],
      "ORG": [
        "ECT"
      ],
      "TIME": [
        "04:59 PM",
        "02:44 PM"
      ]
    },
    "phone_numbers": []
  },
  {
    "sender_full_name": "Phillip K Allen",
    "reciever_full_name": "Ina Rangel",
    "sender_first_name": "Phillip",
    "sender_last_name": "Allen",
    "reciever_first_name": "Ina",
    "reciever_last_name": "Rangel",
    "sender_email": "phillip.allen@enron.com",
    "reciever_email": "ina.rangel@enron.com",
    "sender_org": "enron",
    "reciever_org": "enron",
    "subject": "Systems Meeting 7/18",
    "body": "\n---------------------- Forwarded by Phillip K Allen/HOU/ECT on 07/11/2000 \n04:23 PM ---------------------------\n   \n\tEnron North America Corp.\n\t\n\tFrom:  Kimberly Hillis                           07/11/2000 01:16 PM\n\t\n\nTo: Jeffrey A Shankman/HOU/ECT@ECT, Hunter S Shively/HOU/ECT@ECT, Phillip K \nAllen/HOU/ECT@ECT, Kevin M Presto/HOU/ECT@ECT, Thresa A Allen/HOU/ECT@ECT, \nKristin Albrecht/HOU/ECT@ECT, Brent A Price/HOU/ECT@ECT, Steve \nJackson/HOU/ECT@ECT, Beth Perlman/HOU/ECT@ECT, Sally Beck/HOU/ECT@ECT\ncc: Barbara Lewis/HOU/ECT@ECT, Airam Arteaga/HOU/ECT@ECT, Cherylene R \nWestbrook/HOU/ECT@ECT, Patti Thompson/HOU/ECT@ECT, Felicia Doan/HOU/ECT@ECT, \nIrena D Hogan/HOU/ECT@ECT, Ina Rangel/HOU/ECT@ECT \nSubject: Systems Meeting 7/18\n\nPlease note that John Lavorato has scheduled a Systems Meeting on Tuesday, \nJuly 18, from 2:00 - 3:00 p.m. in EB3321.\n\nPlease call me at x30681 if you have any questions.  \n\nThanks\n\nKim Hillis\n\n",
    "date": "Tue, 11 Jul 2000 09:24:00 -0700 (PDT)",
    "message_id": "26723744.1075855690050.JavaMail.evans@thyme",
    "word_count": 110,
    "summarised_body": "",
    "named_entities": {
      "PERSON": [
        "Phillip K Allen/HOU",
        "Kimberly Hillis                           ",
        "Jeffrey A Shankman/HOU/ECT@ECT",
        "Hunter S Shively/HOU",
        "Phillip K \nAllen/HOU/ECT@ECT",
        "Kevin M Presto/HOU/ECT@ECT",
        "Thresa A Allen/HOU",
        "Kristin Albrecht/HOU/ECT@ECT",
        "Steve \nJackson/HOU/ECT@ECT",
        "Beth Perlman/HOU",
        "Sally Beck/HOU",
        "Barbara Lewis/HOU",
        "Airam Arteaga/HOU/ECT@ECT",
        "Patti Thompson/HOU",
        "Irena D Hogan/HOU/ECT@ECT",
        "John Lavorato",
        "Kim Hillis"
      ],
      "ORG": [
        "ECT",
        "Enron North America Corp.",
        "Brent A Price/HOU/ECT@ECT",
        "Westbrook/HOU/ECT@ECT",
        "Felicia Doan/HOU/ECT@ECT",
        "Ina Rangel/HOU"
      ],
      "TIME": [
        "01:16 PM",
        "2:00 - 3:00 p.m."
      ],
      "DATE": [
        "Tuesday",
        "July 18"
      ],
      "PRODUCT": [
        "EB3321"
      ]
    },
    "phone_numbers": []
  },
  {
    "sender_full_name": "Phillip K Allen",
    "reciever_full_name": "Jeff Smith  <jsmith@austintx.com>",
    "sender_first_name": "Phillip",
    "sender_last_name": "Allen",
    "reciever_first_name": "Jeff",
    "reciever_last_name": "austintx",
    "sender_email": "phillip.allen@enron.com",
    "reciever_email": "jsmith@austintx.com",
    "sender_org": "enron",
    "reciever_org": "austintx",
    "subject": "Re: Leander etc.",
    "body": "\nI would look at properties in San Antonio or Dallas.",
    "date": "Thu, 26 Apr 2001 17:01:00 -0700 (PDT)",
    "message_id": "22039354.1075855378849.JavaMail.evans@thyme",
    "word_count": 10,
    "summarised_body": "",
    "named_entities": {
      "GPE": [
        "San Antonio",
        "Dallas"
      ]
    },
    "phone_numbers": []
  },
  {
    "sender_full_name": "Phillip K Allen",
    "reciever_full_name": "Celeste Roberts",
    "sender_first_name": "Phillip",
    "sender_last_name": "Allen",
    "reciever_first_name": "Celeste",
    "reciever_last_name": "Roberts",
    "sender_email": "phillip.allen@enron.com",
    "reciever_email": "celeste.roberts@enron.com",
    "sender_org": "enron",
    "reciever_org": "enron",
    "subject": "assoc. for west desk",
    "body": "\nCeleste,\n\n I need two assoc./analyst for the west gas trading desk.  Can you help?\n I also left you a voice mail.\n\nPhillip\nx37041",
    "date": "Tue, 11 Jul 2000 05:54:00 -0700 (PDT)",
    "message_id": "19895660.1075855690071.JavaMail.evans@thyme",
    "word_count": 22,
    "summarised_body": "",
    "named_entities": {
      "CARDINAL": [
        "two"
      ],
      "PERSON": [
        "Phillip"
      ]
    },
    "phone_numbers": []
  },
  {
    "sender_full_name": "Phillip K Allen",
    "reciever_full_name": "Al Pollard",
    "sender_first_name": "Phillip",
    "sender_last_name": "Allen",
    "reciever_first_name": "Al",
    "reciever_last_name": "Pollard",
    "sender_email": "phillip.allen@enron.com",
    "reciever_email": "al.pollard@enron.com",
    "sender_org": "enron",
    "reciever_org": "enron",
    "subject": "Re: Katy flatlands",
    "body": "\nHow about Tuesday at 11:15 in front of the building?",
    "date": "Tue, 11 Jul 2000 02:50:00 -0700 (PDT)",
    "message_id": "16453400.1075855690092.JavaMail.evans@thyme",
    "word_count": 9,
    "summarised_body": "",
    "named_entities": {
      "DATE": [
        "Tuesday"
      ]
    },
    "phone_numbers": []
  },
  {
    "sender_full_name": "Phillip K Allen",
    "reciever_full_name": "ywang@enron.com @ ENRON",
    "sender_first_name": "Phillip",
    "sender_last_name": "Allen",
    "reciever_first_name": "enron",
    "reciever_last_name": "ENRON",
    "sender_email": "phillip.allen@enron.com",
    "reciever_email": "ywang@enron.com",
    "sender_org": "enron",
    "reciever_org": "enron",
    "subject": "Re: New Notice from Transwestern Pipeline Co.",
    "body": "\nplease add mike grigsby to distribution list.\n",
    "date": "Tue, 11 Jul 2000 02:12:00 -0700 (PDT)",
    "message_id": "10221129.1075855690113.JavaMail.evans@thyme",
    "word_count": 7,
    "summarised_body": "",
    "named_entities": {
      "PERSON": [
        "mike grigsby"
      ]
    },
    "phone_numbers": []
  },
  {
    "sender_full_name": "Phillip K Allen",
    "reciever_full_name": "brendas@surffree.com",
    "sender_first_name": "Phillip",
    "sender_last_name": "Allen",
    "reciever_first_name": "surffree",
    "reciever_last_name": "",
    "sender_email": "phillip.allen@enron.com",
    "reciever_email": "brendas@surffree.com",
    "sender_org": "enron",
    "reciever_org": "surffree",
    "subject": "test",
    "body": "\ntesting",
    "date": "Mon, 10 Jul 2000 23:26:00 -0700 (PDT)",
    "message_id": "21391430.1075855690135.JavaMail.evans@thyme",
    "word_count": 1,
    "summarised_body": "",
    "named_entities": {},
    "phone_numbers": []
  },
  {
    "sender_full_name": "Phillip K Allen",
    "reciever_full_name": "Ina Rangel",
    "sender_first_name": "Phillip",
    "sender_last_name": "Allen",
    "reciever_first_name": "Ina",
    "reciever_last_name": "Rangel",
    "sender_email": "phillip.allen@enron.com",
    "reciever_email": "ina.rangel@enron.com",
    "sender_org": "enron",
    "reciever_org": "enron",
    "subject": "System Meeting 7/11",
    "body": "\n---------------------- Forwarded by Phillip K Allen/HOU/ECT on 07/11/2000 \n06:12 AM ---------------------------\n   \n\tEnron North America Corp.\n\t\n\tFrom:  John J Lavorato                           07/10/2000 04:03 PM\n\t\n\nSent by: Kimberly Hillis\nTo: Jeffrey A Shankman/HOU/ECT@ECT, Hunter S Shively/HOU/ECT@ECT, Phillip K \nAllen/HOU/ECT@ECT, Steve Jackson/HOU/ECT@ECT, Kevin M Presto/HOU/ECT@ECT, \nKristin Albrecht/HOU/ECT@ECT, Thresa A Allen/HOU/ECT@ECT, Brent A \nPrice/HOU/ECT@ECT\ncc:  \nSubject: System Meeting 7/11\n\nThis is to confirm a meeting for tomorrow, Tuesday, July 11 at 2:00 pm.  \nPlease reference the meeting as Systems Meeting and also note that there will \nbe a follow up meeting.   The meeting will be held in EB3321.  \n\nCall Kim Hillis at x30681 if you have any questions.\n\nk",
    "date": "Mon, 10 Jul 2000 23:12:00 -0700 (PDT)",
    "message_id": "23591021.1075855690157.JavaMail.evans@thyme",
    "word_count": 105,
    "summarised_body": "",
    "named_entities": {
      "PERSON": [
        "Phillip K Allen/HOU",
        "John J Lavorato                           ",
        "Kimberly Hillis",
        "Jeffrey A Shankman/HOU/ECT@ECT",
        "Hunter S Shively/HOU",
        "Phillip K \nAllen/HOU/ECT@ECT",
        "Steve Jackson/HOU",
        "Kevin M Presto/HOU/ECT@ECT",
        "Kristin Albrecht/HOU/ECT@ECT",
        "Thresa A Allen/HOU",
        "Systems Meeting",
        "Call Kim Hillis"
      ],
      "ORG": [
        "ECT",
        "Enron North America Corp."
      ],
      "TIME": [
        "06:12 AM",
        "04:03 PM",
        "2:00 pm"
      ],
      "DATE": [
        "tomorrow, Tuesday, July 11"
      ],
      "PRODUCT": [
        "EB3321"
      ]
    },
    "phone_numbers": []
  },
  {
    "sender_full_name": "Phillip K Allen",
    "reciever_full_name": "Matthew Lenhart, Kenneth Shulklapper",
    "sender_first_name": "Phillip",
    "sender_last_name": "Allen",
    "reciever_first_name": "Matthew",
    "reciever_last_name": "Shulklapper",
    "sender_email": "phillip.allen@enron.com",
    "reciever_email": "matthew.lenhart@enron.com, kenneth.shulklapper@enron.com",
    "sender_org": "enron",
    "reciever_org": "enron.com, kenneth.shulklapper@enron",
    "subject": "Natural Gas Customers",
    "body": "\n---------------------- Forwarded by Phillip K Allen/HOU/ECT on 07/10/2000 \n04:40 PM ---------------------------\n\n\nScott Neal\n07/10/2000 01:19 PM\nTo: Phillip K Allen/HOU/ECT@ECT, Hunter S Shively/HOU/ECT@ECT, Elsa \nVillarreal/HOU/ECT@ECT, Thomas A Martin/HOU/ECT@ECT\ncc:  \nSubject: Natural Gas Customers\n\n\n---------------------- Forwarded by Scott Neal/HOU/ECT on 07/10/2000 03:18 PM \n---------------------------\n\n\nJason Moore\n06/26/2000 10:44 AM\nTo: Scott Neal/HOU/ECT@ECT\ncc: Joel Henenberg/NA/Enron@Enron, Mary G Gosnell/HOU/ECT@ECT \nSubject: Natural Gas Customers\n\nAttached please find a spreadsheet containing a list of natural gas customers \nin the Global Counterparty database.  These are all active counterparties, \nalthough we may not be doing any business with them currently.  If you have \nany questions, please feel free to call me at x33198.\n\n\n\nJason Moore\n\n\n",
    "date": "Mon, 10 Jul 2000 09:47:00 -0700 (PDT)",
    "message_id": "15131861.1075855690179.JavaMail.evans@thyme",
    "word_count": 108,
    "summarised_body": "",
    "named_entities": {
      "PERSON": [
        "Phillip K Allen/HOU",
        "Scott Neal",
        "Phillip K Allen/HOU",
        "Hunter S Shively/HOU",
        "Elsa",
        "Thomas A",
        "Scott Neal/HOU",
        "Jason Moore\n",
        "Scott Neal/HOU",
        "Joel Henenberg/NA/Enron@Enron",
        "Mary G Gosnell/HOU",
        "Jason Moore"
      ],
      "ORG": [
        "ECT",
        "Martin/HOU/ECT@ECT",
        "ECT"
      ],
      "TIME": [
        "04:40 PM",
        "01:19 PM",
        "03:18 PM",
        "10:44 AM"
      ],
      "LOC": [
        "the Global Counterparty"
      ]
    },
    "phone_numbers": []
  },
  {
    "sender_full_name": "Phillip K Allen",
    "reciever_full_name": "Ina Rangel",
    "sender_first_name": "Phillip",
    "sender_last_name": "Allen",
    "reciever_first_name": "Ina",
    "reciever_last_name": "Rangel",
    "sender_email": "phillip.allen@enron.com",
    "reciever_email": "ina.rangel@enron.com",
    "sender_org": "enron",
    "reciever_org": "enron",
    "subject": "Re: EXECUTIVE IMPACT COURSE",
    "body": "\nIna,\n Please sign me up for this course whenever Hunter is signed up. Thanks",
    "date": "Mon, 10 Jul 2000 06:56:00 -0700 (PDT)",
    "message_id": "12154382.1075855690200.JavaMail.evans@thyme",
    "word_count": 14,
    "summarised_body": "",
    "named_entities": {
      "PERSON": [
        "Hunter"
      ]
    },
    "phone_numbers": []
  },
  {
    "sender_full_name": "Phillip K Allen",
    "reciever_full_name": "Al Pollard",
    "sender_first_name": "Phillip",
    "sender_last_name": "Allen",
    "reciever_first_name": "Al",
    "reciever_last_name": "Pollard",
    "sender_email": "phillip.allen@enron.com",
    "reciever_email": "al.pollard@enron.com",
    "sender_org": "enron",
    "reciever_org": "enron",
    "subject": "Re: Katy flatlands",
    "body": "\nAl,\n\nI am not in good enough shape to ride a century right now.  Plus I'm nursing \nsome injuries.  I can do lunch this week or next, let's pick a day.\n\nPhillip",
    "date": "Mon, 10 Jul 2000 06:54:00 -0700 (PDT)",
    "message_id": "32881814.1075855690221.JavaMail.evans@thyme",
    "word_count": 32,
    "summarised_body": "",
    "named_entities": {
      "DATE": [
        "a century right now",
        "this week"
      ],
      "PERSON": [
        "Phillip"
      ]
    },
    "phone_numbers": []
  },
  {
    "sender_full_name": "Phillip K Allen",
    "reciever_full_name": "brendas@tgn.net",
    "sender_first_name": "Phillip",
    "sender_last_name": "Allen",
    "reciever_first_name": null,
    "reciever_last_name": "",
    "sender_email": "phillip.allen@enron.com",
    "reciever_email": "brendas@tgn.net",
    "sender_org": "enron",
    "reciever_org": null,
    "subject": "Mime-Version: 1.0",
    "body": "\nBrenda,\n\n The word document attached is a notice/consent form for the sale.  The excel \nfile is an amortization table for the note.\nYou can use the Additional Principal Reduction to record prepayments.  Please \nemail me back to confirm receipt.\n\n\nPhillip\n\n\n\n\n\n",
    "date": "Fri, 7 Jul 2000 09:41:00 -0700 (PDT)",
    "message_id": "3164932.1075855690243.JavaMail.evans@thyme",
    "word_count": 41,
    "summarised_body": "",
    "named_entities": {
      "PERSON": [
        "Brenda",
        "Phillip"
      ],
      "ORG": [
        "the Additional Principal Reduction"
      ]
    },
    "phone_numbers": []
  },
  {
    "sender_full_name": "Phillip K Allen",
    "reciever_full_name": "\"Jeff Smith\" <jsmith@austintx.com> @ ENRON",
    "sender_first_name": "Phillip",
    "sender_last_name": "Allen",
    "reciever_first_name": "\"Jeff",
    "reciever_last_name": "ENRON",
    "sender_email": "phillip.allen@enron.com",
    "reciever_email": "jsmith@austintx.com",
    "sender_org": "enron",
    "reciever_org": "austintx",
    "subject": "Re: Brenda Stones telephone numbers",
    "body": "\nJeff,\n\n I have spoken to Brenda and everything looks good.  Matt Lutz was supposed \nto email me some language but I did not receive it.  I don't have his # so \ncan you follow up.  When is the estimated closing date.  Let me know what \nelse I need to be doing.\n\nPhillip",
    "date": "Fri, 7 Jul 2000 09:39:00 -0700 (PDT)",
    "message_id": "9250296.1075855690264.JavaMail.evans@thyme",
    "word_count": 51,
    "summarised_body": "",
    "named_entities": {
      "PERSON": [
        "Jeff",
        "Brenda",
        "Matt Lutz",
        "Phillip"
      ]
    },
    "phone_numbers": []
  },
  {
    "sender_full_name": "Phillip K Allen",
    "reciever_full_name": "Gary Schmitz  <gary@creativepanel.com>",
    "sender_first_name": "Phillip",
    "sender_last_name": "Allen",
    "reciever_first_name": "Gary",
    "reciever_last_name": "creativepanel",
    "sender_email": "phillip.allen@enron.com",
    "reciever_email": "gary@creativepanel.com",
    "sender_org": "enron",
    "reciever_org": "creativepanel",
    "subject": "Re:",
    "body": "\nGary,\n\nI have also been speaking to Johnnie Brown in San Antonio to be the general contractor.  According to Johnnie, I would not be pay any less buying from the factory versus purchasing the panels through him since my site is within his region.  Assuming this is true, I will work directly with him.  I believe he has sent you my plans.  They were prepared by Kipp Flores architects.  \n\nCan you confirm that the price is the same direct from the factory or from the distributor?  If you have the estimates worked up for Johnnie will you please email them to me as well?\n\nThank you for your time.  I am excited about potentially using your product.\n\nPhillip Allen",
    "date": "Thu, 26 Apr 2001 16:27:00 -0700 (PDT)",
    "message_id": "8052466.1075855378887.JavaMail.evans@thyme",
    "word_count": 119,
    "summarised_body": "",
    "named_entities": {
      "PERSON": [
        "Gary",
        "Johnnie Brown",
        "Johnnie",
        "Johnnie",
        "Phillip Allen"
      ],
      "GPE": [
        "San Antonio"
      ],
      "NORP": [
        "Kipp Flores"
      ]
    },
    "phone_numbers": []
  },
  {
    "sender_full_name": "Phillip K Allen",
    "reciever_full_name": "Gary Taylor",
    "sender_first_name": "Phillip",
    "sender_last_name": "Allen",
    "reciever_first_name": "Gary",
    "reciever_last_name": "Taylor",
    "sender_email": "phillip.allen@enron.com",
    "reciever_email": "gary.taylor@enron.com",
    "sender_org": "enron",
    "reciever_org": "enron",
    "subject": "Re: market intelligence",
    "body": "\ngary,\n\n thanks for the info.",
    "date": "Fri, 7 Jul 2000 06:56:00 -0700 (PDT)",
    "message_id": "12051992.1075855690285.JavaMail.evans@thyme",
    "word_count": 5,
    "summarised_body": "",
    "named_entities": {},
    "phone_numbers": []
  },
  {
    "sender_full_name": "Phillip K Allen",
    "reciever_full_name": "Felix Buitron",
    "sender_first_name": "Phillip",
    "sender_last_name": "Allen",
    "reciever_first_name": "Felix",
    "reciever_last_name": "Buitron",
    "sender_email": "phillip.allen@enron.com",
    "reciever_email": "felix.buitron@enron.com",
    "sender_org": "enron",
    "reciever_org": "enron",
    "subject": "Re: Memory",
    "body": "\nAnytime after 3 p.m.",
    "date": "Fri, 7 Jul 2000 06:41:00 -0700 (PDT)",
    "message_id": "23290954.1075855690306.JavaMail.evans@thyme",
    "word_count": 3,
    "summarised_body": "",
    "named_entities": {
      "TIME": [
        "3 p.m."
      ]
    },
    "phone_numbers": []
  },
  {
    "sender_full_name": "Phillip K Allen",
    "reciever_full_name": "Tim Belden",
    "sender_first_name": "Phillip",
    "sender_last_name": "Allen",
    "reciever_first_name": "Tim",
    "reciever_last_name": "Belden",
    "sender_email": "phillip.allen@enron.com",
    "reciever_email": "tim.belden@enron.com",
    "sender_org": "enron",
    "reciever_org": "enron",
    "subject": "Re: Thoughts on Presentation",
    "body": "\nTim,\n Matt sent you a email with his attempt to organize some of the cems and wscc \ndata.  Tim H. expressed concern over the reliability of the wscc data.  I \ndon't know if we should scrap the wscc or just keep monitoring in case it \nimproves.  Let me know what you think.\n\nPhillip",
    "date": "Thu, 6 Jul 2000 09:38:00 -0700 (PDT)",
    "message_id": "5063236.1075855690328.JavaMail.evans@thyme",
    "word_count": 52,
    "summarised_body": "",
    "named_entities": {
      "PERSON": [
        "Tim",
        "Matt",
        "Tim H.",
        "Phillip"
      ]
    },
    "phone_numbers": []
  },
  {
    "sender_full_name": "Phillip K Allen",
    "reciever_full_name": "Ina Rangel",
    "sender_first_name": "Phillip",
    "sender_last_name": "Allen",
    "reciever_first_name": "Ina",
    "reciever_last_name": "Rangel",
    "sender_email": "phillip.allen@enron.com",
    "reciever_email": "ina.rangel@enron.com",
    "sender_org": "enron",
    "reciever_org": "enron",
    "subject": "Executive Impact and Influence Course",
    "body": "\nWhat are my choices for dates?\n---------------------- Forwarded by Phillip K Allen/HOU/ECT on 07/06/2000 \n03:44 PM ---------------------------\n\n\nDavid W Delainey\n06/29/2000 10:48 AM\nTo: Jeffery Ader/HOU/ECT@ECT, Phillip K Allen/HOU/ECT@ECT, Edward D \nBaughman/HOU/ECT@ECT, Tim Belden/HOU/ECT@ECT, Greg Blair/Corp/Enron@Enron, \nBryan Burnett/HOU/ECT@ECT, George Carrick/HOU/ECT@ECT, Joseph \nDeffner/HOU/ECT@ECT, Janet R Dietrich/HOU/ECT@ECT, Craig A Fox/HOU/ECT@ECT, \nJulie A Gomez/HOU/ECT@ECT, Mike Jakubik/HOU/ECT@ECT, Scott \nJosey/Corp/Enron@ENRON, Fred Lagrasta/HOU/ECT@ECT, John J \nLavorato/Corp/Enron@Enron, Thomas A Martin/HOU/ECT@ECT, Gil \nMuhl/Corp/Enron@ENRON, Scott Neal/HOU/ECT@ECT, Jesse Neyman/HOU/ECT@ECT, \nEdward Ondarza/HOU/ECT@ECT, Ozzie Pagan/HOU/ECT@ECT, Kevin M \nPresto/HOU/ECT@ECT, Mike A Roberts/HOU/ECT@ECT, Jim Schwieger/HOU/ECT@ECT, \nHunter S Shively/HOU/ECT@ECT, Bruce Sukaly/Corp/Enron@Enron, Colleen \nSullivan/HOU/ECT@ECT, Mike Swerzbin/HOU/ECT@ECT, John Thompson/LON/ECT@ECT, \nCarl Tricoli/Corp/Enron@Enron, Greg Wolfe/HOU/ECT@ECT\ncc: Billy Lemmons/Corp/Enron@ENRON, Mark Frevert/NA/Enron@Enron \nSubject: Executive Impact and Influence Course\n\nFolks, you are the remaining officers of ENA that have not yet enrolled in \nthis mandated training program.  It is ENA's goal to have all its officers \nthrough the program before the end of calendar year 2000.  The course has \nreceived very high marks for effectiveness.  Please take time now to enroll \nin the program. Speak to your HR representative if you need help getting \nsigned up.\n\nRegards\nDelainey\n",
    "date": "Thu, 6 Jul 2000 08:45:00 -0700 (PDT)",
    "message_id": "3784484.1075855690349.JavaMail.evans@thyme",
    "word_count": 205,
    "summarised_body": "",
    "named_entities": {
      "PERSON": [
        "Phillip K Allen/HOU",
        "David W Delainey\n06/29/2000",
        "Jeffery Ader/HOU",
        "Phillip K Allen/HOU",
        "Edward D \nBaughman/HOU/ECT@ECT",
        "Tim Belden/HOU/ECT@ECT",
        "Greg Blair/Corp/Enron@Enron",
        "Bryan Burnett/HOU",
        "George Carrick/HOU",
        "Joseph \nDeffner/HOU/ECT@ECT",
        "Janet R Dietrich/HOU/ECT@ECT",
        "Craig A",
        "Julie A",
        "Mike Jakubik/HOU",
        "Scott \nJosey/Corp/Enron@ENRON",
        "Fred Lagrasta/HOU",
        "John J \nLavorato/Corp/Enron@Enron",
        "Thomas A",
        "Scott Neal/HOU/ECT@ECT",
        "Jesse Neyman/HOU",
        "Edward Ondarza/HOU/ECT@ECT",
        "Kevin M \nPresto/HOU/ECT@ECT",
        "Mike A Roberts/HOU/ECT@ECT",
        "Jim Schwieger/HOU",
        "Hunter S Shively/HOU/ECT@ECT",
        "Colleen \nSullivan/HOU/ECT@ECT",
        "Mike Swerzbin/HOU",
        "John Thompson/LON/ECT@ECT",
        "Carl Tricoli/Corp/Enron@Enron",
        "Greg Wolfe/HOU",
        "Mark Frevert/NA",
        "Delainey"
      ],
      "ORG": [
        "ECT",
        "Fox/HOU/ECT@ECT",
        "Martin/HOU/ECT@ECT",
        "Gil \nMuhl/Corp/Enron@ENRON",
        "Ozzie Pagan/HOU/ECT@ECT",
        "Bruce Sukaly/Corp/Enron@Enron",
        "Billy Lemmons/Corp/Enron@ENRON",
        "ENA"
      ],
      "TIME": [
        "03:44 PM"
      ],
      "DATE": [
        "the end of calendar year 2000"
      ]
    },
    "phone_numbers": []
  },
  {
    "sender_full_name": "Phillip K Allen",
    "reciever_full_name": "\"Lucy Gonzalez\" <stagecoachmama@hotmail.com> @ ENRON",
    "sender_first_name": "Phillip",
    "sender_last_name": "Allen",
    "reciever_first_name": "\"Lucy",
    "reciever_last_name": "ENRON",
    "sender_email": "phillip.allen@enron.com",
    "reciever_email": "stagecoachmama@hotmail.com",
    "sender_org": "enron",
    "reciever_org": "hotmail",
    "subject": "Re: Notices",
    "body": "\nLucy,\n\nI got your email.  I didn't have time to finish it.  I will read it this \nweekend and ask my dad about the a/c's.  I am glad you are enjoying\nthe job.  This weekend I will mark up the lease and rules.  If I didn't \nmention this when I was there, the 4th is a paid holiday for you and Wade.  \nHave a good weekend and I will talk to you next week.\n\nPhillip",
    "date": "Fri, 30 Jun 2000 07:31:00 -0700 (PDT)",
    "message_id": "20174240.1075855690371.JavaMail.evans@thyme",
    "word_count": 76,
    "summarised_body": "",
    "named_entities": {
      "PERSON": [
        "Lucy",
        "Phillip"
      ],
      "DATE": [
        "this \nweekend",
        "This weekend",
        "a good weekend",
        "next week"
      ],
      "ORDINAL": [
        "4th"
      ]
    },
    "phone_numbers": []
  },
  {
    "sender_full_name": "Phillip K Allen",
    "reciever_full_name": "Ina Rangel",
    "sender_first_name": "Phillip",
    "sender_last_name": "Allen",
    "reciever_first_name": "Ina",
    "reciever_last_name": "Rangel",
    "sender_email": "phillip.allen@enron.com",
    "reciever_email": "ina.rangel@enron.com",
    "sender_org": "enron",
    "reciever_org": "enron",
    "subject": "(Reminder) Update GIS Information",
    "body": "\nWhat is GIS info?  Can you do this?\n\n\n\n---------------------- Forwarded by Phillip K Allen/HOU/ECT on 06/30/2000 \n12:53 PM ---------------------------\n   \n\tEnron North America Corp.\n\t\n\tFrom:  David W Delainey                           06/30/2000 07:42 AM\n\t\n\nSent by: Kay Chapman\nTo: Raymond Bowen/HOU/ECT@ECT, Wes Colwell/HOU/ECT@ECT, Janet R \nDietrich/HOU/ECT@ECT, Jeff Donahue/HOU/ECT@ECT, Gary Hickerson/HOU/ECT@ECT, \nJohn J Lavorato/Corp/Enron@Enron, George McClellan/HOU/ECT@ECT, Jere C \nOverdyke/HOU/ECT@ECT, Brian Redmond/HOU/ECT@ECT, Jeffrey A \nShankman/HOU/ECT@ECT, Colleen Sullivan/HOU/ECT@ECT, Mark E \nHaedicke/HOU/ECT@ECT, Vince J Kaminski/HOU/ECT@ECT, Julia Murray/HOU/ECT@ECT, \nGreg Hermans/Corp/Enron@Enron, Paul Adair/Corp/Enron@Enron, Jeffery \nAder/HOU/ECT@ECT, James A Ajello/HOU/ECT@ECT, Jaime Alatorre/NA/Enron@Enron, \nBrad Alford/ECP/HOU/ECT@ECT, Phillip K Allen/HOU/ECT@ECT, John \nArnold/HOU/ECT@ECT, Tim Belden/HOU/ECT@ECT, Michael J Beyer/HOU/ECT@ECT, \nBrian Bierbach/DEN/ECT@Enron, Donald M- ECT Origination Black/HOU/ECT@ECT, \nGreg Blair/Corp/Enron@Enron, Brad Blesie/Corp/Enron@ENRON, Michael W \nBradley/HOU/ECT@ECT, Craig Breslau/HOU/ECT@ECT, Christopher F \nCalger/PDX/ECT@ECT, Cary M Carrabine/Corp/Enron@Enron, George \nCarrick/HOU/ECT@ECT, Douglas Clifford/Corp/Enron@ENRON, Bob \nCrane/HOU/ECT@ECT, Joseph Deffner/HOU/ECT@ECT, Kent Densley/Corp/Enron@Enron, \nTimothy J Detmering/HOU/ECT@ECT, W David Duran/HOU/ECT@ECT, Ranabir \nDutt/Corp/Enron@Enron, Craig A Fox/HOU/ECT@ECT, Julie A Gomez/HOU/ECT@ECT, \nDavid Howe/Corp/Enron@ENRON, Mike Jakubik/HOU/ECT@ECT, Scott \nJosey/Corp/Enron@ENRON, Jeff Kinneman/HOU/ECT@ECT, Kyle Kitagawa/CAL/ECT@ECT, \nFred Lagrasta/HOU/ECT@ECT, Billy Lemmons/Corp/Enron@ENRON, Laura \nLuce/Corp/Enron@Enron, Richard Lydecker/Corp/Enron@Enron, Randal \nMaffett/HOU/ECT@ECT, Rodney Malcolm/HOU/ECT@ECT, Michael McDonald/SF/ECT@ECT, \nJesus Melendrez/Corp/Enron@Enron, mmiller3@enron.com, Rob \nMilnthorp/CAL/ECT@ECT, Gil Muhl/Corp/Enron@ENRON, Scott Neal/HOU/ECT@ECT, \nEdward Ondarza/HOU/ECT@ECT, Michelle Parks/Corp/Enron@Enron, David \nParquet/SF/ECT@ECT, Kevin M Presto/HOU/ECT@ECT, Steve \nPruett/Corp/Enron@Enron, Daniel Reck/HOU/ECT@ECT, Andrea V Reed/HOU/ECT@ECT, \nJim Schwieger/HOU/ECT@ECT, Cliff Shedd/NA/Enron@Enron, Hunter S \nShively/HOU/ECT@ECT, Stuart Staley/LON/ECT@ECT, Fletcher J Sturm/HOU/ECT@ECT, \nThomas M Suffield/Corp/Enron@ENRON, Bruce Sukaly/Corp/Enron@Enron, Jake \nThomas/HOU/ECT@ECT, C John Thompson/Corp/Enron@ENRON, Carl \nTricoli/Corp/Enron@Enron, Max Yzaguirre/NA/Enron@ENRON, Sally \nBeck/HOU/ECT@ECT, Nick Cocavessis/Corp/Enron@ENRON, Peggy \nHedstrom/CAL/ECT@ECT, Sheila Knudsen/Corp/Enron@ENRON, Jordan \nMintz/HOU/ECT@ECT, David Oxley/HOU/ECT@ECT, Brent A Price/HOU/ECT@ECT, Mike \nSwerzbin/HOU/ECT@ECT, Alan Aronowitz/HOU/ECT@ECT, Edward D \nBaughman/HOU/ECT@ECT, Bryan Burnett/HOU/ECT@ECT, James I Ducote/HOU/ECT@ECT, \nDouglas B Dunn/HOU/ECT@ECT, Stinson Gibner/HOU/ECT@ECT, Barbara N \nGray/HOU/ECT@ECT, Robert Greer/HOU/ECT@ECT, Jeffrey T Hodge/HOU/ECT@ECT, \nAndrew Kelemen/HOU/ECT@ECT, Grant Masson/HOU/ECT@ECT, Jesse \nNeyman/HOU/ECT@ECT, Ozzie Pagan/HOU/ECT@ECT, Mike A Roberts/HOU/ECT@ECT, \nWilliam Rome/HOU/ECT@ECT, Lance Schuler-Legal/HOU/ECT@ECT, Vasant \nShanbhogue/HOU/ECT@ECT, Gregory L Sharp/HOU/ECT@ECT, Mark Taylor/HOU/ECT@ECT, \nSheila Tweed/HOU/ECT@ECT, Greg Wolfe/HOU/ECT@ECT, Mark Dobler/NA/Enron@Enron, \nThomas A Martin/HOU/ECT@ECT, Steven Schneider/Enron@Gateway\ncc: Cindy Skinner/HOU/ECT@ECT, Ted C Bland/HOU/ECT@ECT, David W \nDelainey/HOU/ECT@ECT, Marsha Schiller/HOU/ECT@ECT, Shirley \nTijerina/Corp/Enron@ENRON, Christy Chapman/HOU/ECT@ECT, Stella L \nEly/HOU/ECT@ECT, Kimberly Hillis/HOU/ECT@ect, Yolanda Ford/HOU/ECT@ECT, Donna \nBaker/HOU/ECT@ECT, Katherine Benedict/HOU/ECT@ECT, Barbara Lewis/HOU/ECT@ECT, \nJanette Elbertson/HOU/ECT@ECT, Shirley Crenshaw/HOU/ECT@ECT, Carolyn \nGeorge/Corp/Enron@ENRON, Kimberly Brown/HOU/ECT@ECT, Claudette \nHarvey/HOU/ECT@ect, Terrellyn Parker/HOU/ECT@ECT, Maria Elena \nMendoza/NA/Enron@Enron, Ina Rangel/HOU/ECT@ECT, Debra Davidson/PDX/ECT@ECT, \nJessica A Wentworth/DEN/ECT@Enron, Catherine DuMont/PDX/ECT@ECT, Betty J \nConeway/HOU/ECT@ECT, Nicole Mayer/HOU/ECT@ECT, Sherri Carpenter/HOU/ECT@ECT, \nSusan Fallon/Corp/Enron@ENRON, Tina Rode/HOU/ECT@ECT, Tonai \nLehr/Corp/Enron@ENRON, Iris Wong/CAL/ECT@ECT, Rebecca.Young@enron.com, Maxine \nE Levingston/Corp/Enron@Enron, Lynn Pikofsky/Corp/Enron@ENRON, Luann \nMitchell/Corp/Enron@Enron, Ana Alcantara/HOU/ECT@ECT, Deana \nFortine/Corp/Enron@ENRON, Deborah J Edison/HOU/ECT@ECT, Lisa \nZarsky/HOU/ECT@ECT, Angela McCulloch/CAL/ECT@ECT, Dusty Warren \nPaez/HOU/ECT@ECT, Cristina Zavala/SF/ECT@ECT, Felicia Doan/HOU/ECT@ECT, Denys \nWatson/Corp/Enron@ENRON, Angie Collins/HOU/ECT@ECT, Tammie \nDavis/NA/Enron@Enron, Gerry Taylor/Corp/Enron@ENRON, Lorie Leigh/HOU/ECT@ECT, \nAiram Arteaga/HOU/ECT@ECT, Tina Tennant/HOU/ECT@ECT, Mollie \nGustafson/PDX/ECT@ECT, Pilar Cerezo/NA/Enron@ENRON, Patti \nThompson/HOU/ECT@ECT, Leticia Leal/HOU/ECT@ECT, Darlene C \nForsyth/HOU/ECT@ECT, Rhonna Palmer/HOU/ECT@ECT, Irena D Hogan/HOU/ECT@ECT, \nJoya Davis/HOU/ECT@ECT, Erica Braden/HOU/ECT@ECT, Anabel \nGutierrez/HOU/ECT@ECT, Jenny Helton/HOU/ECT@ect, Christine \nDrummond/HOU/ECT@ECT, Kevin G Moore/HOU/ECT@ECT, Dina Snow/Corp/Enron@Enron, \nLillian Carroll/HOU/ECT@ECT, Taffy Milligan/HOU/ECT@ECT, Laura \nHarder/Corp/Enron@Enron, Nancy Hall/HOU/ECT@ECT, Tina Rode/HOU/ECT@ECT, \nCrystal Blair/HOU/ECT@ECT, Angie Collins/HOU/ECT@ECT, Donna \nBaker/HOU/ECT@ECT, Melissa Jones/NA/Enron@ENRON, Beth A Ryan/HOU/ECT@ECT, \nShirley Crenshaw/HOU/ECT@ECT, Tamara Jae Black/HOU/ECT@ECT, Amy \nCooper/HOU/ECT@ECT, Kay Chapman/HOU/ECT@ECT \nSubject: (Reminder) Update GIS Information\n\nThis is a reminder !!!  If you haven't taken the time to update your GIS \ninformation, please do so.  It is essential that this function be performed \nas soon as possible. Please read the following memo sent to you a few days \nago and if you have any questions regarding this request, please feel free to \ncall Ted Bland @ 3-5275.\n\nWith Enron's rapid growth we need to maintain an ability to move employees \nbetween operating companies and new ventures.  To do this it is essential to \nhave one process that will enable us to collect , update and retain employee \ndata.  In the spirit of One Enron, and building on the success of the \nyear-end Global VP/MD Performance Review Process, the  Enron VP/MD PRC \nrequests that all Enron Vice Presidents and Managing Directors update their \nprofiles. Current responsibilities, employment history, skills and education \nneed to be completed  via the HR Global Information System.  HRGIS is \naccessible via the HRWEB home page on the intranet.  Just go to \nhrweb.enron.com and look for the HRGIS link.  Or just type eglobal.enron.com \non the command line of your browser.\n\nThe target date by which to update these profiles is 7 July.  If you would \nlike to have a hard copy of a template that could be filled out and returned \nfor input, or If you need any assistance with the HRGIS application please \ncontact Kathy Schultea at x33841.  \n\nYour  timely response to this request is greatly appreciated.   \n\n\nThanks,\n\n\nDave",
    "date": "Fri, 30 Jun 2000 05:54:00 -0700 (PDT)",
    "message_id": "920154.1075855690394.JavaMail.evans@thyme",
    "word_count": 881,
    "summarised_body": "",
    "named_entities": {
      "PERSON": [
        "Phillip K Allen/HOU",
        "David W Delainey                           06/30/2000",
        "Kay Chapman",
        "Raymond Bowen/HOU/ECT@ECT",
        "Wes Colwell/HOU",
        "Janet",
        "Jeff Donahue/HOU",
        "Gary Hickerson/HOU",
        "John J Lavorato/Corp/Enron@Enron",
        "George McClellan/HOU",
        "Brian Redmond/HOU",
        "Jeffrey A \n",
        "Colleen Sullivan/HOU",
        "Mark E \nHaedicke/HOU/ECT@ECT",
        "Vince J Kaminski/HOU",
        "Julia Murray/HOU",
        "Greg Hermans/Corp/Enron@Enron",
        "Jeffery \nAder/HOU/ECT@ECT",
        "James A Ajello/HOU/ECT@ECT",
        "Jaime Alatorre/",
        "Phillip K Allen/HOU",
        "John \nArnold/HOU/ECT@ECT",
        "Tim Belden/HOU/ECT@ECT",
        "Michael J Beyer/HOU/ECT@ECT",
        "Brian Bierbach",
        "Donald",
        "Greg Blair/Corp/Enron@Enron",
        "Brad Blesie/Corp/Enron@ENRON",
        "Michael W \nBradley",
        "Craig Breslau/HOU",
        "Christopher F \nCalger/PDX/ECT@ECT",
        "Cary M Carrabine/Corp/Enron@Enron",
        "George \nCarrick/HOU/ECT@ECT",
        "Douglas Clifford/Corp/Enron@ENRON",
        "Bob \nCrane/HOU/ECT@ECT",
        "Joseph Deffner/HOU",
        "Timothy J Detmering/HOU/ECT@ECT",
        "Craig A",
        "Julie A",
        "David Howe/Corp/Enron@ENRON",
        "Mike Jakubik/HOU",
        "Scott \nJosey/Corp/Enron@ENRON",
        "Jeff Kinneman/HOU",
        "Kyle Kitagawa/CAL/ECT@ECT",
        "Fred Lagrasta/HOU",
        "Laura \nLuce/Corp/Enron@Enron",
        "Richard Lydecker/Corp/Enron@Enron",
        "Randal \nMaffett/HOU/ECT@ECT",
        "Rodney Malcolm/HOU",
        "Michael McDonald/SF/ECT@ECT",
        "Jesus Melendrez/Corp/Enron@Enron",
        "Scott Neal/HOU/ECT@ECT",
        "Edward Ondarza/HOU/ECT@ECT",
        "Michelle Parks/Corp/Enron@Enron",
        "David \nParquet/SF/ECT@ECT",
        "Kevin M Presto/HOU/ECT@ECT",
        "Steve \nPruett/Corp/Enron@Enron",
        "Daniel Reck/HOU",
        "Andrea V Reed/HOU/ECT@ECT",
        "Jim Schwieger/HOU",
        "Hunter S",
        "Stuart Staley/LON/ECT@ECT",
        "Thomas M Suffield/Corp/Enron@ENRON",
        "Jake \nThomas/HOU/ECT@ECT",
        "John Thompson/Corp/Enron@ENRON",
        "Carl \nTricoli/Corp/Enron@Enron",
        "Max Yzaguirre/",
        "Sally \nBeck/HOU/ECT@ECT",
        "Peggy \nHedstrom/CAL/ECT@ECT",
        "Sheila Knudsen/Corp/Enron@ENRON",
        "Jordan \nMintz/HOU/ECT@ECT",
        "David Oxley/HOU",
        "Mike \nSwerzbin/HOU/ECT@ECT",
        "Alan Aronowitz/HOU",
        "Edward D \nBaughman/HOU/ECT@ECT",
        "Bryan Burnett/HOU",
        "James I Ducote/HOU/ECT@ECT",
        "Douglas B Dunn/HOU/ECT@ECT",
        "Stinson Gibner/HOU",
        "Barbara N \nGray/HOU/ECT@ECT",
        "Robert Greer/HOU",
        "Jeffrey T Hodge/HOU/ECT@ECT",
        "Andrew Kelemen/HOU/ECT@ECT",
        "Grant Masson/HOU",
        "Jesse \nNeyman/HOU/ECT@ECT",
        "Mike A Roberts/HOU/ECT@ECT",
        "William Rome/HOU",
        "Mark Taylor/HOU",
        "Sheila Tweed/HOU/ECT@ECT",
        "Greg Wolfe/HOU",
        "Mark Dobler/",
        "Thomas A",
        "Steven Schneider",
        "Cindy Skinner/HOU",
        "Ted C Bland/HOU",
        "David W \nDelainey/HOU",
        "Marsha Schiller/HOU",
        "Shirley",
        "Christy Chapman/HOU",
        "Stella L \n",
        "Kimberly Hillis/HOU",
        "Yolanda Ford/HOU/ECT@ECT",
        "Donna \nBaker/HOU/ECT@ECT",
        "Katherine Benedict/HOU",
        "Barbara Lewis/HOU",
        "Janette Elbertson/HOU/ECT@ECT",
        "Shirley Crenshaw/HOU",
        "Carolyn \nGeorge/Corp/Enron@ENRON",
        "Claudette \nHarvey/HOU",
        "Terrellyn Parker/HOU/ECT@ECT",
        "Maria Elena \nMendoza/NA/Enron@Enron",
        "Debra Davidson",
        "Catherine DuMont",
        "Betty J \nConeway/HOU/ECT@ECT",
        "Nicole Mayer/HOU",
        "Sherri Carpenter/HOU",
        "Susan Fallon/Corp/Enron@ENRON",
        "Tina Rode/HOU/ECT@ECT",
        "Iris Wong/CAL/ECT@ECT",
        "Lynn Pikofsky/Corp/Enron@ENRON",
        "Deborah J Edison/HOU/ECT@ECT",
        "Lisa \nZarsky/HOU/ECT@ECT",
        "Angela McCulloch/CAL/ECT@ECT",
        "Dusty Warren",
        "Cristina Zavala/SF/ECT@ECT",
        "Angie Collins/HOU/ECT@ECT",
        "Tammie \nDavis/NA/Enron@Enron",
        "Gerry Taylor/Corp/Enron@ENRON",
        "Lorie Leigh/HOU",
        "Airam Arteaga/HOU/ECT@ECT",
        "Tina Tennant/HOU",
        "Mollie",
        "Patti",
        "Leticia Leal/HOU",
        "Darlene C",
        "Rhonna Palmer/HOU",
        "Irena D Hogan/HOU",
        "Joya Davis/HOU/ECT@ECT",
        "Erica Braden/HOU",
        "Jenny Helton/HOU",
        "Christine \nDrummond/HOU/ECT@ECT",
        "Kevin G Moore/HOU/ECT@ECT",
        "Lillian Carroll/HOU/ECT@ECT",
        "Taffy Milligan",
        "Nancy Hall/HOU/ECT@ECT",
        "Tina Rode/HOU/ECT@ECT",
        "Angie Collins/HOU/ECT@ECT",
        "Donna \nBaker/HOU/ECT@ECT",
        "Melissa Jones/",
        "Beth A Ryan/HOU/ECT@ECT",
        "Shirley Crenshaw/HOU",
        "Amy",
        "Kay Chapman/HOU",
        "Ted Bland",
        "Kathy Schultea",
        "Dave"
      ],
      "ORG": [
        "ECT",
        "Enron North America Corp.",
        "Dietrich/HOU/ECT@ECT",
        "Paul Adair/Corp/Enron@Enron",
        "Brad Alford/ECP/HOU/ECT@ECT",
        "DEN",
        "Kent Densley/Corp/Enron@Enron",
        "Fox/HOU/ECT@ECT",
        "Billy Lemmons/Corp/Enron@ENRON",
        "Rob \nMilnthorp/CAL/ECT@ECT",
        "Gil Muhl/Corp/Enron@ENRON",
        "Shedd/NA/Enron@Enron",
        "Fletcher J Sturm/HOU/ECT@ECT",
        "Bruce Sukaly/Corp/Enron@Enron",
        "NA/Enron@ENRON",
        "Nick Cocavessis/Corp/Enron@ENRON",
        "Brent A Price/HOU/ECT@ECT",
        "Ozzie Pagan/HOU/ECT@ECT",
        "Lance Schuler-Legal/HOU/ECT@ECT",
        "Vasant \nShanbhogue/HOU/ECT@ECT",
        "Gregory L Sharp/HOU/ECT@ECT",
        "Martin/HOU/ECT@ECT",
        "Ely/HOU/ECT@ECT",
        "Kimberly Brown/HOU/ECT@ECT",
        "Ina Rangel/HOU/ECT@ECT",
        "Lehr/Corp/Enron@ENRON",
        "Rebecca.Young@enron.com",
        "Maxine",
        "E Levingston/Corp/Enron@Enron",
        "Luann \nMitchell/Corp/Enron@Enron",
        "Alcantara/HOU/ECT@ECT",
        "Deana \nFortine/Corp/Enron@ENRON",
        "Paez/HOU/ECT@ECT",
        "Felicia Doan/HOU/ECT@ECT",
        "Denys \nWatson/Corp/Enron@ENRON",
        "Gustafson/PDX/ECT@ECT",
        "Cerezo/NA/Enron@ENRON",
        "Thompson/HOU/ECT@ECT",
        "Forsyth/HOU/ECT@ECT",
        "Gutierrez/HOU/ECT@ECT",
        "Dina Snow/Corp/Enron@Enron",
        "Laura \nHarder/Corp/Enron@Enron",
        "Enron",
        "Enron",
        "Enron VP/MD PRC",
        "Enron",
        "HRWEB"
      ],
      "TIME": [
        "12:53 PM"
      ],
      "LAW": [
        "Shankman/HOU/ECT@ECT"
      ],
      "FAC": [
        "Crystal Blair/HOU/ECT@ECT"
      ],
      "DATE": [
        "a few days \nago",
        "the \nyear-end Global VP/MD Performance Review Process",
        "7 July"
      ],
      "CARDINAL": [
        "One"
      ]
    },
    "phone_numbers": []
  },
  {
    "sender_full_name": "Phillip K Allen",
    "reciever_full_name": "Mike Grigsby, Keith Holst",
    "sender_first_name": "Phillip",
    "sender_last_name": "Allen",
    "reciever_first_name": "Mike",
    "reciever_last_name": "Holst",
    "sender_email": "phillip.allen@enron.com",
    "reciever_email": "mike.grigsby@enron.com, keith.holst@enron.com",
    "sender_org": "enron",
    "reciever_org": "enron.com, keith.holst@enron",
    "subject": "West Power Strategy Materials",
    "body": "\n---------------------- Forwarded by Phillip K Allen/HOU/ECT on 06/27/2000 \n04:39 PM ---------------------------\n\n\nTIM HEIZENRADER\n06/27/2000 11:35 AM\nTo: John J Lavorato/Corp/Enron@Enron, Phillip K Allen/HOU/ECT@ECT\ncc: Tim Belden/HOU/ECT@ECT \nSubject: West Power Strategy Materials\n\nCharts for today's meeting are attached: \n",
    "date": "Tue, 27 Jun 2000 09:40:00 -0700 (PDT)",
    "message_id": "29996655.1075855690416.JavaMail.evans@thyme",
    "word_count": 36,
    "summarised_body": "",
    "named_entities": {
      "PERSON": [
        "Phillip K Allen/HOU",
        "TIM HEIZENRADER",
        "John J Lavorato/Corp/Enron@Enron",
        "Phillip K Allen/HOU",
        "Tim Belden/HOU"
      ],
      "ORG": [
        "ECT",
        "West Power Strategy Materials\n\nCharts"
      ],
      "TIME": [
        "11:35 AM"
      ],
      "DATE": [
        "today"
      ]
    },
    "phone_numbers": []
  },
  {
    "sender_full_name": "Phillip K Allen",
    "reciever_full_name": "Kenneth Shulklapper",
    "sender_first_name": "Phillip",
    "sender_last_name": "Allen",
    "reciever_first_name": "Kenneth",
    "reciever_last_name": "Shulklapper",
    "sender_email": "phillip.allen@enron.com",
    "reciever_email": "kenneth.shulklapper@enron.com",
    "sender_org": "enron",
    "reciever_org": "enron",
    "subject": "gas storage model",
    "body": "\n---------------------- Forwarded by Phillip K Allen/HOU/ECT on 06/27/2000 \n12:32 PM ---------------------------\n\n\nZimin Lu\n06/14/2000 07:09 AM\nTo: Mark Breese/HOU/ECT@ECT\ncc: Stinson Gibner/HOU/ECT@ECT, Vince J Kaminski/HOU/ECT@ECT, Colleen \nSullivan/HOU/ECT@ECT, Hunter S Shively/HOU/ECT@ECT, Phillip K \nAllen/HOU/ECT@ECT, Thomas A Martin/HOU/ECT@ECT, Jim Schwieger/HOU/ECT@ECT, \nScott Neal/HOU/ECT@ECT \nSubject: gas storage model\n\n\nMark,\n\nWe are currently back-testing the storage model. \nThe enclosed version contains deltas and decision \nvariable. \n\nYou mentioned that you have resources to run the model. Please do so.\nThis will help us to gain experience with the market vs the\nmodel.\n\nI am going to distribute an article by Caminus, an software vendor.\nThe article illustrates the optionality associated with storage operation\nvery well.  The Enron Research storage model  is a lot like that, although \nimplementation may be\ndifferent.  \n\nLet me know if you have any questions.\n\nZimin\n\n\n\n",
    "date": "Tue, 27 Jun 2000 05:33:00 -0700 (PDT)",
    "message_id": "32005218.1075855690438.JavaMail.evans@thyme",
    "word_count": 139,
    "summarised_body": "",
    "named_entities": {
      "PERSON": [
        "Phillip K Allen/HOU",
        "Zimin Lu",
        "Mark Breese/HOU",
        "Stinson Gibner/HOU",
        "Vince J Kaminski/HOU",
        "Colleen \nSullivan/HOU/ECT@ECT",
        "Hunter S Shively/HOU",
        "Phillip K \nAllen/HOU/ECT@ECT",
        "Thomas A",
        "Jim Schwieger/HOU",
        "Scott Neal/HOU",
        "Mark",
        "Zimin\n\n\n\n"
      ],
      "ORG": [
        "ECT",
        "Martin/HOU/ECT@ECT",
        "The Enron Research"
      ],
      "TIME": [
        "12:32 PM",
        "07:09 AM"
      ],
      "GPE": [
        "Caminus"
      ]
    },
    "phone_numbers": []
  },
  {
    "sender_full_name": "Phillip K Allen",
    "reciever_full_name": "Steve Touchstone <STouchstone@natsource.com>",
    "sender_first_name": "Phillip",
    "sender_last_name": "Allen",
    "reciever_first_name": "Steve",
    "reciever_last_name": "natsource",
    "sender_email": "phillip.allen@enron.com",
    "reciever_email": "stouchstone@natsource.com",
    "sender_org": "enron",
    "reciever_org": "natsource",
    "subject": "Re:",
    "body": "\nis your voice healed or are you going to use a real time messenger?",
    "date": "Mon, 26 Jun 2000 07:54:00 -0700 (PDT)",
    "message_id": "612127.1075855690459.JavaMail.evans@thyme",
    "word_count": 14,
    "summarised_body": "",
    "named_entities": {},
    "phone_numbers": []
  },
  {
    "sender_full_name": "Phillip K Allen",
    "reciever_full_name": "Steve Touchstone <STouchstone@natsource.com>",
    "sender_first_name": "Phillip",
    "sender_last_name": "Allen",
    "reciever_first_name": "Steve",
    "reciever_last_name": "natsource",
    "sender_email": "phillip.allen@enron.com",
    "reciever_email": "stouchstone@natsource.com",
    "sender_org": "enron",
    "reciever_org": "natsource",
    "subject": "Re:",
    "body": "\nno",
    "date": "Mon, 26 Jun 2000 07:13:00 -0700 (PDT)",
    "message_id": "20364402.1075855690481.JavaMail.evans@thyme",
    "word_count": 1,
    "summarised_body": "",
    "named_entities": {},
    "phone_numbers": []
  },
  {
    "sender_full_name": "Phillip K Allen",
    "reciever_full_name": "Ray Alvarez <Ray Alvarez/NA/Enron@ENRON>",
    "sender_first_name": "Phillip",
    "sender_last_name": "Allen",
    "reciever_first_name": "Ray",
    "reciever_last_name": "enron",
    "sender_email": "phillip.allen@enron.com",
    "reciever_email": "ray.alvarez@enron.com",
    "sender_org": "enron",
    "reciever_org": "enron",
    "subject": "Re: FERC's Prospective Mitigation and Monitoring Plan for CA",
    "body": "\nRay,\n\nIs there any detail on the gas cost proxy.  Which delivery points from which publication will be used?  Basically, can you help us get any clarification on the language \"the average daily cost of gas for all delivery points in California\"?\n\nPhillip",
    "date": "Thu, 26 Apr 2001 11:34:00 -0700 (PDT)",
    "message_id": "12786049.1075855378908.JavaMail.evans@thyme",
    "word_count": 43,
    "summarised_body": "",
    "named_entities": {
      "PERSON": [
        "Ray",
        "Phillip"
      ],
      "DATE": [
        "daily"
      ],
      "GPE": [
        "California"
      ]
    },
    "phone_numbers": []
  },
  {
    "sender_full_name": "Phillip K Allen",
    "reciever_full_name": "Keith Holst",
    "sender_first_name": "Phillip",
    "sender_last_name": "Allen",
    "reciever_first_name": "Keith",
    "reciever_last_name": "Holst",
    "sender_email": "phillip.allen@enron.com",
    "reciever_email": "keith.holst@enron.com",
    "sender_org": "enron",
    "reciever_org": "enron",
    "subject": "Download Frogger before it hops away!",
    "body": "\n---------------------- Forwarded by Phillip K Allen/HOU/ECT on 06/26/2000 \n01:57 PM ---------------------------\n\n\n\"the shockwave.com team\" <shockwave.com@shockwave.m0.net",
    "date": "Mon, 26 Jun 2000 06:57:00 -0700 (PDT)",
    "message_id": "9309202.1075855690502.JavaMail.evans@thyme",
    "word_count": 11,
    "summarised_body": "",
    "named_entities": {
      "PERSON": [
        "Phillip K Allen/HOU"
      ],
      "ORG": [
        "ECT"
      ],
      "TIME": [
        "01:57 PM"
      ]
    },
    "phone_numbers": []
  },
  {
    "sender_full_name": "Phillip K Allen",
    "reciever_full_name": "Torrey Moorer",
    "sender_first_name": "Phillip",
    "sender_last_name": "Allen",
    "reciever_first_name": "Torrey",
    "reciever_last_name": "Moorer",
    "sender_email": "phillip.allen@enron.com",
    "reciever_email": "torrey.moorer@enron.com",
    "sender_org": "enron",
    "reciever_org": "enron",
    "subject": "FT-Denver book on EOL",
    "body": "\n---------------------- Forwarded by Phillip K Allen/HOU/ECT on 06/23/2000 \n11:45 AM ---------------------------\n   \n\tEnron North America Corp.\n\t\n\tFrom:  Michael Walters                           06/21/2000 04:17 PM\n\t\n\nTo: Phillip K Allen/HOU/ECT@ECT, Paul T Lucci/DEN/ECT@Enron\ncc: Tara Sweitzer/HOU/ECT@ECT \nSubject: FT-Denver book on EOL\n\nPhil or Paul:\n\nPlease forward this note to Torrey Moorer or Tara Sweitzer in the EOL \ndepartment.  It must be sent by you.  \n\nPer this request, we are asking that all financial deals on EOL be bridged \nover to the FT-Denver book instead of the physical ENA IM-Denver book.\n\nThanks in advance.\n\nMick Walters\n3-4783\nEB3299d\n",
    "date": "Fri, 23 Jun 2000 04:46:00 -0700 (PDT)",
    "message_id": "29012384.1075855690524.JavaMail.evans@thyme",
    "word_count": 94,
    "summarised_body": "",
    "named_entities": {
      "PERSON": [
        "Phillip K Allen/HOU",
        "Michael Walters                           ",
        "Phillip K Allen/HOU",
        "Tara Sweitzer/HOU",
        "Phil",
        "Paul",
        "Torrey Moorer",
        "Tara Sweitzer",
        "Mick Walters"
      ],
      "ORG": [
        "ECT",
        "Enron North America Corp.",
        "Paul T Lucci/DEN"
      ],
      "TIME": [
        "11:45 AM",
        "04:17 PM"
      ],
      "CARDINAL": [
        "3-4783"
      ]
    },
    "phone_numbers": []
  },
  {
    "sender_full_name": "Phillip K Allen",
    "reciever_full_name": "\"Carter, Scott\" <Scott.Carter@chase.com> @ ENRON",
    "sender_first_name": "Phillip",
    "sender_last_name": "Allen",
    "reciever_first_name": "\"Carter,",
    "reciever_last_name": "ENRON",
    "sender_email": "phillip.allen@enron.com",
    "reciever_email": "scott.carter@chase.com",
    "sender_org": "enron",
    "reciever_org": "chase",
    "subject": "Re: The New Power Company",
    "body": "\nScott,\n\n I emailed your question to a friend that works for the new company.  I think \nI know the answer to your questions but I want to get the exact details from \nhim.  Basically, they will offer energy  online at a fixed price or some \nprice that undercuts the current provider.  Then once their sales are large \nenough they will go to the wholesale market to hedge and lock in a profit.  \nThe risk is that they have built in enough margin to give them room to manage \nthe price risk.  This is my best guess.  I will get back to you with more.\n\nPhillip",
    "date": "Thu, 22 Jun 2000 00:26:00 -0700 (PDT)",
    "message_id": "31697227.1075855690545.JavaMail.evans@thyme",
    "word_count": 105,
    "summarised_body": "",
    "named_entities": {
      "ORG": [
        "Scott"
      ],
      "PERSON": [
        "Phillip"
      ]
    },
    "phone_numbers": []
  },
  {
    "sender_full_name": "Phillip K Allen",
    "reciever_full_name": "\"Lucy Gonzalez\" <stagecoachmama@hotmail.com> @ ENRON",
    "sender_first_name": "Phillip",
    "sender_last_name": "Allen",
    "reciever_first_name": "\"Lucy",
    "reciever_last_name": "ENRON",
    "sender_email": "phillip.allen@enron.com",
    "reciever_email": "stagecoachmama@hotmail.com",
    "sender_org": "enron",
    "reciever_org": "hotmail",
    "subject": "Re: Wade",
    "body": "\nLucy,\n\n I want to speak to Wade myself.  He can call me at work or home. Or if you \nemail me his number I will call him.  \n I would like Gary to direct Wade on renovation tasks and you can give him \nwork orders for normal maintenance.\n\n I will call you tomorrow to discuss items from the office.  Do you need Mary \nto come in on any more Fridays?  I think I \n can guess your answer.\n\n I might stop by this Friday.\n\nPhillip",
    "date": "Tue, 13 Jun 2000 07:24:00 -0700 (PDT)",
    "message_id": "25139095.1075855690566.JavaMail.evans@thyme",
    "word_count": 83,
    "summarised_body": "",
    "named_entities": {
      "PERSON": [
        "Lucy",
        "Wade",
        "Gary",
        "Wade",
        "Mary",
        "Phillip"
      ],
      "DATE": [
        "tomorrow",
        "Fridays",
        "this Friday"
      ]
    },
    "phone_numbers": []
  },
  {
    "sender_full_name": "Phillip K Allen",
    "reciever_full_name": "Matthew Lenhart",
    "sender_first_name": "Phillip",
    "sender_last_name": "Allen",
    "reciever_first_name": "Matthew",
    "reciever_last_name": "Lenhart",
    "sender_email": "phillip.allen@enron.com",
    "reciever_email": "matthew.lenhart@enron.com",
    "sender_org": "enron",
    "reciever_org": "enron",
    "subject": "Mime-Version: 1.0",
    "body": "\nhttp://ectpdx-sunone.ect.enron.com/~theizen/wsccnav/",
    "date": "Tue, 13 Jun 2000 03:32:00 -0700 (PDT)",
    "message_id": "28925215.1075855690588.JavaMail.evans@thyme",
    "word_count": 0,
    "summarised_body": "",
    "named_entities": {},
    "phone_numbers": []
  },
  {
    "sender_full_name": "Phillip K Allen",
    "reciever_full_name": "Matthew Lenhart",
    "sender_first_name": "Phillip",
    "sender_last_name": "Allen",
    "reciever_first_name": "Matthew",
    "reciever_last_name": "Lenhart",
    "sender_email": "phillip.allen@enron.com",
    "reciever_email": "matthew.lenhart@enron.com",
    "sender_org": "enron",
    "reciever_org": "enron",
    "subject": "Thoughts on Presentation",
    "body": "\n---------------------- Forwarded by Phillip K Allen/HOU/ECT on 06/12/2000 \n10:55 AM ---------------------------\n   \n\t\n\t\n\tFrom:  Tim Belden                           06/11/2000 07:26 PM\n\t\n\nTo: Phillip K Allen/HOU/ECT@ECT\ncc:  \nSubject: Thoughts on Presentation\n\nIt is a shame that the CAISO doesn't provide actual generation by unit.  The \nWSCC data, which is dicey and we don't have until July 1999, and the CEMMS, \nwhich comes on a delay, are ultimately our best sources.  For your purposes \nthe CAISO may suffice.  I think that you probably know this already, but \nthere can be a siginificant difference between \"scheduled\" and \"actual\" \ngeneration.  You are pulling \"scheduled.\"  If someone doesn't schedule their \ngeneration and then generates, either instructed or uninstructed, then you \nwill miss that.  You may also miss generation of the northern california \nmunis such as smud who only schedule their net load to the caiso.  That is, \nif they have 1500 MW of load and 1200 MW of generation, they may simply \nschedule 300 MW of load and sc transfers or imports of 300 MW.  Having said \nall of that, it is probably close enough and better than your alternatives on \nthe generation side.\n\nOn the load side I think that I would simply use CAISO actual load.  While \nthey don't split out NP15 from SP15, I think that using the actual number is \nbetter than the \"scheduled\" number.  The utilities play lots of game on the \nload side, usually under-scheduling depending on price.\n\nI think the presentation looks good.  It would be useful to share this with \nothers up here once you have it finished.  I'd like to see how much gas \ndemand goes up with each additional GW of gas-generated electricity, \nespecially compared to all gas consumption.  I was surprised by how small the \nUEG consumption was compared to other uses.  If it is the largest marginal \nconsumer then it is obviously a different story.\n\nLet's talk.\n",
    "date": "Mon, 12 Jun 2000 03:56:00 -0700 (PDT)",
    "message_id": "9492096.1075855690610.JavaMail.evans@thyme",
    "word_count": 309,
    "summarised_body": "",
    "named_entities": {
      "PERSON": [
        "Phillip K Allen/HOU",
        "Tim Belden                           06/11/2000",
        "Phillip K Allen/HOU"
      ],
      "ORG": [
        "ECT",
        "CAISO",
        "CEMMS",
        "CAISO",
        "MW",
        "MW",
        "MW",
        "CAISO"
      ],
      "TIME": [
        "10:55 AM",
        "07:26 PM"
      ],
      "DATE": [
        "July 1999"
      ],
      "GPE": [
        "california"
      ],
      "CARDINAL": [
        "1500",
        "1200",
        "300",
        "300"
      ]
    },
    "phone_numbers": []
  },
  {
    "sender_full_name": "Phillip K Allen",
    "reciever_full_name": "Jeff Richter, Tim Belden",
    "sender_first_name": "Phillip",
    "sender_last_name": "Allen",
    "reciever_first_name": "Jeff",
    "reciever_last_name": "Belden",
    "sender_email": "phillip.allen@enron.com",
    "reciever_email": "jeff.richter@enron.com, tim.belden@enron.com",
    "sender_org": "enron",
    "reciever_org": "enron.com, tim.belden@enron",
    "subject": "Mime-Version: 1.0",
    "body": "\nCheck out NP Gen & Load.  (aMW)",
    "date": "Thu, 8 Jun 2000 10:17:00 -0700 (PDT)",
    "message_id": "15892545.1075855690631.JavaMail.evans@thyme",
    "word_count": 6,
    "summarised_body": "",
    "named_entities": {
      "ORG": [
        "NP Gen & Load"
      ]
    },
    "phone_numbers": []
  },
  {
    "sender_full_name": "Phillip K Allen",
    "reciever_full_name": "Jeff Richter",
    "sender_first_name": "Phillip",
    "sender_last_name": "Allen",
    "reciever_first_name": "Jeff",
    "reciever_last_name": "Richter",
    "sender_email": "phillip.allen@enron.com",
    "reciever_email": "jeff.richter@enron.com",
    "sender_org": "enron",
    "reciever_org": "enron",
    "subject": "Mime-Version: 1.0",
    "body": "\n---------------------- Forwarded by Phillip K Allen/HOU/ECT on 06/06/2000 \n12:27 PM ---------------------------\n   \n\t\n\t\n\tFrom:  Phillip K Allen                           06/06/2000 10:26 AM\n\t\n\nTo: Robert Badeer/HOU/ECT@ECT\ncc:  \nSubject: \n\nhttp://ecthou-webcl1.nt.ect.enron.com/gas/\n       \nAll the gas reports are under west desk\n\nCall Brian Hoskins for a password\n\n\n\n\n\n\n\n",
    "date": "Tue, 6 Jun 2000 05:27:00 -0700 (PDT)",
    "message_id": "12729421.1075855690654.JavaMail.evans@thyme",
    "word_count": 34,
    "summarised_body": "",
    "named_entities": {
      "PERSON": [
        "Phillip K Allen/HOU",
        "Phillip K Allen                           06/06/2000",
        "Robert Badeer/HOU"
      ],
      "ORG": [
        "ECT"
      ],
      "TIME": [
        "12:27 PM",
        "10:26 AM"
      ]
    },
    "phone_numbers": []
  },
  {
    "sender_full_name": "Phillip K Allen",
    "reciever_full_name": "Jeff Richter",
    "sender_first_name": "Phillip",
    "sender_last_name": "Allen",
    "reciever_first_name": "Jeff",
    "reciever_last_name": "Richter",
    "sender_email": "phillip.allen@enron.com",
    "reciever_email": "jeff.richter@enron.com",
    "sender_org": "enron",
    "reciever_org": "enron",
    "subject": "Mime-Version: 1.0",
    "body": "\n---------------------- Forwarded by Phillip K Allen/HOU/ECT on 06/06/2000 \n12:26 PM ---------------------------\n   \n\t\n\t\n\tFrom:  Phillip K Allen                           06/06/2000 10:26 AM\n\t\n\nTo: Robert Badeer/HOU/ECT@ECT\ncc:  \nSubject: \n\nhttp://ecthou-webcl1.nt.ect.enron.com/gas/\n       \nAll the gas reports are under west desk\n\nCall Brian Hoskins for a password\n\n\n\n\n\n\n\n",
    "date": "Tue, 6 Jun 2000 05:27:00 -0700 (PDT)",
    "message_id": "322515.1075855690675.JavaMail.evans@thyme",
    "word_count": 34,
    "summarised_body": "",
    "named_entities": {
      "PERSON": [
        "Phillip K Allen/HOU",
        "Phillip K Allen                           06/06/2000",
        "Robert Badeer/HOU"
      ],
      "ORG": [
        "ECT"
      ],
      "TIME": [
        "06/06/2000 \n12:26 PM",
        "10:26 AM"
      ]
    },
    "phone_numbers": []
  },
  {
    "sender_full_name": "Phillip K Allen",
    "reciever_full_name": "Robert Badeer",
    "sender_first_name": "Phillip",
    "sender_last_name": "Allen",
    "reciever_first_name": "Robert",
    "reciever_last_name": "Badeer",
    "sender_email": "phillip.allen@enron.com",
    "reciever_email": "robert.badeer@enron.com",
    "sender_org": "enron",
    "reciever_org": "enron",
    "subject": "Mime-Version: 1.0",
    "body": "\nhttp://ecthou-webcl1.nt.ect.enron.com/gas/\n       \nAll the gas reports are under west desk\n\nCall Brian Hoskins for a password\n\n\n\n\n\n",
    "date": "Tue, 6 Jun 2000 05:26:00 -0700 (PDT)",
    "message_id": "18254459.1075855690697.JavaMail.evans@thyme",
    "word_count": 14,
    "summarised_body": "",
    "named_entities": {},
    "phone_numbers": []
  },
  {
    "sender_full_name": "Phillip K Allen",
    "reciever_full_name": "Ned Higgins <Ned Higgins/ENRON@enronXgate@ENRON>",
    "sender_first_name": "Phillip",
    "sender_last_name": "Allen",
    "reciever_first_name": "Ned",
    "reciever_last_name": "enron",
    "sender_email": "phillip.allen@enron.com",
    "reciever_email": "ned.higgins@enron.com",
    "sender_org": "enron",
    "reciever_org": "enron",
    "subject": "Re: Unocal WAHA Storage",
    "body": "\nNed,\n\nRegarding the Waha storage, the west desk does not have a strong need for this storage but we are always willing to show a bid based on the current summer/winter spreads and cycling value.  The following assumptions were made to establish our bid:  5% daily injection capacity, 10% daily withdrawal capacity, 1% fuel (injection only), 0.01/MMBtu variable injection and withdrawal fees.  Also an undiscounted  June 01 to January 02 spread of $0.60 existed at the time of this bid.\n\nBid for a 1 year storage contract beginning June 01 based on above assumptions:  $0.05/ MMBtu/Month ($0.60/Year).  Demand charges only.\n\nI am not sure if this is exactly what you need or not.  Please call or email with comments.\n\nPhillip Allen\n\n",
    "date": "Wed, 25 Apr 2001 18:57:00 -0700 (PDT)",
    "message_id": "12558609.1075855378931.JavaMail.evans@thyme",
    "word_count": 121,
    "summarised_body": "",
    "named_entities": {
      "PERSON": [
        "Waha",
        "Phillip Allen"
      ],
      "DATE": [
        "the current summer/winter",
        "daily",
        "daily",
        "June 01 to January 02",
        "a 1 year",
        "June 01"
      ],
      "PERCENT": [
        "5%",
        "10%",
        "1%"
      ],
      "CARDINAL": [
        "0.01"
      ],
      "MONEY": [
        "0.60",
        "0.05/",
        "0.60"
      ],
      "ORG": [
        "MMBtu/Month"
      ]
    },
    "phone_numbers": []
  },
  {
    "sender_full_name": "Phillip K Allen",
    "reciever_full_name": "Felix Buitron",
    "sender_first_name": "Phillip",
    "sender_last_name": "Allen",
    "reciever_first_name": "Felix",
    "reciever_last_name": "Buitron",
    "sender_email": "phillip.allen@enron.com",
    "reciever_email": "felix.buitron@enron.com",
    "sender_org": "enron",
    "reciever_org": "enron",
    "subject": "Re: Compaq M700 laptop",
    "body": "\nFelix,\n\nNetwork:\n login pallen\n pw ke7davis\n\nNotes:\n pw synergi\n\n\nMy location is 3210B.\n\nPhillip",
    "date": "Mon, 5 Jun 2000 04:59:00 -0700 (PDT)",
    "message_id": "14521042.1075855690718.JavaMail.evans@thyme",
    "word_count": 13,
    "summarised_body": "",
    "named_entities": {
      "CARDINAL": [
        "3210B."
      ],
      "PERSON": [
        "Phillip"
      ]
    },
    "phone_numbers": []
  },
  {
    "sender_full_name": "Phillip K Allen",
    "reciever_full_name": "stagecoachmama@hotmail.com",
    "sender_first_name": "Phillip",
    "sender_last_name": "Allen",
    "reciever_first_name": "hotmail",
    "reciever_last_name": "",
    "sender_email": "phillip.allen@enron.com",
    "reciever_email": "stagecoachmama@hotmail.com",
    "sender_org": "enron",
    "reciever_org": "hotmail",
    "subject": "Mime-Version: 1.0",
    "body": "\nLucy,\n\n Click on this attachment to see the format to record expenses.  You can keep \na log on paper or on the computer.  The computer would be better for sending \nme updates.\n\n  \n\nWhat do you think about being open until noon on Saturday.  This might be \nmore convenient for collecting rent and showing open apartments.\nWe can adjust office hours on another day.\n\nPhillip",
    "date": "Fri, 2 Jun 2000 08:37:00 -0700 (PDT)",
    "message_id": "13776949.1075855690739.JavaMail.evans@thyme",
    "word_count": 64,
    "summarised_body": "",
    "named_entities": {
      "PERSON": [
        "Lucy",
        "Phillip"
      ],
      "TIME": [
        "noon",
        "hours"
      ],
      "DATE": [
        "Saturday",
        "another day"
      ]
    },
    "phone_numbers": []
  },
  {
    "sender_full_name": "Phillip K Allen",
    "reciever_full_name": "\"Jeff Smith\" <jsmith@austintx.com> @ ENRON",
    "sender_first_name": "Phillip",
    "sender_last_name": "Allen",
    "reciever_first_name": "\"Jeff",
    "reciever_last_name": "ENRON",
    "sender_email": "phillip.allen@enron.com",
    "reciever_email": "jsmith@austintx.com",
    "sender_org": "enron",
    "reciever_org": "austintx",
    "subject": "RE: 91 acres",
    "body": "\nJeff,\n\n I will respond to the offer on Monday.  There is a $35 Million expansion \nadding 250 jobs in Burnet.  I am tempted to hold for $3000/acre.  Owner \nfinancing would still work.   Do you have an opinion?\n\nPhillip",
    "date": "Fri, 2 Jun 2000 03:37:00 -0700 (PDT)",
    "message_id": "23616644.1075855690760.JavaMail.evans@thyme",
    "word_count": 39,
    "summarised_body": "",
    "named_entities": {
      "PERSON": [
        "Jeff",
        "Phillip"
      ],
      "DATE": [
        "Monday"
      ],
      "MONEY": [
        "$35 Million",
        "3000"
      ],
      "CARDINAL": [
        "250"
      ],
      "GPE": [
        "Burnet"
      ],
      "ORG": [
        "Owner"
      ]
    },
    "phone_numbers": []
  },
  {
    "sender_full_name": "Phillip K Allen",
    "reciever_full_name": "Al Pollard",
    "sender_first_name": "Phillip",
    "sender_last_name": "Allen",
    "reciever_first_name": "Al",
    "reciever_last_name": "Pollard",
    "sender_email": "phillip.allen@enron.com",
    "reciever_email": "al.pollard@enron.com",
    "sender_org": "enron",
    "reciever_org": "enron",
    "subject": "Re: What's happening?",
    "body": "\nAl,\n\nI was glad to hear from you.  I hope we can put the past behind us.  Sounds \nlike you have been busy.  Congratulations on the new baby.  Judging from your \nemail all is well with you.   That's great.  \n\nWe did have another girl in December, (Evelyn Grace).  Three is it for us.  \nWhat's your target?  The other two are doing well.  Soccer, T-ball, and bike \nriding keeps them busy.  They could use some of Cole's coordination.\n\nMy fitness program is not as intense as yours right now.  I am just on \nmaintenance.  You will be surprised to hear that Hunter is a fanatical \ncyclist.  We have been riding to work twice a week for the last few months.  \nHe never misses, rain or shine.  Sometimes we even hit the trails in Memorial \nPark on Saturdays.   Mountain biking is not as hard as a 50 mile trip on the \nroad.  I would like to dust off my road bike and go for a ride some Saturday.\n\nI would like to hear more about your new job.  Maybe we could grab lunch \nsometime.  \n\nPhillip\n\n",
    "date": "Wed, 31 May 2000 10:01:00 -0700 (PDT)",
    "message_id": "9572632.1075855690782.JavaMail.evans@thyme",
    "word_count": 184,
    "summarised_body": "",
    "named_entities": {
      "DATE": [
        "December",
        "the last few months",
        "Saturdays",
        "Saturday"
      ],
      "PERSON": [
        "Evelyn Grace",
        "Soccer",
        "Hunter"
      ],
      "CARDINAL": [
        "Three",
        "two"
      ],
      "PRODUCT": [
        "Cole"
      ],
      "GPE": [
        "Memorial \nPark"
      ],
      "QUANTITY": [
        "50 mile"
      ]
    },
    "phone_numbers": []
  },
  {
    "sender_full_name": "Phillip K Allen",
    "reciever_full_name": "Jeffrey C Gossett",
    "sender_first_name": "Phillip",
    "sender_last_name": "Allen",
    "reciever_first_name": "Jeffrey",
    "reciever_last_name": "Gossett",
    "sender_email": "phillip.allen@enron.com",
    "reciever_email": "jeffrey.gossett@enron.com",
    "sender_org": "enron",
    "reciever_org": "enron",
    "subject": "Transport p&l",
    "body": "\n---------------------- Forwarded by Phillip K Allen/HOU/ECT on 05/30/2000 \n01:32 PM ---------------------------\n   \n\t\n\t\n\tFrom:  Colleen Sullivan                           05/30/2000 09:18 AM\n\t\n\nTo: Phillip K Allen/HOU/ECT@ECT\ncc:  \nSubject: Transport p&l\n\nPhillip--\nI've noticed one thing on your intra-month transport p&l that looks strange \nto me.  Remember that I do not know the Northwest at all, so this may not be \nan issue, but I'll point it out and let you decide.  Let me know if this is \nO.K. as is, so I'll know to ignore it in the future.  Also, if you want me to \nget with Kim and the Sitara people to change the mapping, let me know and \nI'll take care of it..\n\nOn PG&E NW, it appears that PGEN Kingsgate is mapped to a Malin Citygate \ncurve instead of a Kingsgate curve, resulting in a total transport loss of \n$235,019.   \n(If the mapping were changed, it should just reallocate p&l--not change your \noverall p&l.)  Maybe there is a reason for this mapping or maybe it affects \nsomething else somewhere that I am not seeing, but anyway, here are the Deal \n#'s, paths and p&l impacts of each.\n  139195  From Kingsgate to Malin     ($182,030)\n  139196 From Kingsgate to PGEN/Tuscarora   ($    4,024)\n  139197  From Kingsgate to PGEN Malin    ($    8,271)\n  231321  From Kingsgate to Malin     ($  38,705)\n  153771 From Kingsgate to Stanfield    ($     1,988)\n Suggested fix:  Change PGEN Kingsgate mapping from GDP-Malin Citygate to \nGDP-Kingsgate.\n\n Clay Basin storage--this is really a FYI more than anything else--I see five \ndifferent tickets in Sitara for Clay Basin activity--one appears to be for \nwithdrawals and the other four are injections.  Clay Basin is valued as a \nQuestar curve, which is substantially below NWPL points.  What this means is \nthat any time you are injecting gas, these tickets will show transport \nlosses; each time you are withdrawing, you will show big gains on transport.  \nI'm not sure of the best way to handle this since we don't really have a \nsystematic Sitara way of handling storage deals.  In an ideal world, it seems \nthat you would map it the way you have it today, but during injection times, \nthe transport cost would pass through as storage costs.  Anyway, here's the \ndetail on the tickets just for your info, plus I noticed three days where it \nappears we were both withdrawing and injecting from Clay Basin.  There may be \nan operational reason why this occurred that I'm not aware of, and the dollar \nimpact is very small, but I thought I'd bring it to your attention just in \ncase there's something you want to do about it.  The columns below show the \nvolumes under each ticket and the p&L associated with each. \n \nDeal #  251327                  159540                   265229         \n106300   201756\nP&L  $29,503                ($15,960)                ($3,199)          \n($2,769)   ($273)\nRec:   Ques/Clay Basin/0184   NWPL/Opal 543  NWPL/Opal   Sumas      NWPL/S of \nGr Rvr\nDel:   NWPL/S of Green River/Clay   Ques/Clay Basin/0852   Ques/Clay \nBasin/0852   Ques/Clay Basin    Ques/Clay Basin\n1        329       8,738\n2     1,500\n3         2,974    11,362\n4         6,741    12,349       1,439\n5       19,052          3,183\n9            333\n13  30,863       2,680\n14  30,451    \n15  35,226    \n16         6,979              235 \n17  17,464     \n18    9,294     \n20  10,796          771\n21  17,930     \n22  10,667     \n23       14,415          9,076\n25  23,934       8,695\n26     3,284     \n27         1,976\n28     1,751     \n29     1,591     \n30  20,242     \n\n\n",
    "date": "Tue, 30 May 2000 06:32:00 -0700 (PDT)",
    "message_id": "27290645.1075855690805.JavaMail.evans@thyme",
    "word_count": 492,
    "summarised_body": "",
    "named_entities": {
      "PERSON": [
        "Phillip K Allen/HOU",
        "Colleen Sullivan                           ",
        "Phillip K Allen/HOU",
        "O.K.",
        "Kim",
        "Sitara",
        "PGEN Kingsgate",
        "Malin Citygate",
        "Kingsgate",
        "Kingsgate",
        "Kingsgate",
        "Kingsgate",
        "Kingsgate",
        "Kingsgate",
        "Clay Basin",
        "Sitara"
      ],
      "ORG": [
        "ECT",
        "PG&E NW",
        "Stanfield    ",
        "FYI",
        "Questar",
        "NWPL",
        "P&L",
        "NWPL/S",
        "Ques/Clay Basin    Ques/Clay Basin"
      ],
      "TIME": [
        "09:18 AM"
      ],
      "CARDINAL": [
        "one",
        "1,988",
        "five",
        "four",
        "201756",
        "543",
        "1",
        "329",
        "8,738",
        "2",
        "1,500",
        "12,349",
        "1,439",
        "5",
        "19,052",
        "3,183",
        "333",
        "13",
        "30,863",
        "2,680",
        "14",
        "35,226",
        "16",
        "6,979",
        "235",
        "17",
        "18",
        "771",
        "21",
        "22",
        "10,667",
        "23",
        "14,415",
        "9,076\n25",
        "23,934",
        "8,695",
        "26",
        "3,284",
        "1,976",
        "28",
        "1,751     \n29",
        "1,591",
        "20,242"
      ],
      "DATE": [
        "intra-month",
        "139196",
        "139197",
        "153771",
        "today",
        "three days",
        "159540                   265229         \n106300   "
      ],
      "MONEY": [
        "235,019",
        "182,030",
        "$    4,024",
        "$    8,271",
        "$  38,705",
        "29,503",
        "15,960",
        "3,199",
        "2,769",
        "273"
      ],
      "GPE": [
        "Malin",
        "Malin",
        "Anyway"
      ],
      "LOC": [
        "Clay Basin",
        "Sitara",
        "Clay Basin",
        "Clay Basin"
      ],
      "WORK_OF_ART": [
        "Ques/Clay",
        "NWPL/"
      ],
      "QUANTITY": [
        "9,294     \n20  "
      ]
    },
    "phone_numbers": []
  },
  {
    "sender_full_name": "Phillip K Allen",
    "reciever_full_name": "\"mary richards\" <maryrichards7@hotmail.com> @ ENRON",
    "sender_first_name": "Phillip",
    "sender_last_name": "Allen",
    "reciever_first_name": "\"mary",
    "reciever_last_name": "ENRON",
    "sender_email": "phillip.allen@enron.com",
    "reciever_email": "maryrichards7@hotmail.com",
    "sender_org": "enron",
    "reciever_org": "hotmail",
    "subject": "Re: balance on truck/loan",
    "body": "\nMary,\n\nIf we add both balances together the total is $1,140.  I can spread it over 6 \nor 12 months.  6 month payout would be $190/month.  \n12 month payout would be $95/month.  Your choice.  I would like it if you \ncould work 5/hrs each Friday for another month or so.  Does $10/hr sound \nfair?  We can apply it to the loan.\n\nPhillip",
    "date": "Fri, 26 May 2000 07:19:00 -0700 (PDT)",
    "message_id": "18351800.1075855690826.JavaMail.evans@thyme",
    "word_count": 65,
    "summarised_body": "",
    "named_entities": {
      "PERSON": [
        "Mary",
        "Phillip"
      ],
      "MONEY": [
        "1,140",
        "190",
        "95",
        "10"
      ],
      "CARDINAL": [
        "6"
      ],
      "DATE": [
        "12 months",
        "6 month",
        "12 month",
        "5",
        "Friday",
        "another month or so"
      ]
    },
    "phone_numbers": []
  },
  {
    "sender_full_name": "Phillip K Allen",
    "reciever_full_name": "Hunter S Shively",
    "sender_first_name": "Phillip",
    "sender_last_name": "Allen",
    "reciever_first_name": "Hunter",
    "reciever_last_name": "Shively",
    "sender_email": "phillip.allen@enron.com",
    "reciever_email": "hunter.shively@enron.com",
    "sender_org": "enron",
    "reciever_org": "enron",
    "subject": "Mime-Version: 1.0",
    "body": "\naddress:    http://ectpdx-sunone.ect.enron.com/~ctatham/navsetup/index.htm\n\n\nid:   pallen\npassword:  westgasx",
    "date": "Fri, 26 May 2000 06:10:00 -0700 (PDT)",
    "message_id": "6374041.1075855690847.JavaMail.evans@thyme",
    "word_count": 6,
    "summarised_body": "",
    "named_entities": {},
    "phone_numbers": []
  },
  {
    "sender_full_name": "Phillip K Allen",
    "reciever_full_name": "\"Lucy Gonzalez\" <stagecoachmama@hotmail.com> @ ENRON",
    "sender_first_name": "Phillip",
    "sender_last_name": "Allen",
    "reciever_first_name": "\"Lucy",
    "reciever_last_name": "ENRON",
    "sender_email": "phillip.allen@enron.com",
    "reciever_email": "stagecoachmama@hotmail.com",
    "sender_org": "enron",
    "reciever_org": "hotmail",
    "subject": "Re: Todays update",
    "body": "\nLucy,\n I am going to be in Seguin this Saturday through Monday.  We can talk about \na unit for Wade then.  I will call the bank again today to resolve \nauthorization on the account.  Lets keep the office open until noon on \nMemorial day.\n\nPhilllip",
    "date": "Fri, 26 May 2000 00:08:00 -0700 (PDT)",
    "message_id": "22766758.1075855690869.JavaMail.evans@thyme",
    "word_count": 45,
    "summarised_body": "",
    "named_entities": {
      "PERSON": [
        "Lucy",
        "Wade",
        "Philllip"
      ],
      "ORG": [
        "Seguin"
      ],
      "DATE": [
        "this Saturday through Monday",
        "today"
      ],
      "TIME": [
        "noon"
      ]
    },
    "phone_numbers": []
  },
  {
    "sender_full_name": "Phillip K Allen",
    "reciever_full_name": "stagecoachmama@hotmail.com",
    "sender_first_name": "Phillip",
    "sender_last_name": "Allen",
    "reciever_first_name": "hotmail",
    "reciever_last_name": "",
    "sender_email": "phillip.allen@enron.com",
    "reciever_email": "stagecoachmama@hotmail.com",
    "sender_org": "enron",
    "reciever_org": "hotmail",
    "subject": "Mime-Version: 1.0",
    "body": "\nLucy,\n\n Did you get set up on the checking account?  Try and email me every day with \na note about what happened that day.\n Just info about new vacancies or tenants and which apartments you and wade \nworked on each day.  \n\nPhillip",
    "date": "Wed, 24 May 2000 09:00:00 -0700 (PDT)",
    "message_id": "19715626.1075855690890.JavaMail.evans@thyme",
    "word_count": 42,
    "summarised_body": "",
    "named_entities": {
      "PERSON": [
        "Lucy",
        "Phillip"
      ],
      "DATE": [
        "every day",
        "that day",
        "each day"
      ]
    },
    "phone_numbers": []
  },
  {
    "sender_full_name": "Phillip K Allen",
    "reciever_full_name": "Tara Sweitzer",
    "sender_first_name": "Phillip",
    "sender_last_name": "Allen",
    "reciever_first_name": "Tara",
    "reciever_last_name": "Sweitzer",
    "sender_email": "phillip.allen@enron.com",
    "reciever_email": "tara.sweitzer@enron.com",
    "sender_org": "enron",
    "reciever_org": "enron",
    "subject": "Mime-Version: 1.0",
    "body": "\nThis note is authorization to make the following changes:\n\n1.  Set up a new book for Frank Ermis-NW Basis\n\n2.  Route these products to NW Basis:\n NWPL RkyMtn\n Malin\n PG&E Citygate\n\n3. Route EPNG Permian to Todd Richardson's book FT-New Texas\n\n\nCall with questions. X37041\n\nThank you,\n\nPhillip Allen",
    "date": "Tue, 23 May 2000 07:32:00 -0700 (PDT)",
    "message_id": "10517689.1075855690911.JavaMail.evans@thyme",
    "word_count": 50,
    "summarised_body": "",
    "named_entities": {
      "CARDINAL": [
        "1",
        "2",
        "3"
      ],
      "PERSON": [
        "Frank Ermis-NW Basis",
        "Todd Richardson's",
        "Phillip Allen"
      ],
      "ORG": [
        "Route"
      ],
      "PRODUCT": [
        "NWPL"
      ]
    },
    "phone_numbers": []
  },
  {
    "sender_full_name": "Phillip K Allen",
    "reciever_full_name": "John J Lavorato <John J Lavorato/Corp/Enron@ECT>",
    "sender_first_name": "Phillip",
    "sender_last_name": "Allen",
    "reciever_first_name": "John",
    "reciever_last_name": "enron",
    "sender_email": "phillip.allen@enron.com",
    "reciever_email": "john.lavorato@enron.com",
    "sender_org": "enron",
    "reciever_org": "enron",
    "subject": "Re: This morning's Commission meeting delayed",
    "body": "\n\n---------------------- Forwarded by Phillip K Allen/HOU/ECT on 04/25/2001 01:51 PM ---------------------------\n\n\nRay Alvarez@ENRON\n04/25/2001 11:48 AM\nTo:\tPhillip K Allen/HOU/ECT@ECT\ncc:\t \nSubject:\tRe: This morning's Commission meeting delayed   \n\nPhil,  I suspect that discussions/negotiations are taking place behind closed doors \"in smoke filled rooms\", if not directly between Commissioners then among FERC staffers.  Never say never, but I think it is highly unlikely that the final order will contain a fixed price cap.  I base this belief in large part on what I heard at a luncheon I attended yesterday afternoon at which the keynote speaker was FERC Chairman Curt Hebert.  Although the Chairman began his presentation by expressly stating that he would not comment or answer questions on pending proceedings before the Commission, Hebert had some enlightening comments which relate to price caps:\n\nPrice caps are almost never the right answer\nPrice Caps will have the effect of prolonging shortages\nCompetitive choices for consumers is the right answer\nAny solution, however short term, that does not increase supply or reduce demand, is not acceptable\nEight out of eleven western Governors oppose price caps, in that they would export California's problems to the West\n\nThis is the latest intelligence I have on the matter, and it's a pretty strong anti- price cap position.  Of course, Hebert is just one Commissioner out of 3 currently on the Commission, but he controls the meeting agenda and if the draft order is not to his liking, the item could be bumped off the agenda.  Hope this info helps.  Ray\n\n\n\n\nPhillip K Allen@ECT\n04/25/2001 02:28 PM\nTo:\tRay Alvarez/NA/Enron@ENRON\ncc:\t \n\nSubject:\tRe: This morning's Commission meeting delayed   \n\nAre there behind closed doors discussions being held prior to the meeting?  Is there the potential for a surprise announcement of some sort of fixed price gas or power cap once the open meeting finally happens?\n\n\n\n\n\n\n<Embedded StdOleLink",
    "date": "Wed, 25 Apr 2001 16:52:00 -0700 (PDT)",
    "message_id": "15164543.1075855378954.JavaMail.evans@thyme",
    "word_count": 304,
    "summarised_body": "",
    "named_entities": {
      "PERSON": [
        "Phillip K Allen/HOU",
        "Ray",
        "Phillip K Allen/HOU",
        "Subject",
        "Phil",
        "Curt Hebert",
        "Hebert",
        "Hebert",
        "Ray\n\n\n\n\nPhillip K Allen@ECT\n",
        "Ray Alvarez/"
      ],
      "ORG": [
        "ECT",
        "FERC",
        "FERC",
        "Commission",
        "Price Caps",
        "Commission"
      ],
      "TIME": [
        "01:51 PM",
        "11:48 AM",
        "morning",
        "afternoon",
        "02:28 PM",
        "morning"
      ],
      "DATE": [
        "yesterday"
      ],
      "CARDINAL": [
        "Eight",
        "eleven",
        "one",
        "3"
      ],
      "GPE": [
        "California"
      ]
    },
    "phone_numbers": []
  },
  {
    "sender_full_name": "Phillip K Allen",
    "reciever_full_name": "Matthew Lenhart, Jane M Tholt, Steven P South, Tori Kuykendall, Frank Ermis",
    "sender_first_name": "Phillip",
    "sender_last_name": "Allen",
    "reciever_first_name": "Matthew",
    "reciever_last_name": "Ermis",
    "sender_email": "phillip.allen@enron.com",
    "reciever_email": "matthew.lenhart@enron.com, jane.tholt@enron.com, steven.south@enron.com, ",
    "sender_org": "enron",
    "reciever_org": "enron.com, jane.tholt@enron.com, steven.south@enron",
    "subject": "Gas Transportation Market Intelligence",
    "body": "\n---------------------- Forwarded by Phillip K Allen/HOU/ECT on 05/22/2000 \n11:43 AM ---------------------------\n\n\n\"CapacityCenter.com\" <marketing@capacitycenter.com",
    "date": "Mon, 22 May 2000 04:44:00 -0700 (PDT)",
    "message_id": "6057369.1075855690933.JavaMail.evans@thyme",
    "word_count": 9,
    "summarised_body": "",
    "named_entities": {
      "PERSON": [
        "Phillip K Allen/HOU"
      ],
      "ORG": [
        "ECT"
      ],
      "TIME": [
        "11:43 AM"
      ]
    },
    "phone_numbers": []
  },
  {
    "sender_full_name": "Phillip K Allen",
    "reciever_full_name": "\"Jeff Smith\" <jsmith@austintx.com> @ ENRON",
    "sender_first_name": "Phillip",
    "sender_last_name": "Allen",
    "reciever_first_name": "\"Jeff",
    "reciever_last_name": "ENRON",
    "sender_email": "phillip.allen@enron.com",
    "reciever_email": "jsmith@austintx.com",
    "sender_org": "enron",
    "reciever_org": "austintx",
    "subject": "Re: 91 acres",
    "body": "\nJeff,\n\n I would consider owner financing depending on:\n\n  Established developer/individual/general credit risk\n\n  What are they going to do with the land\n\n  Rate/Term/Downpayment 25%\n \n Let me know.\n\nPhillip\n ",
    "date": "Fri, 19 May 2000 03:53:00 -0700 (PDT)",
    "message_id": "2059657.1075855690955.JavaMail.evans@thyme",
    "word_count": 31,
    "summarised_body": "",
    "named_entities": {
      "PERSON": [
        "Jeff",
        "Phillip\n "
      ],
      "ORG": [
        "Rate/Term/Downpayment"
      ],
      "PERCENT": [
        "25%"
      ]
    },
    "phone_numbers": []
  },
  {
    "sender_full_name": "Phillip K Allen",
    "reciever_full_name": "Tim Belden",
    "sender_first_name": "Phillip",
    "sender_last_name": "Allen",
    "reciever_first_name": "Tim",
    "reciever_last_name": "Belden",
    "sender_email": "phillip.allen@enron.com",
    "reciever_email": "tim.belden@enron.com",
    "sender_org": "enron",
    "reciever_org": "enron",
    "subject": "Large Deal Alert",
    "body": "\n---------------------- Forwarded by Phillip K Allen/HOU/ECT on 05/19/2000 \n10:46 AM ---------------------------\n   \n\t\n\t\n\tFrom:  Jeffrey A Shankman                           05/18/2000 06:27 PM\n\t\n\nTo: Phillip K Allen/HOU/ECT@ECT, Keith Holst/HOU/ECT@ect, Mike \nGrigsby/HOU/ECT@ECT\ncc:  \nSubject: Large Deal Alert\n\n\n---------------------- Forwarded by Jeffrey A Shankman/HOU/ECT on 05/18/2000 \n08:23 PM ---------------------------\n\n\nBruce Sukaly@ENRON\n05/18/2000 08:20 AM\nTo: John Arnold/HOU/ECT@ECT, Mike Maggi/Corp/Enron@Enron, Jeffrey A \nShankman/HOU/ECT@ECT\ncc:  \nSubject: Large Deal Alert\n\nTo make a long story short.\n\nWilliams is long 4000MW of tolling in SP15 (SoCal )  for 20 years (I know I \ndid the deal)\non Tuesday afternoon, Williams sold 1000 MW to Merrill Lynch for the \nremaining life (now 18 years)\n\nMerrill is short fixed price gas at So Cal border  up to 250,000MMBtu a day \nand long SP15 power (1000 MW) a day.\n\nheat rate 10,500  SoCal Border plus $0.50.\n\nI'm not sure if MRL has just brokered this deal or is warehousing it.\n\nFor what its worth........\n\n\n",
    "date": "Fri, 19 May 2000 03:46:00 -0700 (PDT)",
    "message_id": "22039237.1075855690977.JavaMail.evans@thyme",
    "word_count": 143,
    "summarised_body": "",
    "named_entities": {
      "PERSON": [
        "Phillip K Allen/HOU",
        "Jeffrey A Shankman                           ",
        "Phillip K Allen/HOU",
        "Keith Holst/HOU",
        "Mike \nGrigsby/HOU",
        "Jeffrey A Shankman/HOU",
        "John Arnold/HOU/ECT@ECT",
        "Mike Maggi/Corp/Enron@Enron",
        "Jeffrey A \n",
        "Williams",
        "SoCal",
        "Williams",
        "Cal",
        "SoCal Border"
      ],
      "ORG": [
        "ECT",
        "ECT",
        "MW",
        "Merrill Lynch",
        "Merrill",
        "MW",
        "MRL"
      ],
      "TIME": [
        "05/19/2000 \n10:46 AM",
        "06:27 PM",
        "08:23 PM",
        "08:20 AM",
        "afternoon"
      ],
      "NORP": [
        "Bruce"
      ],
      "LAW": [
        "Shankman/HOU/ECT@ECT"
      ],
      "CARDINAL": [
        "4000MW",
        "1000",
        "250,000MMBtu",
        "10,500"
      ],
      "DATE": [
        "20 years",
        "Tuesday",
        "18 years"
      ],
      "MONEY": [
        "0.50"
      ]
    },
    "phone_numbers": []
  },
  {
    "sender_full_name": "Phillip K Allen",
    "reciever_full_name": "Dawn C Kenne",
    "sender_first_name": "Phillip",
    "sender_last_name": "Allen",
    "reciever_first_name": "Dawn",
    "reciever_last_name": "Kenne",
    "sender_email": "phillip.allen@enron.com",
    "reciever_email": "dawn.kenne@enron.com",
    "sender_org": "enron",
    "reciever_org": "enron",
    "subject": "Re: 5/08/00",
    "body": "\nDawn,\n\nI received your email with p&l's.  Please continue to send them daily.\n\nThank you,\nPhillip",
    "date": "Thu, 11 May 2000 01:16:00 -0700 (PDT)",
    "message_id": "6082108.1075855691000.JavaMail.evans@thyme",
    "word_count": 15,
    "summarised_body": "",
    "named_entities": {
      "ORG": [
        "p&l"
      ],
      "DATE": [
        "daily"
      ],
      "PERSON": [
        "Phillip"
      ]
    },
    "phone_numbers": []
  },
  {
    "sender_full_name": "Phillip K Allen",
    "reciever_full_name": "Circuit Provisioning@ENRON",
    "sender_first_name": "Phillip",
    "sender_last_name": "Allen",
    "reciever_first_name": "Circuit",
    "reciever_last_name": null,
    "sender_email": "phillip.allen@enron.com",
    "reciever_email": "Circuit Provisioning@ENRON",
    "sender_org": "enron",
    "reciever_org": null,
    "subject": "Re: DSL- Installs",
    "body": "\nNo one will be home on 5/11/00 to meet DSL installers.  Need to reschedule to \nthe following week.  Also, my PC at home has Windows 95.  Is this a problem? \n\nCall with questions. X37041.\n\nThank you,\n\nPhillip Allen",
    "date": "Mon, 1 May 2000 03:56:00 -0700 (PDT)",
    "message_id": "15201149.1075855691021.JavaMail.evans@thyme",
    "word_count": 37,
    "summarised_body": "",
    "named_entities": {
      "CARDINAL": [
        "5/11/00"
      ],
      "DATE": [
        "the following week"
      ],
      "PRODUCT": [
        "Windows 95"
      ],
      "PERSON": [
        "Phillip Allen"
      ]
    },
    "phone_numbers": []
  },
  {
    "sender_full_name": "Phillip K Allen",
    "reciever_full_name": "Kenneth Shulklapper",
    "sender_first_name": "Phillip",
    "sender_last_name": "Allen",
    "reciever_first_name": "Kenneth",
    "reciever_last_name": "Shulklapper",
    "sender_email": "phillip.allen@enron.com",
    "reciever_email": "kenneth.shulklapper@enron.com",
    "sender_org": "enron",
    "reciever_org": "enron",
    "subject": "Re: SW Gas",
    "body": "\n---------------------- Forwarded by Phillip K Allen/HOU/ECT on 04/28/2000 \n09:02 AM ---------------------------\n\n\nLaird Dyer\n04/27/2000 01:17 PM\nTo: Phillip K Allen/HOU/ECT@ECT\ncc: Christopher F Calger/PDX/ECT@ECT, Michael McDonald/SF/ECT@ECT \nSubject: Re: SW Gas  \n\nMike McDonald and I met with SW Gas this morning.  They were polite regarding \nasset management and procurement function outsourcing and are willing to \nlisten to a proposal.  However, they are very interested in weather hedges to \nprotect throughput related earnings.  We are pursuing a confidentiality \nagreement with them to facilitate the sharing of information that will enable \nus to develop proposals.  Our pitch was based upon enhancing shareholder \nvalue by outsourcing a non-profit and costly function (procurement) and by \nreducing the volatility of their earnings by managing throughput via a \nweather product.\n\nAs to your other question.  We have yet to identify or pursue other \ncandidates; however, Mike McDonald and I are developing a coverage strategy \nto ensure that we meet with all potential entities and investigate our \nopportunities.  We met with 8 entities this week (7 Municipals and SWG) as we \nimplement our strategy in California.\n\nAre there any entities that you think would be interested in an asset \nmanagement deal that we should approach?  Otherwise, we intend to \nsystematically identify and work through all the candidates. \n\nLaird\n",
    "date": "Fri, 28 Apr 2000 02:05:00 -0700 (PDT)",
    "message_id": "2266376.1075855691044.JavaMail.evans@thyme",
    "word_count": 210,
    "summarised_body": "",
    "named_entities": {
      "PERSON": [
        "Phillip K Allen/HOU",
        "Laird Dyer\n04/27/2000",
        "Phillip K Allen/HOU",
        "Christopher F Calger/PDX/ECT@ECT",
        "Michael McDonald/SF/ECT@ECT",
        "Mike McDonald",
        "Mike McDonald",
        "Laird"
      ],
      "ORG": [
        "ECT",
        "SW Gas"
      ],
      "TIME": [
        "09:02 AM",
        "01:17 PM",
        "this morning"
      ],
      "CARDINAL": [
        "8"
      ],
      "DATE": [
        "this week"
      ],
      "GPE": [
        "California"
      ]
    },
    "phone_numbers": []
  },
  {
    "sender_full_name": "Phillip K Allen",
    "reciever_full_name": "Laird Dyer",
    "sender_first_name": "Phillip",
    "sender_last_name": "Allen",
    "reciever_first_name": "Laird",
    "reciever_last_name": "Dyer",
    "sender_email": "phillip.allen@enron.com",
    "reciever_email": "laird.dyer@enron.com",
    "sender_org": "enron",
    "reciever_org": "enron",
    "subject": "SW Gas",
    "body": "\nLaird,\n\n Did you meet with SWG on April 27th.  Are there any other asset management \ntargets in the west?\n\n\n---------------------- Forwarded by Phillip K Allen/HOU/ECT on 04/27/2000 \n01:53 PM ---------------------------\n\n\nJane M Tholt\n04/12/2000 08:45 AM\nTo: Phillip K Allen/HOU/ECT@ECT\ncc:  \nSubject: SW Gas\n\n\n---------------------- Forwarded by Jane M Tholt/HOU/ECT on 04/12/2000 10:45 \nAM ---------------------------\n\n\nLaird Dyer\n04/12/2000 08:17 AM\nTo: Jane M Tholt/HOU/ECT@ECT\ncc:  \nSubject: SW Gas\n\nJanie,\n\nThanks for the fax on SW Gas.\n\nWe are meeting with Larry Black, Bob Armstrong & Ed Zub on April 27th to \ndiscuss asset management.  In preparation for that meeting we would like to \ngain an understanding of the nature of our business relationship with SW.  \nCould you, in general terms, describe our sales activities with SW.  What are \ntypical quantities and term on sales?  Are there any services we provide?  \nHow much pipeline capacity do we buy or sell to them?  Who are your main \ncontacts at SW Gas?\n\nWe will propose to provide a full requirements supply to SW involving our \ncontrol of their assets.  For this to be attractive to SW, we will probably \nhave to take on their regulatory risk on gas purchase disallowance with the \ncommissions.  This will be difficult as there is no clear mandate from their \ncommissions as to what an acceptable portfolio (fixed, indexed, collars....) \nshould look like.  Offering them a guaranteed discount to the 1st of month \nindex may not be attractive unless we accept their regulatory risk.  That \nrisk may not be acceptable to the desk.  I will do some investigation of \ntheir PGA's and see if there is an opportunity.\n\nAs to the asset management:  do you have any preference on structure?  Are \nthere elements that you would like to see?  Any ideas at all would be greatly \nappreciated.\n\nThanks,\n\nLaird\n\n\n",
    "date": "Thu, 27 Apr 2000 06:55:00 -0700 (PDT)",
    "message_id": "6710846.1075855691065.JavaMail.evans@thyme",
    "word_count": 294,
    "summarised_body": "",
    "named_entities": {
      "PERSON": [
        "Laird",
        "Phillip K Allen/HOU",
        "Jane M Tholt",
        "Phillip K Allen/HOU",
        "Jane M Tholt",
        "Laird Dyer\n04/12/2000",
        "Jane M Tholt",
        "Janie",
        "Larry Black",
        "Bob Armstrong & Ed Zub",
        "Laird"
      ],
      "DATE": [
        "April 27th",
        "April 27th",
        "the 1st of month"
      ],
      "ORG": [
        "ECT",
        "ECT",
        "SW Gas",
        "SW",
        "SW Gas",
        "PGA"
      ],
      "TIME": [
        "01:53 PM",
        "08:45 AM",
        "08:17 AM"
      ],
      "LAW": [
        "04/12/2000 10:45 \nAM"
      ],
      "GPE": [
        "SW",
        "SW",
        "Offering"
      ],
      "NORP": [
        "SW"
      ]
    },
    "phone_numbers": []
  },
  {
    "sender_full_name": "Phillip K Allen",
    "reciever_full_name": "hargr@webtv.net (Neal Hargrove) @ ENRON",
    "sender_first_name": "Phillip",
    "sender_last_name": "Allen",
    "reciever_first_name": null,
    "reciever_last_name": "ENRON",
    "sender_email": "phillip.allen@enron.com",
    "reciever_email": "hargr@webtv.net",
    "sender_org": "enron",
    "reciever_org": null,
    "subject": "Re: #30",
    "body": "\nKay & Neal,\n\nThanks for remembering my birthday.  You beat my parents by one day.  \n\nThe family is doing fine.  Grace is really smiling.  She is a very happy baby \nas long as she is being held.\n\nIt sounds like your house is coming along fast.  I think my folks are ready \nto start building.  \n\nWe will probably visit in late June or July.  May is busy.  We are taking the \nkids to Disney for their birthdays.\n\nGood luck on the house.\n\nKeith",
    "date": "Thu, 27 Apr 2000 06:40:00 -0700 (PDT)",
    "message_id": "12747549.1075855691087.JavaMail.evans@thyme",
    "word_count": 82,
    "summarised_body": "",
    "named_entities": {
      "ORG": [
        "Kay & Neal",
        "Disney"
      ],
      "DATE": [
        "one day",
        "late June or",
        "July",
        "May"
      ],
      "PERSON": [
        "Grace",
        "Keith"
      ]
    },
    "phone_numbers": []
  },
  {
    "sender_full_name": "Phillip K Allen",
    "reciever_full_name": "Ina Rangel",
    "sender_first_name": "Phillip",
    "sender_last_name": "Allen",
    "reciever_first_name": "Ina",
    "reciever_last_name": "Rangel",
    "sender_email": "phillip.allen@enron.com",
    "reciever_email": "ina.rangel@enron.com",
    "sender_org": "enron",
    "reciever_org": "enron",
    "subject": "Western Strategy Session Materials",
    "body": "\n---------------------- Forwarded by Phillip K Allen/HOU/ECT on 04/26/2000 \n08:40 AM ---------------------------\n\n\nTIM HEIZENRADER\n04/25/2000 11:43 AM\nTo: Jim Fallon/HOU/ECT@ECT, Phillip K Allen/HOU/ECT@ECT\ncc: Tim Belden/HOU/ECT@ECT \nSubject: Western Strategy Session Materials\n\nToday's charts are attached: \n",
    "date": "Wed, 26 Apr 2000 01:42:00 -0700 (PDT)",
    "message_id": "3015963.1075855691108.JavaMail.evans@thyme",
    "word_count": 33,
    "summarised_body": "",
    "named_entities": {
      "PERSON": [
        "Phillip K Allen/HOU",
        "TIM HEIZENRADER\n04/25/2000",
        "Jim Fallon/HOU",
        "Phillip K Allen/HOU",
        "Tim Belden/HOU"
      ],
      "ORG": [
        "ECT"
      ],
      "TIME": [
        "04/26/2000 \n08:40 AM"
      ],
      "DATE": [
        "Today"
      ]
    },
    "phone_numbers": []
  },
  {
    "sender_full_name": "Phillip K Allen",
    "reciever_full_name": "Hector Campos",
    "sender_first_name": "Phillip",
    "sender_last_name": "Allen",
    "reciever_first_name": "Hector",
    "reciever_last_name": "Campos",
    "sender_email": "phillip.allen@enron.com",
    "reciever_email": "hector.campos@enron.com",
    "sender_org": "enron",
    "reciever_org": "enron",
    "subject": "Western Strategy Session Materials",
    "body": "\n---------------------- Forwarded by Phillip K Allen/HOU/ECT on 04/26/2000 \n08:36 AM ---------------------------\n\n\nTIM HEIZENRADER\n04/25/2000 11:43 AM\nTo: Jim Fallon/HOU/ECT@ECT, Phillip K Allen/HOU/ECT@ECT\ncc: Tim Belden/HOU/ECT@ECT \nSubject: Western Strategy Session Materials\n\nToday's charts are attached: \n",
    "date": "Wed, 26 Apr 2000 01:38:00 -0700 (PDT)",
    "message_id": "22108874.1075855691129.JavaMail.evans@thyme",
    "word_count": 33,
    "summarised_body": "",
    "named_entities": {
      "PERSON": [
        "Phillip K Allen/HOU",
        "TIM HEIZENRADER\n04/25/2000",
        "Jim Fallon/HOU",
        "Phillip K Allen/HOU",
        "Tim Belden/HOU"
      ],
      "ORG": [
        "ECT"
      ],
      "TIME": [
        "04/26/2000 \n08:36 AM"
      ],
      "DATE": [
        "Today"
      ]
    },
    "phone_numbers": []
  },
  {
    "sender_full_name": "Phillip K Allen",
    "reciever_full_name": "Ray Alvarez <Ray Alvarez/NA/Enron@ENRON>",
    "sender_first_name": "Phillip",
    "sender_last_name": "Allen",
    "reciever_first_name": "Ray",
    "reciever_last_name": "enron",
    "sender_email": "phillip.allen@enron.com",
    "reciever_email": "ray.alvarez@enron.com",
    "sender_org": "enron",
    "reciever_org": "enron",
    "subject": "Re: This morning's Commission meeting delayed",
    "body": "\nAre there behind closed doors discussions being held prior to the meeting?  Is there the potential for a surprise announcement of some sort of fixed price gas or power cap once the open meeting finally happens?",
    "date": "Wed, 25 Apr 2001 16:28:00 -0700 (PDT)",
    "message_id": "24578248.1075855378975.JavaMail.evans@thyme",
    "word_count": 36,
    "summarised_body": "",
    "named_entities": {},
    "phone_numbers": []
  },
  {
    "sender_full_name": "Phillip K Allen",
    "reciever_full_name": "hargr@webtv.net (Neal Hargrove) @ ENRON",
    "sender_first_name": "Phillip",
    "sender_last_name": "Allen",
    "reciever_first_name": null,
    "reciever_last_name": "ENRON",
    "sender_email": "phillip.allen@enron.com",
    "reciever_email": "hargr@webtv.net",
    "sender_org": "enron",
    "reciever_org": null,
    "subject": "Re: #30",
    "body": "\n2000-1969=31",
    "date": "Tue, 25 Apr 2000 05:22:00 -0700 (PDT)",
    "message_id": "2068674.1075855691152.JavaMail.evans@thyme",
    "word_count": 1,
    "summarised_body": "",
    "named_entities": {
      "DATE": [
        "2000-1969=31"
      ]
    },
    "phone_numbers": []
  },
  {
    "sender_full_name": "Phillip K Allen",
    "reciever_full_name": "\"mary richards\" <maryrichards7@hotmail.com> @ ENRON",
    "sender_first_name": "Phillip",
    "sender_last_name": "Allen",
    "reciever_first_name": "\"mary",
    "reciever_last_name": "ENRON",
    "sender_email": "phillip.allen@enron.com",
    "reciever_email": "maryrichards7@hotmail.com",
    "sender_org": "enron",
    "reciever_org": "hotmail",
    "subject": "Re: Foundation leveling on #2 & #3 apts.",
    "body": "\nMary,\n\nI spoke to Gary about the foundation work on #2 & #3.  He agreed that it \nwould be better to just clean up #3 and do whatever he and Wade can do to \n#2.  Then they can just focus on #19.  I worked on the books this weekend but \nI need more time to finish.  I will call you in a day or so.\n\nPhillip",
    "date": "Mon, 24 Apr 2000 00:00:00 -0700 (PDT)",
    "message_id": "5818159.1075855691174.JavaMail.evans@thyme",
    "word_count": 65,
    "summarised_body": "",
    "named_entities": {
      "PERSON": [
        "Mary",
        "Gary",
        "Wade",
        "Phillip"
      ],
      "MONEY": [
        "#2 &",
        "3",
        "3",
        "2",
        "19"
      ],
      "DATE": [
        "this weekend",
        "a day or so"
      ]
    },
    "phone_numbers": []
  },
  {
    "sender_full_name": "Phillip K Allen",
    "reciever_full_name": "David Wile",
    "sender_first_name": "Phillip",
    "sender_last_name": "Allen",
    "reciever_first_name": "David",
    "reciever_last_name": "Wile",
    "sender_email": "phillip.allen@enron.com",
    "reciever_email": "david.wile@enron.com",
    "sender_org": "enron",
    "reciever_org": "enron",
    "subject": "Re: DSL Install",
    "body": "\nHere is my DSL form.\n\n",
    "date": "Thu, 13 Apr 2000 04:41:00 -0700 (PDT)",
    "message_id": "8193489.1075855691195.JavaMail.evans@thyme",
    "word_count": 5,
    "summarised_body": "",
    "named_entities": {},
    "phone_numbers": []
  },
  {
    "sender_full_name": "Phillip K Allen",
    "reciever_full_name": "Suzanne Marshall",
    "sender_first_name": "Phillip",
    "sender_last_name": "Allen",
    "reciever_first_name": "Suzanne",
    "reciever_last_name": "Marshall",
    "sender_email": "phillip.allen@enron.com",
    "reciever_email": "suzanne.marshall@enron.com",
    "sender_org": "enron",
    "reciever_org": "enron",
    "subject": "Re: Payroll Reclasses",
    "body": "\nThanks for your help. My assistant is Ina Rangel.",
    "date": "Thu, 13 Apr 2000 04:04:00 -0700 (PDT)",
    "message_id": "592313.1075855691216.JavaMail.evans@thyme",
    "word_count": 9,
    "summarised_body": "",
    "named_entities": {
      "PERSON": [
        "Ina Rangel"
      ]
    },
    "phone_numbers": []
  },
  {
    "sender_full_name": "Phillip K Allen",
    "reciever_full_name": "Frank Ermis, Steven P South",
    "sender_first_name": "Phillip",
    "sender_last_name": "Allen",
    "reciever_first_name": "Frank",
    "reciever_last_name": "South",
    "sender_email": "phillip.allen@enron.com",
    "reciever_email": "frank.ermis@enron.com, steven.south@enron.com",
    "sender_org": "enron",
    "reciever_org": "enron.com, steven.south@enron",
    "subject": "Alliance netback worksheet",
    "body": "\n---------------------- Forwarded by Phillip K Allen/HOU/ECT on 04/10/2000 \n02:09 PM ---------------------------\n   \n\t\n\t\n\tFrom:  Julie A Gomez                           04/01/2000 07:11 AM\n\t\n\nTo: Hunter S Shively/HOU/ECT@ECT, Phillip K Allen/HOU/ECT@ECT\ncc:  \nSubject: Alliance netback worksheet\n\nHello Men-\n\nI have attached my worksheet in case you want to review the data while I am \non holiday.\n\nThanks,\n\nJulie  :-)\n\n\n",
    "date": "Mon, 10 Apr 2000 07:09:00 -0700 (PDT)",
    "message_id": "22908480.1075855691237.JavaMail.evans@thyme",
    "word_count": 49,
    "summarised_body": "",
    "named_entities": {
      "PERSON": [
        "Phillip K Allen/HOU",
        "Julie A",
        "Hunter S Shively/HOU/ECT@ECT",
        "Phillip K Allen/HOU",
        "Julie"
      ],
      "ORG": [
        "ECT"
      ],
      "TIME": [
        "02:09 PM",
        "07:11 AM"
      ]
    },
    "phone_numbers": []
  },
  {
    "sender_full_name": "Phillip K Allen",
    "reciever_full_name": "Mike Grigsby",
    "sender_first_name": "Phillip",
    "sender_last_name": "Allen",
    "reciever_first_name": "Mike",
    "reciever_last_name": "Grigsby",
    "sender_email": "phillip.allen@enron.com",
    "reciever_email": "mike.grigsby@enron.com",
    "sender_org": "enron",
    "reciever_org": "enron",
    "subject": "Alliance netback worksheet",
    "body": "\n---------------------- Forwarded by Phillip K Allen/HOU/ECT on 04/06/2000 \n12:18 PM ---------------------------\n   \n\t\n\t\n\tFrom:  Julie A Gomez                           04/01/2000 07:11 AM\n\t\n\nTo: Hunter S Shively/HOU/ECT@ECT, Phillip K Allen/HOU/ECT@ECT\ncc:  \nSubject: Alliance netback worksheet\n\nHello Men-\n\nI have attached my worksheet in case you want to review the data while I am \non holiday.\n\nThanks,\n\nJulie  :-)\n\n\n",
    "date": "Thu, 6 Apr 2000 05:18:00 -0700 (PDT)",
    "message_id": "19273922.1075855691259.JavaMail.evans@thyme",
    "word_count": 49,
    "summarised_body": "",
    "named_entities": {
      "PERSON": [
        "Phillip K Allen/HOU",
        "Julie A",
        "Hunter S Shively/HOU/ECT@ECT",
        "Phillip K Allen/HOU",
        "Julie"
      ],
      "ORG": [
        "ECT"
      ],
      "TIME": [
        "12:18 PM",
        "07:11 AM"
      ]
    },
    "phone_numbers": []
  },
  {
    "sender_full_name": "Phillip K Allen",
    "reciever_full_name": "Beth Perlman",
    "sender_first_name": "Phillip",
    "sender_last_name": "Allen",
    "reciever_first_name": "Beth",
    "reciever_last_name": "Perlman",
    "sender_email": "phillip.allen@enron.com",
    "reciever_email": "beth.perlman@enron.com",
    "sender_org": "enron",
    "reciever_org": "enron",
    "subject": "Mime-Version: 1.0",
    "body": "\nBeth,\n\nHere are our addresses for DSL lines:\n\n\nHunter Shively\n10545 Gawain\nHouston, TX 77024\n713 461-4130\n\nPhillip Allen\n8855 Merlin Ct\nHouston, TX 77055\n713 463-8626\n\nMike Grigsby\n6201 Meadow Lake\nHouston, TX 77057\n713 780-1022\n\nThanks\n\nPhillip",
    "date": "Wed, 5 Apr 2000 10:13:00 -0700 (PDT)",
    "message_id": "2330656.1075855691280.JavaMail.evans@thyme",
    "word_count": 42,
    "summarised_body": "",
    "named_entities": {
      "PERSON": [
        "Beth",
        "Hunter Shively",
        "Phillip Allen\n8855",
        "Mike Grigsby",
        "Phillip"
      ],
      "DATE": [
        "10545"
      ],
      "GPE": [
        "Gawain",
        "Houston",
        "Houston"
      ],
      "PERCENT": [
        "713 461-4130"
      ],
      "ORG": [
        "TX",
        "TX"
      ],
      "CARDINAL": [
        "713",
        "713 780-1022"
      ],
      "PRODUCT": [
        "6201 Meadow Lake"
      ]
    },
    "phone_numbers": [
      "024\n713 461-4130",
      "055\n713 463-8626",
      "057\n713 780-1022"
    ]
  },
  {
    "sender_full_name": "Phillip K Allen",
    "reciever_full_name": "\"Jeff Smith\" <jsmith@austintx.com> @ ENRON",
    "sender_first_name": "Phillip",
    "sender_last_name": "Allen",
    "reciever_first_name": "\"Jeff",
    "reciever_last_name": "ENRON",
    "sender_email": "phillip.allen@enron.com",
    "reciever_email": "jsmith@austintx.com",
    "sender_org": "enron",
    "reciever_org": "austintx",
    "subject": "RE: Inspection for Mission South",
    "body": "\nAre we going to inspect tomorrow?",
    "date": "Thu, 30 Mar 2000 01:58:00 -0800 (PST)",
    "message_id": "13313266.1075855691301.JavaMail.evans@thyme",
    "word_count": 6,
    "summarised_body": "",
    "named_entities": {
      "DATE": [
        "tomorrow"
      ]
    },
    "phone_numbers": []
  },
  {
    "sender_full_name": "Phillip K Allen",
    "reciever_full_name": "\"Hargrove, Mac D\" <mac.d.hargrove@rssmb.com> @ ENRON",
    "sender_first_name": "Phillip",
    "sender_last_name": "Allen",
    "reciever_first_name": "\"Hargrove,",
    "reciever_last_name": "ENRON",
    "sender_email": "phillip.allen@enron.com",
    "reciever_email": "mac.d.hargrove@rssmb.com",
    "sender_org": "enron",
    "reciever_org": "rssmb",
    "subject": "Re: your moms birthday",
    "body": "\nmac,\n\nWe will be there on the 9th and I will bring the paperwork.\n\nphillip",
    "date": "Tue, 28 Mar 2000 08:22:00 -0800 (PST)",
    "message_id": "15113129.1075855691323.JavaMail.evans@thyme",
    "word_count": 15,
    "summarised_body": "",
    "named_entities": {
      "ORDINAL": [
        "9th"
      ]
    },
    "phone_numbers": []
  },
  {
    "sender_full_name": "Phillip K Allen",
    "reciever_full_name": "Mac05@flash.net",
    "sender_first_name": "Phillip",
    "sender_last_name": "Allen",
    "reciever_first_name": null,
    "reciever_last_name": "",
    "sender_email": "phillip.allen@enron.com",
    "reciever_email": "mac05@flash.net",
    "sender_org": "enron",
    "reciever_org": null,
    "subject": "Mime-Version: 1.0",
    "body": "\nMac,\n\nI checked into executing my options with Smith Barney.  Bad news.  Enron has \nan agreement with Paine Webber that is exclusive.  Employees don't have the \nchoice of where to exercise.  I still would like to get to the premier \nservice account, but I will have to transfer the money.  \n\nHopefully this will reach you.\n\nPhillip",
    "date": "Tue, 28 Mar 2000 06:33:00 -0800 (PST)",
    "message_id": "32868928.1075855691344.JavaMail.evans@thyme",
    "word_count": 56,
    "summarised_body": "",
    "named_entities": {
      "ORG": [
        "Smith Barney",
        "Enron"
      ],
      "PERSON": [
        "Paine Webber",
        "Phillip"
      ]
    },
    "phone_numbers": []
  },
  {
    "sender_full_name": "Phillip K Allen",
    "reciever_full_name": "gary <gary@creativepanel.com>",
    "sender_first_name": "Phillip",
    "sender_last_name": "Allen",
    "reciever_first_name": "gary",
    "reciever_last_name": "creativepanel",
    "sender_email": "phillip.allen@enron.com",
    "reciever_email": "gary@creativepanel.com",
    "sender_org": "enron",
    "reciever_org": "creativepanel",
    "subject": "Mime-Version: 1.0",
    "body": "\nGary,\n\nHere is a photograph of a similar house.  The dimensions would be 56'Wide X 41' Deep for the living area.  In addition there will be a 6' deep two story porch across the entire back and 30' across the front.  A modification to the front will be the addition of a gable across 25' on the left side.  The living area will be brought forward under this gable to be flush with the front porch.  \n\nI don't have my floor plan with me at work today, but will bring in tomorrow and fax you a copy.\n\nPhillip Allen\n713-853-7041\npallen@enron.com\n\n---------------------- Forwarded by Phillip K Allen/HOU/ECT on 04/25/2001 12:51 PM ---------------------------\n\n\nHunter S Shively\n03/26/2001 10:01 AM\nTo:\tphillip.k.allen@enron.com\ncc:\t \nSubject:\t\n\n \n",
    "date": "Wed, 25 Apr 2001 16:09:00 -0700 (PDT)",
    "message_id": "31563236.1075855378998.JavaMail.evans@thyme",
    "word_count": 117,
    "summarised_body": "",
    "named_entities": {
      "PERSON": [
        "Gary",
        "Phillip Allen\n713-853-7041",
        "Phillip K Allen/HOU",
        "Hunter S",
        "Subject"
      ],
      "CARDINAL": [
        "56'Wide",
        "6",
        "two",
        "30",
        "25"
      ],
      "WORK_OF_ART": [
        "Deep for the living area"
      ],
      "DATE": [
        "today",
        "tomorrow"
      ],
      "ORG": [
        "ECT"
      ],
      "TIME": [
        "12:51 PM",
        "10:01 AM"
      ]
    },
    "phone_numbers": [
      "\n713-853-7041"
    ]
  },
  {
    "sender_full_name": "Phillip K Allen",
    "reciever_full_name": "\"Jeff Smith\" <jsmith@austintx.com>",
    "sender_first_name": "Phillip",
    "sender_last_name": "Allen",
    "reciever_first_name": "\"Jeff",
    "reciever_last_name": "austintx",
    "sender_email": "phillip.allen@enron.com",
    "reciever_email": "jsmith@austintx.com",
    "sender_org": "enron",
    "reciever_org": "austintx",
    "subject": "Re: Inspection for Mission South",
    "body": "\nJeff,\n\nCould we set up an inspection for this Friday at 2:00?\n\nListing for Burnet is in the mail\n\nPhillip",
    "date": "Tue, 28 Mar 2000 06:12:00 -0800 (PST)",
    "message_id": "21460187.1075855691365.JavaMail.evans@thyme",
    "word_count": 19,
    "summarised_body": "",
    "named_entities": {
      "PERSON": [
        "Jeff",
        "Phillip"
      ],
      "DATE": [
        "this Friday"
      ],
      "TIME": [
        "2:00"
      ]
    },
    "phone_numbers": []
  },
  {
    "sender_full_name": "Phillip K Allen",
    "reciever_full_name": "Tara Sweitzer",
    "sender_first_name": "Phillip",
    "sender_last_name": "Allen",
    "reciever_first_name": "Tara",
    "reciever_last_name": "Sweitzer",
    "sender_email": "phillip.allen@enron.com",
    "reciever_email": "tara.sweitzer@enron.com",
    "sender_org": "enron",
    "reciever_org": "enron",
    "subject": "Mime-Version: 1.0",
    "body": "\ntara,\n\nPlease grant access to manage financial products to the following:\n\n Janie Tholt\n Frank Ermis\n Steve South\n Tory Kuykendall\n Matt Lenhart\n Randy Gay\n\nWe are making markets on one day gas daily swaps.  Thank you.\n\nPhillip Allen",
    "date": "Mon, 27 Mar 2000 23:52:00 -0800 (PST)",
    "message_id": "4784801.1075855691386.JavaMail.evans@thyme",
    "word_count": 37,
    "summarised_body": "",
    "named_entities": {
      "ORG": [
        "Janie Tholt\n Frank Ermis\n Steve South\n Tory Kuykendall\n Matt"
      ],
      "PERSON": [
        "Randy Gay",
        "Phillip Allen"
      ],
      "DATE": [
        "one day",
        "daily"
      ]
    },
    "phone_numbers": []
  },
  {
    "sender_full_name": "Phillip K Allen",
    "reciever_full_name": "\"mary richards\" <maryrichards7@hotmail.com> @ ENRON",
    "sender_first_name": "Phillip",
    "sender_last_name": "Allen",
    "reciever_first_name": "\"mary",
    "reciever_last_name": "ENRON",
    "sender_email": "phillip.allen@enron.com",
    "reciever_email": "maryrichards7@hotmail.com",
    "sender_org": "enron",
    "reciever_org": "hotmail",
    "subject": "re: storm results & refrigerators",
    "body": "\nMary,\n\nGo ahead and work with Gary to get a new fridge for #8.  \n\nI am going to try and come down this Saturday.\n\nTalk to you later.\n\nPhillip",
    "date": "Mon, 27 Mar 2000 03:20:00 -0800 (PST)",
    "message_id": "21733998.1075855691407.JavaMail.evans@thyme",
    "word_count": 29,
    "summarised_body": "",
    "named_entities": {
      "PERSON": [
        "Mary",
        "Gary",
        "Phillip"
      ],
      "MONEY": [
        "8"
      ],
      "DATE": [
        "Saturday"
      ]
    },
    "phone_numbers": []
  },
  {
    "sender_full_name": "Phillip K Allen",
    "reciever_full_name": "Keith Holst",
    "sender_first_name": "Phillip",
    "sender_last_name": "Allen",
    "reciever_first_name": "Keith",
    "reciever_last_name": "Holst",
    "sender_email": "phillip.allen@enron.com",
    "reciever_email": "keith.holst@enron.com",
    "sender_org": "enron",
    "reciever_org": "enron",
    "subject": "Western Strategy Briefing Materials",
    "body": "\n---------------------- Forwarded by Phillip K Allen/HOU/ECT on 03/24/2000 \n08:57 AM ---------------------------\n\n\nTim Heizenrader\n03/23/2000 08:09 AM\nTo: James B Fallon/HOU/ECT@ECT, Phillip K Allen/HOU/ECT@ECT\ncc:  \nSubject: Western Strategy Briefing Materials\n\nSlides from this week's strategy session are attached: \n",
    "date": "Fri, 24 Mar 2000 01:00:00 -0800 (PST)",
    "message_id": "9766732.1075855691429.JavaMail.evans@thyme",
    "word_count": 35,
    "summarised_body": "",
    "named_entities": {
      "PERSON": [
        "Phillip K Allen/HOU",
        "Tim Heizenrader\n03/23/2000",
        "James B Fallon/HOU/ECT@ECT",
        "Phillip K Allen/HOU"
      ],
      "ORG": [
        "ECT"
      ],
      "TIME": [
        "08:57 AM",
        "08:09 AM"
      ],
      "DATE": [
        "week"
      ]
    },
    "phone_numbers": []
  },
  {
    "sender_full_name": "Phillip K Allen",
    "reciever_full_name": "Mark Miles",
    "sender_first_name": "Phillip",
    "sender_last_name": "Allen",
    "reciever_first_name": "Mark",
    "reciever_last_name": "Miles",
    "sender_email": "phillip.allen@enron.com",
    "reciever_email": "mark.miles@enron.com",
    "sender_org": "enron",
    "reciever_org": "enron",
    "subject": "Re: MS 150",
    "body": "\nMark,\n\n Thank you for the offer, but I am not doing the ride this year.  \n Good luck.\n\nPhillip",
    "date": "Thu, 23 Mar 2000 01:32:00 -0800 (PST)",
    "message_id": "1197112.1075855691450.JavaMail.evans@thyme",
    "word_count": 18,
    "summarised_body": "",
    "named_entities": {
      "PERSON": [
        "Mark",
        "Good",
        "Phillip"
      ],
      "DATE": [
        "this year"
      ]
    },
    "phone_numbers": []
  },
  {
    "sender_full_name": "Phillip K Allen",
    "reciever_full_name": "Ina Rangel",
    "sender_first_name": "Phillip",
    "sender_last_name": "Allen",
    "reciever_first_name": "Ina",
    "reciever_last_name": "Rangel",
    "sender_email": "phillip.allen@enron.com",
    "reciever_email": "ina.rangel@enron.com",
    "sender_org": "enron",
    "reciever_org": "enron",
    "subject": "Meeting-THURSDAY, MARCH 23 - 11:15 AM",
    "body": "\n---------------------- Forwarded by Phillip K Allen/HOU/ECT on 03/22/2000 \n01:46 PM ---------------------------\n   \n\t\n\t\n\tFrom:  Colleen Sullivan                           03/22/2000 08:42 AM\n\t\n\nTo: Hunter S Shively/HOU/ECT@ECT, Phillip K Allen/HOU/ECT@ECT, Scott \nNeal/HOU/ECT@ECT, Thomas A Martin/HOU/ECT@ECT\ncc: Bhavna Pandya/HOU/ECT@ECT \nSubject: Meeting-THURSDAY, MARCH 23 - 11:15 AM\n\nPlease plan on attending a meeting on Thursday, March 23 at 11:15 am in Room \n3127.  This meeting will be brief.  I would like to take the time to \nintroduce Bhavna Pandya, and get some input from you on various projects she \nwill be assisting us with.  Thank you.\n",
    "date": "Wed, 22 Mar 2000 05:48:00 -0800 (PST)",
    "message_id": "20758726.1075855691471.JavaMail.evans@thyme",
    "word_count": 87,
    "summarised_body": "",
    "named_entities": {
      "PERSON": [
        "Phillip K Allen/HOU",
        "Colleen Sullivan                           ",
        "Hunter S Shively/HOU/ECT@ECT",
        "Phillip K Allen/HOU",
        "Scott \nNeal/HOU/ECT@ECT",
        "Thomas A",
        "Bhavna Pandya"
      ],
      "ORG": [
        "ECT",
        "Martin/HOU/ECT@ECT"
      ],
      "TIME": [
        "01:46 PM",
        "08:42 AM",
        "11:15 am"
      ],
      "DATE": [
        "MARCH 23 - 11:15 AM",
        "Thursday, March 23",
        "3127"
      ]
    },
    "phone_numbers": []
  },
  {
    "sender_full_name": "Phillip K Allen",
    "reciever_full_name": "Stephane Brodeur",
    "sender_first_name": "Phillip",
    "sender_last_name": "Allen",
    "reciever_first_name": "Stephane",
    "reciever_last_name": "Brodeur",
    "sender_email": "phillip.allen@enron.com",
    "reciever_email": "stephane.brodeur@enron.com",
    "sender_org": "enron",
    "reciever_org": "enron",
    "subject": "Re: Maps",
    "body": "\nStephane,\n\n Can you create an e-mail list to distribute your reports everyday to the \nwest desk?\nOr put them on a common drive?  We can do the same with our reports.   List \nshould include:\n\n Phillip Allen\n Mike Grigsby\n Keith Holst\n Frank Ermis\n Steve South\n Janie Tholt\n Tory Kuykendall\n Matt Lenhart\n Randy Gay\n\nThanks.\n\nPhillip",
    "date": "Wed, 22 Mar 2000 01:27:00 -0800 (PST)",
    "message_id": "26482479.1075855691493.JavaMail.evans@thyme",
    "word_count": 55,
    "summarised_body": "",
    "named_entities": {
      "ORG": [
        "Stephane"
      ],
      "PERSON": [
        "Phillip Allen\n Mike Grigsby\n ",
        "Matt Lenhart",
        "Randy Gay",
        "Phillip"
      ]
    },
    "phone_numbers": []
  },
  {
    "sender_full_name": "Phillip K Allen",
    "reciever_full_name": "Brian Hoskins",
    "sender_first_name": "Phillip",
    "sender_last_name": "Allen",
    "reciever_first_name": "Brian",
    "reciever_last_name": "Hoskins",
    "sender_email": "phillip.allen@enron.com",
    "reciever_email": "brian.hoskins@enron.com",
    "sender_org": "enron",
    "reciever_org": "enron",
    "subject": "Mime-Version: 1.0",
    "body": "\nhttp://ectpdx-sunone/~ctatham/navsetup/index.htm\n\nid   pallen\npw  westgasx\n\nhighly sensitive do not distribute",
    "date": "Wed, 22 Mar 2000 00:36:00 -0800 (PST)",
    "message_id": "25048691.1075855691514.JavaMail.evans@thyme",
    "word_count": 11,
    "summarised_body": "",
    "named_entities": {},
    "phone_numbers": []
  },
  {
    "sender_full_name": "Phillip K Allen",
    "reciever_full_name": "Keith Holst",
    "sender_first_name": "Phillip",
    "sender_last_name": "Allen",
    "reciever_first_name": "Keith",
    "reciever_last_name": "Holst",
    "sender_email": "phillip.allen@enron.com",
    "reciever_email": "keith.holst@enron.com",
    "sender_org": "enron",
    "reciever_org": "enron",
    "subject": "Maps",
    "body": "\n---------------------- Forwarded by Phillip K Allen/HOU/ECT on 03/21/2000 \n01:24 PM ---------------------------\n\n\nStephane Brodeur\n03/16/2000 07:06 AM\nTo: Phillip K Allen/HOU/ECT@ECT\ncc:  \nSubject: Maps\n\nAs requested by John, here's the map and the forecast...\nCall me if you have any questions (403) 974-6756.\n\n",
    "date": "Tue, 21 Mar 2000 05:26:00 -0800 (PST)",
    "message_id": "19452788.1075855691536.JavaMail.evans@thyme",
    "word_count": 40,
    "summarised_body": "",
    "named_entities": {
      "PERSON": [
        "Phillip K Allen/HOU",
        "Phillip K Allen/HOU",
        "John"
      ],
      "ORG": [
        "ECT"
      ],
      "TIME": [
        "01:24 PM",
        "07:06 AM"
      ],
      "FAC": [
        "Stephane Brodeur\n"
      ],
      "CARDINAL": [
        "403",
        "974"
      ]
    },
    "phone_numbers": [
      " (403) 974-6756"
    ]
  },
  {
    "sender_full_name": "Phillip K Allen",
    "reciever_full_name": "\"mary richards\" <maryrichards7@hotmail.com> @ ENRON",
    "sender_first_name": "Phillip",
    "sender_last_name": "Allen",
    "reciever_first_name": "\"mary",
    "reciever_last_name": "ENRON",
    "sender_email": "phillip.allen@enron.com",
    "reciever_email": "maryrichards7@hotmail.com",
    "sender_org": "enron",
    "reciever_org": "hotmail",
    "subject": "Re:",
    "body": "\nMary \n\nI was out of the office on friday.\n\nI will call you about wade later today\n\nPhilip",
    "date": "Mon, 20 Mar 2000 00:58:00 -0800 (PST)",
    "message_id": "22191798.1075855691557.JavaMail.evans@thyme",
    "word_count": 18,
    "summarised_body": "",
    "named_entities": {
      "DATE": [
        "friday"
      ],
      "TIME": [
        "later today"
      ],
      "PERSON": [
        "Philip"
      ]
    },
    "phone_numbers": []
  },
  {
    "sender_full_name": "Phillip K Allen",
    "reciever_full_name": "Eric Benson <Eric Benson/NA/Enron@ENRON>",
    "sender_first_name": "Phillip",
    "sender_last_name": "Allen",
    "reciever_first_name": "Eric",
    "reciever_last_name": "enron",
    "sender_email": "phillip.allen@enron.com",
    "reciever_email": "eric.benson@enron.com",
    "sender_org": "enron",
    "reciever_org": "enron",
    "subject": "Re: Instructions for FERC Meetings",
    "body": "\nit works.  thank you",
    "date": "Tue, 24 Apr 2001 17:26:00 -0700 (PDT)",
    "message_id": "21295362.1075855379019.JavaMail.evans@thyme",
    "word_count": 4,
    "summarised_body": "",
    "named_entities": {},
    "phone_numbers": []
  },
  {
    "sender_full_name": "Phillip K Allen",
    "reciever_full_name": "Steven P South",
    "sender_first_name": "Phillip",
    "sender_last_name": "Allen",
    "reciever_first_name": "Steven",
    "reciever_last_name": "South",
    "sender_email": "phillip.allen@enron.com",
    "reciever_email": "steven.south@enron.com",
    "sender_org": "enron",
    "reciever_org": "enron",
    "subject": "Maps",
    "body": "\n---------------------- Forwarded by Phillip K Allen/HOU/ECT on 03/16/2000 \n02:07 PM ---------------------------\n\n\nStephane Brodeur\n03/16/2000 07:06 AM\nTo: Phillip K Allen/HOU/ECT@ECT\ncc:  \nSubject: Maps\n\nAs requested by John, here's the map and the forecast...\nCall me if you have any questions (403) 974-6756.\n\n",
    "date": "Thu, 16 Mar 2000 06:09:00 -0800 (PST)",
    "message_id": "20043519.1075855691578.JavaMail.evans@thyme",
    "word_count": 40,
    "summarised_body": "",
    "named_entities": {
      "PERSON": [
        "Phillip K Allen/HOU",
        "Phillip K Allen/HOU",
        "John"
      ],
      "ORG": [
        "ECT"
      ],
      "TIME": [
        "02:07 PM",
        "07:06 AM"
      ],
      "FAC": [
        "Stephane Brodeur\n"
      ],
      "CARDINAL": [
        "403",
        "974"
      ]
    },
    "phone_numbers": [
      " (403) 974-6756"
    ]
  },
  {
    "sender_full_name": "Phillip K Allen",
    "reciever_full_name": "Fletcher J Sturm",
    "sender_first_name": "Phillip",
    "sender_last_name": "Allen",
    "reciever_first_name": "Fletcher",
    "reciever_last_name": "Sturm",
    "sender_email": "phillip.allen@enron.com",
    "reciever_email": "fletcher.sturm@enron.com",
    "sender_org": "enron",
    "reciever_org": "enron",
    "subject": "Mime-Version: 1.0",
    "body": "\nsocal position\n\n\n\n\nThis is short, but is it good enough?\n",
    "date": "Wed, 15 Mar 2000 04:44:00 -0800 (PST)",
    "message_id": "18492696.1075855691599.JavaMail.evans@thyme",
    "word_count": 10,
    "summarised_body": "",
    "named_entities": {},
    "phone_numbers": []
  },
  {
    "sender_full_name": "Phillip K Allen",
    "reciever_full_name": "dwagman@FTENERGY.COM",
    "sender_first_name": "Phillip",
    "sender_last_name": "Allen",
    "reciever_first_name": "ftenergy",
    "reciever_last_name": "",
    "sender_email": "phillip.allen@enron.com",
    "reciever_email": "dwagman@ftenergy.com",
    "sender_org": "enron",
    "reciever_org": "ftenergy",
    "subject": "Re: 220,000 MW of New Capacity Needed by 2012",
    "body": "\nDavid,\n\nI have been receiving your updates.  Either I forgot my password or do not \nhave one.  Can you check?\n\nPhillip Allen\nEnron\n713-853-7041",
    "date": "Wed, 15 Mar 2000 02:00:00 -0800 (PST)",
    "message_id": "25603924.1075855691621.JavaMail.evans@thyme",
    "word_count": 26,
    "summarised_body": "",
    "named_entities": {
      "PERSON": [
        "David",
        "Phillip Allen\nEnron"
      ],
      "CARDINAL": [
        "713"
      ]
    },
    "phone_numbers": [
      "\n713-853-7041"
    ]
  },
  {
    "sender_full_name": "Phillip K Allen",
    "reciever_full_name": "Ina Rangel",
    "sender_first_name": "Phillip",
    "sender_last_name": "Allen",
    "reciever_first_name": "Ina",
    "reciever_last_name": "Rangel",
    "sender_email": "phillip.allen@enron.com",
    "reciever_email": "ina.rangel@enron.com",
    "sender_org": "enron",
    "reciever_org": "enron",
    "subject": "Mime-Version: 1.0",
    "body": "\n---------------------- Forwarded by Phillip K Allen/HOU/ECT on 03/14/2000 \n12:17 PM ---------------------------\n   \n\t\n\t\n\tFrom:  William Kelly                           03/13/2000 01:43 PM\n\t\n\nTo: Phillip K Allen/HOU/ECT@ECT, Steve Jackson/HOU/ECT@ECT\ncc:  \nSubject: \n\nWe have room EB3014 from 3 - 4 pm on Wednesday.\n\nWK\n",
    "date": "Tue, 14 Mar 2000 04:19:00 -0800 (PST)",
    "message_id": "23130394.1075855691643.JavaMail.evans@thyme",
    "word_count": 34,
    "summarised_body": "",
    "named_entities": {
      "PERSON": [
        "Phillip K Allen/HOU",
        "William Kelly                           ",
        "Phillip K Allen/HOU",
        "Steve Jackson/HOU"
      ],
      "ORG": [
        "ECT"
      ],
      "TIME": [
        "12:17 PM",
        "01:43 PM",
        "3 - 4 pm"
      ],
      "DATE": [
        "Wednesday"
      ]
    },
    "phone_numbers": []
  },
  {
    "sender_full_name": "Phillip K Allen",
    "reciever_full_name": "\"mary richards\" <maryrichards7@hotmail.com> @ ENRON",
    "sender_first_name": "Phillip",
    "sender_last_name": "Allen",
    "reciever_first_name": "\"mary",
    "reciever_last_name": "ENRON",
    "sender_email": "phillip.allen@enron.com",
    "reciever_email": "maryrichards7@hotmail.com",
    "sender_org": "enron",
    "reciever_org": "hotmail",
    "subject": "re: apt. #2",
    "body": "\nre: window unit check with gary about what kind he wants to install",
    "date": "Tue, 14 Mar 2000 03:42:00 -0800 (PST)",
    "message_id": "24442933.1075855691664.JavaMail.evans@thyme",
    "word_count": 13,
    "summarised_body": "",
    "named_entities": {},
    "phone_numbers": []
  },
  {
    "sender_full_name": "Phillip K Allen",
    "reciever_full_name": "Ina Rangel, Monique Sanchez",
    "sender_first_name": "Phillip",
    "sender_last_name": "Allen",
    "reciever_first_name": "Ina",
    "reciever_last_name": "Sanchez",
    "sender_email": "phillip.allen@enron.com",
    "reciever_email": "ina.rangel@enron.com, monique.sanchez@enron.com",
    "sender_org": "enron",
    "reciever_org": "enron.com, monique.sanchez@enron",
    "subject": "Mime-Version: 1.0",
    "body": "\n---------------------- Forwarded by Phillip K Allen/HOU/ECT on 03/13/2000 \n05:33 PM ---------------------------\n   \n\t\n\t\n\tFrom:  William Kelly                           03/13/2000 01:43 PM\n\t\n\nTo: Phillip K Allen/HOU/ECT@ECT, Steve Jackson/HOU/ECT@ECT\ncc:  \nSubject: \n\nWe have room EB3014 from 3 - 4 pm on Wednesday.\n\nWK\n",
    "date": "Mon, 13 Mar 2000 09:35:00 -0800 (PST)",
    "message_id": "5477801.1075855691686.JavaMail.evans@thyme",
    "word_count": 34,
    "summarised_body": "",
    "named_entities": {
      "PERSON": [
        "Phillip K Allen/HOU",
        "William Kelly                           ",
        "Phillip K Allen/HOU",
        "Steve Jackson/HOU"
      ],
      "ORG": [
        "ECT"
      ],
      "CARDINAL": [
        "03/13/2000"
      ],
      "TIME": [
        "05:33 PM",
        "01:43 PM",
        "3 - 4 pm"
      ],
      "DATE": [
        "Wednesday"
      ]
    },
    "phone_numbers": []
  },
  {
    "sender_full_name": "Phillip K Allen",
    "reciever_full_name": "Monique Sanchez",
    "sender_first_name": "Phillip",
    "sender_last_name": "Allen",
    "reciever_first_name": "Monique",
    "reciever_last_name": "Sanchez",
    "sender_email": "phillip.allen@enron.com",
    "reciever_email": "monique.sanchez@enron.com",
    "sender_org": "enron",
    "reciever_org": "enron",
    "subject": "Priority List",
    "body": "\n---------------------- Forwarded by Phillip K Allen/HOU/ECT on 03/13/2000 \n01:30 PM ---------------------------\n   \n\t\n\t\n\tFrom:  Phillip K Allen                           03/13/2000 11:31 AM\n\t\n\nTo: William Kelly/HOU/ECT@ECT, Steve Jackson/HOU/ECT@ECT, Brent A \nPrice/HOU/ECT@ECT\ncc:  \nSubject: Priority List\n\n\nWill,\n\n\nHere is a list of the top items we need to work on to improve the position \nand p&l reporting for the west desk.\nMy underlying goal is to create position managers and p&l reports that \nrepresent all the risk held by the desk\nand estimate p&l with great accuracy.\n\n\nLet's try and schedule a meeting for this Wednesday to go over the items \nabove.\n\nPhillip\n \n\n\n",
    "date": "Mon, 13 Mar 2000 05:32:00 -0800 (PST)",
    "message_id": "25611018.1075855691707.JavaMail.evans@thyme",
    "word_count": 93,
    "summarised_body": "",
    "named_entities": {
      "PERSON": [
        "Phillip K Allen/HOU",
        "Phillip K Allen                           ",
        "William Kelly/HOU",
        "Steve Jackson/HOU",
        "Phillip"
      ],
      "ORG": [
        "ECT"
      ],
      "CARDINAL": [
        "03/13/2000"
      ],
      "TIME": [
        "01:30 PM",
        "11:31 AM"
      ],
      "DATE": [
        "this Wednesday"
      ]
    },
    "phone_numbers": []
  },
  {
    "sender_full_name": "Phillip K Allen",
    "reciever_full_name": "William Kelly, Steve Jackson, Brent A Price",
    "sender_first_name": "Phillip",
    "sender_last_name": "Allen",
    "reciever_first_name": "William",
    "reciever_last_name": "Price",
    "sender_email": "phillip.allen@enron.com",
    "reciever_email": "william.kelly@enron.com, steve.jackson@enron.com, brent.price@enron.com",
    "sender_org": "enron",
    "reciever_org": "enron.com, steve.jackson@enron.com, brent.price@enron",
    "subject": "Priority List",
    "body": "\nWill,\n\n\nHere is a list of the top items we need to work on to improve the position \nand p&l reporting for the west desk.\nMy underlying goal is to create position managers and p&l reports that \nrepresent all the risk held by the desk\nand estimate p&l with great accuracy.\n\n\nLet's try and schedule a meeting for this Wednesday to go over the items \nabove.\n\nPhillip\n \n",
    "date": "Mon, 13 Mar 2000 05:31:00 -0800 (PST)",
    "message_id": "11165334.1075855691750.JavaMail.evans@thyme",
    "word_count": 64,
    "summarised_body": "",
    "named_entities": {
      "DATE": [
        "this Wednesday"
      ],
      "PERSON": [
        "Phillip"
      ]
    },
    "phone_numbers": []
  },
  {
    "sender_full_name": "Phillip K Allen",
    "reciever_full_name": "\"mary richards\" <maryrichards7@hotmail.com> @ ENRON",
    "sender_first_name": "Phillip",
    "sender_last_name": "Allen",
    "reciever_first_name": "\"mary",
    "reciever_last_name": "ENRON",
    "sender_email": "phillip.allen@enron.com",
    "reciever_email": "maryrichards7@hotmail.com",
    "sender_org": "enron",
    "reciever_org": "hotmail",
    "subject": "re: apt. #2",
    "body": "\nGo ahead and level the floor in #2.  ",
    "date": "Mon, 13 Mar 2000 02:22:00 -0800 (PST)",
    "message_id": "19400637.1075855691771.JavaMail.evans@thyme",
    "word_count": 8,
    "summarised_body": "",
    "named_entities": {
      "MONEY": [
        "2"
      ]
    },
    "phone_numbers": []
  },
  {
    "sender_full_name": "Phillip K Allen",
    "reciever_full_name": "jsmith <jsmith@austintx.com>",
    "sender_first_name": "Phillip",
    "sender_last_name": "Allen",
    "reciever_first_name": "jsmith",
    "reciever_last_name": "austintx",
    "sender_email": "phillip.allen@enron.com",
    "reciever_email": "jsmith@austintx.com",
    "sender_org": "enron",
    "reciever_org": "austintx",
    "subject": "Mime-Version: 1.0",
    "body": "\nLet me know when you get the quotes from Pauline.  I am expecting to pay something in the $3,000 to $5,000 range.  I would like to see the quotes and a description of the work to be done.  It is my understanding that some rock will be removed and replaced with siding.  If they are getting quotes to put up new rock then we will need to clarify.\n\nJacques is ready to drop in a dollar amount on the release.  If the negotiations stall, it seems like I need to go ahead and cut off the utilities.  Hopefully things will go smoothly.\n\nPhillip",
    "date": "Fri, 11 May 2001 11:26:00 -0700 (PDT)",
    "message_id": "2594534.1075855378221.JavaMail.evans@thyme",
    "word_count": 101,
    "summarised_body": "",
    "named_entities": {
      "WORK_OF_ART": [
        "Pauline"
      ],
      "MONEY": [
        "$3,000 to $5,000"
      ],
      "PERSON": [
        "Jacques",
        "Phillip"
      ]
    },
    "phone_numbers": []
  },
  {
    "sender_full_name": "Phillip K Allen",
    "reciever_full_name": "Mike Grigsby <Mike Grigsby/HOU/ECT@ECT>, Keith Holst <Keith Holst/HOU/ECT@ect>, Matthew Lenhart <Matthew Lenhart/HOU/ECT@ECT>, Monique Sanchez <Monique Sanchez/HOU/ECT@ECT>, Randall L Gay <Randall L Gay/HOU/ECT@ECT>, Frank Ermis <Frank Ermis/HOU/ECT@ECT>, Jane M Tholt <Jane M Tholt/HOU/ECT@ECT>, Tori Kuykendall <Tori Kuykendall/HOU/ECT@ECT>, Steven P South <Steven P South/HOU/ECT@ECT>, Jay Reitmeyer <Jay Reitmeyer/HOU/ECT@ECT>, Susan M Scott <Susan M Scott/HOU/ECT@ECT>",
    "sender_first_name": "Phillip",
    "sender_last_name": "Allen",
    "reciever_first_name": "Mike",
    "reciever_last_name": "enron.com, keith.holst@enron.com, matthew.lenhart@enron",
    "sender_email": "phillip.allen@enron.com",
    "reciever_email": "mike.grigsby@enron.com, keith.holst@enron.com, matthew.lenhart@enron.com, ",
    "sender_org": "enron",
    "reciever_org": "enron.com, keith.holst@enron.com, matthew.lenhart@enron",
    "subject": "Instructions for FERC Meetings",
    "body": "\n\n---------------------- Forwarded by Phillip K Allen/HOU/ECT on 04/24/2001 02:23 PM ---------------------------\n\n\nEric Benson@ENRON on 04/24/2001 11:47:40 AM\nTo:\tPhillip K Allen/HOU/ECT@ECT\ncc:\t \nSubject:\tInstructions for FERC Meetings\n\nMr. Allen - \n\nPer our phone conversation, please see the instructions below to get access to view FERC meetings.  Please advise if there are any problems, questions or concerns.\n\nEric Benson\nSr. Specialist\nEnron Government Affairs - The Americas\n713-853-1711\n\n++++++++++++++++++++++++++\n\n----- Forwarded by Eric Benson/NA/Enron on 04/24/2001 01:45 PM -----\n\n\tJanet Butler 11/06/2000 04:51 PM \t   To: Eric.Benson@enron.com, Steve.Kean@enron.com, Richard.Shapiro@enron.com  cc:   Subject: Instructions for FERC Meetings\t\n\n\nAs long as you are configured to receive Real Video, you should be able to access the FERC meeting this Wednesday, November 8.  The instructions are below.\n\n\n---------------------- Forwarded by Janet Butler/ET&S/Enron on 11/06/2000 04:49 PM ---------------------------\n\n\nJanet Butler\n10/31/2000 04:12 PM\nTo:\tChristi.L.Nicolay@enron.com, James D Steffes/NA/Enron@Enron, Rebecca.Cantrell@enron.com\ncc:\tShelley Corman/ET&S/Enron@Enron \n\nSubject:\tInstructions for FERC Meetings\n\n \t\t\n\n\nHere is the URL address for the Capitol Connection.  You should be able to simply click on this URL below and it should come up for you.  (This is assuming your computer is configured for Real Video/Audio).  We will pay for the annual contract and bill your cost centers.\n\nYou are connected for tomorrow as long as you have access to Real Video.\n\nhttp://www.capitolconnection.gmu.edu/\n\nInstructions:\n\nOnce into the Capitol Connection sight, click on FERC\nClick on first line (either \"click here\" or box)\nDialogue box should require:  user name:  enron-y\n\t\t\t           password:  fercnow\n\nReal Player will connect you to the meeting\n\nExpand your screen as you wish for easier viewing\n\nAdjust your sound as you wish\n\n\n\n\n\n",
    "date": "Tue, 24 Apr 2001 17:26:00 -0700 (PDT)",
    "message_id": "19583103.1075855379044.JavaMail.evans@thyme",
    "word_count": 246,
    "summarised_body": "",
    "named_entities": {
      "PERSON": [
        "Phillip K Allen/HOU",
        "Eric",
        "Phillip K Allen/HOU",
        "Subject",
        "Allen - \n\n",
        "Eric Benson\nSr",
        "Eric Benson/",
        "Janet Butler",
        "Janet Butler",
        "Janet Butler",
        "James D Steffes/NA/Enron@Enron"
      ],
      "ORG": [
        "ECT",
        "FERC",
        "Enron Government Affairs - The Americas",
        "Richard.Shapiro@enron.com",
        "Real Video",
        "FERC",
        "Enron",
        "Shelley Corman/ET&S/Enron@Enron \n\nSubject",
        "Real Video/Audio",
        "Real Video",
        "FERC"
      ],
      "TIME": [
        "02:23 PM",
        "11:47:40 AM",
        "01:45 PM",
        "04:51 PM",
        "04:49 PM",
        "04:12 PM"
      ],
      "CARDINAL": [
        "713"
      ],
      "DATE": [
        "this Wednesday,",
        "November 8",
        "annual",
        "tomorrow"
      ],
      "EVENT": [
        "the Capitol Connection",
        "the Capitol Connection"
      ],
      "ORDINAL": [
        "first"
      ]
    },
    "phone_numbers": [
      "\n713-853-1711"
    ]
  },
  {
    "sender_full_name": "Phillip K Allen",
    "reciever_full_name": "Stephen Wolfe",
    "sender_first_name": "Phillip",
    "sender_last_name": "Allen",
    "reciever_first_name": "Stephen",
    "reciever_last_name": "Wolfe",
    "sender_email": "phillip.allen@enron.com",
    "reciever_email": "stephen.wolfe@enron.com",
    "sender_org": "enron",
    "reciever_org": "enron",
    "subject": "Mime-Version: 1.0",
    "body": "\nSteve,\n\nPlease remove Bob Shiring and Liz Rivera from rc #768.  \n\nThank you\n\nPhillip Allen",
    "date": "Thu, 9 Mar 2000 06:20:00 -0800 (PST)",
    "message_id": "18106223.1075855691792.JavaMail.evans@thyme",
    "word_count": 15,
    "summarised_body": "",
    "named_entities": {
      "PERSON": [
        "Steve",
        "Bob Shiring",
        "Liz Rivera",
        "Phillip Allen"
      ],
      "MONEY": [
        "768"
      ]
    },
    "phone_numbers": []
  },
  {
    "sender_full_name": "Phillip K Allen",
    "reciever_full_name": "\"mary richards\" <maryrichards7@hotmail.com> @ ENRON",
    "sender_first_name": "Phillip",
    "sender_last_name": "Allen",
    "reciever_first_name": "\"mary",
    "reciever_last_name": "ENRON",
    "sender_email": "phillip.allen@enron.com",
    "reciever_email": "maryrichards7@hotmail.com",
    "sender_org": "enron",
    "reciever_org": "hotmail",
    "subject": "RE: a/c for #27",
    "body": "\nGo ahead and order the ac for #27.  \nCan you email or fax a summary of all rents collected from August through \nDecember.  I need this to finish my tax return.\nI have all the expense data but not rent collection.  Fax number is \n713-646-3239.\n\nThank you,\n\nPhillip",
    "date": "Thu, 9 Mar 2000 06:00:00 -0800 (PST)",
    "message_id": "6152859.1075855691814.JavaMail.evans@thyme",
    "word_count": 50,
    "summarised_body": "",
    "named_entities": {
      "ORG": [
        "ac"
      ],
      "MONEY": [
        "27"
      ],
      "DATE": [
        "August",
        "December"
      ],
      "CARDINAL": [
        "713"
      ],
      "PERSON": [
        "Phillip"
      ]
    },
    "phone_numbers": [
      "\n713-646-3239"
    ]
  },
  {
    "sender_full_name": "Phillip K Allen",
    "reciever_full_name": "\"Jeff Smith\" <jsmith@austintx.com>",
    "sender_first_name": "Phillip",
    "sender_last_name": "Allen",
    "reciever_first_name": "\"Jeff",
    "reciever_last_name": "austintx",
    "sender_email": "phillip.allen@enron.com",
    "reciever_email": "jsmith@austintx.com",
    "sender_org": "enron",
    "reciever_org": "austintx",
    "subject": "Re: Mission South",
    "body": "\nAnymore details?  Is the offer above or below 675?\n\nWhat else do you have in a clean 11cap in a good location with room to expand?\n",
    "date": "Tue, 7 Mar 2000 09:02:00 -0800 (PST)",
    "message_id": "29912025.1075855691835.JavaMail.evans@thyme",
    "word_count": 26,
    "summarised_body": "",
    "named_entities": {
      "CARDINAL": [
        "675"
      ],
      "DATE": [
        "11cap"
      ]
    },
    "phone_numbers": []
  },
  {
    "sender_full_name": "Phillip K Allen",
    "reciever_full_name": "\"mary richards\" <maryrichards7@hotmail.com> @ ENRON",
    "sender_first_name": "Phillip",
    "sender_last_name": "Allen",
    "reciever_first_name": "\"mary",
    "reciever_last_name": "ENRON",
    "sender_email": "phillip.allen@enron.com",
    "reciever_email": "maryrichards7@hotmail.com",
    "sender_org": "enron",
    "reciever_org": "hotmail",
    "subject": "Re:",
    "body": "\n$100 for the yard seems like enough for up to 12.5 hours.  How long did it \ntake him?  I think $100 should be enough. \n\nUse Page Setup under the File menu to change  from Portrait to Landscape if \nyou want to change from printing vertically \nto printing horizontally.  Also try selecting Fit to one page if you want \nyour print out to be on only one page.  Use Print preview\nto see what your print out will look like before you print.\n\nThe truck might need new sparkplugs at around 120,000-125,000 miles.  A valve \nadjustment might do some good.  It has idled very high\nfor the last 25,000 miles, but it has never broken down.\n\nGlad to hear about the good deposit for this week.  Great job on February.\n\nPhillip",
    "date": "Mon, 6 Mar 2000 05:27:00 -0800 (PST)",
    "message_id": "18916002.1075855691857.JavaMail.evans@thyme",
    "word_count": 127,
    "summarised_body": "",
    "named_entities": {
      "MONEY": [
        "100",
        "100"
      ],
      "TIME": [
        "up to 12.5 hours"
      ],
      "ORG": [
        "Page Setup",
        "File"
      ],
      "WORK_OF_ART": [
        "Portrait to Landscape"
      ],
      "CARDINAL": [
        "one",
        "only one"
      ],
      "QUANTITY": [
        "120,000-125,000 miles",
        "25,000 miles"
      ],
      "PERSON": [
        "Glad",
        "Phillip"
      ],
      "DATE": [
        "this week",
        "February"
      ]
    },
    "phone_numbers": []
  },
  {
    "sender_full_name": "Phillip K Allen",
    "reciever_full_name": "Jim Brysch",
    "sender_first_name": "Phillip",
    "sender_last_name": "Allen",
    "reciever_first_name": "Jim",
    "reciever_last_name": "Brysch",
    "sender_email": "phillip.allen@enron.com",
    "reciever_email": "jim.brysch@enron.com",
    "sender_org": "enron",
    "reciever_org": "enron",
    "subject": "Mime-Version: 1.0",
    "body": "\nThe file is updated and renamed as Gas Basis Mar 00.  ",
    "date": "Fri, 3 Mar 2000 04:48:00 -0800 (PST)",
    "message_id": "26565660.1075855691878.JavaMail.evans@thyme",
    "word_count": 11,
    "summarised_body": "",
    "named_entities": {
      "DATE": [
        "00"
      ]
    },
    "phone_numbers": []
  },
  {
    "sender_full_name": "Phillip K Allen",
    "reciever_full_name": "Mike Grigsby",
    "sender_first_name": "Phillip",
    "sender_last_name": "Allen",
    "reciever_first_name": "Mike",
    "reciever_last_name": "Grigsby",
    "sender_email": "phillip.allen@enron.com",
    "reciever_email": "mike.grigsby@enron.com",
    "sender_org": "enron",
    "reciever_org": "enron",
    "subject": "Western Strategy Summaries",
    "body": "\n---------------------- Forwarded by Phillip K Allen/HOU/ECT on 03/03/2000 \n12:30 PM ---------------------------\n\n\nTim Heizenrader\n03/03/2000 07:25 AM\nTo: James B Fallon/HOU/ECT@ECT, Phillip K Allen/HOU/ECT@ECT\ncc:  \nSubject: Western Strategy Summaries\n\nSlides from yesterday's meeting are attached: \n",
    "date": "Fri, 3 Mar 2000 04:33:00 -0800 (PST)",
    "message_id": "13777999.1075855691899.JavaMail.evans@thyme",
    "word_count": 32,
    "summarised_body": "",
    "named_entities": {
      "PERSON": [
        "Phillip K Allen/HOU",
        "Tim Heizenrader\n03/03/2000",
        "James B Fallon/HOU/ECT@ECT",
        "Phillip K Allen/HOU"
      ],
      "ORG": [
        "ECT"
      ],
      "TIME": [
        "12:30 PM",
        "07:25 AM"
      ],
      "DATE": [
        "yesterday"
      ]
    },
    "phone_numbers": []
  },
  {
    "sender_full_name": "Phillip K Allen",
    "reciever_full_name": "\"mary richards\" <maryrichards7@hotmail.com> @ ENRON",
    "sender_first_name": "Phillip",
    "sender_last_name": "Allen",
    "reciever_first_name": "\"mary",
    "reciever_last_name": "ENRON",
    "sender_email": "phillip.allen@enron.com",
    "reciever_email": "maryrichards7@hotmail.com",
    "sender_org": "enron",
    "reciever_org": "hotmail",
    "subject": "Re:",
    "body": "\nIt is ok to let the deposit rollover on #13 if there is no interruption in \nrent.",
    "date": "Fri, 3 Mar 2000 02:53:00 -0800 (PST)",
    "message_id": "7700634.1075855691920.JavaMail.evans@thyme",
    "word_count": 17,
    "summarised_body": "",
    "named_entities": {
      "MONEY": [
        "13"
      ]
    },
    "phone_numbers": []
  },
  {
    "sender_full_name": "Phillip K Allen",
    "reciever_full_name": "Matthew Lenhart",
    "sender_first_name": "Phillip",
    "sender_last_name": "Allen",
    "reciever_first_name": "Matthew",
    "reciever_last_name": "Lenhart",
    "sender_email": "phillip.allen@enron.com",
    "reciever_email": "matthew.lenhart@enron.com",
    "sender_org": "enron",
    "reciever_org": "enron",
    "subject": "Just Released! Exclusive new animation from Stan Lee",
    "body": "\n---------------------- Forwarded by Phillip K Allen/HOU/ECT on 03/03/2000 \n08:36 AM ---------------------------\n\n\n\"the shockwave.com team\" <shockwave.com@shockwave.m0.net",
    "date": "Fri, 3 Mar 2000 00:39:00 -0800 (PST)",
    "message_id": "5112524.1075855691942.JavaMail.evans@thyme",
    "word_count": 11,
    "summarised_body": "",
    "named_entities": {
      "PERSON": [
        "Phillip K Allen/HOU"
      ],
      "ORG": [
        "ECT"
      ],
      "TIME": [
        "08:36 AM"
      ]
    },
    "phone_numbers": []
  },
  {
    "sender_full_name": "Phillip K Allen",
    "reciever_full_name": "Imelda Frayre",
    "sender_first_name": "Phillip",
    "sender_last_name": "Allen",
    "reciever_first_name": "Imelda",
    "reciever_last_name": "Frayre",
    "sender_email": "phillip.allen@enron.com",
    "reciever_email": "imelda.frayre@enron.com",
    "sender_org": "enron",
    "reciever_org": "enron",
    "subject": "Mime-Version: 1.0",
    "body": "\nImelda,\n\nPlease switch my sitara access from central to west and email me with my \npassword.\n\nthank you,\n\nPhillip",
    "date": "Thu, 2 Mar 2000 05:08:00 -0800 (PST)",
    "message_id": "26856805.1075855691963.JavaMail.evans@thyme",
    "word_count": 19,
    "summarised_body": "",
    "named_entities": {
      "PERSON": [
        "Imelda",
        "Phillip"
      ]
    },
    "phone_numbers": []
  },
  {
    "sender_full_name": "Phillip K Allen",
    "reciever_full_name": "\"mary richards\" <maryrichards7@hotmail.com> @ ENRON",
    "sender_first_name": "Phillip",
    "sender_last_name": "Allen",
    "reciever_first_name": "\"mary",
    "reciever_last_name": "ENRON",
    "sender_email": "phillip.allen@enron.com",
    "reciever_email": "maryrichards7@hotmail.com",
    "sender_org": "enron",
    "reciever_org": "hotmail",
    "subject": "Re: Feb. Expense Report",
    "body": "\nTry again.  The attachment was not attached.",
    "date": "Thu, 2 Mar 2000 05:07:00 -0800 (PST)",
    "message_id": "8109671.1075855691984.JavaMail.evans@thyme",
    "word_count": 7,
    "summarised_body": "",
    "named_entities": {},
    "phone_numbers": []
  },
  {
    "sender_full_name": "Phillip K Allen",
    "reciever_full_name": "Frank Hayden <Frank Hayden/ENRON@enronXgate@ENRON>",
    "sender_first_name": "Phillip",
    "sender_last_name": "Allen",
    "reciever_first_name": "Frank",
    "reciever_last_name": "enron",
    "sender_email": "phillip.allen@enron.com",
    "reciever_email": "frank.hayden@enron.com",
    "sender_org": "enron",
    "reciever_org": "enron",
    "subject": "Re:",
    "body": "\nFrank,\n\nThe implied risk created by the san juan and rockies indeces being partially set after today is the same as the risk in a long futures position.  Whatever the risk was prior should not matter.  Since the rest of the books are very short price this should be a large offset.  If the VAR calculation does not match the company's true risk then it needs to be revised or adjusted.  \n\nPhillip",
    "date": "Tue, 24 Apr 2001 15:08:00 -0700 (PDT)",
    "message_id": "31350833.1075855379066.JavaMail.evans@thyme",
    "word_count": 72,
    "summarised_body": "",
    "named_entities": {
      "PERSON": [
        "Frank",
        "Phillip"
      ],
      "ORG": [
        "the san juan",
        "VAR"
      ],
      "DATE": [
        "today"
      ]
    },
    "phone_numbers": []
  },
  {
    "sender_full_name": "Phillip K Allen",
    "reciever_full_name": "maryrichards7@hotmail.com",
    "sender_first_name": "Phillip",
    "sender_last_name": "Allen",
    "reciever_first_name": "hotmail",
    "reciever_last_name": "",
    "sender_email": "phillip.allen@enron.com",
    "reciever_email": "maryrichards7@hotmail.com",
    "sender_org": "enron",
    "reciever_org": "hotmail",
    "subject": "Mime-Version: 1.0",
    "body": "\nMary,\n\n I transferred $10,000 out of the checking account on Monday 2/28/00.  I will \ncall you Monday or Tuesday to see what is new.\n\nPhillip",
    "date": "Mon, 28 Feb 2000 03:19:00 -0800 (PST)",
    "message_id": "1148543.1075855692007.JavaMail.evans@thyme",
    "word_count": 23,
    "summarised_body": "",
    "named_entities": {
      "PERSON": [
        "Mary",
        "Phillip"
      ],
      "MONEY": [
        "10,000"
      ],
      "DATE": [
        "Monday",
        "Monday",
        "Tuesday"
      ],
      "CARDINAL": [
        "2/28/00"
      ]
    },
    "phone_numbers": []
  },
  {
    "sender_full_name": "Phillip K Allen",
    "reciever_full_name": "\"Jeff Smith\" <jsmith@austintx.com>",
    "sender_first_name": "Phillip",
    "sender_last_name": "Allen",
    "reciever_first_name": "\"Jeff",
    "reciever_last_name": "austintx",
    "sender_email": "phillip.allen@enron.com",
    "reciever_email": "jsmith@austintx.com",
    "sender_org": "enron",
    "reciever_org": "austintx",
    "subject": "Re: 91acres",
    "body": "\nJeff,\n\n Let's just close on March 1.\n\nPhillip",
    "date": "Mon, 21 Feb 2000 23:03:00 -0800 (PST)",
    "message_id": "9771425.1075855692029.JavaMail.evans@thyme",
    "word_count": 8,
    "summarised_body": "",
    "named_entities": {
      "PERSON": [
        "Jeff",
        "Phillip"
      ],
      "DATE": [
        "March 1"
      ]
    },
    "phone_numbers": []
  },
  {
    "sender_full_name": "Phillip K Allen",
    "reciever_full_name": "Mike Grigsby",
    "sender_first_name": "Phillip",
    "sender_last_name": "Allen",
    "reciever_first_name": "Mike",
    "reciever_last_name": "Grigsby",
    "sender_email": "phillip.allen@enron.com",
    "reciever_email": "mike.grigsby@enron.com",
    "sender_org": "enron",
    "reciever_org": "enron",
    "subject": "PIRA's California/Southwest Gas Pipeline Study",
    "body": "\n---------------------- Forwarded by Phillip K Allen/HOU/ECT on 02/21/2000=\n=20\n08:06 AM ---------------------------\n  =20\n=09\n=09\n=09From:  Jennifer Fraser                           02/19/2000 01:57 PM\n=09\n\nTo: Stephanie Miller/Corp/Enron@ENRON, Julie A Gomez/HOU/ECT@ECT, Phillip K=\n=20\nAllen/HOU/ECT@ECT\ncc: =20\nSubject: PIRA's California/Southwest Gas Pipeline Study\n\nDid any of you order this\nJEn\n\n---------------------- Forwarded by Jennifer Fraser/HOU/ECT on 02/19/2000=\n=20\n03:56 PM ---------------------------\n\n\n\"Jeff Steele\" <jsteele@pira.com",
    "date": "Mon, 21 Feb 2000 00:07:00 -0800 (PST)",
    "message_id": "12960873.1075855692052.JavaMail.evans@thyme",
    "word_count": 57,
    "summarised_body": "",
    "named_entities": {
      "PERSON": [
        "Phillip K Allen/HOU",
        "Jennifer Fraser                           02/19/2000",
        "Stephanie Miller/Corp/Enron@ENRON",
        "Julie A",
        "Phillip",
        "Jennifer Fraser/HOU",
        "Jeff Steele"
      ],
      "ORG": [
        "ECT",
        "Allen/HOU/ECT@ECT",
        "PIRA",
        "California/Southwest Gas Pipeline Study",
        "ECT"
      ],
      "WORK_OF_ART": [
        "02/21/2000="
      ],
      "CARDINAL": [
        "20",
        "20",
        "09",
        "09",
        "09From",
        "09",
        "20",
        "20"
      ],
      "TIME": [
        "01:57 PM",
        "20\n03:56 PM"
      ]
    },
    "phone_numbers": []
  },
  {
    "sender_full_name": "Phillip K Allen",
    "reciever_full_name": "Tara Sweitzer",
    "sender_first_name": "Phillip",
    "sender_last_name": "Allen",
    "reciever_first_name": "Tara",
    "reciever_last_name": "Sweitzer",
    "sender_email": "phillip.allen@enron.com",
    "reciever_email": "tara.sweitzer@enron.com",
    "sender_org": "enron",
    "reciever_org": "enron",
    "subject": "Re: Desk to Desk access Request",
    "body": "\ntara,\n\n I received your email about setting up Paul Lucci and Niccole Cortez with \nexecutable id's.  The rights you set up are fine.\n Thank you for your help.\n\nPhillip",
    "date": "Thu, 17 Feb 2000 05:39:00 -0800 (PST)",
    "message_id": "31575550.1075855692106.JavaMail.evans@thyme",
    "word_count": 30,
    "summarised_body": "",
    "named_entities": {
      "ORG": [
        "Paul Lucci"
      ],
      "PERSON": [
        "Niccole Cortez",
        "Phillip"
      ]
    },
    "phone_numbers": []
  },
  {
    "sender_full_name": "Phillip K Allen",
    "reciever_full_name": "\"mary richards\" <maryrichards7@hotmail.com> @ ENRON",
    "sender_first_name": "Phillip",
    "sender_last_name": "Allen",
    "reciever_first_name": "\"mary",
    "reciever_last_name": "ENRON",
    "sender_email": "phillip.allen@enron.com",
    "reciever_email": "maryrichards7@hotmail.com",
    "sender_org": "enron",
    "reciever_org": "hotmail",
    "subject": "Re: February expenses",
    "body": "\nmary,\n\nAre you sure you did the attachment right.  There was no file attached to \nyour message.  Please try again.\n\nPhillip",
    "date": "Thu, 17 Feb 2000 05:07:00 -0800 (PST)",
    "message_id": "26941460.1075855692127.JavaMail.evans@thyme",
    "word_count": 21,
    "summarised_body": "",
    "named_entities": {
      "PERSON": [
        "Phillip"
      ]
    },
    "phone_numbers": []
  },
  {
    "sender_full_name": "Phillip K Allen",
    "reciever_full_name": "\"mary richards\" <maryrichards7@hotmail.com> @ ENRON",
    "sender_first_name": "Phillip",
    "sender_last_name": "Allen",
    "reciever_first_name": "\"mary",
    "reciever_last_name": "ENRON",
    "sender_email": "phillip.allen@enron.com",
    "reciever_email": "maryrichards7@hotmail.com",
    "sender_org": "enron",
    "reciever_org": "hotmail",
    "subject": "Re:",
    "body": "\nMary,\n\n I got your email.  Go ahead and get a carpet shampooer.  Make sure it comes \nback clean after each use.  (Wade and the tenants.)\n\n As far as W-2.  I looked up the rules for withholding and social security.  \nI will call you later today to discuss.\n\nPhillip",
    "date": "Tue, 15 Feb 2000 05:42:00 -0800 (PST)",
    "message_id": "21623527.1075855692150.JavaMail.evans@thyme",
    "word_count": 47,
    "summarised_body": "",
    "named_entities": {
      "PERSON": [
        "Mary",
        "Phillip"
      ],
      "PRODUCT": [
        "W-2"
      ],
      "TIME": [
        "later today"
      ]
    },
    "phone_numbers": []
  },
  {
    "sender_full_name": "Phillip K Allen",
    "reciever_full_name": "Hunter S Shively",
    "sender_first_name": "Phillip",
    "sender_last_name": "Allen",
    "reciever_first_name": "Hunter",
    "reciever_last_name": "Shively",
    "sender_email": "phillip.allen@enron.com",
    "reciever_email": "hunter.shively@enron.com",
    "sender_org": "enron",
    "reciever_org": "enron",
    "subject": "Storage of Cycles at the Body Shop",
    "body": "\nShould I appeal to Skilling.\n\n---------------------- Forwarded by Phillip K Allen/HOU/ECT on 02/15/2000 \n12:52 PM ---------------------------\n\n\nLee Wright@ENRON\n02/15/2000 10:48 AM\nTo: Phillip K Allen/HOU/ECT@ECT\ncc: Amelia Alder/OTS/Enron@ENRON \nSubject: Storage of Cycles at the Body Shop\n\nPhillip -\nI applaud you for using your cycle as daily transportation.  Saves on gas, \npollution and helps keep you strong and healthy.  Enron provides bike racks \nin the front of the building for requests such as this.  Phillip, I wish we \ncould accommodate this request; however, The Body Shop does not have the \ncapacity nor can assume the responsibility for storing cycles on a daily \nbasis.  If you bring a very good lock you should be able to secure the bike \nat the designated outside racks.  \n\nKeep Pedalling - Lee\n",
    "date": "Tue, 15 Feb 2000 04:53:00 -0800 (PST)",
    "message_id": "32123574.1075855692171.JavaMail.evans@thyme",
    "word_count": 122,
    "summarised_body": "",
    "named_entities": {
      "GPE": [
        "Skilling"
      ],
      "PERSON": [
        "Phillip K Allen/HOU",
        "Lee Wright@ENRON\n",
        "Phillip K Allen/HOU",
        "Amelia Alder/OTS/Enron@ENRON \nSubject: Storage of Cycles",
        "Phillip",
        "Keep Pedalling - Lee"
      ],
      "ORG": [
        "ECT",
        "Enron",
        "The Body Shop"
      ],
      "CARDINAL": [
        "02/15/2000"
      ],
      "TIME": [
        "12:52 PM"
      ],
      "DATE": [
        "daily",
        "daily"
      ]
    },
    "phone_numbers": []
  },
  {
    "sender_full_name": "Phillip K Allen",
    "reciever_full_name": "Mike Grigsby",
    "sender_first_name": "Phillip",
    "sender_last_name": "Allen",
    "reciever_first_name": "Mike",
    "reciever_last_name": "Grigsby",
    "sender_email": "phillip.allen@enron.com",
    "reciever_email": "mike.grigsby@enron.com",
    "sender_org": "enron",
    "reciever_org": "enron",
    "subject": "Western Strategy Briefing",
    "body": "\n---------------------- Forwarded by Phillip K Allen/HOU/ECT on 02/11/2000 \n03:38 PM ---------------------------\n\n\nTim Heizenrader\n02/10/2000 12:55 PM\nTo: James B Fallon/HOU/ECT@ECT, Phillip K Allen/HOU/ECT@ECT\ncc: Tim Belden/HOU/ECT@ECT \nSubject: Western Strategy Briefing\n\nSlides for today's meeting are attached: \n",
    "date": "Fri, 11 Feb 2000 07:39:00 -0800 (PST)",
    "message_id": "10110194.1075855692193.JavaMail.evans@thyme",
    "word_count": 35,
    "summarised_body": "",
    "named_entities": {
      "PERSON": [
        "Phillip K Allen/HOU",
        "Tim Heizenrader\n02/10/2000",
        "James B Fallon/HOU/ECT@ECT",
        "Phillip K Allen/HOU",
        "Tim Belden/HOU"
      ],
      "ORG": [
        "ECT"
      ],
      "TIME": [
        "03:38 PM",
        "12:55 PM"
      ],
      "DATE": [
        "today"
      ]
    },
    "phone_numbers": []
  },
  {
    "sender_full_name": "Phillip K Allen",
    "reciever_full_name": "Keith Holst",
    "sender_first_name": "Phillip",
    "sender_last_name": "Allen",
    "reciever_first_name": "Keith",
    "reciever_last_name": "Holst",
    "sender_email": "phillip.allen@enron.com",
    "reciever_email": "keith.holst@enron.com",
    "sender_org": "enron",
    "reciever_org": "enron",
    "subject": "RE: W basis quotes",
    "body": "\n---------------------- Forwarded by Phillip K Allen/HOU/ECT on 02/11/2000 \n12:31 PM ---------------------------\n\n\n\"George Rahal\" <george.rahal@acnpower.com",
    "date": "Fri, 11 Feb 2000 04:31:00 -0800 (PST)",
    "message_id": "2398018.1075855692214.JavaMail.evans@thyme",
    "word_count": 11,
    "summarised_body": "",
    "named_entities": {
      "PERSON": [
        "Phillip K Allen/HOU",
        "George Rahal"
      ],
      "ORG": [
        "ECT"
      ],
      "TIME": [
        "12:31 PM"
      ]
    },
    "phone_numbers": []
  },
  {
    "sender_full_name": "Phillip K Allen",
    "reciever_full_name": "Keith Holst",
    "sender_first_name": "Phillip",
    "sender_last_name": "Allen",
    "reciever_first_name": "Keith",
    "reciever_last_name": "Holst",
    "sender_email": "phillip.allen@enron.com",
    "reciever_email": "keith.holst@enron.com",
    "sender_org": "enron",
    "reciever_org": "enron",
    "subject": "RE: W basis quotes",
    "body": "\n---------------------- Forwarded by Phillip K Allen/HOU/ECT on 02/09/2000 \n10:27 AM ---------------------------\n\n\n\"George Rahal\" <george.rahal@acnpower.com",
    "date": "Wed, 9 Feb 2000 02:27:00 -0800 (PST)",
    "message_id": "4627792.1075855692236.JavaMail.evans@thyme",
    "word_count": 11,
    "summarised_body": "",
    "named_entities": {
      "PERSON": [
        "Phillip K Allen/HOU",
        "George Rahal"
      ],
      "ORG": [
        "ECT"
      ],
      "TIME": [
        "10:27 AM"
      ]
    },
    "phone_numbers": []
  },
  {
    "sender_full_name": "Phillip K Allen",
    "reciever_full_name": "Jeff Smith  <jsmith@austintx.com>",
    "sender_first_name": "Phillip",
    "sender_last_name": "Allen",
    "reciever_first_name": "Jeff",
    "reciever_last_name": "austintx",
    "sender_email": "phillip.allen@enron.com",
    "reciever_email": "jsmith@austintx.com",
    "sender_org": "enron",
    "reciever_org": "austintx",
    "subject": "Re: The Stage",
    "body": "\nI just spoke to the insurance company.  They are going to cancel and prorate my policy and work with the Kuo's to issue a new policy.",
    "date": "Tue, 24 Apr 2001 13:05:00 -0700 (PDT)",
    "message_id": "8220274.1075855379087.JavaMail.evans@thyme",
    "word_count": 26,
    "summarised_body": "",
    "named_entities": {
      "PERSON": [
        "Kuo"
      ]
    },
    "phone_numbers": []
  },
  {
    "sender_full_name": "Phillip K Allen",
    "reciever_full_name": "William Kelly",
    "sender_first_name": "Phillip",
    "sender_last_name": "Allen",
    "reciever_first_name": "William",
    "reciever_last_name": "Kelly",
    "sender_email": "phillip.allen@enron.com",
    "reciever_email": "william.kelly@enron.com",
    "sender_org": "enron",
    "reciever_org": "enron",
    "subject": "Re: APEA - $228,204 hit",
    "body": "\nPlease get with randy to resolve.",
    "date": "Wed, 9 Feb 2000 02:12:00 -0800 (PST)",
    "message_id": "140197.1075855692257.JavaMail.evans@thyme",
    "word_count": 6,
    "summarised_body": "",
    "named_entities": {},
    "phone_numbers": []
  },
  {
    "sender_full_name": "Phillip K Allen",
    "reciever_full_name": "\"George Rahal\" <george.rahal@acnpower.com> @ ENRON",
    "sender_first_name": "Phillip",
    "sender_last_name": "Allen",
    "reciever_first_name": "\"George",
    "reciever_last_name": "ENRON",
    "sender_email": "phillip.allen@enron.com",
    "reciever_email": "george.rahal@acnpower.com",
    "sender_org": "enron",
    "reciever_org": "acnpower",
    "subject": "Re: W basis quotes",
    "body": "\nGeorge,\n\n Can you please call my credit desk at 713-853-1803.  They have not received \nany financials for ACN Power.  \n\nThanks,\n\nPhillip Allen",
    "date": "Mon, 7 Feb 2000 08:53:00 -0800 (PST)",
    "message_id": "7485729.1075855692278.JavaMail.evans@thyme",
    "word_count": 24,
    "summarised_body": "",
    "named_entities": {
      "CARDINAL": [
        "713"
      ],
      "ORG": [
        "ACN Power"
      ],
      "PERSON": [
        "Phillip Allen"
      ]
    },
    "phone_numbers": [
      " 713-853-1803"
    ]
  },
  {
    "sender_full_name": "Phillip K Allen",
    "reciever_full_name": "Kimberly S Olinger",
    "sender_first_name": "Phillip",
    "sender_last_name": "Allen",
    "reciever_first_name": "Kimberly",
    "reciever_last_name": "Olinger",
    "sender_email": "phillip.allen@enron.com",
    "reciever_email": "kimberly.olinger@enron.com",
    "sender_org": "enron",
    "reciever_org": "enron",
    "subject": "Re: January El paso invoice",
    "body": "\nKim,\n\n Doublecheck with Julie G. , but I think it ok to pay Jan. demand charges.\n",
    "date": "Mon, 7 Feb 2000 07:39:00 -0800 (PST)",
    "message_id": "17093085.1075855692300.JavaMail.evans@thyme",
    "word_count": 13,
    "summarised_body": "",
    "named_entities": {
      "PERSON": [
        "Kim",
        "Julie G."
      ],
      "DATE": [
        "Jan."
      ]
    },
    "phone_numbers": []
  },
  {
    "sender_full_name": "Phillip K Allen",
    "reciever_full_name": "Robert Superty",
    "sender_first_name": "Phillip",
    "sender_last_name": "Allen",
    "reciever_first_name": "Robert",
    "reciever_last_name": "Superty",
    "sender_email": "phillip.allen@enron.com",
    "reciever_email": "robert.superty@enron.com",
    "sender_org": "enron",
    "reciever_org": "enron",
    "subject": "Re: Kim Olinger - Transport Rate Team",
    "body": "\nI think Steven Wolf is the person to talk to about moving Kim Olinger to a \ndifferent RC code.",
    "date": "Mon, 7 Feb 2000 07:37:00 -0800 (PST)",
    "message_id": "24000507.1075855692322.JavaMail.evans@thyme",
    "word_count": 19,
    "summarised_body": "",
    "named_entities": {
      "PERSON": [
        "Steven Wolf",
        "Kim Olinger"
      ]
    },
    "phone_numbers": []
  }
]